url,title,saves,timestamp
https://www.pinterest.com/pin/slow-cooker-beer-brats--212795151133545440/,"Slow Cooker Beer Brats | Slow cooker apples, Recipes, Summer crockpot recipes",126,2026-05-22 18:51:45
https://www.pinterest.com/pin/strawberry-cupcakes--212795151133530062/,"Strawberry Cupcakes | Fun cupcake recipes, Cupcake recipes, Gourmet cupcakes",3374,2026-05-22 18:51:46
https://www.pinterest.com/pin/212795151133524755/,"Peach Pie Recipe | Recipe | Peach pie recipes, Peach recipe, Fresh peach pie",303,2026-05-22 18:51:47
https://www.pinterest.com/pin/212795151133524295/,"With minimal ingredients and huge flavor these Lemon Pepper Chicken Kabobs are a tasty summertime treat tha… | Kabob recipes, Chicken kabob recipes, Stuffed peppers",877,2026-05-22 18:51:47
https://www.pinterest.com/pin/212795151133524736/,"Easy Summer Corn Salad | Recipe | Corn salad recipes, Summer corn salad, Summer salad recipes",813,2026-05-22 18:51:47
https://www.pinterest.com/pin/212795151133493094/,"Banana Bread Pudding | Recipe | Banana bread pudding, Bread pudding, Bread recipes sweet",158,2026-05-22 18:51:49
https://www.pinterest.com/pin/212795151133497382/,"Rhubarb Slush | Recipe | Rhubarb slush recipe, Slush recipes, Rhubarb",365,2026-05-22 18:51:49
https://www.pinterest.com/pin/212795151133484443/,"Beer Brats | Recipe | Recipes, Bratwurst, Cooking recipes",108,2026-05-22 18:51:49
https://www.pinterest.com/pin/212795151133484442/,"Lemon Pepper Chicken | Recipe | Stuffed peppers, Lemon pepper chicken, Recipes",91,2026-05-22 18:51:50
https://www.pinterest.com/pin/banana-zucchini-sheet-cake--212795151133484441/,"Banana Zucchini Sheet Cake | Recipe | Sheet cake, Desserts, Savoury cake",105,2026-05-22 18:51:50
https://www.pinterest.com/pin/212795151133429602/,"Cinnamon Cream Cheese Frosting | Recipe | Cream cheese frosting, Cinnamon cream cheese frosting, Peanut butter fudge easy",29,2026-05-22 18:51:53
https://www.pinterest.com/pin/212795151133412163/,"Banana Pudding Trifle | Recipe | Banana pudding, Easy banana pudding, Easy banana pudding recipe",20,2026-05-22 18:51:54
https://www.pinterest.com/pin/212795151133410043/,"Lemon Tart | Recipe | Lemon recipes, Tart recipes, Dessert recipes",50,2026-05-22 18:51:55
https://www.pinterest.com/pin/212795151133402527/,"When it comes to a good thing you can never have enough and these Mississippi Sin Dip Pinwheels are exactly tha… | Pinwheel appetizers, Recipes, Mississippi sin dip",561,2026-05-22 18:51:55
https://www.pinterest.com/pin/212795151133377154/,Greek Pasta Salad with Fresh Vegetables and Feta Cheese | Recipe,62,2026-05-22 18:51:58
https://www.pinterest.com/pin/berry-ricotta-cake--212795151133360149/,"Berry Ricotta Cake | Fun desserts, Berries recipes, Delicious desserts",96,2026-05-22 18:51:58
https://www.pinterest.com/pin/lemon-sandwich-cookies--212795151133356439/,"Lemon Sandwich Cookies | Lemon recipes, Sandwich cookies, Cookie recipes",98,2026-05-22 18:51:58
https://www.pinterest.com/pin/212795151133346042/,"Easy and delicious this Chicken Fried Chicken is a quick and flavorful dinnertime recipe that brings the whole fa… | Chicken recipes, Fried chicken recipes, Recipes",1688,2026-05-22 18:51:59
https://www.pinterest.com/pin/raspberry-icebox-cake--212795151133356330/,"Raspberry Icebox Cake | Dessert recipes, Cake recipes, Homemade rice pudding",67,2026-05-22 18:52:00
https://www.pinterest.com/pin/212795151133342617/,"Chocoflan Recipe | Recipe | Chocoflan recipe, Homemade cake mixes, Easy cake recipes",59,2026-05-22 18:52:00
https://www.pinterest.com/pin/212795151133296023/,"Fruit Salad Recipe | Recipe | Summer salads with fruit, Fresh summer fruit salad, Fruit salad recipes",57,2026-05-22 18:52:01
https://www.pinterest.com/pin/212795151133273802/,"Walking Tacos | Recipe | Walking tacos, Easy meals for kids, Tacos",45,2026-05-22 18:52:02
https://www.pinterest.com/pin/212795151133273805/,Arnold Palmer Drink,107,2026-05-22 18:52:03
https://www.pinterest.com/pin/212795151133253811/,"Mango Salsa | Recipe | Mango salsa recipes, Salsa recipe, Mango salsa",56,2026-05-22 18:52:03
https://www.pinterest.com/pin/212795151133159269/,"#recipes Ground Beef Carbonara | Recipe | Beef recipes for dinner Beef pasta recipes Dinner … | Beef pasta recipes, Dinner with ground beef, Beef recipes for dinner",8281,2026-05-22 18:52:08
https://www.pinterest.com/pin/212795151133153690/,"Soufflé Pancakes | Recipe | Souffle pancakes, Chocolate chip pancakes, Pancakes",20,2026-05-22 18:52:08
https://www.pinterest.com/pin/212795151133148463/,"Olive Garden Chicken Gnocchi Soup | Recipe | Fall soup recipes, Chicken gnocchi soup olive garden, Delicious soup recipes",173,2026-05-22 18:52:08
https://www.pinterest.com/pin/212795151133140770/,"Fall Off The Bone Ribs [Video] | Recipe [Video] | Recipes, Rib recipes, Meat recipes",77,2026-05-22 18:52:09
https://www.pinterest.com/pin/212795151133144329/,"The Best Chicken Fried Chicken | Chicken recipes, Fried chicken recipes, Recipes",1383,2026-05-22 18:52:09
https://www.pinterest.com/pin/212795151132953054/,"Steak Bites and Potatoes | Recipe | Steak bites, Steak bites recipe, Steak dinner recipes",322,2026-05-22 18:52:15
https://www.pinterest.com/pin/212795151132944784/,"Steak Bites and Potatoes | Recipe | Steak bites, Beef recipes easy, Hearty family meal",15,2026-05-22 18:52:15
https://www.pinterest.com/pin/valentines-rice-krispie-treats--212795151132943549/,"Galentine's Day Rice Krispie Treats | Krispie treats, Rice krispie treats, Rice krispies",41,2026-05-22 18:52:15
https://www.pinterest.com/pin/212795151132943334/,"Spaghetti Casserole | Recipe | Spaghetti casserole, Spaghetti casserole recipe, Casserole recipes",74,2026-05-22 18:52:15
https://www.pinterest.com/pin/212795151132931913/,"This flirty spin on a classic these Valentine's Rice Krispie Treats are loaded up with raspberries… | Rice krispie treats, Summer dessert recipes, Lemon curd recipe",53,2026-05-22 18:52:15
https://www.pinterest.com/pin/212795151132926545/,"French Onion Chicken | Recipe | French onion chicken, Onion chicken, Yummy chicken recipes",92,2026-05-22 18:52:16
https://www.pinterest.com/pin/212795151132897422/,"Cookie Monster Edible Cookie Dough | Recipe | Edible cookie dough recipe, Cookie dough, Chocolate chip cookies",1642,2026-05-22 18:52:16
https://www.pinterest.com/pin/212795151132829468/,"Texas Trash Party Mix | Recipe | Chex mix recipes, Chex mix, Homemade chex mix",241,2026-05-22 18:52:17
https://www.pinterest.com/pin/the-best-holiday-appetizers-you-never-knew-you-needed--212795151132756143/,"The Best Holiday Appetizers You Never Knew You Needed! | Best holiday appetizers, Appetizer recipes, Appetizers",264,2026-05-22 18:52:17
https://www.pinterest.com/pin/delicious-must-make-holiday-sweets-treats--212795151132753873/,Delicious Must Make Holiday Sweets & Treats,141,2026-05-22 18:52:19
https://www.pinterest.com/pin/212795151132820368/,"Packed full of flavor this Copycat Cracker Barrel Meatloaf is a delicious and tasty dinnertime meal that … | Good meatloaf recipe, Meatloaf, Classic meatloaf recipe",418,2026-05-22 18:52:19
https://www.pinterest.com/pin/212795151132647932/,"Red Velvet Brownies | Recipe | Red velvet brownies, Summer dessert recipes, Dessert recipes",57,2026-05-22 18:52:21
https://www.pinterest.com/pin/212795151132640961/,"Sausage Rolls [Video] | Recipe [Video] | Homemade sausage rolls, Homemade sausage, Recipes",49604,2026-05-22 18:52:22
https://www.pinterest.com/pin/212795151132529259/,"Pin by Tornadough Alli | Swipe up for on DELICIOUS RECIPE BOARD | Dinner rolls, Fluffy dinner rolls, Easy dinner",86,2026-05-22 18:52:23
https://www.pinterest.com/pin/212795151132531838/,"Easy Dinner Rolls | Dinner rolls, Cooking, Bread recipes sweet",29,2026-05-22 18:52:23
https://www.pinterest.com/pin/212795151132528053/,"Copycat Applebee's Honey Pepper Chicken Mac and Cheese | Recipe | Applebees recipes, Recipes, Chicken dinner recipes",4777,2026-05-22 18:52:24
https://www.pinterest.com/pin/212795151132528563/,"Creamy Root Beer Rum Cocktail | Mixed drinks recipes, Summer drink recipes, Root beer recipe",98,2026-05-22 18:52:24
https://www.pinterest.com/pin/212795151132527687/,"Crockpot Cheesy Potatoes | Dinner recipes crockpot, Crockpot side dishes, Recipes",4597,2026-05-22 18:52:25
https://www.pinterest.com/pin/212795151132524821/,"Brussel Sprout Casserole | Recipe | Yummy casserole recipes, Brussel sprout casserole, Whole food recipes",23,2026-05-22 18:52:25
https://www.pinterest.com/pin/212795151132508879/,"Cheesecake Swirled Brownie Cake | Recipe | Cheesecake swirl brownies, Swirl brownies, Brownie cake",104,2026-05-22 18:52:25
https://www.pinterest.com/pin/212795151132522956/,"Chicken Fried Chicken [Video] | Recipes, Easy fast dinner recipes, Fried chicken recipes",1863,2026-05-22 18:52:26
https://www.pinterest.com/pin/212795151132429321/,"Creamy Potato Soup | Recipe | Creamy potato, Creamy potato soup, Recipes",54,2026-05-22 18:52:26
https://www.pinterest.com/pin/sundried-tomato-pasta--212795151132411913/,"Sun-Dried Tomato Pasta | Recipe | Tomato pasta, Cheesy pasta recipes, Pasta dishes",176,2026-05-22 18:52:28
https://www.pinterest.com/pin/212795151132386866/,"Smashed Potatoes | Recipe | Potatoes, Smashed potatoes, Side dishes",90,2026-05-22 18:52:28
https://www.pinterest.com/pin/212795151132380982/,Hot Buttered Rum Recipe: Easy and Delicious Cocktail,34,2026-05-22 18:52:28
https://www.pinterest.com/pin/212795151132380314/,Delicious Sweet & Spicy Slow Cooker Meatballs | Recipe,77,2026-05-22 18:52:28
https://www.pinterest.com/pin/212795151132377842/,"Hot Buttered Rum | Recipe | Hot buttered rum, Hot buttered rum recipe, Rum recipes",78,2026-05-22 18:52:29
https://www.pinterest.com/pin/212795151132380737/,"Pumpkin Bread with Maple Glaze | Recipe | Healthy pumpkin bread, Pumpkin recipes, Pumpkin bread",31,2026-05-22 18:52:29
https://www.pinterest.com/pin/212795151132307422/,"Vegetable Beef Soup | Recipe | Instant pot soup recipes, Beef soup recipes, Instant pot dinner recipes",83,2026-05-22 18:52:31
https://www.pinterest.com/pin/212795151132289997/,Homemade Sausage Rolls | Easy Crowd-Pleasing Recipe,1981,2026-05-22 18:52:31
https://www.pinterest.com/pin/212795151132288379/,"Donut Cake | Recipe | Cake donuts, Desserts, Dessert cake recipes",72,2026-05-22 18:52:32
https://www.pinterest.com/pin/212795151132279881/,"Donut Cake | Recipe | Cake donuts, Cake, Desserts",155,2026-05-22 18:52:32
https://www.pinterest.com/pin/212795151132278597/,"Snickerdoodle Cookie Recipe | Recipe | Snickerdoodles, Easy snickerdoodles, Cookie recipes",38,2026-05-22 18:52:33
https://www.pinterest.com/pin/peanut-clusters--212795151132257079/,"Peanut Clusters | Recipe | Homemade cake recipes, S'mores",6397,2026-05-22 18:52:33
https://www.pinterest.com/pin/pumpkin-cheesecake--212795151132278395/,"Pumpkin Cheesecake | Recipe | Pumpkin cheesecake recipes, Desserts, Pumpkin cheesecake",116,2026-05-22 18:52:34
https://www.pinterest.com/pin/212795151132278476/,"Egg Drop Soup | Homemade egg drop soup, Egg drop soup, Egg drop",83,2026-05-22 18:52:34
https://www.pinterest.com/pin/212795151132278454/,Classic White Russian Cocktail Recipe,41,2026-05-22 18:52:34
https://www.pinterest.com/pin/easy-cheesy-breakfast-potatoes--212795151132257027/,Easy Cheesy Breakfast Potatoes | Recipe,48,2026-05-22 18:52:34
https://www.pinterest.com/pin/212795151132206488/,Slow Cooker Pumpkin Hot Chocolate Recipe,11240,2026-05-22 18:52:36
https://www.pinterest.com/pin/212795151132169271/,"Instant Pot Chicken Caesar Sandwiches | Recipe | Chicken caesar sandwich, Chicken ranch crock pot recipe, Recipes",157,2026-05-22 18:52:36
https://www.pinterest.com/pin/212795151132204312/,"Air Fryer Ranch Chex Mix | Recipe | Chex mix recipes, Chex mix, Air fryer recipes breakfast",125,2026-05-22 18:52:37
https://www.pinterest.com/pin/212795151132188195/,"Roasted Red Pepper Hummus | Recipe | Stuffed peppers, Roasted red pepper hummus, Food processor recipes",66,2026-05-22 18:52:37
https://www.pinterest.com/pin/56787645293892855/,"This Orange Glazed Salmon is a quick and easy weeknight meal that serves the whole family, has minimal in gr… | Orange glazed salmon, Orange recipes, Salmon recipes",244,2026-05-22 18:52:38
https://www.pinterest.com/pin/212795151131927274/,Delicious Strawberry Rhubarb Pie | Recipe,336,2026-05-22 18:52:44
https://www.pinterest.com/pin/212795151131922919/,"Copycat Sausage Egg McMuffin | Recipe | Sausage and egg, Sausage and egg mcmuffin, Delicious breakfast recipes",59,2026-05-22 18:52:44
https://www.pinterest.com/pin/212795151131926811/,"Strawberry Pie | Strawberry pie recipe, Fresh strawberry recipes, Strawberry dessert recipes",10496,2026-05-22 18:52:44
https://www.pinterest.com/pin/56787645293584913/,"Popular Pins | Recipes, Wahlburgers recipes, Sloppy joes recipe",46,2026-05-22 18:52:44
https://www.pinterest.com/pin/212795151131885292/,"When it comes to easy flavorful and delicious this Slow Cooker Meatloaf is it. With a delicious… | Slow cooker meatloaf, Good meatloaf recipe, Crockpot recipes easy",134,2026-05-22 18:52:44
https://www.pinterest.com/pin/45036065012157038/,"The Best Chocolate Chip Cookies | Recipe | Favorite dessert recipes, Easy cookie recipes, Best chocolate",39,2026-05-22 18:52:44
https://www.pinterest.com/pin/329536897738004316/,"Schnell und einfach, dieser Eintopf-Chili-Mac ist einer unserer beliebtesten ...  #chili #die... | Recipes, Cold weather food, Cooking recipes",14,2026-05-22 18:52:45
https://www.pinterest.com/pin/212795151131884527/,"Slow Cooker Barbacoa Beef | Beef barbacoa slow cooker, Slow cooker barbacoa, Barbacoa beef",31,2026-05-22 18:52:45
https://www.pinterest.com/pin/212795151131870429/,Strawberry Cheesecake Bars | Recipe,105,2026-05-22 18:52:47
https://www.pinterest.com/pin/212795151131881433/,Instant Pot Mongolian Beef Recipe with Sticky Garlic Sauce,32,2026-05-22 18:52:47
https://www.pinterest.com/pin/45036065012133690/,Homemade Coconut Pudding: A Delicious Dessert,214,2026-05-22 18:52:47
https://www.pinterest.com/pin/212795151131880903/,"Veggie Pizza Pinwheels | Recipe | Clean eating snacks, Recipes, Veggie pizza",6515,2026-05-22 18:52:47
https://www.pinterest.com/pin/212795151131848966/,"With only 3 ingredients and less than 20 minutes cook time the Crescent Dogs are an easy, family friendly recipe tha… | Crescent dog recipes, Recipes, Crescent dogs",70,2026-05-22 18:52:49
https://www.pinterest.com/pin/212795151131845301/,"Weeknight Dinner For Kids | Mexican food recipes, Meals, Recipes",15,2026-05-22 18:52:49
https://www.pinterest.com/pin/229754018480517381/,"Want a trusted and tasty Peach Pie Recipe Look no further, fresh peaches and a double crust this pie is a classi… | Peach pie recipes, Peach recipe, Fresh peach pie",17,2026-05-22 18:52:49
https://www.pinterest.com/pin/229754018480516914/,"Frog Eye Salad- -#Desserts | Frog eye salad, Frog eye salad recipe, Fruit salad recipes",72,2026-05-22 18:52:50
https://www.pinterest.com/pin/212795151131845051/,Cherry Limeade Recipe: Sweet & Tart Refreshing Drink,74,2026-05-22 18:52:50
https://www.pinterest.com/pin/212795151131844959/,212795151131844959,69,2026-05-22 18:52:51
https://www.pinterest.com/pin/212795151131838807/,"Slow Cooker Nashville Hot Chicken Sandwiches | Recipe | Hot chicken sandwiches, Nashville hot chicken, Recipes",23,2026-05-22 18:52:53
https://www.pinterest.com/pin/212795151131833797/,Bacon Parmesan Crisps Recipe | Low Carb Keto Snack,65,2026-05-22 18:52:55
https://www.pinterest.com/pin/212795151131834671/,"#bloggers | Strawberry cake recipes, Ricotta cake, Desserts",14,2026-05-22 18:52:56
https://www.pinterest.com/pin/212795151131834287/,Ground Beef Carbonara Recipe | White pasta with ground beef,9,2026-05-22 18:52:56
https://www.pinterest.com/pin/212795151131834116/,"Asian Crockpot Meatballs,  #Asian #Crockpot #crockpotAppetizers #Meatballs | Crock pot meatballs, Appetizer recipes, Crockpot appetizers",8,2026-05-22 18:52:56
https://www.pinterest.com/pin/212795151131829056/,"Ranch Baked Breaded Chicken | Recipe | Baked breaded chicken, Breaded chicken, Baked chicken recipes",61,2026-05-22 18:52:57
https://www.pinterest.com/pin/229754018480500377/,"Pineapple Upside Down Cake Recipe - A Classic Delicious Recipe! | Pineapple upside down cake, Pineapple upside, Pineapple upside down",34,2026-05-22 18:52:58
https://www.pinterest.com/pin/212795151131824840/,"Baked Pork Chops & Rice- | Pork chop recipes baked, Baked pork chops and rice recipe, Boneless pork chop recipes",13358,2026-05-22 18:52:58
https://www.pinterest.com/pin/229754018480499638/,"Easy Fruit Pizza {A Fun Sweet Spin for Pizza Night} | Easy fruit pizza, Fruit pizza recipe, Dessert pizza",32,2026-05-22 18:52:59
https://www.pinterest.com/pin/229754018480495464/,"Easy No Bake Cookies - Tornadough Alli | Recipe | Easy no bake cookies, No bake cookies, Baking",74,2026-05-22 18:52:59
https://www.pinterest.com/pin/212795151131728519/,"Tres Leches Cake | Recipe | Baking, Tres leches cake recipe, Desserts",83,2026-05-22 18:53:01
https://www.pinterest.com/pin/212795151131726113/,"Lemon Pepper Chicken | Recipe | Chicken stuffed peppers, Stuffed peppers, Lemon pepper chicken",58,2026-05-22 18:53:01
https://www.pinterest.com/pin/212795151131726090/,"Baked Chicken and Rice | Recipe | Recipes, Baked chicken, Chicken recipes",254,2026-05-22 18:53:01
https://www.pinterest.com/pin/212795151131726089/,Sheet Pan Chicken Fajitas,363,2026-05-22 18:53:02
https://www.pinterest.com/pin/loaded-fries-video--212795151131723344/,"Loaded Fries [Video] | Recipe [Video] | Fast dinner recipes, Recipes, Easy chicken dinner recipes",459,2026-05-22 18:53:03
https://www.pinterest.com/pin/212795151131723252/,Loaded Fries | Easy and Delicious Recipes,67,2026-05-22 18:53:03
https://www.pinterest.com/pin/212795151131720707/,"Carne Asada | Recipe | Carne asada tacos, Mexican food recipes, Carne asada recipes",123,2026-05-22 18:53:03
https://www.pinterest.com/pin/italian-pinwheels--212795151131719158/,"Italian Pinwheels | Recipe | Italian pinwheel recipe, Pinwheel recipes, Pinwheel sandwiches",126,2026-05-22 18:53:03
https://www.pinterest.com/pin/212795151131720703/,"Easy No Bake Cookies - Tornadough Alli | Recipe | Easy no bake cookies, Baking recipes cookies, Desserts",42791,2026-05-22 18:53:03
https://www.pinterest.com/pin/47710077292256648/,"Italian Pinwheels | Recipe | Healthy recipes, Cold appetizers, Italian appetizers",4054,2026-05-22 18:53:03
https://www.pinterest.com/pin/212795151131696910/,"Banana Mug Cake | Recipe | Mug cake, Banana mug cake, Mug recipes",37,2026-05-22 18:53:06
https://www.pinterest.com/pin/212795151131694143/,"Easy Cookie Cups | Recipe | Easy cookies, Cookie cups recipe, Cookie cups",227,2026-05-22 18:53:06
https://www.pinterest.com/pin/212795151131687180/,"Cast Iron Skillet Pizza | Recipe | Cast iron skillet pizza, Cast iron pizza, Easy cast iron recipes",138,2026-05-22 18:53:06
https://www.pinterest.com/pin/212795151131683169/,"Cast Iron Skillet Pizza | Recipe | Cast iron skillet pizza, Skillet pizza, Cast iron recipes",237,2026-05-22 18:53:06
https://www.pinterest.com/pin/329536897737488631/,"Fall Off The Bone Ribs | Recipe | Recipes, Food network recipes, Low calorie recipes",35,2026-05-22 18:53:07
https://www.pinterest.com/pin/329536897737488685/,KFC Bowls | Recipe | Best kfc meal deals,46853,2026-05-22 18:53:08
https://www.pinterest.com/pin/212795151131628908/,"The Best Grilled Cheese Sandwich | Recipe | Best grilled cheese, Grilled cheese recipes, Ultimate grilled cheese",293,2026-05-22 18:53:10
https://www.pinterest.com/pin/329536897737399001/,"Spaghetti Casserole | Recipe | Spaghetti casserole, Easy weeknight meals, Spaghetti casserole recipe",73,2026-05-22 18:53:10
https://www.pinterest.com/pin/212795151131628300/,"French Bread Pizza | Pizza recipes homemade, Recipes, Cooking recipes",1783,2026-05-22 18:53:10
https://www.pinterest.com/pin/frozen-lemonade-recipe-refreshing-and-easy-to-make--212795151131623901/,"Frozen Lemonade | Recipe | Frozen lemonade, Lemonade recipes, Lemon sugar cookies",61,2026-05-22 18:53:11
https://www.pinterest.com/pin/212795151131612859/,"Pulled Pork Sandwiches | Recipe | Pulled pork, Pork, Pork tenderloin recipes",55,2026-05-22 18:53:11
https://www.pinterest.com/pin/212795151131594765/,"Tuna Pasta Salad | Recipe | Tuna pasta salad recipes, Recipes, Tuna salad pasta",6279,2026-05-22 18:53:12
https://www.pinterest.com/pin/212795151131595177/,"Vegetable Lo Mein | Recipe | Vegetable lo mein, Asian cooking, Asian dishes",78,2026-05-22 18:53:12
https://www.pinterest.com/pin/212795151131602300/,"Strawberry Dumplings | Recipe | Strawberry recipes, Recipes, Desserts",179,2026-05-22 18:53:12
https://www.pinterest.com/pin/212795151131604576/,"Strawberry Dumplings | Recipe | Delicious cookie recipes, Strawberry recipes, Sweet desserts",48,2026-05-22 18:53:12
https://www.pinterest.com/pin/212795151131594335/,"Crescent Dogs | Dog recipes, Crescent roll recipes, Recipes",192,2026-05-22 18:53:13
https://www.pinterest.com/pin/212795151131581710/,"Baked Cheesy Chicken | Recipe | New chicken recipes, Tasty chicken dishes, Cheesy chicken",43,2026-05-22 18:53:14
https://www.pinterest.com/pin/45036065011857991/,"Blueberry Upside Down Cake - Tornadough Alli | Pay de chocolate, Fondue de chocolate, Gelatina de chocolate",326,2026-05-22 18:53:15
https://www.pinterest.com/pin/212795151131581149/,"Beer Can Burgers | Recipe | Smoked burgers, Grilled desserts",113,2026-05-22 18:53:15
https://www.pinterest.com/pin/329536897737264835/,"Italian Pinwheels | Recipe | Recipes, Yummy appetizers, Cooking recipes",92,2026-05-22 18:53:15
https://www.pinterest.com/pin/212795151131573120/,"Hawaiian BBQ Chicken Sliders | Bbq chicken sliders, Recipes, Cooking recipes",30,2026-05-22 18:53:15
https://www.pinterest.com/pin/212795151131571037/,"Beer Can Burgers | Recipe | Beer can burgers, Delicious beef recipe, Beef recipes",97,2026-05-22 18:53:15
https://www.pinterest.com/pin/45036065011847466/,"#bloggers | Churros recipe, Mexican food recipes, Recipes",35,2026-05-22 18:53:16
https://www.pinterest.com/pin/212795151131560179/,"Raspberry Sauce | Recipe | Raspberry sauce, Cake fillings, Raspberry cake filling",109,2026-05-22 18:53:16
https://www.pinterest.com/pin/212795151131557886/,"Italian Ricotta Cake | Recipe | Cake recipes, Ricotta cake, Desserts",158,2026-05-22 18:53:17
https://www.pinterest.com/pin/212795151131558386/,"Crockpot Cheesy Potatoes | Recipes, Crockpot recipes easy, Cheesy potatoes recipe",68290,2026-05-22 18:53:17
https://www.pinterest.com/pin/212795151131530219/,Baked Meatballs | Recipe | Big meatballs in oven,155,2026-05-22 18:53:18
https://www.pinterest.com/pin/easy-cheddar-bread--212795151131518490/,"Easy Cheddar Bread | Recipe | Ingredients recipes, Food, Best bread recipe",132,2026-05-22 18:53:19
https://www.pinterest.com/pin/212795151131493461/,Overnight Raspberry Cream Cheese French Toast Bake,103,2026-05-22 18:53:21
https://www.pinterest.com/pin/allpininfo--212795151131493381/,"allpin.info | Waffle maker recipes, Yummy breakfast, Waffle recipes",30,2026-05-22 18:53:21
https://www.pinterest.com/pin/212795151131431403/,"Coconut Cream Pie Recipe | Recipe | Coconut cream pie, Coconut cream pie recipes, Cream pie recipes",29,2026-05-22 18:53:21
https://www.pinterest.com/pin/212795151131432943/,"Fun, quick and delicious this Easy Fruit Pizza uses minimal ingredients and is the perfect dessert or sweet b… | Easy fruit pizza, Fruit pizza recipe, Dessert pizza",444,2026-05-22 18:53:22
https://www.pinterest.com/pin/212795151131450091/,"Easy Fruit Pizza | Easy fruit pizza, Breakfast recipes sweet, Dessert ingredients",139,2026-05-22 18:53:24
https://www.pinterest.com/pin/229754018479962423/,"Scotcheroos | Recipe | Yummy desserts easy, Desserts, Delicious",114,2026-05-22 18:53:24
https://www.pinterest.com/pin/212795151131426760/,"Banana Bread Pudding | Desserts, Bread pudding, Banana pudding recipes",4584,2026-05-22 18:53:24
https://www.pinterest.com/pin/212795151131386987/,"Lemon Raspberry Cheesecake Bars [Video] | Recipe [Video] | Raspberry cheesecake, Cheesecake bars, Raspberry cheesecake bars",7659,2026-05-22 18:53:26
https://www.pinterest.com/pin/212795151131379071/,"Italian Cream Cake | Recipe | Italian cream cakes, Cream cake, Desserts",100,2026-05-22 18:53:26
https://www.pinterest.com/pin/212795151131362934/,"Love a quick and easy dinnertime meal that only requires 6 ingredients? Then you'll have to whip up this … | French bread pizza, Easy main dish recipes, Pizza bread",47,2026-05-22 18:53:26
https://www.pinterest.com/pin/229754018479836347/,"akpin.info | Banana dessert recipes, Bread pudding, Banana bread pudding",158,2026-05-22 18:53:26
https://www.pinterest.com/pin/212795151131348576/,"The Best Angel Food Cake Recipe | Recipe | Angel food, Cake recipes, Angel food cake",57,2026-05-22 18:53:28
https://www.pinterest.com/pin/212795151131354626/,"Blueberry Upside Down Cake - Tornadough Alli | Upside down cake, Upside down desserts, Blueberry upside down cake",63,2026-05-22 18:53:28
https://www.pinterest.com/pin/212795151131339400/,"Blueberry Lemon Sweet Rolls | Recipe | Sweet roll, Lemon blueberry, Delicious breakfast recipes",38,2026-05-22 18:53:28
https://www.pinterest.com/pin/212795151131347710/,"Ham and Cheese Sliders | Recipe | Ham and cheese, Ham and cheese sliders hawaiian, Recipes",197,2026-05-22 18:53:29
https://www.pinterest.com/pin/110338259610970855/,110338259610970855,172,2026-05-22 18:53:29
https://www.pinterest.com/pin/47710077291901662/,47710077291901662,172,2026-05-22 18:53:29
https://www.pinterest.com/pin/763852786786313448/,"Oreo Chocolate Chip Cheesecake Bars | Recipe | Chocolate chip cheesecake bars, Chocolate chip cheesecake, Cheesecake bars",69,2026-05-22 18:53:30
