url,title,saves,timestamp
https://www.pinterest.com/pin/56787645302181227/,"Hearty Tater Tot Breakfast Casserole with Bacon, Sausage, and Cheese | Breakfast casserole with tater tots and bacon, Bacon tator tot breakfast casserole, Breakfast recipes casserole",310,2026-06-14 13:54:33
https://www.pinterest.com/pin/56787645302181279/,"Delicious Chicken Bacon Ranch Sliders Recipe | Chicken ranch sliders recipes kings hawaiian, Bacon bits, Chicken sandwich",486,2026-06-14 13:54:34
https://www.pinterest.com/pin/212795151136998928/,"Easy and Delicious Chicken Fried Chicken | Recipe | Homemade chicken fried chicken, Fried chicken tenders with mashed potatoes, Fried chicken and gravy dinner",2323,2026-06-14 13:54:34
https://www.pinterest.com/pin/56787645302172690/,"Potato Salad - Tornadough Alli | Easy potato salad, How to make potato salad, Potato salad recipes",51,2026-06-14 13:54:36
https://www.pinterest.com/pin/56787645302172760/,"Make Your Own Delicious Dirty Soda at Home | Recipe | How to make italian cream soda with alcohol, Dirty soda recipe non alcoholic, Italian soda flavors combinations",43,2026-06-14 13:54:37
https://www.pinterest.com/pin/56787645302172411/,"Muffuletta Sandwich Recipe | Bread for muffaletta, Giant muffaletta italian sandwich, Jason’s deli muffuletta",37,2026-06-14 13:54:37
https://www.pinterest.com/pin/56787645302172406/,"Bacon Ranch Pasta Salad | Recipe | Bacon ranch pasta salad recipes cold, Bacon ranch pasta salad dressing, Easy bacon ranch pasta salad",55,2026-06-14 13:54:37
https://www.pinterest.com/pin/56787645302172387/,"Baked Queso Dip - Tornadough Alli | Recipe | Baked queso dip easy, Baked queso dip for party, Queso dip in oven",44,2026-06-14 13:54:37
https://www.pinterest.com/pin/212795151136992352/,"Slow Cooker Beer Brats Recipe | Beer brat slow cooker, Beer brats in crock pot, Best dinner recipes",36,2026-06-14 13:54:37
https://www.pinterest.com/pin/56787645302171991/,"Grilled Italian Sausage Sandwiches | Recipe | Italian sausage sub sandwich, How to make italian sausage sandwiches, Italian sausage and pepper sandwich",27,2026-06-14 13:54:38
https://www.pinterest.com/pin/56787645302169509/,"3-Ingredient Strawberry Mousse Recipe | Strawberry puree desserts, Strawberry mousse recipe from scratch, Strawberry mousse dessert with sauce",39,2026-06-14 13:54:38
https://www.pinterest.com/pin/56787645302171877/,"Chocolate Chip Banana Bread—Great for Mother's Day Breakfast or Brunch! | Recipe | Brunch ideas with chocolate chips, Banana bread recipe chocolate chip cinnamon, Chocolate chip banana bread variation",28,2026-06-14 13:54:38
https://www.pinterest.com/pin/212795151136989801/,"Homemade Baked Beans - Tornadough Alli | Recipe | Homemade bbq baked beans, From scratch baked beans, Baked beans recipe oven",115,2026-06-14 13:54:38
https://www.pinterest.com/pin/56787645302154502/,"Easiest Fruit Pizza | Recipe | Baked fruit desserts healthy, Healthy fruit pizza ideas, Best sugar cookie recipe for fruit pizza",105,2026-06-14 13:54:44
https://www.pinterest.com/pin/212795151136974936/,"Fall Off The Bone Ribs | Recipe | Fall ribs recipe, How to make fall off the bone ribs, Oven ribs fall off the bone pork",399,2026-06-14 13:54:44
https://www.pinterest.com/pin/56787645302154365/,"Delicious Blueberry Jam | Best blueberry jam, Easy homemade blueberry jam, Blueberry jam recipes",48,2026-06-14 13:54:44
https://www.pinterest.com/pin/212795151136971758/,"Bacon Ranch Pasta Salad | Recipe | Bacon ranch pasta salad recipes cold, Pickle bacon ranch pasta salad, Easy pasta salad",76,2026-06-14 13:54:45
https://www.pinterest.com/pin/212795151136973311/,"Creamy Cucumber Salad | Recipe | What to serve with cucumber salad, Cold veggie side dish, Cucumber onion salad creamy",49,2026-06-14 13:54:45
https://www.pinterest.com/pin/56787645302154445/,"Homemade Pancake Muffins | Recipe | Muffins from pancake mix recipes, Pancake mix banana muffins, Homemade banana muffins in pan",112,2026-06-14 13:54:45
https://www.pinterest.com/pin/no-bake-coconut-cheesecake--56787645302138108/,"Easy No Bake Coconut Cheesecake | Coconut food recipes, Coconut cream cheesecake no bake, Easy coconut cheesecake",290,2026-06-14 13:54:45
https://www.pinterest.com/pin/212795151136941217/,"Limoncello | Recipe | Summer drink ideas with limoncello, Lemoncello drink, Non alcoholic limoncello recipe",6,2026-06-14 13:54:47
https://www.pinterest.com/pin/212795151136940677/,"Copycat Olive Garden Chicken Gnocchi Soup Recipe—A Comforting, Warm Meal! | Simple chicken gnocchi soup, Chicken gnocchi soup with artichokes, Chicken an gnocchi soup",704,2026-06-14 13:54:47
https://www.pinterest.com/pin/56787645302058434/,"Nutella French Toast Sticks - A Delicious Breakfast Treat! | Recipe | Easy at home breakfast ideas, Easy breakfast for mom, Nutella breakfast recipes",114,2026-06-14 13:54:47
https://www.pinterest.com/pin/56787645302058404/,"Tender and Juicy Marry Me Chicken | Recipe | How to cook chicken tikka masala, How to make marry me chicken keto, Marry me dinner recipes",486,2026-06-14 13:54:47
https://www.pinterest.com/pin/56787645302058389/,"Overnight French Toast Bake {An Easy Breakfast Solution} | Recipe | Baked french toast recipe overnight, French toast bake not overnight",413,2026-06-14 13:54:47
https://www.pinterest.com/pin/56787645302058341/,"Easy Homemade Fruit Pizza | Recipe | Homemade fruit pizza dessert, Simple fruit pizza, Fruit pizza with homemade crust",75,2026-06-14 13:54:47
https://www.pinterest.com/pin/56787645302058218/,"Strawberry Cupcakes | Recipe | Strawberry frosting donut, Strawberry cupcakes with strawberry filling, Strawberries & cream cupcakes",49,2026-06-14 13:54:47
https://www.pinterest.com/pin/56787645301947197/,"Homemade Baked Beans—Great for Summer! | Recipe | Baked beans dish with herbs, Baked beans recipe using bushes baked beans, Easy jack daniels baked beans",96,2026-06-14 13:54:48
https://www.pinterest.com/pin/56787645301947244/,"Parmesan Crusted Chicken | Recipe | 3 ingredient parmesan crusted chicken, Parmesan crusted chicken meal, Parmesan crusted chicken no bread crumbs",34,2026-06-14 13:54:48
https://www.pinterest.com/pin/212795151136937540/,"Strawberry Dumplings—Great for Summer! | Fruit dumplings easy recipes, Strawberry dumplings with crumble topping, Strawberry dumplings with sauce",50,2026-06-14 13:54:50
https://www.pinterest.com/pin/56787645301946958/,"Slow Cooker Beer Brats You Have to Try! | Recipe | Beer brats recipe, Easy dinner recipes, Crockpot beer",49,2026-06-14 13:54:50
https://www.pinterest.com/pin/56787645301946949/,"Lemon Pepper Chicken Kabobs - Tornadough Alli | Recipe | Lemon pepper chicken skewers, Lemon pepper chicken recipe, Easy recipes",83,2026-06-14 13:54:51
https://www.pinterest.com/pin/56787645301946917/,"Beer Can Chicken | Recipe | Beer can chicken sides dishes, Beer can chicken recipe with beer, Best beer can chicken",38,2026-06-14 13:54:51
https://www.pinterest.com/pin/56787645301946488/,"Lemon Pepper Chicken {The Easiest and Best Grilled Chicken Recipe} | Grilled lemon pepper chicken, Grilled chicken recipes easy",29,2026-06-14 13:54:51
https://www.pinterest.com/pin/212795151136933791/,"Coconut Cream Bread Pudding | Recipe | Bread pudding with coconut milk, Coconut cheesecake bread pudding, Bread pudding recipes",263,2026-06-14 13:54:54
https://www.pinterest.com/pin/chocolate-chip-banana-bread-recipe--56787645301479976/,"Chocolate Chip Banana Bread Recipe | Banana bread with chocolate chips moist, Chocolate chip banana bread recipe moist, Chocolate chip banana bread variations",215,2026-06-14 13:54:56
https://www.pinterest.com/pin/dirty-soda--56787645301479715/,"Easy Dirty Soda | Recipe | Dirty soda recipe non alcoholic, Creamer in soda, Dirty soda drink ideas",170,2026-06-14 13:54:56
https://www.pinterest.com/pin/212795151136914771/,"Baked Queso Dip | Recipe | Baked queso dip easy, Baked queso dip for party, Queso dip in oven",10,2026-06-14 13:54:56
https://www.pinterest.com/pin/212795151136913145/,"The BEST Fruit Pizza | Recipe | Simple fruit pizza recipe, Dessert pizza with fruit, Homemade pizza with fruit",19,2026-06-14 13:54:56
https://www.pinterest.com/pin/56787645301479364/,"Almond Croissants Recipe with Almond Cream Filling | Almond croissant recipe easy, Almond croissant recipe from scratch, Homemade almond croissants",80,2026-06-14 13:54:56
https://www.pinterest.com/pin/56787645301473495/,"Southern Banana Pudding | Classic Dessert Recipe | Southern banana pudding recipe homemade, How to make banana pudding with vanilla pudding, Vanilla wafer pudding",1560,2026-06-14 13:54:57
https://www.pinterest.com/pin/212795151136910848/,"Creamy Bacon Cheddar Ranch Pasta Salad | Recipe | Bacon ranch pasta salad recipe, Bacon ranch pasta salad with mayo, Dinner recipes",7,2026-06-14 13:54:58
https://www.pinterest.com/pin/47710077297710376/,"Marry Me Chicken | Recipe | Oven roasted dinners, Marry me chicken recipe oven, Marry me chicken for a crowd",68,2026-06-14 13:54:59
https://www.pinterest.com/pin/47710077297709916/,"Mojo Pork Chops with Cilantro Sour Cream Rice Recipe | Pork chop dinner side dishes, Summer pork chop recipes, Pork chops and rice recipes",130,2026-06-14 13:54:59
https://www.pinterest.com/pin/56787645301456985/,"Irish Coffee Recipe | Easy and Delicious | Best whiskey for irish coffee, Jameson irish coffee recipe, Homemade irish coffee ingredients",36,2026-06-14 13:54:59
https://www.pinterest.com/pin/56787645301456977/,"TikTok Grinder Sandwich | Recipe | Grinder sandwich ingredients, Grinder sandwich recipe, How to make a grinder sandwich",140,2026-06-14 13:54:59
https://www.pinterest.com/pin/the-best-dirty-sodagreat-for-summer--212795151136904925/,The BEST Dirty Soda—Great for Summer!,13,2026-06-14 13:55:00
https://www.pinterest.com/pin/56787645301456975/,"Pizza Grilled Cheese | Delicious Sandwich Recipe | Grilled cheese sandwich hacks, How to make grilled cheese sandwich with pepperoni, Pizza grilled cheese recipes",250,2026-06-14 13:55:00
https://www.pinterest.com/pin/tuna-melt-recipe--56787645301456650/,"Tuna Melt Recipe | Tuna melt sandwich ideas, How to make a tuna melt with tomato, Easy tuna melt recipe",46,2026-06-14 13:55:02
https://www.pinterest.com/pin/212795151136891827/,"Slow Cooker Shredded Mexican Chicken | Recipe | Mexican style shredded chicken, Mexican restaurant shredded chicken, Mexican chicken recipe",16,2026-06-14 13:55:04
https://www.pinterest.com/pin/muffuletta-sandwich-recipe--212795151136889640/,"Muffuletta Sandwich Recipe | Recipe | Muffuletta sandwich, Muffuletta, Muffuletta recipe",3,2026-06-14 13:55:04
https://www.pinterest.com/pin/212795151136889186/,"Vanilla Bean Pistachio Cake {A Delicious, Light, Flavorful Cake} | Recipe | Vanilla pistachio cake, Pistachio birthday cake recipe, Pistachio buttercream cake",459,2026-06-14 13:55:05
https://www.pinterest.com/pin/212795151136885409/,"The Ultimate Easter Menu | Easter dinner menu with ham, Easter meats besides ham, Typical easter meal",14,2026-06-14 13:55:07
https://www.pinterest.com/pin/47710077297689256/,Southern Chicken Fried Chicken,7448,2026-06-14 13:55:07
https://www.pinterest.com/pin/212795151136882388/,"Fruit Pizza | Recipe | Easy fruit pizza, Fruit pizza dessert, Fruit pizza ideas",2635,2026-06-14 13:55:08
https://www.pinterest.com/pin/212795151136883206/,"New York Cheesecake with Cherries | Recipe | Cheesecake bars with cherry filling, Cheesecake bars with cherry topping, Cherry cheesecake bars recipe",8,2026-06-14 13:55:08
https://www.pinterest.com/pin/212795151136882538/,"How to Make Walking Tacos | Recipe | Walking tacos recipe, Crock pot tacos, Taco night",46,2026-06-14 13:55:08
https://www.pinterest.com/pin/56787645301433764/,"Easy Fruit Pizza | Recipe | Fruit pizza with cream cheese, Homemade pizza with fruit, Cream cheese frosting for fruit pizza",151,2026-06-14 13:55:08
https://www.pinterest.com/pin/56787645301433670/,"Traditional Carrot Cake Recipe with Cream Cheese Buttercream | Best frosting for carrot cake, Best icing for carrot cake, Best carrot cake for parties",258,2026-06-14 13:55:08
https://www.pinterest.com/pin/212795151136872862/,"Easy Walking Tacos | Recipe | Walking tacos recipe, Crock pot tacos, Taco night",3,2026-06-14 13:55:10
https://www.pinterest.com/pin/carrot-cake-cupcakes--56787645301430834/,"Delicious Carrot Cake Cupcakes | Recipe | Easy carrot cupcake recipe, Homemade carrot cupcakes recipe, Classic carrot cupcakes",60,2026-06-14 13:55:10
https://www.pinterest.com/pin/212795151136870762/,"TikTok Grinder Sandwich | Recipe | Tik tok grinder sandwich recipe, Best sandwich recipes",334,2026-06-14 13:55:10
https://www.pinterest.com/pin/56787645301404485/,"Easy Crispy Buffalo Shrimp Recipe | Baked buffalo shrimp dip, How to make buffalo shrimp tacos, Spicy buffalo shrimp dip",231,2026-06-14 13:55:12
https://www.pinterest.com/pin/212795151136870633/,"Chicken Fried Chicken - Tornadough Alli | Recipe | Traditional fried chicken meal, Classic fried chicken meal, Southern fried chicken and gravy",7448,2026-06-14 13:55:12
https://www.pinterest.com/pin/56787645300917247/,"Strawberries and Cream Oatmeal Recipe | Strawberry oatmeal with oats, Homemade strawberry oatmeal, Strawberry oatmeal with fresh fruit",31,2026-06-14 13:55:15
https://www.pinterest.com/pin/56787645300917199/,"Easy and Tart Lemon Brownies | Recipe | Fudgy lemon brownies recipe, Moist fudgy lemon brownies, Easy lemon brownie recipe",87,2026-06-14 13:55:15
https://www.pinterest.com/pin/212795151136851861/,Banana Bread Pudding Recipe for a Delicious Dessert | Banana bread pudding recipe easy,239,2026-06-14 13:55:15
https://www.pinterest.com/pin/easy-fruit-pizzaperfect-for-breakfast-brunch-or-dessert-in-2024--212795151136851474/,"Easy Fruit Pizza—Perfect for Breakfast, Brunch, or Dessert! | Recipe | Simple fruit pizza recipe, Dessert pizza with fruit, Homemade pizza with fruit",112,2026-06-14 13:55:15
https://www.pinterest.com/pin/56787645300639000/,"Easter Menu Inspiration: Explore Delicious Options for Your Perfect Meal | Best easter dinner, Easter dinner ideas pinterest, Easter dinner menus",119,2026-06-14 13:55:17
https://www.pinterest.com/pin/56787645300638975/,"Easy Strawberry Mousse | Recipe | Strawberry puree desserts, Strawberry mousse dessert with sauce, Fluffy strawberry mousse recipe",23,2026-06-14 13:55:17
https://www.pinterest.com/pin/56787645300638958/,"Instant Pot BBQ Ribs | Recipe | Instant pot ribs recipe, Rib recipes, Instant pot dinner recipes",24,2026-06-14 13:55:17
https://www.pinterest.com/pin/212795151136848519/,One Pot Creamy Sausage Gnocchi {A Quick and Easy Weeknight Dinner},592,2026-06-14 13:55:17
https://www.pinterest.com/pin/212795151136848348/,"Homemade Strawberry Pop Tarts Recipe | Strawberry pop tart recipe, How to make strawberry pop tarts, Strawberry pop tarts breakfast",46,2026-06-14 13:55:17
https://www.pinterest.com/pin/212795151136845749/,"Strawberry Shortcake Bars Recipe | Simple vanilla icing, Easy strawberry shortcake, Make strawberry shortcake",31,2026-06-14 13:55:18
https://www.pinterest.com/pin/212795151136846874/,"Refreshing Malibu Bay Breeze Cocktail | Recipe | Easy cocktails with malibu, Easy mixed drinks with malibu rum, Summer drinks",23,2026-06-14 13:55:18
https://www.pinterest.com/pin/212795151136848154/,"Bisquick Quiche | Easy Breakfast Recipe | Breakfast with bisquick, Bisquick quiche recipes simple, Bisquick recipes dinner",436,2026-06-14 13:55:18
https://www.pinterest.com/pin/212795151136845354/,"Tortellini Carbonara | Recipe | Tortellini recipes, Entree recipes, Recipes",527,2026-06-14 13:55:20
https://www.pinterest.com/pin/47710077297643664/,"Homemade Chicken Tenders | Recipe | Homemade chicken tenders with ranch, Best homemade chicken tenders, Easy homemade chicken tenders",538,2026-06-14 13:55:20
https://www.pinterest.com/pin/212795151136836586/,"Easy Lemon Brownies | Recipe | Fudgy lemon brownies recipe, Moist fudgy lemon brownies, Easy lemon brownie recipe",15,2026-06-14 13:55:20
https://www.pinterest.com/pin/212795151136834813/,"Tuna Melt Recipe | What goes good with a tuna melt, Tuna melt recipe sandwiches, Easy tuna melt recipe",289,2026-06-14 13:55:21
https://www.pinterest.com/pin/56787645300413860/,Slow Cooker Meatloaf Recipe—Perfect for Lunch or Dinner!,1045,2026-06-14 13:55:21
https://www.pinterest.com/pin/56787645300410580/,"Club Sandwich Recipe - Tornadough Alli | Best club sandwich, Classic club sandwich, Deluxe sandwich",74,2026-06-14 13:55:22
https://www.pinterest.com/pin/212795151136827724/,"Instant Pot BBQ Ribs | Recipe | Best instant pot bbq ribs, Easy instant pot bbq ribs, Instant pot ribs recipe",4,2026-06-14 13:55:23
https://www.pinterest.com/pin/212795151136825265/,"Tender Fall Off The Bone Ribs | Recipe | Fall off the bone ribs in oven, Fall off the bone ribs recipe, Tender ribs",1165,2026-06-14 13:55:24
https://www.pinterest.com/pin/212795151136822200/,"Strawberry Mousse | Recipe | Strawberry puree desserts, Strawberry mousse dessert with sauce, Fluffy strawberry mousse recipe",2,2026-06-14 13:55:26
https://www.pinterest.com/pin/slow-cooker-shredded-mexican-chicken-recipe--212795151136820260/,"Slow Cooker Shredded Mexican Chicken Recipe | Mexican shredded chicken recipes crockpot, Mexican chicken slow cooker recipes, Mexican shredded chicken crockpot easy",159,2026-06-14 13:55:27
https://www.pinterest.com/pin/212795151136820534/,"Hibachi Noodles Recipe - Easy Asian Dish | Simple asian noodles, Hibachi noodles at home, Hibachi noodles recipe easy",21,2026-06-14 13:55:27
https://www.pinterest.com/pin/212795151136803117/,"Crispy Air Fryer Frozen French Fries in Minutes | Frozen fries in deep fryer, Frozen fry recipes, Frozen fries in air fryer",184,2026-06-14 13:55:27
https://www.pinterest.com/pin/56787645300383972/,"The Best Bread Pudding EVER! | Recipe | Best bread pudding recipe simple, Breadpudding dessert, Homemade bread pudding recipes",225,2026-06-14 13:55:34
https://www.pinterest.com/pin/56787645300383942/,"Summer Fancy Toast with Stella® Cheese | Deviled egg potato salad for a crowd, Deviled egg potato salad recipe",48,2026-06-14 13:55:34
https://www.pinterest.com/pin/212795151136798310/,"Homemade Tartar Sauce | Delicious Condiment for Any Dish | Recipe | Simple homemade tartar sauce, Quick tartar sauce, How do you make homemade tartar sauce",846,2026-06-14 13:55:34
https://www.pinterest.com/pin/56787645300383797/,"Creamy Slow Cooker Mashed Potatoes | Instant mashed potatoes in crockpot, Crockpot mashed potatoes without chicken broth, Slow cooker mashed potatoes pioneer woman",123,2026-06-14 13:55:34
https://www.pinterest.com/pin/212795151136795325/,"Fried Shrimp Recipe | Tornadough Alli | Chinese fried shrimp recipes, Homemade fried seafood appetizer, Spicy fried seafood appetizer",95,2026-06-14 13:55:35
https://www.pinterest.com/pin/212795151136795301/,"Honey BBQ Crockpot Meatballs - The Perfect Party Appetizer! | Recipe | Meatball recipes appetizer crock pot, Halloween meatballs crockpot, Bbq meatball recipes crockpot",3570,2026-06-14 13:55:35
https://www.pinterest.com/pin/212795151136794409/,"Chicken Fried Chicken with Gravy and Ranch Sauce | Recipe | Homemade country fried chicken, Easy chicken frying tips, Homemade chicken frying tips",2039,2026-06-14 13:55:37
https://www.pinterest.com/pin/212795151136790609/,"Easy One-Pan Stuffed Pepper Casserole: A Twist on a Classic Recipe | Stuffed pepper casserole easy, Pepper casserole recipes",574,2026-06-14 13:55:37
https://www.pinterest.com/pin/212795151136769887/,"Tuna Melt | Recipe | What goes good with a tuna melt, Tuna melt recipe sandwiches, Easy tuna melt recipe",5,2026-06-14 13:55:40
https://www.pinterest.com/pin/212795151136764479/,"Simple Bread Pudding Recipe with Cinnamon and Nutmeg | Best bread pudding recipe simple, Sauce for bread pudding easy, Bread pudding sauce recipe",46,2026-06-14 13:55:41
https://www.pinterest.com/pin/56787645300358772/,"Homemade French Crullers | Perfect Breakfast Recipe | French crullers doughnut, French crullers recipe, Cruller donut recipe",1024,2026-06-14 13:55:41
https://www.pinterest.com/pin/212795151136764580/,"Homemade Chicken and Dumplings | Recipe | Homemade chicken and dumplings, Recipes, Chicken and dumplings",436,2026-06-14 13:55:43
https://www.pinterest.com/pin/212795151136761442/,212795151136761442,0,2026-06-14 13:55:43
https://www.pinterest.com/pin/56787645300352063/,"How to Make the Perfect Chicken Tenders | Recipe | Homemade chicken tenders with ranch, Best homemade chicken tenders, Easy homemade chicken tenders",538,2026-06-14 13:55:43
https://www.pinterest.com/pin/56787645300348819/,"McDonald's Copycat Shamrock Shake | Recipe | Copycat shamrock shake recipe, Mcdonald's shamrock shake, Mcdonalds shamrock shake recipe",62,2026-06-14 13:55:44
https://www.pinterest.com/pin/212795151136748023/,"Savory and Juicy Slow Cooker Pork Chops | Recipe | Peach pork chops crock pot, Lemon pepper pork chops slow cooker, Keto slow cooker pork chops",1182,2026-06-14 13:55:45
https://www.pinterest.com/pin/212795151136747916/,"Homemade Shrimp Boil | Recipe | How to make a shrimp boil with vegetables, Simple shrimp boil recipe, Shrimp recipes for dinner",64,2026-06-14 13:55:46
https://www.pinterest.com/pin/212795151136748257/,Homemade Strawberry Pop-Tarts,121,2026-06-14 13:55:46
https://www.pinterest.com/pin/212795151136742060/,"Crispy Fish Sandwich with Tartar Sauce and Cheese | Recipe | Slaw for fish sandwiches, Homemade crispy fish sandwich, Fish hoagie",245,2026-06-14 13:55:48
https://www.pinterest.com/pin/212795151136741740/,"Homemade Tartar Sauce Recipe for Fish & More | Simple homemade tartar sauce, Quick tartar sauce, How do you make homemade tartar sauce",409,2026-06-14 13:55:48
https://www.pinterest.com/pin/47710077297553386/,"Olive Garden Chicken Gnocchi Soup | Recipe | Recipes, Soup recipes, Chicken gnocchi soup olive garden",917,2026-06-14 13:55:49
https://www.pinterest.com/pin/212795151136741646/,"Best Air Fryer French Fries Recipe | French fry air fryer recipes, Ninja air fryer french fries, French fries recipe air fryer",155,2026-06-14 13:55:49
https://www.pinterest.com/pin/tortellini-carbonara-recipe-with-spinach-and-bacon--212795151136734482/,"Tortellini Carbonara Recipe with Spinach and Bacon | Tortellini carbonara pasta dish, Chicken tortellini carbonara, Creamy tortellini carbonara",429,2026-06-14 13:55:50
https://www.pinterest.com/pin/212795151136731170/,Homemade Pizza Grilled Cheese,17098,2026-06-14 13:55:52
https://www.pinterest.com/pin/56787645300311369/,"Creamy Root Beer Rum Cocktail - Tornadough Alli | Recipe | Easy whiskey drink ideas, Homemade root beer drink, Creamy alcoholic drinks recipes",3337,2026-06-14 13:55:56
https://www.pinterest.com/pin/56787645300311731/,"Easy Mini Tacos—A Bite-Sized Side or Appetizer! | Recipe | Easy mini taco recipe, Mini tacos for kids, Simple taco",694,2026-06-14 13:55:56
https://www.pinterest.com/pin/chocolate-raspberry-cake--56787645300305393/,"Valentine's Day Chocolate Raspberry Cake—Great for Crowds! | Recipe | Chocolate raspberry cake recipe, Raspberry layer cake, Raspberry buttercream",780,2026-06-14 13:55:58
https://www.pinterest.com/pin/56787645300305319/,"Indulgent Chicken Fried Chicken | Recipe | Fast and easy chicken dinners, Traditional fried chicken meal, Classic fried chicken meal",3313,2026-06-14 13:55:58
https://www.pinterest.com/pin/56787645300305244/,"Chicken Fried Chicken With Country Gravy | Recipe | Country gravy recipe, Creamy cajun shrimp pasta, Large family meals",152,2026-06-14 13:55:58
https://www.pinterest.com/pin/212795151136711034/,"Korean Spicy Pork Bowls | Delicious Asian Recipes | Korean pork rice bowl recipe, Pork bulgogi bowl, Spicy pork bulgogi",164,2026-06-14 13:56:00
https://www.pinterest.com/pin/mini-tacos--212795151136709229/,"Mini Tacos—The BEST Appetizer or Dinner Idea! | Recipe | Easy mini taco recipe, Mini tacos for kids, Simple taco",34,2026-06-14 13:56:02
https://www.pinterest.com/pin/212795151136708480/,"Cinnamon Muffins Recipe - Perfect for Breakfast or Brunch! | Best cinnamon muffin recipe, Cinnamon breakfast muffins, Quick cinnamon muffins",419,2026-06-14 13:56:02
https://www.pinterest.com/pin/47710077297517472/,"Baked Ribs Recipe | Best country style ribs in oven, Country style ribs recipe oven, Baked country style ribs",183,2026-06-14 13:56:02
https://www.pinterest.com/pin/56787645300290440/,"Savory Veggie Pizza Pinwheels - A Crowd-Pleasing Appetizer! | Recipe | No meat pinwheels, Meatless pinwheels, Party foods",684,2026-06-14 13:56:03
https://www.pinterest.com/pin/56787645300281076/,"Valentine's Day Chocolate Raspberry Cake | Recipe | Chocolate raspberry cake recipe, Raspberry layer cake, Raspberry buttercream",37,2026-06-14 13:56:05
https://www.pinterest.com/pin/56787645300280969/,"Baked Pork Chop Recipes: Delicious and Easy! | Pork chops and rice recipes in oven, Easy pork chop and rice recipes, Pork chop and rice casserole easy",312,2026-06-14 13:56:05
https://www.pinterest.com/pin/212795151136684843/,"Classic French Onion Chicken | Recipe | Cheesy french onion chicken, French onion chicken delish, French onion chicken recipe allrecipes",396,2026-06-14 13:56:08
https://www.pinterest.com/pin/homemade-chicken-tenders--47710077297500200/,"Homemade Chicken Tenders | Recipe | Homemade chicken tenders with ranch, Best homemade chicken tenders, How to make ranch chicken tenders in oven",589,2026-06-14 13:56:08
https://www.pinterest.com/pin/delicious-shredded-brussel-sprout-harvest-salad-recipe--212795151136674596/,"Delicious Shredded Brussel Sprout Harvest Salad Recipe | Shredded brussel sprout recipes salad, Shaved brussel sprout salad thanksgiving, Salad dressings",42,2026-06-14 13:56:11
