url,title,saves,timestamp
https://www.pinterest.com/pin/mexican-rice-casserole--212795151133866410/,"Mexican Rice Casserole Recipe | Rice main dish recipes, White rice, Casserole recipes",388,2026-06-20 14:15:16
https://www.pinterest.com/pin/56787645295950900/,"Delicious Vintage Chocolate Chip Applesauce Cake | Recipe | Chocolate chip applesauce cake recipe, Apple pastry, Apple cakes",2,2026-06-20 14:15:18
https://www.pinterest.com/pin/45036065014087068/,"Chocolate Chip Pumpkin Pudding Pie | No bake thanksgiving pie, Pumpkin chip cream pie, Classic pumpkin pie",5,2026-06-20 14:15:21
https://www.pinterest.com/pin/56787645295937894/,"One Pan Stuffed Pepper Casserole | Recipe | Stuffed pepper casserole easy, Stuffed pepper hot dish, Casserole recipes",9,2026-06-20 14:15:21
https://www.pinterest.com/pin/hot-toddy--212795151133852682/,"Hot Toddy Recipe with Lemon and Spices | Hot toddies recipe, Toddy coffee, Food drink",129,2026-06-20 14:15:21
https://www.pinterest.com/pin/212795151133850207/,"Southern Pecan Pie Recipe for Thanksgiving and Christmas | Best easy pecan pie, Best southern pecan pie recipe, The best pecan pie recipe",10,2026-06-20 14:15:22
https://www.pinterest.com/pin/easy-pecan-sticky-buns-tornadough-alli--56787645295930791/,"Easy Pecan Sticky Buns | Recipe | Recipe for pecan sticky buns, Pecan buns recipe easy, Sticky buns easy",41,2026-06-20 14:15:23
https://www.pinterest.com/pin/56787645295926116/,"Sausage Rolls Appetizer | Easy sausage rolls appetizer, How to make sausage rolls with crescent rolls, Sausage rolls recipes",2,2026-06-20 14:15:25
https://www.pinterest.com/pin/pumpkin-bread-with-maple-glaze--212795151133839364/,"Pumpkin Bread with Maple Glaze Recipe | Delicious pumpkin, Pumpkin sweet, Pumpkin recipes dessert",362,2026-06-20 14:15:27
https://www.pinterest.com/pin/cornbread-muffins--212795151133829146/,"Cornbread Muffins Recipe | Corn bread recipe, Yellow cornmeal, Cupcakes muffins",102,2026-06-20 14:15:29
https://www.pinterest.com/pin/212795151133828780/,"Copycat Applebees Honey Pepper Checking Mac and Cheese | Applebee's honey pepper chicken mac and cheese recipe, Copycat applebee's honey pepper chicken mac and cheese, Best easy dinner recipes",91,2026-06-20 14:15:29
https://www.pinterest.com/pin/212795151133829072/,"The BEST Fall Off the Bone Ribs! | Recipe | How to make fall off the bone ribs, Oven ribs fall off the bone pork, Easy fall off the bone ribs",7,2026-06-20 14:15:29
https://www.pinterest.com/pin/pumpkin-donuts--212795151133828727/,"Pumpkin Donuts Recipe | Pumpkin sweet, Pumpkin recipes, Everything pumpkin",110,2026-06-20 14:15:30
https://www.pinterest.com/pin/ham-bacon-cheesy-potatoes--212795151133826791/,"Hearty and Cheesy Ham and Bacon Potatoes | Recipe | What goes with ham and cheesy potatoes, Ham and bacon cheesy potatoes, Cheese potato wedges",4,2026-06-20 14:15:30
https://www.pinterest.com/pin/sausage-rolls-an-easy-fun-party-appetizer--212795151133823609/,"Easy Sausage Rolls Appetizer | How to make sausage rolls with crescent rolls, Sausage rolls recipes",3,2026-06-20 14:15:33
https://www.pinterest.com/pin/212795151133823604/,"The Best Homemade Sloppy Joes - Tornadough Alli | Recipe | Spicy meat sandwich recipe, Savory sloppy joe recipe, How to make spicy sloppy joes",3,2026-06-20 14:15:33
https://www.pinterest.com/pin/212795151133823407/,"Chicken Fried Chicken | Recipe | Country gravy recipe, Creamy cajun shrimp pasta, Fried chicken recipes",16,2026-06-20 14:15:34
https://www.pinterest.com/pin/212795151133823178/,"Copycat Cracker Barrel Meatloaf - Tornadough Alli | Recipe | Cracker barrel meatloaf sauce, Cracker barrel meatloaf recipe with ground beef, Cracker barrel meatloaf recipe copycat",2,2026-06-20 14:15:34
https://www.pinterest.com/pin/212795151133815431/,"Sweet and Savory Candied Sweet Potatoes | Recipe | Candied sweet potato recipes, Southern candied sweet potatoes, Sweet potato side dish recipes",283,2026-06-20 14:15:37
https://www.pinterest.com/pin/tuna-noodle-casserole--212795151133815388/,"Tuna Noodle Casserole Recipe | One pot tuna noodle casserole, One pan tuna noodle casserole, Tuna noodle casserole elbow macaroni",167,2026-06-20 14:15:37
https://www.pinterest.com/pin/vegetable-lo-mein--212795151133814949/,"Vegetable Lo Mein | Recipe | Easy vegetable lo mein, Low mein recipe vegetable, Lo mein recipe",41,2026-06-20 14:15:37
https://www.pinterest.com/pin/329536897742848839/,"Creamy, meaty and flavorful this Ground Beef Carbonara is a serious family hit full of flavor and goodness that no one c… | Ground beef carbonara recipe, White pasta with ground beef, Beef pasta recip",1255,2026-06-20 14:15:37
https://www.pinterest.com/pin/pasta-e-fagioli-soup-recipe-with-fresh-herbs-and-carrots--212795151133812806/,"Pasta e Fagioli Soup Recipe with Fresh Herbs and Carrots | Ministroni soup recipe italian crockpot, Easy classic minestrone soup, Classic homemade minestrone soup recipe",92,2026-06-20 14:15:38
https://www.pinterest.com/pin/white-chicken-chili--212795151133803094/,"White Chicken Chili | White chicken chilli in dutch oven, Healthier white chicken chili, White chicken chili crockpot recipes greek yogurt",139,2026-06-20 14:15:39
https://www.pinterest.com/pin/212795151133812300/,"Easy Pecan Sticky Buns Recipe | Pecan buns recipe easy, Toffee pecan sticky buns, Sticky buns easy",20,2026-06-20 14:15:39
https://www.pinterest.com/pin/229754018483118097/,"Decadent Paleo Brownies with Coconut Salted Caramel Sauce | Recipe | Caramel brownies recipe, Almond flour brownies, Chocolate brownies",8,2026-06-20 14:15:39
https://www.pinterest.com/pin/212795151133806670/,"Easy Croissant Breakfast Sandwiches | Make ahead breakfast sandwiches croissant, Crossaint breakfast sandwiches, Breakfast brunch recipes",10,2026-06-20 14:15:40
https://www.pinterest.com/pin/sweet-potato-pie-recipe-a-delicious-alternative-to-pumpkin-pie--56787645295875825/,"Sweet Potato Pie Recipe - A Delicious Alternative to Pumpkin Pie | Sweet potato pie on cooling rack, Old fashioned sweet potato pie recipes, Sweet potato pie southern",4,2026-06-20 14:15:40
https://www.pinterest.com/pin/212795151133805256/,"Easy Apple Crisp Recipe | Thm apple crisp recipe, Apple crisp sugar free, Best apple crisp",23,2026-06-20 14:15:41
https://www.pinterest.com/pin/56787645295880016/,"French Toast Waffle Sticks | Recipe | Homemade waffle sticks recipe, Belgian waffle sticks, Baked waffle sticks",75,2026-06-20 14:15:41
https://www.pinterest.com/pin/229754018483114866/,"The Best Bread Pudding | Recipe | Best bread pudding recipe, Thanksgiving food desserts",21,2026-06-20 14:15:42
https://www.pinterest.com/pin/56787645295867316/,"Baked Tortellini | Recipe | How to make baked tortellini, Easy oven tortellini dish, Tortellini oven dish recipe",1,2026-06-20 14:15:44
https://www.pinterest.com/pin/212795151133793301/,"Vegetable Frittata | Recipe | Vegetable frittata with salad, Vegetable frittata with tomatoes and spinach, Green vegetable frittata in skillet",140,2026-06-20 14:15:45
https://www.pinterest.com/pin/56787645295865402/,"Slow Cooker Pork Carnitas | Recipe | Pulled pork carnitas slow cooker, Pork loin carnitas slow cooker, Easy pork carnitas slow cooker",6,2026-06-20 14:15:45
https://www.pinterest.com/pin/212795151133793296/,Pistachio Cake,8,2026-06-20 14:15:45
https://www.pinterest.com/pin/212795151133789009/,"Maple Chocolate Pecan Pie Bars Recipe | Easy pecan pie bar recipe, Best fall desserts",76,2026-06-20 14:15:46
https://www.pinterest.com/pin/212795151133789006/,"Irresistible Pumpkin Chocolate Chip Cookies | Recipe | Chocolate chip fall treats, Chocolate chip cookie mix with pumpkin, Recipes with pumpkin spice baking chips",47,2026-06-20 14:15:47
https://www.pinterest.com/pin/212795151133788975/,"Cinnamon Swirl Bread Recipe | Loaf pan sizes, Sweet bread, Homemade bread",34,2026-06-20 14:15:47
https://www.pinterest.com/pin/212795151133782787/,"Easy and Delicious Chicken Tortilla Casserole Recipe | Casserole with corn tortillas, Casserole using corn tortillas, Casserole recipes",2,2026-06-20 14:15:47
https://www.pinterest.com/pin/45036065014014322/,"Homemade Oatmeal Cream Pies Recipe | Iced oatmeal cookies, Cake oatmeal, Whoopie pie recipes",6,2026-06-20 14:15:47
https://www.pinterest.com/pin/cinnamon-apple-cheesecake-recipe--212795151133781635/,"Cinnamon Apple Cheesecake Recipe | Apple cinnamon cheesecake recipe, Apple cheesecake with slice missing, Caramel apple cheesecake",77,2026-06-20 14:15:49
https://www.pinterest.com/pin/easy-creamed-potatoes-a-delicious-side-dish-recipe--212795151133781419/,"Creamed Potatoes | Recipe | Creamed potatoes southern, Creamed potatoes recipe, Creamed potatoes old fashioned",51,2026-06-20 14:15:50
https://www.pinterest.com/pin/212795151133779028/,"Sloppy Joe Casserole | Recipe | Sloppy joe pasta bake with cream cheese, Sloppy joe casserole with noodles, Hamburger helper recipes",192,2026-06-20 14:15:51
https://www.pinterest.com/pin/56787645295845408/,"Delicious Old-Fashioned Oatmeal Cake | Oatmeal cinnamon cake, Desserts using oats, Oatmeal cookie cake",3,2026-06-20 14:15:55
https://www.pinterest.com/pin/212795151133769059/,Sweet Potato Pie,1,2026-06-20 14:15:55
https://www.pinterest.com/pin/56787645295842287/,"French Onion Chicken with Caramelized Onions and Cheese | Recipe | French onion stuffed chicken casserole, Cheesy french onion chicken, French onion soup chicken dish",92,2026-06-20 14:15:55
https://www.pinterest.com/pin/212795151133771421/,"Ultimate Thanksgiving Roundup: Delicious Everyday Paleo Favorites | Recipe | All recipes apple pie, White chocolate apple pie, Apple pie in white dish",17,2026-06-20 14:15:55
https://www.pinterest.com/pin/brussel-sprout-casserole--56787645295841491/,"Brussel Sprout Casserole | Recipe | Easy brussel sprout casserole, Brussel sprouts casserole recipes, Easy casserole recipes",111,2026-06-20 14:15:55
https://www.pinterest.com/pin/212795151133758643/,"Crockpot Honey BBQ Meatballs | Recipe | Meatball side dishes, Recipes using meatballs, Bbq meatballs crockpot",4,2026-06-20 14:15:58
https://www.pinterest.com/pin/212795151133758590/,"Peanut Butter and Jelly Poke Cake | Recipe | Poke cake recipes, Peanut butter frosting, Peanut butter jelly time",497,2026-06-20 14:15:59
https://www.pinterest.com/pin/212795151133758062/,"Three Street Tacos with Salsa and Cilantro | Street tacos in crockpot, Street tacos recipe crockpot, Crock pot street tacos",353,2026-06-20 14:16:00
https://www.pinterest.com/pin/apple-cider-sangria--212795151133758021/,"Apple Cider Sangria Recipe | Halloween party drinks, Zinc rich foods, Fall sangria",184,2026-06-20 14:16:00
https://www.pinterest.com/pin/crock-pot-easy-apple-crumble--212795151133745176/,"Crock Pot Easy Apple Crumble Recipe | Apple crumble crockpot recipe, Apple crumble in crockpot, Apple desserts",191,2026-06-20 14:16:02
https://www.pinterest.com/pin/pumpkin-chocolate-chip-cookies--212795151133744697/,"Pumpkin Chocolate Chip Cookies Recipe | Chocolate chip fall treats, Chocolate chip cookie mix with pumpkin, Recipes with pumpkin spice baking chips",99,2026-06-20 14:16:02
https://www.pinterest.com/pin/212795151133741928/,"Ground Beef Carbonara | Ground beef carbonara recipe, White pasta with ground beef, Beef pasta recipes",18,2026-06-20 14:16:03
https://www.pinterest.com/pin/oatmeal-cream-pies--212795151133736056/,"Oatmeal Cream Pies Recipe | Homemade oatmeal cream pie cookies, How to make homemade oatmeal cream pies, Oatmeal crème pies",2989,2026-06-20 14:16:06
https://www.pinterest.com/pin/56787645295799700/,"Easy Slow Cooker Beer Brats | Recipe | Beer brats crockpot, Slow cooker brats, Beer brats recipe",43,2026-06-20 14:16:07
https://www.pinterest.com/pin/212795151133732721/,"Brownie in a Mug Recipe | Brownie mug cake recipe, Mug desserts, Brownies bars",24,2026-06-20 14:16:08
https://www.pinterest.com/pin/56787645295794011/,"Homemade Chicken Tenders | Recipe | Homemade chicken tenders recipe, Chicken pesto sandwich, Easy chicken",21,2026-06-20 14:16:09
https://www.pinterest.com/pin/212795151133729983/,"Baked French Fries | Recipe | Easy french fries baked, Homemade french fries side dish, Best potato for french fries",167,2026-06-20 14:16:09
https://www.pinterest.com/pin/nashville-hot-chicken-tenders--212795151133722302/,"Nashville Hot Chicken Tenders Recipe | Homemade chicken tenders, Chicken tenderloin, Crispy chicken sandwiches",178,2026-06-20 14:16:15
https://www.pinterest.com/pin/212795151133719409/,"Easy Ground Beef Enchiladas | Recipe | Ground beef cheesy enchiladas, Ground beef enchiladas with cheese sauce, Ground beef enchiladas corn tortillas",6,2026-06-20 14:16:16
https://www.pinterest.com/pin/212795151133719201/,"Italian Pinwheels Appetizer | Recipe | How to make italian pinwheels, Italian pinwheel roll recipe, Italian pin wheel recipes",14,2026-06-20 14:16:17
https://www.pinterest.com/pin/pumpkin-bread-pudding--212795151133718842/,"Pumpkin Bread Pudding Recipe for Thanksgiving | Pumpkin bread pudding recipe easy, Autumn bread pudding dish, Pumpkin recipes dessert",3766,2026-06-20 14:16:17
https://www.pinterest.com/pin/apple-monkey-bread--212795151133712593/,"Apple Monkey Bread Recipe | Apple walnut monkey bread rolls, Apple monkey bread with cinnamon rolls, Easy apple monkey bread",402,2026-06-20 14:16:19
https://www.pinterest.com/pin/329536897742586235/,"Mini Air Fryer Pizza Recipe | Quick and Delicious | How long to cook mini pizza in air fryer, Air fryer dinner recipes",4,2026-06-20 14:16:20
https://www.pinterest.com/pin/pumpkin-cheesecake-pie--212795151133712255/,"Pumpkin Cheesecake Pie with Whipped Cream and Cinnamon Sticks | Homemade pumpkin pie cheesecake, Pumpkin and cheesecake pie, Pumpkin pie with cheesecake layer",276,2026-06-20 14:16:20
https://www.pinterest.com/pin/212795151133712564/,"Slow Cooker Grape Jelly Meatballs Recipe | Homemade grape jelly meatballs, Meatballs and jelly, Appetizer meatballs",58,2026-06-20 14:16:21
https://www.pinterest.com/pin/212795151133712097/,"Slow Cooker Meatloaf with Delicious Glaze | Salmon patties recipe, Ground beef dishes, Slow cooker meatloaf recipe",3,2026-06-20 14:16:21
https://www.pinterest.com/pin/56787645295768471/,"Gluten-Free Peach Crumb Bars with a Summery Twist | Recipe | Peach crumble cheesecake bars, Peach pie cheesecake bars, Peach cobbler cheesecake bars",14,2026-06-20 14:16:21
https://www.pinterest.com/pin/56787645295764534/,"Fall Off The Bone Ribs Recipe | Fall ribs recipe, How to make fall off the bone ribs, Oven ribs fall off the bone pork",285,2026-06-20 14:16:22
https://www.pinterest.com/pin/spaghetti-aglio-e-olio--212795151133702225/,"Spaghetti Aglio e Olio Recipe | Ethnic recipes, Food - pasta, Pasta dishes",78,2026-06-20 14:16:23
https://www.pinterest.com/pin/212795151133702183/,"Italian Pinwheels Recipe | How to make italian pinwheels, Italian pinwheel roll recipe, Italian pin wheel recipes",2,2026-06-20 14:16:23
https://www.pinterest.com/pin/212795151133702099/,"Easy Pumpkin Donuts | Recipe | Cinnamon sugar pumpkin donuts, Baked pumpkin donuts, Pumpkin donuts recipe",1,2026-06-20 14:16:24
https://www.pinterest.com/pin/212795151133701657/,"Flavorful Instant Pot Street Tacos: A Quick and Delicious Recipe | Instapot beef tacos, Instant pot mexican beef tacos, Dinner recipes",2655,2026-06-20 14:16:24
https://www.pinterest.com/pin/braided-apple-puff-pastry--212795151133701614/,"Braided Apple Puff Pastry | Easy apple puff pastry recipes, Apple strudel recipe puff pastry, Apple recipes with puff pastry",4136,2026-06-20 14:16:24
https://www.pinterest.com/pin/cookie-monster-edible-cookie-dough--229754018482956712/,"Cookie Monster Edible Cookie Dough Recipe | Homemade monster cookie dough, Recipe for monster cookie dough, Easy edible monster cookie dough",528,2026-06-20 14:16:25
https://www.pinterest.com/pin/copycat-cracker-barrel-meatloaf--212795151133698523/,"Copycat Cracker Barrel Meatloaf Recipe | Glazed meatloaf slices, Glazed meatloaf on serving plate, Meatloaf with barbecue sauce",224,2026-06-20 14:16:26
https://www.pinterest.com/pin/82753711892695718/,"Homemade Soft Pretzels with Cheese Sauce | Recipe | Homemade pretzel cheese sauce, Pretzel recipe, Appetizer recipes",7,2026-06-20 14:16:26
https://www.pinterest.com/pin/french-toast-waffle-sticks--212795151133691812/,"French Toast Waffle Sticks | Homemade waffle sticks recipe, Belgian waffle sticks, Baked waffle sticks",204,2026-06-20 14:16:28
https://www.pinterest.com/pin/7-layer-dip--212795151133689617/,"Delicious 7 Layer Dip Recipe | Clean appetizers, Layered dip recipes, Taco layer dip",575,2026-06-20 14:16:28
https://www.pinterest.com/pin/peach-cobbler-dump-cake-recipe--212795151133689603/,"Peach Cobbler Dump Cake Recipe | Easy 4-Ingredient Dessert | Canned peach dump cake easy, Peach cobbler ice cream cake with cool whip, Peach cobbler with cake mix and sprite",2,2026-06-20 14:16:28
https://www.pinterest.com/pin/212795151133689261/,"Grandma's Butterscotch Oatmeal Crinkle Cookies | Recipe | Easy butterscotch cookie recipe, Old fashioned butterscotch cookies, Oatmealcookies",265,2026-06-20 14:16:29
https://www.pinterest.com/pin/212795151133688864/,"Easy and Decadent Pumpkin Roll Recipe with Cream Cheese Filling | Easy pumpkin rolls with cream cheese, Pumpkin roll cream cheese filling, Cream cheese stuffed pumpkin rolls",4,2026-06-20 14:16:30
https://www.pinterest.com/pin/walking-tacos--212795151133688816/,"Walking Tacos | How to make walking tacos, Walking tacos in bag, Taco night",83,2026-06-20 14:16:30
https://www.pinterest.com/pin/peach-cobbler-cheesecake-bars--212795151133680495/,"Peach Cobbler Cheesecake Bars Recipe | Peach crumble cheesecake bars, Peach pie cheesecake bars, Cheese cakes",1781,2026-06-20 14:16:33
https://www.pinterest.com/pin/55591376641525000/,"Apple Puff Pastry | Recipe | Easy apple puff pastry recipes, Apple strudel recipe puff pastry, Apple recipes with puff pastry",509,2026-06-20 14:16:33
https://www.pinterest.com/pin/212795151133678165/,"Delicious Lemon Pepper Chicken Kabobs | Chicken kabob side dishes, Sides for chicken kabobs, Grilled kabob recipes",9,2026-06-20 14:16:33
https://www.pinterest.com/pin/56787645295733050/,"Homemade Southern Banana Pudding | Recipe | Homemade banana pudding recipe, Southern recipes desserts, Classic southern recipes",10,2026-06-20 14:16:33
https://www.pinterest.com/pin/45036065013907310/,"No Bake Peanut Butter Bars | Best peanut butter bars, Homemade peanut butter bars, Peanut butter bars with graham crackers",2,2026-06-20 14:16:33
https://www.pinterest.com/pin/copycat-baja-blast-recipe--212795151133673154/,"Copycat Baja Blast Recipe | Easy Drink Recipes | Cracker barrel meatloaf, Sliced ham, Sticky buns",41,2026-06-20 14:16:34
https://www.pinterest.com/pin/cinnamon-cream-cheese-frosting--212795151133673130/,"Quick and Delicious Cinnamon Cream Cheese Frosting | Cinnamon icing recipe, Cinnamon frosting recipe, Frosting icing",821,2026-06-20 14:16:34
https://www.pinterest.com/pin/45036065013903650/,"Homemade Chocolate Chip Brookies | Recipe | Brookie cookie bars, Chocolate chip cookie and brownie bars, S'mores brookie recipe",3,2026-06-20 14:16:35
https://www.pinterest.com/pin/212795151133671380/,"22 Copycat Panda Express Recipes for Homemade Take-Out Faves | Panda express menu copycat, How to make panda express dishes, Asian foods",2,2026-06-20 14:16:35
https://www.pinterest.com/pin/212795151133671373/,"Copycat Honey Pepper Chicken Mac N' Cheese | Applebee's honey pepper chicken mac and cheese recipe, Copycat applebee's honey pepper chicken mac and cheese, Best easy dinner recipes",13,2026-06-20 14:16:35
https://www.pinterest.com/pin/212795151133664809/,"Easy Homemade Macaroni Salad Recipe | Macaroni salad with corn and ham, Macaroni salad recipe with peas, Easy macaroni salad",3,2026-06-20 14:16:37
https://www.pinterest.com/pin/homemade-chicken-tenders--212795151133664749/,"The Best Homemade Chicken Tenders | Recipe | Homemade chicken tenders recipe, Boneless chicken wings, Chicken sliders",9,2026-06-20 14:16:38
https://www.pinterest.com/pin/copycat-applebees-honey-pepper-chicken-mac-and-cheese--212795151133661088/,"Copycat Applebee's Honey Pepper Chicken Mac and Cheese | Applebee's honey pepper chicken mac and cheese ingredients, Applebee's honey pepper chicken mac and cheese recipe, Chicken dinners",933,2026-06-20 14:16:38
https://www.pinterest.com/pin/56787645295714523/,Arnold Palmer Drink,4,2026-06-20 14:16:38
https://www.pinterest.com/pin/229754018482885614/,"Cannoli Dip Recipe | Vegan cannoli dip, Easy cannoli dip, Cannoli dip for cake",12,2026-06-20 14:16:38
https://www.pinterest.com/pin/oldfashioned-oatmeal-cake--212795151133656612/,"Old-Fashioned Oatmeal Cake Recipe | Oatmeal cinnamon cake, Desserts using oats, Oatmeal cookie cake",210,2026-06-20 14:16:38
https://www.pinterest.com/pin/slow-cooker-chicken-tinga--212795151133661080/,"Slow Cooker Chicken Tinga Recipe | Chicken tinga crockpot slow cooker, Make ahead meals, Healthy meal plans",49,2026-06-20 14:16:40
https://www.pinterest.com/pin/56787645295709728/,"Spicy Korean Pork Bowls | Creamy cajun shrimp pasta, Best easy dinner recipes, Spicy appetizers",4,2026-06-20 14:16:40
https://www.pinterest.com/pin/blackberry-muffins--212795151133655424/,"Blackberry Muffins | Blackberry crumble muffins, Blackberry muffins with oatmeal streusel, Blueberry muffins",122,2026-06-20 14:16:41
https://www.pinterest.com/pin/homemade-applesauce-tornadough-alli--56787645295709219/,"Homemade Applesauce - Tornadough Alli | Recipe | Strawberry applesauce recipe, Homemade applesauce in glass jar, Homemade applesauce recipes",8,2026-06-20 14:16:42
https://www.pinterest.com/pin/56787645295704042/,"Refreshing Homemade Arnold Palmer Recipe | Arnold palmer drink recipe, How to make arnold palmer, Iced tea lemonade",2,2026-06-20 14:16:43
https://www.pinterest.com/pin/ham-salad--56787645295703519/,"Ham Salad Recipe | Pizza grilled cheese, Ham steaks, Recipe for ham salad",4,2026-06-20 14:16:43
https://www.pinterest.com/pin/212795151133651236/,"Banana Cookies with Cinnamon Cream Cheese Frosting | Recipe | Banana cookie recipe, Banana nut cookies, 2 banana",39,2026-06-20 14:16:43
https://www.pinterest.com/pin/donut-cake--212795151133649636/,"Donut Cake | Delicious Desserts | Diy donut cake inspiration, Sprinkle cake donut recipe, Pink donut cake",76,2026-06-20 14:16:43
https://www.pinterest.com/pin/slow-cooker-buffalo-chicken-sandwiches--212795151133649347/,"Slow Cooker Buffalo Chicken Sandwiches Recipe | Shredded buffalo chicken, Sweet potato buns, Chicken recipes at home",320,2026-06-20 14:16:44
https://www.pinterest.com/pin/homemade-star-crunch--212795151133648403/,"Homemade Star Crunch | Star crunch copycat recipe, Crunchie fudge recipe, No bake desserts",242,2026-06-20 14:16:45
https://www.pinterest.com/pin/56787645295700265/,Easy Peach Cake,2,2026-06-20 14:16:45
https://www.pinterest.com/pin/sausage-rolls--212795151133645677/,"Savory Sausage Rolls for Easy and Delicious Entertaining | Snacks for bible study group, Sausage roll appetizer, Savory sausage pastry recipe",665,2026-06-20 14:16:47
https://www.pinterest.com/pin/56787645295697215/,"Easy Pineapple Margarita | Recipe | Classic margarita ingredients, Pineapple margarita recipe, Blended margaritas",16,2026-06-20 14:16:47
https://www.pinterest.com/pin/56787645295697152/,"Mexican Street Corn | Recipe | Corn on the cob mexican street corn, Mexican street corn with mayo, Mexican street corn recipe",5,2026-06-20 14:16:47
https://www.pinterest.com/pin/212795151133642718/,"Easy Macaroni Salad Recipe | Macaroni salad with corn and ham, Macaroni salad recipe with peas, Salad dishes",22,2026-06-20 14:16:48
https://www.pinterest.com/pin/56787645295689841/,"Watergate Cake: A Delicious Vintage Recipe | Watergate bundt cake, Watergate cake recipe, Pistachio watergate cake",26,2026-06-20 14:16:49
https://www.pinterest.com/pin/copycat-kfc-bowls--212795151133642034/,"Copycat KFC Bowls | Quick and Easy Dinner Recipe | Easy kfc bowl recipe, Homemade kfc bowl, At home kfc bowls",99,2026-06-20 14:16:50
https://www.pinterest.com/pin/oreo-milkshake--212795151133640957/,"Oreo Milkshake Recipe | Easy oreo milkshake, Homemade oreo milkshake, How to make oreo strawberry milkshake",46,2026-06-20 14:16:50
https://www.pinterest.com/pin/229754018482816460/,"Delicious Peach Dump Cake Recipe | Canned peach dump cake easy, Peach cobbler ice cream cake with cool whip, Peach cobbler with cake mix and sprite",23,2026-06-20 14:16:52
https://www.pinterest.com/pin/56787645295680156/,"Lobster Rolls | Recipe | Gourmet lobster roll dish, Fresh lobster roll dinner, Lobster roll with fresh ingredients",29,2026-06-20 14:16:53
https://www.pinterest.com/pin/56787645295673296/,"Cheesy Zucchini Bread | Recipe | Bacon and cheddar zucchini bread, Cheesy zucchini quick bread, Savory zucchini bread",5,2026-06-20 14:16:57
https://www.pinterest.com/pin/easy-sauted-zucchini--212795151133624391/,"Easy Sautéed Zucchini Recipe | Sautéed zucchini recipes, Quick zucchini onion dish, Zucchini sauteed",223,2026-06-20 14:16:57
https://www.pinterest.com/pin/pistachio-cake--212795151133624383/,"Pistachio Cake Recipe | Watergate bundt cake, Watergate cake recipe, Pistachio watergate cake",711,2026-06-20 14:16:58
https://www.pinterest.com/pin/fall-off-the-bone-ribs--212795151133622029/,"Fall Off the Bone Ribs | Fall off the bone ribs in oven, Fall off the bone ribs recipe, Back ribs",136,2026-06-20 14:16:58
https://www.pinterest.com/pin/baked-french-fries--212795151133621823/,"Baked French Fries | Baked french fries in oven, Best way to bake french fries, Air fryer wedges",160,2026-06-20 14:16:59
https://www.pinterest.com/pin/56787645295661416/,The BEST Bread Pudding Recipe | Thanksgiving food desserts,15,2026-06-20 14:17:00
