url,title,saves,timestamp
https://www.pinterest.com/pin/56787645297300286/,"Christmas Tree Cookies | Recipe | Christmas desserts, Christmas food, Christmas cookies",5,2026-05-22 18:41:21
https://www.pinterest.com/pin/peanut-butter-halloween-brownies--212795151135063305/,"Peanut Butter Halloween Brownies | Halloween food treats, Halloween treats, Peanut butter brownies",135,2026-05-22 18:41:23
https://www.pinterest.com/pin/45036065015224675/,"Braided Apple Puff Pastry | Recipe | Apple recipes with puff pastry, Puff pastry recipes, Puff pastry desserts",11,2026-05-22 18:41:23
https://www.pinterest.com/pin/212795151135061305/,Chicken Gyros with Homemade Tzatziki Sauce Recipe,1,2026-05-22 18:41:23
https://www.pinterest.com/pin/45036065015223811/,The Best Bread Pudding EVER!,68,2026-05-22 18:41:23
https://www.pinterest.com/pin/212795151135055257/,"Fireball Hard Cider | Recipe | Hard cider recipe, Cider recipe, Hard cider",72,2026-05-22 18:41:27
https://www.pinterest.com/pin/56787645297288415/,"Chewy Molasses Cookies | Recipe | Chewy molasses cookies, Chewy sugar cookies, Molasses cookies",2,2026-05-22 18:41:27
https://www.pinterest.com/pin/56787645297288076/,"Brown Sugar Cinnamon Pop-Tarts | Recipe | Pop tarts homemade, Cinnamon pop tart, Poptart recipe",2,2026-05-22 18:41:27
https://www.pinterest.com/pin/56787645297280241/,"Chewy Sugar Cookies | Recipe | Chewy sugar cookies, Chewy sugar cookie recipe, Easy cookie recipes",1,2026-05-22 18:41:28
https://www.pinterest.com/pin/45036065015215414/,"Grinch Sugar Cookie Bars | Recipe | Sugar cookie bars, Cookie bars, Best cookie recipes",3,2026-05-22 18:41:28
https://www.pinterest.com/pin/56787645297284586/,"Pumpkin Chocolate Chip Cookies | Recipe | Pumpkin chocolate chip cookie recipe, Pumpkin chocolate chip cookies, Cookies recipes chocolate chip",3,2026-05-22 18:41:28
https://www.pinterest.com/pin/cream-puffs-recipe-tornadough-alli--56787645297278761/,Cream Puffs Recipe: Tornadough Alli,2,2026-05-22 18:41:29
https://www.pinterest.com/pin/212795151135046673/,Cranberry Orange Bundt Cake Recipe,7,2026-05-22 18:41:29
https://www.pinterest.com/pin/slow-cooker-shredded-beef-tacos--56787645297270910/,"Slow Cooker Shredded Beef Tacos | Recipe | Slow cooker shredded beef, Best easy dinner recipes, Slow cooker recipes healthy",4,2026-05-22 18:41:32
https://www.pinterest.com/pin/212795151135040339/,"Christmas Mimosas | Recipe | Christmas mimosa, Best mimosa recipe, Quick drink recipes",16,2026-05-22 18:41:32
https://www.pinterest.com/pin/110338259614576803/,"Easy Banana Bread | Recipe | Easy banana bread, Baking soda baking powder, Banana bread",18,2026-05-22 18:41:32
https://www.pinterest.com/pin/45036065015198774/,"Chocolate Chip Cake | Recipe | Chocolate chip cake recipe, Chocolate chip cake, Sheet cake recipes",11,2026-05-22 18:41:33
https://www.pinterest.com/pin/maple-dijon-pork-tenderloin--212795151135039560/,"Maple Dijon Pork Tenderloin | Pork recipes, Pork tenderloin, Pork tenderloin recipes",81,2026-05-22 18:41:34
https://www.pinterest.com/pin/212795151135017906/,"These No Bake Cheesecake Bites are a fun and minimal ingredient recipe that everyone loves. Drizzled with cho… | Cheesecake bites, Cheesecake bites recipe, Desserts",1255,2026-05-22 18:41:39
https://www.pinterest.com/pin/56787645297244688/,"Chili Cheese Fries | Recipe | Chili cheese fries, Cheese fries, Chili cheese fries recipe",36,2026-05-22 18:41:40
https://www.pinterest.com/pin/212795151135015411/,"Maple Dijon Pork Tenderloin | Recipe | Pork tenderloin recipes, Pork, Pork tenderloin",1,2026-05-22 18:41:40
https://www.pinterest.com/pin/pumpkin-banana-bread--212795151135009189/,"Pumpkin Banana Bread | Pumpkin banana bread, Pumpkin banana bread recipe, Banana bread",46,2026-05-22 18:41:40
https://www.pinterest.com/pin/212795151135008297/,"Chocolate Chip Pumpkin Blondies | Recipe | Pumpkin recipes, Pumpkin dessert, Easy desserts",32,2026-05-22 18:41:40
https://www.pinterest.com/pin/212795151135008240/,"Slow Cooker Pork Chops | Recipe | Slow cooker pork chops, Slow cooker pork, Pork chop recipes crockpot",110,2026-05-22 18:41:41
https://www.pinterest.com/pin/56787645297237934/,"Buffalo Chicken Pinwheels | Recipe | Buffalo chicken pinwheels, Chicken pinwheels, Buffalo chicken rolls",85,2026-05-22 18:41:41
https://www.pinterest.com/pin/instant-pot-spaghetti--212795151135008252/,"Instant Pot Spaghetti | Recipe | Instant pot recipes, Pressure cooker recipes, Cheesy pasta recipes",12,2026-05-22 18:41:42
https://www.pinterest.com/pin/56787645297237927/,"Hot Toddy Recipe | Recipe | Toddy recipe, Hot toddies recipe, Hot toddy",27,2026-05-22 18:41:42
https://www.pinterest.com/pin/56787645297235720/,"Halloween Cookie Bars | Recipe | Cookie bars, Yummy cookies, Scrumptious desserts",6,2026-05-22 18:41:44
https://www.pinterest.com/pin/56787645297235050/,"Ground Beef Stroganoff | Recipe | Ground beef stroganoff, Beef stroganoff, Easy ground beef stroganoff",7,2026-05-22 18:41:44
https://www.pinterest.com/pin/229754018487237638/,"No Bake Banana Cheesecake Bars | Recipe | Banana cheesecake, Cheesecake bars, Baking",14,2026-05-22 18:41:45
https://www.pinterest.com/pin/56787645297231565/,Irresistible Almond Cheesecake Bars for a Sweet Tooth Fix! | Recipe,10,2026-05-22 18:41:45
https://www.pinterest.com/pin/56787645297233186/,"Pumpkin Bread with Maple Glaze | Recipe | Sweet cornbread, Baked dessert recipes, Pumpkin bread recipe",7,2026-05-22 18:41:45
https://www.pinterest.com/pin/hot-buttered-rum--56787645297233667/,"Hot Buttered Rum | Recipe | Hot buttered rum, Delicious drink recipes, Amazing food",27,2026-05-22 18:41:45
https://www.pinterest.com/pin/212795151135000073/,Candy Corn Hot Chocolate | Recipe,248,2026-05-22 18:41:46
https://www.pinterest.com/pin/56787645297229582/,Stuffed Pepper Casserole,12,2026-05-22 18:41:46
https://www.pinterest.com/pin/212795151134999613/,"Pumpkin Truffles | Recipe | Pumpkin truffles, Pumpkin dessert, Pumpkin recipes dessert",31,2026-05-22 18:41:47
https://www.pinterest.com/pin/apple-cinnamon-cake--212795151134997479/,"Apple Cinnamon Cake | Dessert cake recipes, Baked dessert recipes, Cinnamon cake recipes",130,2026-05-22 18:41:48
https://www.pinterest.com/pin/212795151134996629/,"Pin by Amber Cagle on Recipes | Homemade ice cream sandwiches, Homemade ice cream, Frozen dessert recipe",16,2026-05-22 18:41:49
https://www.pinterest.com/pin/pumpkin-truffles--212795151134991113/,"Pumpkin Truffles | Pumpkin recipes dessert, Fall recipes, Christmas candy recipes",101,2026-05-22 18:41:49
https://www.pinterest.com/pin/212795151134990862/,Oreo Cheesecake Cups Recipe,24,2026-05-22 18:41:49
https://www.pinterest.com/pin/slow-cooker-pumpkin-hot-chocolate--56787645297216352/,"Slow Cooker Pumpkin Hot Chocolate | Recipe | Slow cooker pumpkin, Pumpkin hot chocolate, Pumpkin hot chocolate recipe",32,2026-05-22 18:41:52
https://www.pinterest.com/pin/56787645297212688/,"Egg in a Hole | Recipe | Recipes, Breakfast recipes easy quick, Breakfast recipes",5,2026-05-22 18:41:52
https://www.pinterest.com/pin/grinch-sugar-cookie-bars--56787645297215535/,Grinch Cookie Bars - Festive Christmas Dessert Recipe,11,2026-05-22 18:41:52
https://www.pinterest.com/pin/56787645297215739/,"Bubble Tea Recipe (Boba Tea) | Recipe | Bubble tea recipe, Easy bubble tea recipe, Tea recipes",4,2026-05-22 18:41:53
https://www.pinterest.com/pin/212795151134984527/,"Kringla | Recipe | Kringla recipe, Light dessert recipes, Recipes",310,2026-05-22 18:41:53
https://www.pinterest.com/pin/pizza-grilled-cheese--212795151134984454/,"Pizza Grilled Cheese | Pizza grilled cheese, Amish recipes, Easy pasta recipes",210,2026-05-22 18:41:54
https://www.pinterest.com/pin/56787645297210696/,"Tortellini alla Panna | Recipe | Best easy dinner recipes, Quick dinner recipes, Easy dinner recipes",1,2026-05-22 18:41:54
https://www.pinterest.com/pin/56787645297206236/,"Pumpkin Truffles | Recipe | Pumpkin truffles, Scrumptious desserts, Truffle recipe",6,2026-05-22 18:41:56
https://www.pinterest.com/pin/chocolate-peppermint-blossoms--56787645297204571/,"Chocolate Peppermint Blossoms | Recipe | Cookies recipes christmas, Easy christmas cookie recipes, Holiday baking recipes",4,2026-05-22 18:41:56
https://www.pinterest.com/pin/212795151134972920/,"Slow Cooker Barbacoa Beef | Recipe | Beef barbacoa slow cooker, Slow cooker barbacoa, Barbacoa beef",10,2026-05-22 18:41:57
https://www.pinterest.com/pin/56787645297201808/,"Apple Pie | Recipe | Best apple pie, Apple pies filling, Apple pie recipes",8,2026-05-22 18:41:58
https://www.pinterest.com/pin/56787645297200759/,"Taco Bell Nacho Fries | Recipe | Copykat recipes, Recipes, Restaurant recipes",1675,2026-05-22 18:41:59
https://www.pinterest.com/pin/56787645297196714/,"Taco Spaghetti | Recipe | Taco spaghetti, Best easy dinner recipes, Favorite pasta recipes",11,2026-05-22 18:42:01
https://www.pinterest.com/pin/yellow-cake--45036065015137631/,"Yellow Cake | Recipe | Yellow cake, Yellow cake recipe, Cake",4,2026-05-22 18:42:02
https://www.pinterest.com/pin/56787645297196640/,"Cheese Grits | Recipe | Cheese grits, Grits recipe, Recipes",6,2026-05-22 18:42:02
https://www.pinterest.com/pin/45036065015137448/,"Hello Dolly Bars | Recipe | Thanksgiving desserts easy, Hello dolly bars, Desserts",5,2026-05-22 18:42:02
https://www.pinterest.com/pin/45036065015137237/,"Honey Bun Bread Pudding | Recipe | Honey buns, Bread pudding, Dessert recipes easy",4,2026-05-22 18:42:02
https://www.pinterest.com/pin/56787645297189006/,56787645297189006,36,2026-05-22 18:42:04
https://www.pinterest.com/pin/56787645297191308/,"Apple Hand Pies | Recipe | Apple hand pies, Mexican dessert, Hand pies",25,2026-05-22 18:42:04
https://www.pinterest.com/pin/56787645297190342/,56787645297190342,1617,2026-05-22 18:42:04
https://www.pinterest.com/pin/56787645297187237/,"Fudge Brownies | Recipe | Fudge brownies, Desserts, Scrumptious desserts",5,2026-05-22 18:42:06
https://www.pinterest.com/pin/212795151134955527/,"Migas Recipe | Recipe | Migas recipe, Recipes, Stuffed peppers",32,2026-05-22 18:42:06
https://www.pinterest.com/pin/tiktok-ramen--212795151134956407/,"TikTok Ramen | Recipe | Ramen recipes easy, Ramen dinner, Main dish recipes",45,2026-05-22 18:42:06
https://www.pinterest.com/pin/56787645297179879/,"Chicken Fried Steak | Recipe | Chicken fried steak, Chicken fried steak recipe, Recipes",8,2026-05-22 18:42:11
https://www.pinterest.com/pin/chicken-salad-pinwheels--56787645297174802/,"Chicken Salad Pinwheels | Recipe | Pinwheel recipes, Appetizer recipes, Recipes",475,2026-05-22 18:42:11
https://www.pinterest.com/pin/212795151134950219/,"Oreo Cheesecake Cups | Recipe | Cheesecake cups, Oreo cheesecake, Cheesecake cups recipe",27,2026-05-22 18:42:11
https://www.pinterest.com/pin/212795151134946517/,Baked Italian Subs | Recipe,4,2026-05-22 18:42:11
https://www.pinterest.com/pin/56787645297173596/,Creamy Crockpot Cheesy Potatoes Recipe,7,2026-05-22 18:42:13
https://www.pinterest.com/pin/hot-honey-with-chicken-tenders--56787645297172057/,"Hot Honey (with Chicken Tenders) | Recipe | Honey recipes, Hot honey recipe, Sweet and spicy",42,2026-05-22 18:42:14
https://www.pinterest.com/pin/212795151134945176/,"Crescent Roll Apple Dumplings | Recipe | Easy apple dumplings, Crescent roll apple dumplings, Apple dumplings",8,2026-05-22 18:42:14
https://www.pinterest.com/pin/45036065015117410/,"Funnel Cake Recipe | Recipe | Funnel cake, Funnel cake recipe, Recipes",11,2026-05-22 18:42:14
https://www.pinterest.com/pin/apple-cinnamon-muffins--56787645297165430/,"Apple Cinnamon Muffins | Recipe | Apple cinnamon muffins recipe, Sweet desserts, Desserts",5,2026-05-22 18:42:15
https://www.pinterest.com/pin/45036065015108798/,"Chocolate Chip Pumpkin Pudding Pie | Recipe | Pumpkin pudding, Pudding pies, Delicious desserts",2,2026-05-22 18:42:17
https://www.pinterest.com/pin/56787645297163267/,"Peach Muffins | Recipe | Peach muffins, Muffins, Sweet muffin",100,2026-05-22 18:42:18
https://www.pinterest.com/pin/bubble-tea-recipe-boba-tea--212795151134931277/,"Bubble Tea | Recipe | Thai tea boba, Mcdonalds recipes",7,2026-05-22 18:42:20
https://www.pinterest.com/pin/56787645297153013/,"Easy Apple Crisp | Recipe | Easy apple crisp recipe, Apple crisp recipes, Best apple crisp recipe",5,2026-05-22 18:42:21
https://www.pinterest.com/pin/45036065015097217/,"Almond Cheesecake Bars | Recipe | Almond desserts, Almond recipes, Desserts",43,2026-05-22 18:42:22
https://www.pinterest.com/pin/56787645297149917/,"Chicken Sheet Pan Quesadillas | Recipe | Sheet pan dinners recipes, Sheet pan recipes, Best easy dinner recipes",13,2026-05-22 18:42:22
https://www.pinterest.com/pin/212795151134923865/,"Apple Monkey Bread | Recipe | Monkey bread, Apple monkey bread, Flavorful breakfast",10,2026-05-22 18:42:23
https://www.pinterest.com/pin/56787645297147829/,Apple Cinnamon Muffins: Best Recipes,5,2026-05-22 18:42:24
https://www.pinterest.com/pin/212795151134921052/,"Banana Split Pudding Shots | Recipe | Pudding shots, Milk recipes, Banana split",20,2026-05-22 18:42:25
https://www.pinterest.com/pin/56787645297146884/,"Brownie Ice Cream Sandwiches: BHG's Best Recipes | Brownie ice cream, Ice cream sandwich, Easy summer desserts",17,2026-05-22 18:42:25
https://www.pinterest.com/pin/56787645297146272/,"Raspberry Sweet Rolls | Recipe | Sweet roll, Sweet roll recipe, Raspberry recipes",10,2026-05-22 18:42:25
https://www.pinterest.com/pin/45036065015091564/,Brownie Sundae Bowls: Best Recipes on Pinterest,18,2026-05-22 18:42:25
https://www.pinterest.com/pin/cheese-grits--212795151134919534/,"Cheese Grits | Side dishes recipes, Recipes, Side dish recipes",166,2026-05-22 18:42:28
https://www.pinterest.com/pin/45036065015088614/,"Elephant Ears Recipe | Recipe | Elephant ears recipe, Fair food recipes, Recipes",4,2026-05-22 18:42:28
https://www.pinterest.com/pin/grandmas-fried-chicken-recipe--56787645297140778/,"Grandma's Fried Chicken Recipe | Recipe | Chicken recipes, Fried chicken, Best fried chicken recipe",170,2026-05-22 18:42:28
https://www.pinterest.com/pin/reeses-cheesecake-dip--45036065015087167/,"Reese's Cheesecake Dip - The BEST for Parties! | Cheesecake dip, Peanut butter cup cheesecake, Dessert dip recipes",125,2026-05-22 18:42:28
https://www.pinterest.com/pin/56787645297142803/,"Slow Cooker Meatloaf | Recipe | Slow cooker meatloaf, Beef recipes, Meatloaf",15,2026-05-22 18:42:28
https://www.pinterest.com/pin/yellow-cake-recipe--212795151134910858/,"Yellow Cake Recipe | Yellow cake, Yellow cake recipe, No bake cake",80,2026-05-22 18:42:31
https://www.pinterest.com/pin/56787645297137509/,Cracker barrel meatloaf sauce,9,2026-05-22 18:42:31
https://www.pinterest.com/pin/56787645297136249/,Easy and Delicious 5-Ingredient Pumpkin Dip Recipe,8,2026-05-22 18:42:32
https://www.pinterest.com/pin/212795151134908349/,"French Toast Casserole | Recipe | French toast casserole recipes, Easy french toast casserole recipe, French toast easy",7,2026-05-22 18:42:33
https://www.pinterest.com/pin/45036065015080224/,"Deep Fried Snickers | Recipe | Deep fried snickers, Fried snickers, Amazing food",15,2026-05-22 18:42:33
https://www.pinterest.com/pin/212795151134905074/,"Easy, cheesy and saucy these Ground Beef Enchiladas are a quick and effortless dinnertime reci… | Ground beef enchiladas, Mexican food recipes, Easy beef enchiladas",46,2026-05-22 18:42:34
https://www.pinterest.com/pin/45036065015068469/,"Iced Oatmeal Cookies | Recipe | Cookie recipes, Iced oatmeal cookies, Oatmeal cookie recipes",16,2026-05-22 18:42:39
https://www.pinterest.com/pin/56787645297123511/,"Pecan Pralines | Recipe | Praline recipe, Pecan pralines, Caramel pecan",47,2026-05-22 18:42:39
https://www.pinterest.com/pin/47710077295705898/,"Smoked Steak | Recipe | Steak recipes, Ny strip steak recipes, Smoked food recipes",8,2026-05-22 18:42:46
https://www.pinterest.com/pin/212795151134886881/,How to Make the Tik Tok Grinder Sandwich | Recipe,15,2026-05-22 18:42:46
https://www.pinterest.com/pin/212795151134886326/,"The BEST Chicken Fried Chicken Recipe Ever! | Recipes, Fried chicken, Chicken main dish recipes",1,2026-05-22 18:42:46
https://www.pinterest.com/pin/212795151134886319/,Lemon Raspberry Cheesecake Bars | Recipe,2,2026-05-22 18:42:46
https://www.pinterest.com/pin/212795151134886311/,"Honey Roasted Carrots | Recipe | Honey roasted carrots, Honey roasted, Carrot recipes",1,2026-05-22 18:42:46
https://www.pinterest.com/pin/212795151134886307/,"Lemon Blueberry Cake | Recipe | Blueberry lemon cake, Lemon recipes, Fresh lemon recipes",2,2026-05-22 18:42:47
https://www.pinterest.com/pin/212795151134885159/,How to Make Reese's Cheesecake Dip | Reeses dip recipe,6,2026-05-22 18:42:48
https://www.pinterest.com/pin/212795151134885209/,212795151134885209,148,2026-05-22 18:42:48
https://www.pinterest.com/pin/egg-and-onion-rice-dish--56787645297107553/,Egg and onion rice dish | Recipe | Chicken loco rice,5,2026-05-22 18:42:50
https://www.pinterest.com/pin/45036065015055023/,"Glazed Apple Cider Donuts | Recipe | Apple cider donuts, Apple cider donuts recipe, Apple glaze",25,2026-05-22 18:42:50
https://www.pinterest.com/pin/212795151134883236/,"Creamy Root Beer Rum Cocktail: Best Blogger Recipes | Alcohol recipes, Yummy alcoholic drinks, Drinks alcohol recipes",26,2026-05-22 18:42:50
https://www.pinterest.com/pin/212795151134879907/,"Dirty Shirley | Recipe | Delicious drink recipes, Dirty shirley recipe, Summer drink recipes",7,2026-05-22 18:42:51
https://www.pinterest.com/pin/creme-brle-cheesecake--212795151134879082/,"Creme Brûlée Cheesecake | Recipe | Creme brulee cheesecake, Desserts, Savoury cake",3,2026-05-22 18:42:52
https://www.pinterest.com/pin/212795151134879153/,"How to Make Reese's Cheesecake Dip | Dessert dip recipes, Peanut butter recipes, Easy desserts",2,2026-05-22 18:42:52
https://www.pinterest.com/pin/212795151134879146/,"Berry Ricotta Cake | Recipe | Ricotta cake, Fruit recipes, Delicious desserts",3,2026-05-22 18:42:52
https://www.pinterest.com/pin/56787645297099589/,"Easy Pecan Sticky Buns | Recipe | Pecan sticky buns, Sticky buns, Easy sticky buns",5,2026-05-22 18:42:52
https://www.pinterest.com/pin/peach-bellini--56787645297096815/,"Peach Bellini | Recipe | Peach bellini recipe, Gin and prosecco cocktail, Peach bellini",6,2026-05-22 18:42:52
https://www.pinterest.com/pin/cheese-stuffed-bacon-wrapped-brats--212795151134877444/,"Cheese Stuffed Bacon Wrapped Brats | Harvest recipes, Cooking recipes, Smoked food recipes",131,2026-05-22 18:42:55
https://www.pinterest.com/pin/212795151134877591/,"How to Make the BEST Chicken Fried Chicken Recipe Ever! | Recipes, Fried chicken, Chicken main dish recipes",2,2026-05-22 18:42:55
https://www.pinterest.com/pin/212795151134877592/,"Ham & Bacon Cheesy Potatoes | Recipe | Cheesy side dish, Cheesy potatoes, Side dishes easy",1,2026-05-22 18:42:55
https://www.pinterest.com/pin/56787645297094964/,"Chicken Fried Chicken Recipe: Tornadough Alli | Fried chicken recipes, Recipes, Ingredients recipes",23,2026-05-22 18:42:55
https://www.pinterest.com/pin/56787645297094903/,"Peach Cobbler Cheesecake Bars | Recipe | Cheesecake bar recipes, Cheesecake bars, Yummy food",5,2026-05-22 18:42:55
https://www.pinterest.com/pin/bhgs-best-recipes--56787645297094804/,bhgs best recipes  56787645297094804,97,2026-05-22 18:42:55
https://www.pinterest.com/pin/56787645297092309/,"Marble Cake Recipe | Recipe | Cake recipes, Marble cake recipes, Delicious cake recipes",9,2026-05-22 18:42:55
https://www.pinterest.com/pin/56787645297092908/,"Lunch Lady Peanut Butter Bars | Recipe | Peanut butter bars recipe, Favorite dessert recipes, Scrumptious desserts",25,2026-05-22 18:42:56
https://www.pinterest.com/pin/212795151134863889/,212795151134863889,3,2026-05-22 18:42:58
https://www.pinterest.com/pin/47710077295677494/,"Fall Off The Bone Ribs | Recipe | Breakfast recipes easy, Easy meals, Recipes",4,2026-05-22 18:43:01
https://www.pinterest.com/pin/45036065015031062/,"Easy Blackberry Cobbler | Recipe | Desserts, Cobbler recipes, Blackberry cobbler recipe",9,2026-05-22 18:43:01
https://www.pinterest.com/pin/56787645297080619/,"No Churn Banana Ice Cream | Recipe | Homemade ice cream recipes, Homemade ice cream, Easy ice cream recipe",155,2026-05-22 18:43:01
https://www.pinterest.com/pin/212795151134853090/,Irresistible Glazed Apple Cider Donuts: Indulge in Autumn's … | Recipe,2,2026-05-22 18:43:03
https://www.pinterest.com/pin/peach-dump-cake--56787645297075860/,"Peach Dump Cake | Recipe | Peach dump cake, Dump cake, Recipes",8,2026-05-22 18:43:03
https://www.pinterest.com/pin/chicken-fried-chicken--212795151134852105/,"Chicken Fried Chicken Recipe: Dinner Recipes | Fried chicken recipes, Recipes, Ingredients recipes",3,2026-05-22 18:43:05
https://www.pinterest.com/pin/raspberry-sweet-rolls--212795151134851494/,"Raspberry Sweet Rolls | Sweet roll recipe, Sweet roll, Baking",85,2026-05-22 18:43:05
https://www.pinterest.com/pin/212795151134849304/,"Juicy Lucy Recipe | Recipe | Juicy lucy, Recipes, Best easy dinner recipes",6,2026-05-22 18:43:06
https://www.pinterest.com/pin/dirty-shirley-cocktail--212795151134847988/,Dirty Shirley Cocktail | Recipe | Dirty shirley recipe,1,2026-05-22 18:43:06
https://www.pinterest.com/pin/pimento-cheese--56787645297072305/,"Pimento Cheese | Recipe | Pimento cheese, Pimento cheese recipes, Recipes",41,2026-05-22 18:43:07
https://www.pinterest.com/pin/212795151134845983/,Homemade Chicken Tenders: Tornadough Alli | Recipe,8,2026-05-22 18:43:07
https://www.pinterest.com/pin/peach-rice-pudding-recipe--212795151134844406/,"Peach Rice Pudding Recipe | Recipe | Recipes, Rice pudding, Pudding recipes",24,2026-05-22 18:43:09
https://www.pinterest.com/pin/strawberry-pretzel-salad--56787645297067411/,"Strawberry Pretzel Salad | Recipe | Strawberry pretzel salad, Pretzel salad, Strawberry pretzel salad recipe",7,2026-05-22 18:43:10
https://www.pinterest.com/pin/212795151134836443/,Delicious Homemade Peach Pie | Recipe,52,2026-05-22 18:43:12
https://www.pinterest.com/pin/56787645297052045/,"Cheese Curds Recipe | Recipe | Cheese curds recipe, Curd recipe, Recipes",18,2026-05-22 18:43:14
https://www.pinterest.com/pin/56787645297053708/,"Raspberry Palmier Cookies - A Fun and Easy Cookie Recipe | Recipe | Easy cookie recipes, Palmier cookies, Easy cookies",10,2026-05-22 18:43:14
https://www.pinterest.com/pin/brownie-sundae-bowls--212795151134835473/,"Brownie Sundae Bowls | Fun desserts, Favorite dessert recipes, Dessert recipes",31,2026-05-22 18:43:15
https://www.pinterest.com/pin/56787645297051977/,"Smoked Corn on the Cob: !Delicious Recipes! | Smoked food recipes, Fair food recipes, Smoking recipes",4797,2026-05-22 18:43:15
https://www.pinterest.com/pin/tiktok-ramen-recipe--212795151134829946/,"TikTok Ramen Recipe | Dinner recipes, Ramen recipes easy, Spicy recipes",172,2026-05-22 18:43:15
https://www.pinterest.com/pin/212795151134829966/,"Honig BBQ Crockpot Fleischbällchen   - Food | Party Foods | Superbowl party food, Super bowl food, Bowl party food",3204,2026-05-22 18:43:16
https://www.pinterest.com/pin/212795151134829925/,"Beer Can Chicken | Recipe | Beer can chicken, Canned chicken, Recipes",18,2026-05-22 18:43:18
https://www.pinterest.com/pin/56787645297047319/,Easy Banana Bread Truffle Recipe,14,2026-05-22 18:43:18
https://www.pinterest.com/pin/flavorful-instant-pot-street-tacos-a-quick-and-delicious-re--56787645297045123/,Flavorful Instant Pot Street Tacos: A Quick and Delicious Re… | Recipe,82,2026-05-22 18:43:19
https://www.pinterest.com/pin/56787645297045347/,"Chicken Fried Chicken: Best Food Blogger Recipes | Chicken dishes recipes, Recipes, Chicken breast recipes",41961,2026-05-22 18:43:20
https://www.pinterest.com/pin/strawberry-mojito--56787645297041369/,"Strawberry Mojito | Recipe | Strawberry mojito, Cocktail recipes easy, Strawberry mojito recipe",3,2026-05-22 18:43:22
https://www.pinterest.com/pin/212795151134812604/,"Birria Tacos | Recipe | Beef birria recipe, Hispanic food",24,2026-05-22 18:43:26
https://www.pinterest.com/pin/47710077295632116/,Chicken Sheet Pan Quesadillas | Recipe,154,2026-05-22 18:43:26
https://www.pinterest.com/pin/banana-split-pudding-shots--212795151134812295/,"Banana Split Pudding Shots | Pudding shots, Shot recipes, Pudding shot recipes",49,2026-05-22 18:43:26
https://www.pinterest.com/pin/56787645297019999/,"Peach Wine Slushies | Recipe | Wine slushie, Peach mango smoothie, Slushies",5,2026-05-22 18:43:28
https://www.pinterest.com/pin/cinnamon-sugar-mini-donuts--212795151134806909/,"Cinnamon Sugar Mini Donuts | Mini donut recipes, Sweet breakfast, Mini donuts",170,2026-05-22 18:43:28
https://www.pinterest.com/pin/56787645297019155/,"Fried Mac and Cheese Balls | Recipe | Cheese ball, Mac and cheese, Fried mac",46,2026-05-22 18:43:28
https://www.pinterest.com/pin/212795151134804583/,"Beach picnic Summer picnic Health desserts Picnic parties Picnic foods Picnic recipes Gardening Romantic picn… | Tuna pasta salad recipes, Recipes, Tuna salad pasta",12,2026-05-22 18:43:28
https://www.pinterest.com/pin/212795151134806836/,"With only 6 ingredients this Strawberry Cobbler is a delicious old-fashioned recipe that is bursting with fl… | Cobbler recipes, Strawberry cobbler, Dessert recipes",432,2026-05-22 18:43:29
https://www.pinterest.com/pin/56787645297012245/,"Bourbon Chicken | Recipe | Instant pot dinner recipes, Bourbon chicken, Easy skillet dinner",2,2026-05-22 18:43:29
https://www.pinterest.com/pin/212795151134802566/,Cinnamon Sugar Mini Donots | Recipe,1,2026-05-22 18:43:30
https://www.pinterest.com/pin/56787645297010893/,Chicken Sheet Pan Quesadillas Recipe | Mexican Food Dinner,16,2026-05-22 18:43:31
https://www.pinterest.com/pin/229754018486422940/,"Homemade Star Crunch | Recipe | Crunch recipe, Best easy dessert recipes, Star crunch",6,2026-05-22 18:43:31
