url,title,saves,timestamp
https://www.pinterest.com/pin/nashville-hot-chicken-tenders--212795151133722302/,"Nashville Hot Chicken Tenders Recipe | Homemade chicken tenders, Crispy chicken sandwiches, Buffalo chicken sandwiches",178,2026-06-14 14:12:27
https://www.pinterest.com/pin/slow-cooker-grape-jelly-meatballs--212795151133716138/,"Slow Cooker Grape Jelly Meatballs Recipe | Homemade grape jelly meatballs, Meatballs and jelly, Appetizer meatballs",1119,2026-06-14 14:12:28
https://www.pinterest.com/pin/212795151133719409/,"Easy Ground Beef Enchiladas | Recipe | Ground beef cheesy enchiladas, Ground beef enchiladas with cheese sauce, Ground beef enchiladas corn tortillas",6,2026-06-14 14:12:29
https://www.pinterest.com/pin/ground-beef-carbonara--212795151133717908/,"Ground Beef Carbonara Recipe | White pasta with ground beef, White sauce spaghetti with ground beef, Creamy mushroom stroganoff with pasta",492,2026-06-14 14:12:31
https://www.pinterest.com/pin/329536897742606741/,"Easy Pumpkin Donuts | Recipe | Cinnamon sugar pumpkin donuts, Baked pumpkin donuts, Pumpkin donuts recipe",4,2026-06-14 14:12:31
https://www.pinterest.com/pin/apple-monkey-bread--212795151133712593/,"Apple Monkey Bread Recipe | Apple walnut monkey bread rolls, Apple monkey bread with cinnamon rolls, Easy apple monkey bread",402,2026-06-14 14:12:31
https://www.pinterest.com/pin/pumpkin-cheesecake-pie--212795151133712255/,"Pumpkin Cheesecake Pie with Whipped Cream and Cinnamon Sticks | Homemade pumpkin pie cheesecake, Pumpkin and cheesecake pie, Pumpkin pie with cheesecake layer",276,2026-06-14 14:12:31
https://www.pinterest.com/pin/brookies--212795151133702587/,"Brookies | Delicious Dessert Bars | Chocolate chip, Brownies bars, Cookies and bars",121,2026-06-14 14:12:33
https://www.pinterest.com/pin/212795151133702468/,"Baked Pork Chops & Rice Dinner | Recipe | Baked pork chops and rice recipe, Baked pork chops oven",4,2026-06-14 14:12:33
https://www.pinterest.com/pin/spaghetti-aglio-e-olio--212795151133702225/,"Spaghetti Aglio e Olio Recipe | Ethnic recipes, Food - pasta, Pasta dishes",78,2026-06-14 14:12:33
https://www.pinterest.com/pin/212795151133702183/,"Italian Pinwheels Recipe | How to make italian pinwheels, Italian pinwheel roll recipe, Italian pin wheel recipes",2,2026-06-14 14:12:33
https://www.pinterest.com/pin/cookie-monster-edible-cookie-dough--229754018482956712/,"Cookie Monster Edible Cookie Dough Recipe | Homemade monster cookie dough, Recipe for monster cookie dough, Easy edible monster cookie dough",529,2026-06-14 14:12:35
https://www.pinterest.com/pin/braided-apple-puff-pastry--212795151133701614/,"Braided Apple Puff Pastry | Easy apple puff pastry recipes, Apple strudel recipe puff pastry, Apple recipes with puff pastry",4137,2026-06-14 14:12:36
https://www.pinterest.com/pin/82753711892695718/,"Homemade Soft Pretzels with Cheese Sauce | Recipe | Homemade pretzel cheese sauce, Cheese sauce recipe for soft pretzels, Appetizer recipes",7,2026-06-14 14:12:37
https://www.pinterest.com/pin/copycat-cracker-barrel-meatloaf--212795151133698523/,"Copycat Cracker Barrel Meatloaf Recipe | Glazed meatloaf slices, Glazed meatloaf on serving plate, Meatloaf with barbecue sauce",224,2026-06-14 14:12:38
https://www.pinterest.com/pin/329536897742553687/,"Fall off the Bone Ribs - SO GOOD!!! | Recipe | Fall ribs recipe, How to make fall off the bone ribs, Oven ribs fall off the bone pork",24,2026-06-14 14:12:38
https://www.pinterest.com/pin/212795151133696105/,"Instant Pot Chicken Caesar Sandwiches | Recipe | Caesar chicken instant pot, Chicken ceasar instant pot, Family friendly recipe",12,2026-06-14 14:12:38
https://www.pinterest.com/pin/banana-cookies--212795151133698179/,"Banana Cookies with White Frosting and Chopped Nuts | Banana cookie recipe, Cinnamon cream cheese frosting, Banana nut cookies",243,2026-06-14 14:12:38
https://www.pinterest.com/pin/copycat-olive-garden-lemon-crumb-cake--212795151133695885/,"Copycat Olive Garden Lemon Crumb Cake | Olive garden cake recipe, Lemon layer cake, Lemon frosting",824,2026-06-14 14:12:38
https://www.pinterest.com/pin/212795151133688864/,"Easy and Decadent Pumpkin Roll Recipe with Cream Cheese Filling | Easy pumpkin rolls with cream cheese, Pumpkin roll cream cheese filling, Cream cheese stuffed pumpkin rolls",4,2026-06-14 14:12:41
https://www.pinterest.com/pin/56787645295740630/,"Blue Lagoon Cocktail Recipe | Mixologist's Guide | Blue hawaiian drink recipe easy, Blue hawaiian cocktail recipe, Blue hawaiian cocktail with garnish",15,2026-06-14 14:12:41
https://www.pinterest.com/pin/walking-tacos--212795151133688816/,"Walking Tacos | How to make walking tacos, Walking tacos in bag, Taco night",83,2026-06-14 14:12:41
https://www.pinterest.com/pin/212795151133680712/,"Cannoli Dip Recipe | Vegan cannoli dip, Easy cannoli dip, Cannoli dip for cake",12,2026-06-14 14:12:41
https://www.pinterest.com/pin/45036065013907310/,"No Bake Peanut Butter Bars | Best peanut butter bars, Homemade peanut butter bars, Peanut butter bars with graham crackers",2,2026-06-14 14:12:43
https://www.pinterest.com/pin/cinnamon-cream-cheese-frosting--212795151133673130/,"Quick and Delicious Cinnamon Cream Cheese Frosting | Cinnamon icing recipe, Cinnamon frosting recipe, Frosting icing",821,2026-06-14 14:12:43
https://www.pinterest.com/pin/copycat-baja-blast-recipe--212795151133673154/,"Copycat Baja Blast Recipe | Easy Drink Recipes | Cracker barrel meatloaf, Olive garden chicken gnocchi, Cherry limeade",40,2026-06-14 14:12:43
https://www.pinterest.com/pin/212795151133671380/,"22 Copycat Panda Express Recipes for Homemade Take-Out Faves | Panda express menu copycat, How to make panda express dishes, Asian foods",2,2026-06-14 14:12:44
https://www.pinterest.com/pin/212795151133670492/,"7 Layer Dip | Recipe | 7 layer dip with cream cheese, Best 7 layer dip recipe, 7 layer chip dip",5,2026-06-14 14:12:44
https://www.pinterest.com/pin/45036065013903650/,"Homemade Chocolate Chip Brookies | Recipe | Brookie cookie bars, Chocolate chip cookie and brownie bars, S'mores brookie recipe",3,2026-06-14 14:12:44
https://www.pinterest.com/pin/easy-cannoli-dip--45036065013903030/,"Easy Cannoli Dip | Recipe | Vegan cannoli dip, Cannoli dip for cake, Cannoli dip recipe",4,2026-06-14 14:12:44
https://www.pinterest.com/pin/instant-pot-chicken-tikkimasala--212795151133670487/,"Instant Pot Chicken Tikki-Masala | Recipe | Tikki masala, One pot dishes, Instant pot chicken tikka masala",10,2026-06-14 14:12:44
https://www.pinterest.com/pin/47710077294386220/,"Pepperoni Pizza Rolls Recipe | Perfect appetizers, Pizza recipes, Homemade pepperoni pizza",4,2026-06-14 14:12:44
https://www.pinterest.com/pin/56787645295709728/,"Spicy Korean Pork Bowls | Recipe | Chicken pesto sandwich, Boneless chicken wings, Spicy appetizers",4,2026-06-14 14:12:45
https://www.pinterest.com/pin/oldfashioned-oatmeal-cake--212795151133656612/,"Old-Fashioned Oatmeal Cake Recipe | Oatmeal cinnamon cake, Desserts using oats, Oatmeal cookie cake",210,2026-06-14 14:12:45
https://www.pinterest.com/pin/212795151133664809/,"Easy Homemade Macaroni Salad Recipe | Macaroni salad with corn and ham, Macaroni salad recipe with peas, Easy macaroni salad",3,2026-06-14 14:12:46
https://www.pinterest.com/pin/56787645295709471/,"Applebee's Honey Pepper Chicken Mac & Cheese - The Perfect Copycat! | Recipe | Applebee's honey pepper chicken mac and cheese recipe, Copycat applebee's honey pepper chicken mac and cheese, Easy dinne",103,2026-06-14 14:12:47
https://www.pinterest.com/pin/homemade-applesauce-tornadough-alli--56787645295709219/,"Homemade Applesauce - Tornadough Alli | Recipe | Strawberry applesauce recipe, Homemade applesauce in glass jar, Homemade applesauce recipes",8,2026-06-14 14:12:47
https://www.pinterest.com/pin/slow-cooker-buffalo-chicken-sandwiches--212795151133649347/,"Slow Cooker Buffalo Chicken Sandwiches Recipe | Shredded buffalo chicken, Sweet potato buns, Chicken recipes at home",320,2026-06-14 14:12:49
https://www.pinterest.com/pin/56787645295700588/,"Easy Croissant Breakfast Sandwiches | Recipe | Make ahead breakfast sandwiches croissant, Crossaint breakfast sandwiches, Easy croissant sandwiches",2,2026-06-14 14:12:49
https://www.pinterest.com/pin/329536897742449885/,"Chili Dogs Recipe | Hot dogs with chili and onions, Chili cheese hot dogs with onions, Chili cheese hot dog boats",1,2026-06-14 14:12:50
https://www.pinterest.com/pin/56787645295700265/,"Easy Peach Cake | Minimal Ingredients & Full of Flavor | Recipe | Peach cake with cool whip, Easy peach cake recipe, Peach dump cake",2,2026-06-14 14:12:50
https://www.pinterest.com/pin/homemade-star-crunch--212795151133648403/,"Homemade Star Crunch | Star crunch copycat recipe, Crunchie fudge recipe, No bake desserts",242,2026-06-14 14:12:50
https://www.pinterest.com/pin/56787645295697152/,"Mexican Street Corn | Recipe | Corn on the cob mexican street corn, Mexican street corn with mayo, Mexican street corn recipe",5,2026-06-14 14:12:50
https://www.pinterest.com/pin/copycat-kfc-bowls--212795151133642034/,"Copycat KFC Bowls | Quick and Easy Dinner Recipe | Easy kfc bowl recipe, Homemade kfc bowl, At home kfc bowls",99,2026-06-14 14:12:53
https://www.pinterest.com/pin/56787645295688574/,"The Best Lemon Poppy Seed Cake | Homemade lemon cake recipe, Lemon poppyseed cake recipe, Cranberry orange bundt cake",4,2026-06-14 14:12:53
https://www.pinterest.com/pin/peach-dump-cake--212795151133638566/,"Peach Cobbler Dump Cake Recipe | Easy 4-Ingredient Dessert | Canned peach dump cake easy, Peach cobbler ice cream cake with cool whip, Peach cobbler with cake mix and sprite",78,2026-06-14 14:12:53
https://www.pinterest.com/pin/229754018482816950/,"Easy Southern Banana Pudding Recipe | Homemade banana pudding recipe, Southern recipes desserts, Classic southern recipes",3,2026-06-14 14:12:54
https://www.pinterest.com/pin/56787645295675736/,"Easy Chicken Caesar Pasta Salad Recipe | Chicken bacon ceaser pasta salads, Chicken ceasar salad with pasta, Ceaser salad pasta salad",4302,2026-06-14 14:12:57
https://www.pinterest.com/pin/56787645295680156/,"Lobster Rolls | Recipe | Gourmet lobster roll dish, Fresh lobster roll dinner, Lobster roll with fresh ingredients",29,2026-06-14 14:12:57
https://www.pinterest.com/pin/329536897742398871/,"Easy Ground Beef Carbonara Recipe | Thrifty meals, Pasta carbonara recipe, New recipes for dinner",11,2026-06-14 14:12:57
https://www.pinterest.com/pin/56787645295677069/,"Pumpkin Bread with Maple Glaze | Recipe | Pumpkin loaf maple glaze, Pumpkin banana bread with maple glaze, Pumpkin bread with maple icing",1,2026-06-14 14:12:57
https://www.pinterest.com/pin/56787645295673296/,"Cheesy Zucchini Bread | Recipe | Bacon and cheddar zucchini bread, Cheesy zucchini quick bread, Savory zucchini bread",5,2026-06-14 14:12:57
https://www.pinterest.com/pin/baked-french-fries--212795151133621823/,"Baked French Fries | Baked french fries in oven, Best way to bake french fries, Fried",160,2026-06-14 14:13:00
https://www.pinterest.com/pin/fall-off-the-bone-ribs--212795151133622029/,"Fall Off the Bone Ribs | Fall off the bone ribs in oven, Fall off the bone ribs recipe, Back ribs",136,2026-06-14 14:13:00
https://www.pinterest.com/pin/easy-sauted-zucchini--212795151133624391/,"Easy Sautéed Zucchini Recipe | Sautéed zucchini recipes, Quick zucchini onion dish, Zucchini sauteed",223,2026-06-14 14:13:00
https://www.pinterest.com/pin/pistachio-cake--212795151133624383/,"Pistachio Cake Recipe | Watergate bundt cake, Watergate cake recipe, Pistachio watergate cake",711,2026-06-14 14:13:00
https://www.pinterest.com/pin/homemade-biscuits-and-gravy--212795151133618467/,Homemade Biscuits and Gravy,182,2026-06-14 14:13:01
https://www.pinterest.com/pin/212795151133616182/,"Creamy Root Beer Rum Cocktail | Recipe | Easy whiskey drink ideas, Homemade root beer drink, Creamy alcoholic drinks recipes",4282,2026-06-14 14:13:02
https://www.pinterest.com/pin/329536897742368617/,"One Pot Cajun Pasta with Sausage and Parmesan Cheese | Recipe | Cajun one pot meals, Easy one-pot cajun meal, Cajun chicken and sausage pasta recipe",208,2026-06-14 14:13:02
https://www.pinterest.com/pin/slow-cooker-indian-butter-chicken--212795151133616006/,"Slow Cooker Indian Butter Chicken | Recipe | Indian butter chicken, Best easy dinner recipes, Butter chicken",84,2026-06-14 14:13:03
https://www.pinterest.com/pin/56787645295661416/,The Best Bread Pudding - The Perfect Breakfast or Dessert,15,2026-06-14 14:13:03
https://www.pinterest.com/pin/56787645295658921/,"Homemade Chicken Tenders | Recipe | Homemade chicken tenders recipe, Boneless chicken wings, Chicken sliders",7,2026-06-14 14:13:03
https://www.pinterest.com/pin/212795151133605855/,"Cinnamon Cream Cheese Frosting | Recipe | Homemade frosting recipes, Frosting recipes easy, Cupcake decorating tips",7,2026-06-14 14:13:04
https://www.pinterest.com/pin/229754018482771567/,"Kahlua Tres Leches Cake Recipe | How to make tres leches cake with baileys, Coffee tres leches cake recipe, Desserts",141,2026-06-14 14:13:05
https://www.pinterest.com/pin/212795151133605429/,"Easy Summer Corn Salad | Recipe | Corn salad with tomatoes and onions, Grilled corn and tomato salad, Two-corn summer salad",1,2026-06-14 14:13:07
https://www.pinterest.com/pin/homemade-chicken-tenders--212795151133602725/,"Easy Homemade Chicken Tenders | Recipe | Homemade chicken tenders recipe, Boneless chicken wings, Chicken sliders",6,2026-06-14 14:13:07
https://www.pinterest.com/pin/212795151133602775/,"Applebee's Copycat Honey Pepper Chicken Mac & Cheese | Recipe | Applebee's honey pepper chicken mac and cheese recipe, Copycat applebee's honey pepper chicken mac and cheese, Easy dinner recipes",934,2026-06-14 14:13:07
https://www.pinterest.com/pin/212795151133601387/,"The Best Sausage Rolls Appetizer | Recipe | Easy sausage rolls appetizer, Homemade sausage rolls appetizer, Sausage roll ups",6,2026-06-14 14:13:08
https://www.pinterest.com/pin/chicken-fried-chicken--212795151133601528/,"The Best Chicken Fried Chicken | Recipe | Best easy dinner recipes, Large family meals, Buttermilk chicken",2,2026-06-14 14:13:08
https://www.pinterest.com/pin/thai-iced-tea--212795151133598118/,"Thai Iced Tea Recipe | Best thai tea for summer, Easy thai iced tea recipe, Iced tea at home",58,2026-06-14 14:13:08
https://www.pinterest.com/pin/212795151133598083/,"Tuna Pasta Salad | Recipe | Tuna pasta salad recipes, Picnic side dishes, Best pasta salad",3,2026-06-14 14:13:08
https://www.pinterest.com/pin/strawberry-shortcake-bars--212795151133590947/,"Strawberry Shortcake Bars Recipe | Shortbread strawberry shortcake, Lemon meringue strawberry shortcake show, Strawberry shortcake bar recipe",59,2026-06-14 14:13:15
https://www.pinterest.com/pin/crispy-parmesan-potatoes--212795151133591049/,"Crispy Parmesan Potatoes | Recipe | Crispy parmesan potato stacks, Crispy parmesan potato bites, Crispy parmesan crusted buffalo potatoes",5,2026-06-14 14:13:15
https://www.pinterest.com/pin/mississippi-sin-dip-pinwheels--212795151133590533/,"Mississippi Sin Dip Pinwheels Recipe | Ham roll up dip recipe, Spam pinwheels, Appetizers dips",3067,2026-06-14 14:13:15
https://www.pinterest.com/pin/212795151133591322/,"Fall Off the Bone Ribs | Recipe | Fall off the bone ribs in oven, Fall off the bone ribs recipe, Back ribs",9,2026-06-14 14:13:15
https://www.pinterest.com/pin/lemon-pepper-chicken-kabobs--212795151133583423/,lemon pepper chicken kabobs  212795151133583423,9999,2026-06-14 14:13:16
https://www.pinterest.com/pin/56787645295623211/,"The BEST Air Fryer Cinnamon Roll Casserole | Recipe | Air fryer crescent roll breakfast, Pillsbury cinnamon roll recipes air fryer, Crescent roll cinnamon rolls air fryer",7,2026-06-14 14:13:17
https://www.pinterest.com/pin/212795151133578251/,"Traditional Mexican Conchas with Streusel Topping | Recipe | Concha’s recipe, Homemade conchas, Colorful conchas",58,2026-06-14 14:13:18
https://www.pinterest.com/pin/229754018482729701/,"Strawberry Pie | Recipe | Strawberry pie enchiladas, Fresh strawberry pie recipe with jello, Strawberry slab pie",11,2026-06-14 14:13:18
https://www.pinterest.com/pin/212795151133578076/,"Funfetti Sugar Cookie Cheesecake Bars | Recipe | Funfetti cheesecake cookies, Birthday cake cheesecake bars, Funfetti cheesecake bar recipe",88,2026-06-14 14:13:18
https://www.pinterest.com/pin/lemon-poppy-seed-cake--212795151133552014/,"Lemon Poppy Seed Cake Recipe | Gluten free cake recipes easy, Best icing recipe, Homemade lemon cake",213,2026-06-14 14:13:21
https://www.pinterest.com/pin/212795151133551024/,"Sausage Rolls | Recipe | Homemade beef sausage rolls, Pastry dough with sausage filling, Cocktail sausage rolls",9,2026-06-14 14:13:21
https://www.pinterest.com/pin/slow-cooker-beer-brats--212795151133545440/,Slow Cooker Beer Brats,125,2026-06-14 14:13:21
https://www.pinterest.com/pin/212795151133524746/,"Fresh and Easy Peach Cake | Recipe | Peach cake with cool whip, Easy peach cake recipe, Peach dump cake",403,2026-06-14 14:13:21
https://www.pinterest.com/pin/212795151133524736/,"Easy Summer Corn Salad | Recipe | The cozy cook corn salad, Corn off the cob salad, Corn salad recipe easy",813,2026-06-14 14:13:23
https://www.pinterest.com/pin/212795151133497382/,"Rhubarb Slush | Recipe | Rhubarb slush recipe with jello, Summer rhubarb slush, Rhubarb slush drink",372,2026-06-14 14:13:25
https://www.pinterest.com/pin/212795151133489846/,"Grape Salad | Recipe | Easy grape salad, Grape salad recipe, Fruit salad recipes",49,2026-06-14 14:13:25
https://www.pinterest.com/pin/212795151133484443/,"One-Pan Boiled Brats with Sweet Onions & Hard Apple Cider | Recipe | Brats with onions and apple cider, Brats with onions and beer, Brats with onions and mustard",108,2026-06-14 14:13:25
https://www.pinterest.com/pin/212795151133493094/,"Banana Bread Pudding | Banana bread recipe pudding, Banana bread pudding ideas, Peanut butter bread pudding",159,2026-06-14 14:13:25
https://www.pinterest.com/pin/212795151133484442/,"Lemon Pepper Chicken | Recipe | Lemon pepper marinade recipe, Lemon pepper chicken tenderloin marinade, Grilled chicken",91,2026-06-14 14:13:25
https://www.pinterest.com/pin/banana-zucchini-sheet-cake-recipe--212795151133484441/,"Banana Zucchini Sheet Cake Recipe | Zucchini banana bread bars, Banana zucchini cake, Zucchini bread cake",105,2026-06-14 14:13:25
https://www.pinterest.com/pin/212795151133478764/,"Chicken Fried Chicken | Recipe | Fried chicken meal ideas, Sauce for chicken fried steak, Fried chicken breast dinner ideas",25,2026-06-14 14:13:26
https://www.pinterest.com/pin/212795151133468444/,"Classic Blueberry Pie Recipe - Perfectly Flaky Crust & Juicy Berry Filling | The best blueberry pie, Blueberry pie recipe easy, Best blueberry pie recipe",102,2026-06-14 14:13:26
https://www.pinterest.com/pin/212795151133482105/,"S'mores Bars | Recipe | Brownie smores bars, Graham cracker crust smores, S'mores bars recipe",37,2026-06-14 14:13:26
https://www.pinterest.com/pin/212795151133466404/,"Brookies | Recipe | Brookies recipe with box brownies, Recipe for brookies, Brookies recipe cookie brownies easy",14,2026-06-14 14:13:27
https://www.pinterest.com/pin/229754018482548540/,"Memorial Day Menu: Tantalizing Torte with Fresh Berries and Whipped Cream | Recipe | Pavlova with berries, Berry pavlova dessert on wooden table, Pavlova dessert with fresh fruits",9,2026-06-14 14:13:27
https://www.pinterest.com/pin/212795151133438361/,"Mexican Street Corn (Elotes) | Recipe | Corn on the cob mexican street corn, Mexican street corn with mayo, Mexican street corn recipe",108,2026-06-14 14:13:29
https://www.pinterest.com/pin/212795151133429602/,"Quick and Delicious Cinnamon Cream Cheese Frosting | Recipe | Cinnamon icing recipe, Cinnamon frosting recipe, Frosting icing",29,2026-06-14 14:13:30
https://www.pinterest.com/pin/212795151133417931/,"Macaroni Salad Recipe | Macaroni salad with corn and ham, Macaroni salad recipe with peas, Easy macaroni salad",136,2026-06-14 14:13:30
https://www.pinterest.com/pin/212795151133410043/,"Delicious Lemon Tart Recipe | Summer lemon tart recipe, Simple lemon tart recipe, Easy lemon tart",50,2026-06-14 14:13:30
https://www.pinterest.com/pin/212795151133412163/,"Peanut Butter Banana Pudding Recipe - Perfect Dessert for Peanut Butter Lovers | Banana pudding trifle recipe easy, Banana cake recipes, Banana bread recipe",20,2026-06-14 14:13:30
https://www.pinterest.com/pin/lemon-sandwich-cookies--212795151133356439/,"Lemon Sandwich Cookies Recipe | Lemon recipes, Cool cookies, Weekend snacks",98,2026-06-14 14:13:33
https://www.pinterest.com/pin/berry-ricotta-cake--212795151133360149/,"Berry Ricotta Cake with Fresh Berries | Best icing recipe, Carrot cake cookies, Berry recipes",96,2026-06-14 14:13:33
https://www.pinterest.com/pin/212795151133356490/,Chicken Caesar Pasta Salad,447,2026-06-14 14:13:33
https://www.pinterest.com/pin/raspberry-icebox-cake--212795151133356330/,"Raspberry Icebox Cake Recipe | Dessert ideas, Recipes desserts, Treats",67,2026-06-14 14:13:33
https://www.pinterest.com/pin/212795151133273802/,"Walking Tacos | Recipe | How to make walking tacos, Walking tacos in bag, Taco night",45,2026-06-14 14:13:34
https://www.pinterest.com/pin/229754018482310698/,"Brookies | Recipe | Brookie cookie bars, Chocolate chip cookie and brownie bars, S'mores brookie recipe",3,2026-06-14 14:13:34
https://www.pinterest.com/pin/212795151133273805/,"Refreshing Homemade Arnold Palmer Recipe | Arnold palmer drink recipe, How to make arnold palmer, Iced tea lemonade",107,2026-06-14 14:13:34
https://www.pinterest.com/pin/212795151133342617/,"Chocoflan Recipe: Two Desserts in One! | Chocolate cake with caramel topping, Dessert ideas for parties, Chocoflan cake recipe",59,2026-06-14 14:13:34
https://www.pinterest.com/pin/212795151133253811/,"Delicious Mango Salsa Recipe | Fresh mango salsa, How to make mango salsa, Mango avocado",56,2026-06-14 14:13:37
https://www.pinterest.com/pin/212795151133159269/,"#recipes Ground Beef Carbonara | Recipe | Beef recipes for dinner, Beef pasta recipes, Dinner with ground bee - recipes | Ground beef carbonara recipe, White pasta with ground beef, Dinner with ground",8279,2026-06-14 14:13:39
https://www.pinterest.com/pin/212795151133163007/,"Copycat KFC Bowls | Recipes, Chicken bowl recipe, Kfc bowls recipe",25,2026-06-14 14:13:39
https://www.pinterest.com/pin/212795151133153690/,"Soufflé Pancakes | Fluffy Pancake Recipe | Fluffy pancake with toppings, Souffle pancake ideas, Souffle style pancakes",20,2026-06-14 14:13:40
https://www.pinterest.com/pin/212795151133148463/,"The Best Chicken Gnocchi Soup | Recipe | Chicken gnocchi soup with artichokes, Olive garden chicken gnocchi soup recipe easy, Creamy lemon chicken gnocchi soup",173,2026-06-14 14:13:40
https://www.pinterest.com/pin/212795151133093767/,"Slow Cooker Chicken Cacciatore | Recipe | Quick chicken cacciatore, Homemade chicken cacciatore dinner, Easy homemade chicken cacciatore",44,2026-06-14 14:13:43
https://www.pinterest.com/pin/212795151133065719/,"Crispy Chicken Sandwich | Recipe | Crispy chicken sandwich lunch, Easy crispy chicken sandwich, Restaurant style chicken sandwich",111,2026-06-14 14:13:45
https://www.pinterest.com/pin/212795151133055160/,"Mini Air Fryer Pizza Recipe | Quick and Delicious | How long to cook mini pizza in air fryer, Air fryer dinner recipes",73,2026-06-14 14:13:45
https://www.pinterest.com/pin/authentic-cuban-instant-pot-rice-pudding-recipe--212795151133016027/,"Authentic Cuban Instant Pot Rice Pudding Recipe | Instant rice pudding easy, Rice pudding with instant rice recipe, Coconut rice pudding",20,2026-06-14 14:13:45
https://www.pinterest.com/pin/212795151132953054/,"Garlic Butter Steak Bites and Potatoes | Recipe | Sheet pan garlic butter steak bites, Garlic steak and potato bites crockpot, Garlic herb steak bites",323,2026-06-14 14:13:47
https://www.pinterest.com/pin/valentines-rice-krispie-treats--212795151132943549/,"Galentine's Day Rice Krispie Treats | Recipe | Galentine's day party treats, Valentine's day dessert ideas, Rice crispy treats",41,2026-06-14 14:13:48
https://www.pinterest.com/pin/212795151132943334/,"Spaghetti Casserole Recipe | Easy and Delicious | Classic spaghetti casserole, Spaghetti casserole with leftover spaghetti, Spaghetti sauce casserole",74,2026-06-14 14:13:48
https://www.pinterest.com/pin/212795151132907285/,"The BEST Homemade Sloppy Joes | Recipe | Spicy meat sandwich recipe, Savory sloppy joe recipe, How to make spicy sloppy joes",99,2026-06-14 14:13:48
https://www.pinterest.com/pin/212795151132944784/,Steak Bites and Potatoes,15,2026-06-14 14:13:48
https://www.pinterest.com/pin/212795151132926545/,"French Onion Chicken with Caramelized Onions and Cheese | Recipe | French onion stuffed chicken casserole, Cheesy french onion chicken, French onion soup chicken dish",92,2026-06-14 14:13:48
https://www.pinterest.com/pin/212795151132829468/,"Texas Trash Party Mix Recipe | Buffalo chex mix recipes, How to make buffalo chex mix, Appetizers snacks",242,2026-06-14 14:13:49
https://www.pinterest.com/pin/the-best-christmas-morning-breakfast-ideas--212795151132795564/,"The Best Christmas Morning Breakfast Ideas | Christmas fun, Christmas recipes, Appetizers for christmas",315,2026-06-14 14:13:51
https://www.pinterest.com/pin/french-toast-recipe--212795151132765028/,"French Toast Recipe with Syrup Drizzle | French toast recipe no vanilla, French toast recipe without vanilla extract, Breakfast ideas",63,2026-06-14 14:13:51
https://www.pinterest.com/pin/the-best-holiday-appetizers-you-never-knew-you-needed--212795151132756143/,"The Best Holiday Appetizers You Never Knew You Needed! | Best christmas appetizers ever, Delicious christmas appetizers, Best christmas appetizer recipes",264,2026-06-14 14:13:51
