url,title,saves,timestamp
https://www.pinterest.com/pin/212795151135359086/,"Homemade Fudge | Recipe | How to make bounty fudge, Stack of homemade fudge squares, Homemade chocolate fudge in pan",5,2026-07-12 13:29:31
https://www.pinterest.com/pin/chocolate-peppermint-blossoms--56787645298045946/,"Chocolate Peppermint Blossoms | Christmas Cookie Recipes | Chocolate peppermint blossom cookies, Chocolate and peppermint, Holiday dessert",10,2026-07-12 13:29:32
https://www.pinterest.com/pin/delicious-eggnog-cookies-for-the-holidays--212795151135350540/,"Delicious Eggnog Cookies for the Holidays | Recipe | Best eggnog cookies, Cinnamon eggnog cookies, Homemade eggnog cookies",3,2026-07-12 13:29:33
https://www.pinterest.com/pin/crockpot-ranch-mushrooms-in-2022--212795151135350428/,"Crockpot Ranch Mushrooms | Recipe | Mushroom slow cooker, Crockpot side dishes, Mushroom recipes crockpot",30,2026-07-12 13:29:35
https://www.pinterest.com/pin/homemade-caramels--56787645298042743/,"Homemade Caramels | Recipe | Recipe for homemade carmels, Easy homemade soft caramels, Homemade caramel candy pieces",20,2026-07-12 13:29:35
https://www.pinterest.com/pin/212795151135328831/,"Baked Queso Dip Recipe for Parties | Baked queso dip easy, Queso dip oven, Easy homemade queso",4,2026-07-12 13:29:39
https://www.pinterest.com/pin/212795151135331703/,"Ham & Cheese Hawaiian Roll Sliders Recipe | Han and cheese sliders hawaiian rolls, Ham and cheese sliders on hawaiian rolls without poppy seeds, Ham and cheese hawaiian rolls cold",20,2026-07-12 13:29:39
https://www.pinterest.com/pin/delicious-baklava-recipe-with-sweet-honey-syrup--56787645298029778/,"Delicious Baklava Recipe with Sweet Honey Syrup | Homemade baklava steps, Homemade baklava tutorial, How to make baklava bars",7,2026-07-12 13:29:39
https://www.pinterest.com/pin/gingerbread-cake-from-tornadough-alli--56787645298022791/,"Gingerbread Cake from Tornadough Alli | Ground ginger, Custard cake, Ginger snap cookies",26,2026-07-12 13:29:39
https://www.pinterest.com/pin/212795151135317408/,"Easy Fruit Pizza {A Fun Sweet Spin for Pizza Night} | Recipe | Colorful fruit pizza recipe, Dessert pizza recipe fruit, Easy fruit pizza sugar cookie",21,2026-07-12 13:29:42
https://www.pinterest.com/pin/212795151135314750/,"Sopapilla Recipe | Homemade sopapilla, Easy sopapilla recipe, Authentic sopapilla recipe",50,2026-07-12 13:29:42
https://www.pinterest.com/pin/eggnog-french-toast-recipe--212795151135313105/,"Eggnog French Toast Recipe | Oreo milkshake recipe, Easy eggnog, Classic french toast",9,2026-07-12 13:29:42
https://www.pinterest.com/pin/star-bread-from-tornadough-alli--56787645298005285/,"Star Bread Recipe with Cinnamon and Powdered Sugar | Bread recipes homemade, Bread sweet, Beautiful bread",77,2026-07-12 13:29:43
https://www.pinterest.com/pin/56787645298005090/,"Vegetable Egg Foo Young Recipe | Egg foo young ingredients, Egg foo young recipe easy, Egg foo yong",102,2026-07-12 13:29:43
https://www.pinterest.com/pin/56787645298004943/,"Hot and Sour Soup | Recipe | Hot and sour mushroom soup, Pf changs hot and sour soup, Hot and sour soup vegetarian",3,2026-07-12 13:29:43
https://www.pinterest.com/pin/heavenly-gingerbread-cake-with-cream-cheese-frosting--56787645298004937/,"Heavenly Gingerbread Cake with Cream Cheese Frosting | Recipe | Homemade gingerbread cake, Slice of moist gingerbread cake, Two slices of gingerbread cake",4,2026-07-12 13:29:44
https://www.pinterest.com/pin/delicious-star-bread-recipe--56787645298004863/,"Delicious Star Bread Recipe | Sweet star bread, Almond star bread, Rustic star bread recipe",1,2026-07-12 13:29:45
https://www.pinterest.com/pin/212795151135309967/,"Pecan Logs: Christmas Snack | Recipe | Favorite holiday desserts, Candy recipes homemade, Christmas baking treats",23,2026-07-12 13:29:45
https://www.pinterest.com/pin/vodka-cranberry-christmas-cocktail-from-tornadough-alli--56787645297998283/,"Vodka Cranberry Christmas Cocktail Recipe | Vodka cranberry juice, Christmas drinks, Festive drinks",77,2026-07-12 13:29:47
https://www.pinterest.com/pin/chocolate-thumbprint-cookies-tornadough-alli--56787645297995621/,"Chocolate Thumbprint Cookies - Tornadough Alli | Recipe | Homemade ganache, Thumbprint cookies recipe, Cookies biscuits",13,2026-07-12 13:29:48
https://www.pinterest.com/pin/56787645297998192/,"Turtle Candy | Recipe | Turtles candy, Potato candy, Favorite holiday desserts",27,2026-07-12 13:29:48
https://www.pinterest.com/pin/212795151135303560/,"Cranberry Moscow Mules: Festive Holiday Cocktails | Recipe | Cranberry moscow mule drink, Cranberry mint mule, Cranberry moscow mule mocktail",17,2026-07-12 13:29:49
https://www.pinterest.com/pin/212795151135300079/,"Cranberry Orange Bundt Cake - Tornadough Alli | Recipe | Cranberry orange cake easy, Cranberry cake with orange juice, Cranberry orange bundt cake with pineapple",27,2026-07-12 13:29:50
https://www.pinterest.com/pin/212795151135299788/,"Copy Cat Applebees Honey Pepper Chicken Mac N' Cheese | Applebee's honey pepper chicken mac and cheese recipe, Copycat applebee's honey pepper chicken mac and cheese, Best easy dinner recipes",6,2026-07-12 13:29:51
https://www.pinterest.com/pin/212795151135300010/,"Glazed Apple Cider Donuts | Recipe | Apple cider donuts recipe, Homemade donuts recipe, Apple cider reduction",30,2026-07-12 13:29:51
https://www.pinterest.com/pin/212795151135284758/,"Potato Candy: A Delicious and Easy-to-Make Treat | Recipe | Homemade potato candy recipe, Peanut butter potato candy, Potato candy easy",3,2026-07-12 13:29:53
https://www.pinterest.com/pin/56787645297538555/,"Sopapillas Recipe | Homemade sopapilla, Easy sopapilla recipe, Authentic sopapilla recipe",2,2026-07-12 13:29:53
https://www.pinterest.com/pin/212795151135284755/,"Hot and Sour Soup | Recipe | Beer cheese soups, Hearty soup recipes, Hot and sour soup recipe",3,2026-07-12 13:29:53
https://www.pinterest.com/pin/star-bread--212795151135284557/,"Star Bread Recipe | Sweet Cinnamon Sugar Filled Bread | Rustic star bread recipe, How to make cinnamon star bread, Dessert bread",7,2026-07-12 13:29:54
https://www.pinterest.com/pin/tornadough-alli--212795151135275270/,"Warm Up with Peppermint Hot Chocolate | Recipe | How to make peppermint hot chocolate, Peppermint hot chocolate recipe, Perfect holiday beverage",20,2026-07-12 13:29:55
https://www.pinterest.com/pin/212795151135275142/,"Crescent Roll Apple Dumplings - Tornadough Alli | Recipe | Apple recipe with crescent rolls, Grandmas apple dumplings, Apple and dumplings",24,2026-07-12 13:29:55
https://www.pinterest.com/pin/homemade-fudge-from-tornadough-alli--56787645297528724/,"Delicious Homemade Fudge for Christmas | Christmas fudge, Fudge brownie recipe, Granulated sugar",134,2026-07-12 13:29:56
https://www.pinterest.com/pin/212795151135272751/,"Bourbon Sweet Potato Cake | Recipe | Sweet potato rum cake, Sweet potato recipes with bourbon, Sweet potato cake southern",13,2026-07-12 13:29:57
https://www.pinterest.com/pin/212795151135272705/,"Custard Pie | Recipe | Kinds of pie, Refrigerated pie crust, Potato pie",10,2026-07-12 13:29:58
https://www.pinterest.com/pin/sticky-toffee-pudding-recipe--212795151135262931/,"Sticky Toffee Pudding | Recipe | Sticky toffee pudding recipe allrecipes, Classic sticky toffee pudding, How to make sticky toffee pudding",2,2026-07-12 13:29:58
https://www.pinterest.com/pin/212795151135263231/,"Reindeer Cookies | Recipe | Holiday cookie exchange, Candy eyeballs, Christmas cookie recipes",1,2026-07-12 13:29:58
https://www.pinterest.com/pin/212795151135263321/,"Chicken Alfredo Casserole | Recipe | Leftover chicken alfredo ideas, Leftover rotisserie chicken recipes pasta alfredo sauce, Easy alfredo casserole",80,2026-07-12 13:30:00
https://www.pinterest.com/pin/212795151135263288/,"Crème Anglaise | Recipe | Quick puddings, Custard sauce, Souffle recipes",20,2026-07-12 13:30:01
https://www.pinterest.com/pin/212795151135262808/,"KFC Bowls: COPYCAT | Recipe | Kfc famous bowl recipe crock pot, Kfc famous bowl recipe casserole easy, Kfc bowls copycat",45,2026-07-12 13:30:03
https://www.pinterest.com/pin/212795151135260262/,"Loaded Potato Skins Appetizer | Loaded potato skins with toppings, Loaded breakfast potato skins, Loaded potato skins with cheese and bacon",38,2026-07-12 13:30:03
https://www.pinterest.com/pin/212795151135255983/,"Brown Sugar Cinnamon Pop-Tarts Recipe | Brown sugar poptart recipe, Homemade brown sugar pop tarts with pie crust, Brown sugar cinnamon pop tarts",55,2026-07-12 13:30:04
https://www.pinterest.com/pin/212795151135245704/,"Cracker Barrel Hashbrown Casserole Recipe | Hashbrown casserole cracker barrel, Simple cheesy hash brown casserole, Breakfast casserole",541,2026-07-12 13:30:05
https://www.pinterest.com/pin/212795151135245752/,"Applebee's Spinach Artichoke Dip Recipe | Easy hot dips crockpot, Hot appetizer dips crockpot, Best hot dips for parties crockpot",14,2026-07-12 13:30:05
https://www.pinterest.com/pin/56787645297497163/,"Homemade Baileys Irish Cream | Recipe | Easy irish cream drink, Holiday cocktail ideas, Homemade irish cream in bottles",2,2026-07-12 13:30:05
https://www.pinterest.com/pin/easy-stuffing-recipe--212795151135245660/,"Easy Stuffing Recipe | Fast stuffing recipe, Stuffing easy recipes, Easy homemade stuffing",4,2026-07-12 13:30:08
https://www.pinterest.com/pin/212795151135245535/,"Delicious Fall Off The Bone Ribs | Recipe | Fall off the bone ribs in oven, Fall off the bone ribs recipe, Tender ribs",229,2026-07-12 13:30:08
https://www.pinterest.com/pin/56787645297496965/,"Sweets & Meats Inspired Sweet Potato Casserole Recipe | Perfect for Easter! | The best sweet potato casserole ever, Best sweet potato casserole with pecans, Sweet potato recipes casserole",21,2026-07-12 13:30:09
https://www.pinterest.com/pin/212795151135242546/,"Frozen Mudslides | Recipe | Mud slides drink recipe, Mudslides with baileys, Frozen drinks",9,2026-07-12 13:30:09
https://www.pinterest.com/pin/easy-stuffing-recipe-from-tornadough-alli--56787645297493726/,"Easy Stuffing Recipe from Tornadough Alli | Home made stuffing, Recipes side dishes, Homemade everything",32,2026-07-12 13:30:10
https://www.pinterest.com/pin/212795151135241489/,"Delicious White Chicken Chili Recipe | What goes with white chicken chili, Which chicken chili, Chicken chili with toppings",22,2026-07-12 13:30:10
https://www.pinterest.com/pin/turkey-moist-maker-sandwich-from-tornadough-alli--56787645297472396/,"Turkey Moist Maker Sandwich Recipe | Turkey stuffing, Sandwiches wraps, White sandwich",14,2026-07-12 13:30:12
https://www.pinterest.com/pin/212795151135223346/,"Homemade Dumplings Recipe: Impress Anyone with Flat or Drop Dumplings | Old fashioned chicken and dumplings, Homemade chicken and dumplings, Stove top chicken and dumplings",12,2026-07-12 13:30:13
https://www.pinterest.com/pin/212795151135223595/,"Arancini | Recipe | Golden fried arancini, Fried arancini with tomato sauce, Bowl of fried arancini balls",8,2026-07-12 13:30:13
https://www.pinterest.com/pin/212795151135220075/,"Linzer Cookies | Recipe | Easy linzer cookies recipe, Christmas no bake treats, Classic christmas treats",5,2026-07-12 13:30:13
https://www.pinterest.com/pin/212795151135223329/,"Honey Walnut Baked Brie Recipe | Baked brie recipes, Bhg recipes, Brie puff pastry",7,2026-07-12 13:30:13
https://www.pinterest.com/pin/sticky-toffee-pudding-recipe--56787645297471881/,"Sticky Toffee Pudding | Recipe | Winter desserts, Sticky toffee pudding recipe",5,2026-07-12 13:30:14
https://www.pinterest.com/pin/56787645297471968/,"Crescent Rolls Recipe - Tornadough Alli | Buttery rolls, Crescent roll recipes, Food content",7,2026-07-12 13:30:15
https://www.pinterest.com/pin/212795151135219977/,"Melted Snowman Cookies | Recipe | Melted chocolate snowman cookies recipe, Melting snowman cookie recipe, Cookies recipes christmas",8,2026-07-12 13:30:15
https://www.pinterest.com/pin/rum-balls--212795151135219946/,"Rum Balls | Recipe | Good rum, Spiced pecans, Easy rum balls",19,2026-07-12 13:30:15
https://www.pinterest.com/pin/212795151135219893/,"Creamy Crockpot Mashed Potatoes Recipe | Mashed potatoes recipe crock pot easy, Mashed potatoes in a crockpot, Crockpot mashed potatoes easy",5,2026-07-12 13:30:15
https://www.pinterest.com/pin/212795151135219888/,"Eggnog Cake | Recipe | Eggnog cake recipe with cake mix, Eggnog cake recipe with pudding mix, Homemade eggnog cake",9,2026-07-12 13:30:17
https://www.pinterest.com/pin/212795151135212837/,"Olive Garden Chicken Gnocchi Soup | Recipe | Olive garden chicken gnocchi soup recipe, Crockpot mashed potatoes, Copycat olive garden chicken gnocchi",4,2026-07-12 13:30:18
https://www.pinterest.com/pin/easy-stuffing-recipe--212795151135185693/,"Easy Stuffing Recipe | Best easy dinner recipes, Homemade stuffing, Dinner side dish",5,2026-07-12 13:30:24
https://www.pinterest.com/pin/monster-cookie-bars--212795151135177168/,"Monster Cookie Bars | Monster bars with oatmeal, How to make monster cookie bars, Cookie bar recipes",3,2026-07-12 13:30:25
https://www.pinterest.com/pin/212795151135174037/,"Sausage Dip Pinwheels: A Delicious Party Appetizer | Recipe | Easy sausage dip pinwheels, Party sausage dip pinwheels, Party appetizers",4,2026-07-12 13:30:26
https://www.pinterest.com/pin/classic-sticky-toffee-pudding-recipe--212795151135179770/,"Classic Sticky Toffee Pudding Recipe | Sticky toffee pudding in pan, Sticky toffee pudding bake off, Sticky toffee pudding recipe food52",61,2026-07-12 13:30:26
https://www.pinterest.com/pin/212795151135172956/,"Easy Shepherd’s Pie for Dinner | Recipe | Quick shepards pie ground beef, How to make shepherd's pie with ground beef, Shepherd's pie recipe with ground beef and gravy",6,2026-07-12 13:30:27
https://www.pinterest.com/pin/roasted-turkey-from-tornadough-alli--56787645297416293/,"Roasted Turkey from Tornadough Alli | Turkey recipes, Chicken turkey, Turkey leg",32,2026-07-12 13:30:27
https://www.pinterest.com/pin/56787645297403658/,"Korean Spicy Pork Bowls | Spicy pork dish ideas, Korean pork bowl recipe, Spicy pork dinner",12,2026-07-12 13:30:29
https://www.pinterest.com/pin/212795151135156027/,"Easy Ground Beef Stir Fry Recipe | Ground meat stir-fry dish, Spicy ground meat stir-fry, Teriyaki ground beef stir fry",10,2026-07-12 13:30:30
https://www.pinterest.com/pin/delicious-smothered-potatoes-recipe--212795151135142327/,"Delicious Smothered Potatoes Recipe | Smothered potatoes in oven, How to make smothered potatoes, Southern smothered potatoes",9,2026-07-12 13:30:32
https://www.pinterest.com/pin/212795151135141984/,"Slow Cooker Stuffing with Sausage and Apples | Recipe | Crockpot sausage stuffing thanksgiving, Crock pot sausage stuffing thanksgiving, Slow cooker sausage stuffing recipe",8,2026-07-12 13:30:33
https://www.pinterest.com/pin/212795151135141965/,"TikTok Ramen | Recipe | Top ramen recipes, Ramen noodle recipes easy, Ramen dinner recipes",104,2026-07-12 13:30:34
https://www.pinterest.com/pin/german-chocolate-cake--212795151135141880/,"German Chocolate Cake | German baking, Baking chocolate, Cake recipes",137,2026-07-12 13:30:34
https://www.pinterest.com/pin/212795151135138860/,"Smothered Chicken Recipe | Crispy Chicken in Delicious Gravy | Best smothered chicken recipe, How to make smothered chicken, Southern smothered chicken",3,2026-07-12 13:30:35
https://www.pinterest.com/pin/212795151135138808/,"DIY Corn Muffin Mix Recipe - Every Day with Rachael Ray | Preppy kitchen cornbread, Fluffy cornbread muffins, Preppy kitchen muffins",7,2026-07-12 13:30:35
https://www.pinterest.com/pin/212795151135138856/,"Chewy Sugar Cookies | Soft and Irresistible | Recipe | Thick and chewy sugar cookies, Chewy rolled sugar cookies, Easy cookie recipe",7,2026-07-12 13:30:35
https://www.pinterest.com/pin/212795151135138786/,"Pumpkin Banana Bread | Recipe | Moist pumpkin banana cake bread, Pumpkin and banana bread, Pumpkin banana bread recipe",4,2026-07-12 13:30:35
https://www.pinterest.com/pin/212795151135138458/,"Delicious Slow Cooker Jambalaya Recipe | Jambalaya crock pot recipe healthy, Slow cooker chicken jambalaya, Forgotten jambalaya",10,2026-07-12 13:30:36
https://www.pinterest.com/pin/212795151135137501/,"Porcupine Meatball Recipe | Ground beef porcupine meatballs, Porcupine meatballs 12 tomatoes, Porcupine meatballs recipe",6,2026-07-12 13:30:36
https://www.pinterest.com/pin/212795151135137373/,"Slow Cooker Pork Chops | Recipe | Boneless pork loin chops, Pork chops and gravy, Cooked pork chops",3,2026-07-12 13:30:38
https://www.pinterest.com/pin/212795151135135455/,"Maple Dijon Pork Tenderloin Recipe | Pork tenderloin recipes with maple syrup, Maple dijon pork loin recipe, Maple dijon pork tenderloin oven",5,2026-07-12 13:30:39
https://www.pinterest.com/pin/212795151135135542/,"Buffalo Chicken Mac and Cheese Recipe | Buffalo chicken bacon mac and cheese, High protein buffalo chicken mac and cheese, Mac and cheese with buffalo chicken",5,2026-07-12 13:30:39
https://www.pinterest.com/pin/56787645297379868/,"Slow Cooker Pizza | Recipe | Buffalo chicken sandwiches, Slow cooker meatballs, Homemade pizza dough",7,2026-07-12 13:30:40
https://www.pinterest.com/pin/212795151135134634/,"Sun-Dried Tomato Cheese Ball Recipe | Cheese ball with sun dried tomatoes, Sun dried tomato cheese ball dip, Cheese ball recipes easy",2,2026-07-12 13:30:42
https://www.pinterest.com/pin/brown-sugar-bacon-little-smokies--212795151135134528/,"Brown Sugar Bacon Little Smokies | Recipe | Little smokies with bacon brown sugar, Party appetizers, Delicious appetizers",3,2026-07-12 13:30:43
https://www.pinterest.com/pin/212795151135134517/,"Pesto Tortellini Recipe | Tortellini recipes with pesto, Pesto tortellini pasta recipe, Pesto tortellini dish",18,2026-07-12 13:30:43
https://www.pinterest.com/pin/212795151135134472/,"Fall Off The Bone Ribs Recipe | Back rib recipes, Bone in rib recipe, Ribs oven",16993,2026-07-12 13:30:44
https://www.pinterest.com/pin/212795151135132782/,"Braided Apple Puff Pastry Recipe | Quick and Easy Dessert | Easy apple pastry tutorial, Apple caramel puff pastry braid, Apple butter puff pastry braid",6,2026-07-12 13:30:45
https://www.pinterest.com/pin/540361655306039881/,"Pumpkin Patch Cookies | Recipe | Festive cookie recipes, Halloween food desserts, Halloween food treats",5,2026-07-12 13:30:50
https://www.pinterest.com/pin/212795151135128394/,"Butterbeer Recipe | Easy butterbeer recipe, Homemade butterbeer, Butter beer recipe harry potter",4,2026-07-12 13:30:51
https://www.pinterest.com/pin/212795151135128095/,"Slow Cooker Pizza Recipe | Buffalo chicken sandwiches, Slow cooker meatballs, Homemade pizza dough",3,2026-07-12 13:30:53
https://www.pinterest.com/pin/wendys-chili-recipe--212795151135122558/,"Wendy's Chili Recipe | Wendys chilli recipes, Wendy's chilli, Wendys chili recipe",102,2026-07-12 13:30:54
https://www.pinterest.com/pin/212795151135123027/,"30 Minute Ground Beef Stroganoff Recipe | Beef stroganoff with ground turkey, Ground beef stroganoff recipe healthy, Ground beef stroganoff recipe no mushrooms",7,2026-07-12 13:30:54
https://www.pinterest.com/pin/butterbeer-recipe--56787645297364042/,"Butterbeer Recipe | Butterscotch beer recipe, Easy butterbeer, Butterbeer recipe with beer",42,2026-07-12 13:30:54
https://www.pinterest.com/pin/212795151135120112/,"Slow Cooker Shredded Beef Tacos - Tornadough Alli | Shredded beef taco recipes, Shredded beef taco tuesday, Shredded beef taco crockpot",10,2026-07-12 13:30:56
https://www.pinterest.com/pin/212795151135116102/,"Slow Cooker Pizza Recipe | Crockpot deep dish pizza, Slow cooker pizza casserole, Pizza in crockpot",19,2026-07-12 13:30:58
https://www.pinterest.com/pin/56787645297354840/,"Steak Fingers Recipe | Finger steak batter recipe, Homemade steak fingers, Hand breaded steak fingers",6,2026-07-12 13:30:58
https://www.pinterest.com/pin/212795151135108081/,"Cinnamon Crescent Rolls: Tornadough Alli | Recipe | Cinnamon cresent rolls, Super easy breakfast, Crescent roll recipes dessert",12,2026-07-12 13:31:00
https://www.pinterest.com/pin/mini-halloween-cheesecakes--212795151135108099/,"Mini Halloween Cheesecakes Recipe | Halloween desserts, Halloween food treats, Like cheesecake",99,2026-07-12 13:31:00
https://www.pinterest.com/pin/212795151135108014/,"Mini Halloween Cheesecakes | Recipe | Cocoa powder cookies, Chocolate whipped cream, Cheesecake flavor",17,2026-07-12 13:31:01
https://www.pinterest.com/pin/212795151135107905/,"Finger steak batter recipe | Homemade steak fingers, Hand breaded steak fingers, Chicken fried steak fingers recipe",355,2026-07-12 13:31:01
https://www.pinterest.com/pin/56787645297343546/,"Chicken Salad Pinwheels Recipe | Chicken salad roll ups, Chicken pinwheels for lunch, Chicken cranberry pinwheels",9,2026-07-12 13:31:03
https://www.pinterest.com/pin/56787645297342741/,"Fluffy Buttermilk Pancake Recipe | Buttermilk pancakes with butter, Ingredients for buttermilk pancakes, Pancake recipe image",9,2026-07-12 13:31:03
https://www.pinterest.com/pin/212795151135104875/,"Delicious Apple Pie Monkey Bread Recipe for Fall Brunch or Dessert | Apple monkey bread from scratch, Monkey bread with canned biscuits and apple pie filling, Apple desserts",10,2026-07-12 13:31:03
https://www.pinterest.com/pin/212795151135104671/,"Apple Cider Sangria | Recipe | Fall fun food, Sangria fall, Pinot noir sangria",8,2026-07-12 13:31:04
https://www.pinterest.com/pin/56787645297341935/,"The Best Lasagna - Tornadough Alli | Recipe | Italian sausage lasagna, Homemade meat sauce, Best lasagna recipe",6,2026-07-12 13:31:04
https://www.pinterest.com/pin/212795151135101728/,"Let the Slow Cooker slave away to make these flavorful and irresistible Shredded Beef Tacos with this simple recipe! A f… | Shredded beef tacos recipes, Slow cooker shredded beef, Shaved beef recipes",32,2026-07-12 13:31:04
https://www.pinterest.com/pin/212795151135101386/,"Chicken Fried Chicken Recipe | Traditional fried chicken meal, Classic fried chicken meal, Chicken fried chicken easy",27066,2026-07-12 13:31:07
https://www.pinterest.com/pin/45036065015263151/,"Burnt Almond Torte Cake Recipe | Burnt almond cake, Burnt almond torte recipe",175,2026-07-12 13:31:07
https://www.pinterest.com/pin/212795151135101324/,"Maple Dijon Pork Tenderloin Recipe | Best easy dinner recipes, Stuffed pork tenderloin, Best pork tenderloin recipe",4,2026-07-12 13:31:07
https://www.pinterest.com/pin/56787645297337871/,"Chicken Sheet Pan Quesadillas | Recipe | Loaded sheet pan quesadillas, Sheet pan cheese quesadillas, Buffalo chicken sheet pan quesadilla",154,2026-07-12 13:31:08
https://www.pinterest.com/pin/colorful-mini-halloween-cheesecakes-with-oreo-crumble-crust--212795151135100855/,"Colorful Mini Halloween Cheesecakes with Oreo Crumble Crust | Recipe | Halloween mini cheesecakes, Halloween party dessert ideas, Halloween treats",112,2026-07-12 13:31:08
https://www.pinterest.com/pin/56787645297331366/,"German Chocolate Cake Recipe - Tornadough Alli | German chocolate cake with coconut filling, German chocolate cake with cocoa powder, Kenneth temple german chocolate cake",4,2026-07-12 13:31:09
https://www.pinterest.com/pin/56787645297330532/,"Easy Beef Stir Fry | Leftover beef, Tender beef, Simple stir fry",10,2026-07-12 13:31:10
https://www.pinterest.com/pin/56787645297330118/,"Candied Sweet Potatoes - Easy Side Dish Recipe | Candied sweet potatoes with canned sweet potatoes, Southern style candied yams, How to make southern candied yams",8,2026-07-12 13:31:11
https://www.pinterest.com/pin/212795151135093464/,"Soft Pumpkin Chocolate Chip Cookies Recipe | Pumpkin chocolate chip cookies with brown sugar, Moist pumpkin chocolate chip cookies, Soft batch pumpkin cookies",9,2026-07-12 13:31:11
https://www.pinterest.com/pin/45036065015254962/,"No Bake Mint Chocolate Cheesecake Recipe | Mint cheesecake topping, Homemade mint cheesecake recipe, Mint chocolate cheesecake no bake",4,2026-07-12 13:31:11
https://www.pinterest.com/pin/212795151135091979/,"Chocolate Chip Pumpkin Blondies | Recipe | Pumpkin bread pudding, Chocolate chip blondies, Caramel bits",14,2026-07-12 13:31:12
https://www.pinterest.com/pin/45036065015254589/,"Chocolate Chip Pumpkin Pudding Pie Recipe | Pumpkin pie with pudding recipe, Thanksgiving pudding desserts, Chocolate chip pumpkin pie",5,2026-07-12 13:31:15
https://www.pinterest.com/pin/45036065015254440/,"Pumpkin Truffles - Tornadough Alli | Recipe | Expensive chocolate, Pumpkin spice treats, Truffles recipe",7,2026-07-12 13:31:15
https://www.pinterest.com/pin/235383518016955541/,"Delicious Air Fryer Chicken Tenders | Recipe | Battered chicken tenders air fryer, Air fryer tenderloin chicken, Air fryer homemade chicken tenders",60,2026-07-12 13:31:15
https://www.pinterest.com/pin/crockpot-easy-apple-crumble--56787645297327925/,"Crockpot Easy Apple Crumble | Recipe | Crock pot desserts, Slow cooker desserts, Apple crumble crockpot",7,2026-07-12 13:31:15
https://www.pinterest.com/pin/slow-cooker-sausage-stuffing--212795151135091718/,"Slow Cooker Sausage Stuffing Recipe | Crockpot sausage stuffing thanksgiving, Crock pot sausage stuffing thanksgiving",2229,2026-07-12 13:31:15
https://www.pinterest.com/pin/47710077295906804/,"Crockpot French Dips | Recipe | Beer french dip slow cooker, Crock pot french dip slow cooker, Easy slow cooker french dip",7,2026-07-12 13:31:16
https://www.pinterest.com/pin/german-chocolate-cake-recipe--212795151135091245/,"German Chocolate Cake Recipe | German chocolate cake with coconut filling, German chocolate cake with cocoa powder, Kenneth temple german chocolate cake",64,2026-07-12 13:31:17
https://www.pinterest.com/pin/pumpkin-patch-cookies--212795151135087367/,"Pumpkin Patch Cookies Recipe | Dog cookies recipe easy pumpkin, How to make pumpkin cookie dough, Pumpkin dog treats no peanut butter",130,2026-07-12 13:31:17
