url,title,saves,timestamp
https://www.pinterest.com/pin/212795151137045533/,Raspberry Icebox Cake for Summer | Recipe,21,2026-05-22 18:28:08
https://www.pinterest.com/pin/56787645302927466/,The BEST Marry Me Chicken Recipe,218,2026-05-22 18:28:08
https://www.pinterest.com/pin/strawberry-sugar-cookies--56787645302927423/,"Strawberry Sugar Cookies | Recipe | Strawberry sugar cookies, Strawberry sugar cookie recipe, How sweet eats",126,2026-05-22 18:28:09
https://www.pinterest.com/pin/56787645302927411/,"Homemade Strawberry Pie Recipe | Strawberry pie recipe, Easy strawberry pie recipe, Easy strawberry pie",1092,2026-05-22 18:28:09
https://www.pinterest.com/pin/212795151137045223/,Garlic Butter Grilled Mushrooms Recipe,24,2026-05-22 18:28:09
https://www.pinterest.com/pin/56787645302927069/,Horseradish Pickles (2 Ways) | Recipe,34,2026-05-22 18:28:10
https://www.pinterest.com/pin/56787645302927174/,"Fruit Pizza | Easy fruit pizza, Fruit pizza recipe, Fruit recipes",2622,2026-05-22 18:28:10
https://www.pinterest.com/pin/212795151137042424/,"Pineapple Margaritas | Recipe | Yummy alcoholic drinks, Yummy drinks, Frozen drinks",550,2026-05-22 18:28:10
https://www.pinterest.com/pin/212795151137042152/,"Key Lime Pie Bars | Recipe | Key lime pie bars, Pie bar recipes, Key lime desserts",27,2026-05-22 18:28:12
https://www.pinterest.com/pin/212795151137042111/,"Blackberry Bourbon Smash | Recipe | Bourbon cocktails, Bourbon smash, Bourbon drinks recipes",17,2026-05-22 18:28:12
https://www.pinterest.com/pin/47710077297950776/,"Chicken Fried Chicken | Fried chicken recipes, Recipes, Ingredients recipes",279,2026-05-22 18:28:15
https://www.pinterest.com/pin/56787645302900844/,"Cream Cheese Wontons | Recipe | Wonton recipes, Recipes, Chinese cooking recipes",1228,2026-05-22 18:28:16
https://www.pinterest.com/pin/212795151137005216/,"Horseradish Pickles (2 Ways) | Recipe | Horseradish pickles, Pickling recipes, Canning recipes",267,2026-05-22 18:28:17
https://www.pinterest.com/pin/56787645302181539/,"Korean dessert Food photography Food photo Frozen drinks Frozen alcoholic drinks Punch recipes Fruity mixed dr… | Pineapple margarita, Yummy drinks, Alcohol recipes",398,2026-05-22 18:28:18
https://www.pinterest.com/pin/56787645302181227/,"Fruit Ovens Chicken soups Overnight french toast Sausages Breakfast casserole Stu… | Best breakfast casserole, Tater tot breakfast casserole, Breakfast recipes easy",309,2026-05-22 18:28:19
https://www.pinterest.com/pin/56787645302181534/,"Slow Cooker BBQ Chicken | Recipe | Slow cooker bbq chicken, Chicken crockpot recipes, Crockpot recipes easy",102,2026-05-22 18:28:19
https://www.pinterest.com/pin/56787645302181279/,"Chicken Bacon Ranch Sliders Recipe | Recipes, Easy meals, Slider recipes",486,2026-05-22 18:28:19
https://www.pinterest.com/pin/56787645302176331/,"Strawberry Pie - The Most Addicting Pie Ever | Strawberry pie, Strawberry pie recipe, Fresh strawberry pie",1012,2026-05-22 18:28:20
https://www.pinterest.com/pin/56787645302176357/,One Pot Creamy Sausage Gnocchi | Recipe,597,2026-05-22 18:28:21
https://www.pinterest.com/pin/212795151136989681/,"Potato Salad | Recipe | Potatoe salad recipe, Salad recipes, Recipes",50,2026-05-22 18:28:26
https://www.pinterest.com/pin/212795151136989455/,"Bacon Ranch Pasta Salad | Recipe | Best pasta salad, Easy bacon ranch pasta salad recipe, Bacon ranch pasta salad",55,2026-05-22 18:28:26
https://www.pinterest.com/pin/212795151136989399/,"Baked Queso Dip | Recipe | Spicy appetizers, Appetizers easy, Queso dip",43,2026-05-22 18:28:26
https://www.pinterest.com/pin/212795151136989460/,"Muffuletta Sandwich Recipe | Recipe | Muffuletta sandwich, Recipes, Food processor recipes",36,2026-05-22 18:28:26
https://www.pinterest.com/pin/212795151136988757/,"Grilled Italian Sausage Sandwiches | Recipe | Italian sausage sandwich, Italian sausage, Best easy dinner recipes",27,2026-05-22 18:28:26
https://www.pinterest.com/pin/212795151136988417/,"Chocolate Chip Banana Bread | Recipe | Chocolate chip banana bread, Chocolate chip banana bread recipe, Make banana bread",28,2026-05-22 18:28:27
https://www.pinterest.com/pin/slow-cooker-beer-brats-tornadough-alli--212795151136986108/,Slow Cooker Beer Brats - Tornadough Alli,31,2026-05-22 18:28:27
https://www.pinterest.com/pin/212795151136974936/,"Fall Off The Bone Ribs | Recipe | Baked bbq ribs, Pork rib recipes, Rib recipes",399,2026-05-22 18:28:29
https://www.pinterest.com/pin/56787645302154365/,"Blueberry Jam | Recipe | Jam recipes, Blueberry jam recipe, Blueberry recipes",48,2026-05-22 18:28:29
https://www.pinterest.com/pin/56787645302154502/,"Easiest Fruit Pizza | Easy fruit pizza, Healthy fruit desserts, Fruit pizza recipe",105,2026-05-22 18:28:30
https://www.pinterest.com/pin/56787645302154445/,"Pancake Muffins (with Banana and Peanut Butter Chips) | Recipe | Pancake muffins, Peanut butter chips, Tasty pancakes",112,2026-05-22 18:28:30
https://www.pinterest.com/pin/212795151136971758/,"Bacon Ranch Pasta Salad | Recipe | Ranch pasta, Best pasta salad, Ranch pasta salad",76,2026-05-22 18:28:31
https://www.pinterest.com/pin/212795151136969098/,"Parmesan Crusted Chicken | Recipe | Parmesan crusted chicken, Parmesan crusted, Best easy dinner recipes",34,2026-05-22 18:28:31
https://www.pinterest.com/pin/212795151136973311/,"Creamy Cucumber Salad | Recipe | Cucumber salad, Creamy cucumbers, Easy salad recipes",49,2026-05-22 18:28:31
https://www.pinterest.com/pin/56787645302130186/,"Limoncello Recipe | Recipe | Limoncello recipe, Yummy alcoholic drinks, Christmas drinks alcohol recipes",220,2026-05-22 18:28:31
https://www.pinterest.com/pin/212795151136956912/,"Wendy's Frosty | Recipe | Wendys frosty recipe, Sherbet recipes, Frosty recipe",107,2026-05-22 18:28:32
https://www.pinterest.com/pin/212795151136968392/,"Lemon Pepper Chicken | Recipe | Stuffed peppers, Grilled chicken recipes easy, Easy grilled chicken",29,2026-05-22 18:28:32
https://www.pinterest.com/pin/no-bake-coconut-cheesecake--56787645302138108/,"No Bake Coconut Cheesecake | Recipe | Coconut cheesecake, Coconut desserts, Baking",289,2026-05-22 18:28:32
https://www.pinterest.com/pin/212795151136963286/,"Blueberry Jam | Recipe | Blueberry jam, Blueberry recipes, Jam recipes",16,2026-05-22 18:28:33
https://www.pinterest.com/pin/212795151136951064/,"Vanilla Bean Pistachio Cake—A Delicious, Light, Flavorful Cake | Dolcetti, Dessert, Dolci",12291,2026-05-22 18:28:34
https://www.pinterest.com/pin/56787645302061426/,"Olive Garden Chicken Gnocchi Soup | Recipe | Soup recipes slow cooker, Recipes, Easy soup recipes",705,2026-05-22 18:28:34
https://www.pinterest.com/pin/212795151136941217/,"Limoncello Recipe | Recipe | Limoncello recipe, Cocktail recipes easy, Flavored drinks",6,2026-05-22 18:28:37
https://www.pinterest.com/pin/56787645302058434/,"Nutella French Toast Sticks—Great for Breakfast or Brunch! | Nutella french toast, Delicious french toast recipe, Tasty pancakes",114,2026-05-22 18:28:37
https://www.pinterest.com/pin/56787645302058389/,"Overnight French Toast Bake | Recipe | French toast bake overnight, French toast bake, French toast easy",412,2026-05-22 18:28:37
https://www.pinterest.com/pin/56787645302058404/,"Marry Me Chicken | Recipe | Chicken dishes recipes, Chicken dinner recipes, Recipes",487,2026-05-22 18:28:37
https://www.pinterest.com/pin/56787645302058341/,"Easy Homemade Fruit Pizza | Easy fruit pizza, Fruit pizza recipe, Fruit pizza",75,2026-05-22 18:28:38
https://www.pinterest.com/pin/56787645301946949/,"Lemon Pepper Chicken Kabobs - Tornadough Alli | Chicken kabobs, Chicken stuffed peppers, Stuffed peppers",83,2026-05-22 18:28:40
https://www.pinterest.com/pin/56787645301946917/,"Beer Can Chicken | Recipe | Dinner recipes, Yummy chicken recipes, Beer can chicken",39,2026-05-22 18:28:40
https://www.pinterest.com/pin/212795151136934406/,Easy No Bake Coconut Cheesecake | Recipe,45,2026-05-22 18:28:41
https://www.pinterest.com/pin/56787645301946751/,"Easy Summer Corn Salad | Recipe | Corn salad recipes, Salad side dishes, Easy salads",1038,2026-05-22 18:28:41
https://www.pinterest.com/pin/212795151136937215/,Strawberry Cupcakes | Recipe | Strawberry frosting donut,49,2026-05-22 18:28:42
https://www.pinterest.com/pin/56787645301946633/,"Slow Cooker Cheesy Potatoes | Dinner recipes crockpot, Crockpot side dishes, Recipes",939,2026-05-22 18:28:42
https://www.pinterest.com/pin/mojo-pork-chops-with-sour-cream-ricea-great-family-meal--212795151136929759/,"Mojo Pork Chops With Sour Cream Rice—A Great Family Meal! | Pork chop dinner, Cilantro recipes, Mojo pork",127,2026-05-22 18:28:46
https://www.pinterest.com/pin/tiktok-grinder-sandwich--212795151136926103/,"TikTok Grinder Sandwich | Recipe | Grinder sandwich, Sandwhich recipes, Cooking",334,2026-05-22 18:28:46
https://www.pinterest.com/pin/212795151136925970/,"Chicken Fried Chicken - Tornadough Alli | Recipes, Chicken dishes recipes, Chicken recipes",7457,2026-05-22 18:28:47
https://www.pinterest.com/pin/212795151136919595/,"Walking Tacos | Recipe | Walking tacos, Quick meals, Favorite recipes dinner",46,2026-05-22 18:28:48
https://www.pinterest.com/pin/56787645301476661/,56787645301476661,341,2026-05-22 18:28:49
https://www.pinterest.com/pin/212795151136913275/,"Chocolate Chip Banana Bread | Recipe | Chocolate chip banana bread, Chocolate chip banana bread recipe, Chocolate chip bread",215,2026-05-22 18:28:49
https://www.pinterest.com/pin/212795151136913145/,"The BEST Fruit Pizza | Easy fruit pizza, Fruit pizza, Breakfast recipes sweet",19,2026-05-22 18:28:50
https://www.pinterest.com/pin/212795151136913104/,"Dirty Soda | Recipe | Soda recipe, Delicious drink recipes, Yummy drinks",170,2026-05-22 18:28:50
https://www.pinterest.com/pin/212795151136912801/,"Almond Croissants | Recipe | Almond recipes, Almond paste recipes, Desserts",80,2026-05-22 18:28:50
https://www.pinterest.com/pin/212795151136910244/,212795151136910244,341,2026-05-22 18:28:51
https://www.pinterest.com/pin/212795151136910848/,"Bacon Ranch Pasta Salad | Recipe | Pasta, Pasta dishes, Dinner recipes",7,2026-05-22 18:28:51
https://www.pinterest.com/pin/homemade-chicken-tenders--47710077297713496/,"Homemade Chicken Tenders | Recipe | Chicken tender recipes, Chicken dishes recipes, Recipes",541,2026-05-22 18:28:51
https://www.pinterest.com/pin/56787645301473495/,"Southern Banana Pudding | Recipe | Banana pudding desserts, Best banana pudding, Homemade banana pudding",1561,2026-05-22 18:28:51
https://www.pinterest.com/pin/tuna-melt-recipe--56787645301456650/,"Tuna Melt Recipe | Recipe | Tuna melt recipe, Melt recipe, Tuna melt recipe easy",45,2026-05-22 18:28:53
https://www.pinterest.com/pin/212795151136892088/,"TikTok Grinder Sandwich | Recipe | Dinner sandwiches, Grinder sandwich, Sandwhich recipes",140,2026-05-22 18:28:54
https://www.pinterest.com/pin/212795151136892085/,"Strawberry Pie - The Most Addicting Pie Ever | Strawberry pie recipe, Strawberry dessert recipes, Fresh strawberry recipes",1134,2026-05-22 18:28:55
https://www.pinterest.com/pin/212795151136892084/,Pizza Grilled Cheese | Delicious Sandwich Recipe,251,2026-05-22 18:28:55
https://www.pinterest.com/pin/56787645301453401/,"Cherry Cheesecake Bars | Recipe | Cheesecake bar recipes, Desserts, Cheesecake recipes",45,2026-05-22 18:28:55
https://www.pinterest.com/pin/212795151136892097/,"Irish Coffee Recipe | Recipe | Irish coffee recipe, Coffee recipes, Irish coffee",36,2026-05-22 18:28:55
https://www.pinterest.com/pin/muffuletta-sandwich-recipe--212795151136889640/,"Muffuletta Sandwich Recipe | Recipe | Muffuletta sandwich, Muffuletta, Muffuletta recipe",3,2026-05-22 18:28:56
https://www.pinterest.com/pin/212795151136891827/,"Slow Cooker Shredded Mexican Chicken | Recipe | Slow cooker mexican chicken, Mexican chicken recipes, Favorite recipes dinner",16,2026-05-22 18:28:58
https://www.pinterest.com/pin/212795151136888999/,Delicious Chicken Bacon Ranch Sliders Recipe,141,2026-05-22 18:28:58
https://www.pinterest.com/pin/212795151136889186/,"Vanilla Bean Pistachio Cake {A Delicious, Light, Flavorful Cake} | Vanilla bean cakes, Pistachio cake recipe, Cake recipes",437,2026-05-22 18:28:59
https://www.pinterest.com/pin/212795151136885409/,"The Ultimate Easter Menu | Top dinner recipes, Favorite recipes dinner, Breakfast recipes easy",14,2026-05-22 18:29:00
https://www.pinterest.com/pin/56787645301433670/,"The Best Carrot Cake | Recipe | Carrot cake recipe homemade, Desserts, Sheet cake recipes",258,2026-05-22 18:29:03
https://www.pinterest.com/pin/56787645301433764/,"Easy Fruit Pizza | Easy fruit pizza, Fruit pizza recipe, Homemade fruit pizza",150,2026-05-22 18:29:03
https://www.pinterest.com/pin/carrot-cake-cupcakes--56787645301430834/,"Carrot Cake Cupcakes | Recipe | Cupcake recipes, Desserts, Easter desserts recipes",60,2026-05-22 18:29:05
https://www.pinterest.com/pin/47710077297662671/,"Instant Pot BBQ Ribs | Recipe | Instant pot ribs recipe, Rib recipes, Easy instant pot recipes",24,2026-05-22 18:29:07
https://www.pinterest.com/pin/212795151136860594/,Slow Cooker Shredded Mexican Chicken | Recipe,159,2026-05-22 18:29:08
https://www.pinterest.com/pin/212795151136859086/,"Buffalo Shrimp | Recipe | Buffalo shrimp, Buffalo shrimp recipes, Grilled seafood recipes",12,2026-05-22 18:29:08
https://www.pinterest.com/pin/56787645300639186/,Delicious Strawberry Cupcakes with Strawberry Puree Filling | Recipe,25,2026-05-22 18:29:09
https://www.pinterest.com/pin/212795151136848803/,"Lemon Baked Donuts | Recipe | Lemon glazed donuts, Baked donut recipes, Baked donuts",39,2026-05-22 18:29:09
https://www.pinterest.com/pin/56787645300917247/,"Strawberry Oatmeal | Recipe | Strawberries and cream oatmeal, Strawberry oatmeal, Breakfast brunch recipes",31,2026-05-22 18:29:10
https://www.pinterest.com/pin/strawberry-shortcake-bars--56787645300639233/,"Strawberry Shortcake Bars | Recipe | Strawberry shortcake bars, Easy bar recipes, Strawberry recipes",31,2026-05-22 18:29:10
https://www.pinterest.com/pin/212795151136848631/,"Lemon Brownies | Recipe | Lemon brownies, Baking, Desserts",87,2026-05-22 18:29:11
https://www.pinterest.com/pin/56787645300639000/,"The Ultimate Easter Menu | Easter dishes, Easter dinner menus, Easter dinner recipes",119,2026-05-22 18:29:12
https://www.pinterest.com/pin/212795151136848580/,"Pickle Dip Pinwheels | Recipe | Pinwheel recipes, Finger food appetizers, Yummy appetizers",488,2026-05-22 18:29:12
https://www.pinterest.com/pin/56787645300638975/,"Strawberry Mousse | Recipe | Strawberry mousse, Strawberry recipes, Desserts",23,2026-05-22 18:29:13
https://www.pinterest.com/pin/212795151136845354/,"Tortellini Carbonara | Recipe | Tortellini recipes, Recipes, Cooking recipes",526,2026-05-22 18:29:15
https://www.pinterest.com/pin/47710077297643664/,Homemade Chicken Tenders | Recipe,538,2026-05-22 18:29:15
https://www.pinterest.com/pin/212795151136842707/,"Strawberry Dumplings | Recipe | Recipes, Favorite dessert recipes, Dessert recipes easy",259,2026-05-22 18:29:15
https://www.pinterest.com/pin/212795151136834813/,"Tuna Melt Recipe | Recipe | Melt recipe, Tuna melt recipe, Tuna melts",288,2026-05-22 18:29:16
https://www.pinterest.com/pin/56787645300410659/,"Ham & Bacon Cheesy Potatoes | Recipe | Easy casserole recipes, Cooking recipes, Recipes",16870,2026-05-22 18:29:16
https://www.pinterest.com/pin/56787645300410245/,"Fall Off The Bone Ribs | Recipe | Rib recipes, Pork rib recipes, Slow cooked ribs",1166,2026-05-22 18:29:18
https://www.pinterest.com/pin/212795151136825486/,Club Sandwich Recipe - Tornadough Alli,74,2026-05-22 18:29:21
https://www.pinterest.com/pin/56787645300390673/,"Air Fryer French Fries | Recipe | Frozen french fries, Air fryer dinner recipes, Air fryer recipes healthy",185,2026-05-22 18:29:27
https://www.pinterest.com/pin/irish-coffee-recipe--212795151136804113/,"Irish Coffee Recipe | Recipe | Coffee recipes, Irish coffee recipe, Irish coffee",3,2026-05-22 18:29:28
https://www.pinterest.com/pin/homemade-tartar-sauce--56787645300386999/,"Homemade Tartar Sauce | Recipe | Homemade tartar sauce easy, Sauce recipes, Quick tartar sauce recipe",846,2026-05-22 18:29:29
https://www.pinterest.com/pin/212795151136802744/,"Cinnamon Muffins | Muffin recipes cinnamon, Pumpkin chocolate chip muffins, Cinnamon sugar muffins",31,2026-05-22 18:29:29
https://www.pinterest.com/pin/56787645300383942/,"Potato Salad | Recipe | Potato salad recipe easy, Deviled egg potato salad, Classic potato salad",48,2026-05-22 18:29:31
https://www.pinterest.com/pin/56787645300383972/,"The Best Bread Pudding EVER! | Best bread pudding recipe, Bread pudding recipe, Pudding recipes",225,2026-05-22 18:29:31
https://www.pinterest.com/pin/212795151136798360/,"Homemade Strawberry Pop-Tarts | Recipe | Pop tarts homemade, Strawberry pop tart, Poptart recipe",121,2026-05-22 18:29:31
https://www.pinterest.com/pin/212795151136795325/,"Fried Shrimp Recipe | Recipe | Shrimp appetizer recipes, Shrimp recipes for dinner, Fried shrimp recipes",95,2026-05-22 18:29:32
https://www.pinterest.com/pin/212795151136795301/,Honey BBQ Crockpot Meatballs - The Perfect Party Appetizer! | Recipe,3549,2026-05-22 18:29:32
https://www.pinterest.com/pin/56787645300383797/,"Crockpot Mashed Potatoes | Recipe | Easy thanksgiving recipes, Potato recipes crockpot, Recipes",123,2026-05-22 18:29:33
https://www.pinterest.com/pin/56787645300383620/,"Veggie Pizza Pinwheels | Recipe | Veggie pizza, Pizza pinwheels, Pinwheel recipes",267,2026-05-22 18:29:33
https://www.pinterest.com/pin/212795151136794409/,"Chicken Fried Chicken | Fried chicken recipes, Dinner recipes, Chicken dishes recipes",2039,2026-05-22 18:29:33
https://www.pinterest.com/pin/47710077297599137/,"Hibachi Noodles | Recipe | Hibachi noodles, Noodle recipes easy, Recipes",21,2026-05-22 18:29:34
https://www.pinterest.com/pin/56787645300359195/,Easy Honey BBQ Crockpot Meatbal;s,1624,2026-05-22 18:29:38
https://www.pinterest.com/pin/56787645300358701/,"The Best Bread Pudding EVER! | Best bread pudding recipe, Bread pudding, Pudding recipes",46,2026-05-22 18:29:40
https://www.pinterest.com/pin/56787645300358772/,"French Crullers | Recipe | Perfect breakfast recipes, Delicious breakfast recipes, Recipes",1009,2026-05-22 18:29:40
https://www.pinterest.com/pin/212795151136764580/,"Homemade Chicken and Dumplings | Recipe | Homemade chicken and dumplings, Chicken and dumplings, Recipes",436,2026-05-22 18:29:42
https://www.pinterest.com/pin/212795151136763772/,Hibachi Noodles | Recipe | Simple asian noodles,37,2026-05-22 18:29:42
https://www.pinterest.com/pin/56787645300348819/,McDonald's Copycat Shamrock Shake | Recipe,62,2026-05-22 18:29:44
https://www.pinterest.com/pin/212795151136748609/,212795151136748609,1672,2026-05-22 18:29:46
https://www.pinterest.com/pin/212795151136748023/,"Slow Cooker Pork Chops | Recipe | Crockpot pork, Recipes, Slow cooker pork",1183,2026-05-22 18:29:47
https://www.pinterest.com/pin/56787645300336877/,"Stuffed Pepper Casserole | Recipe | Stuffed peppers, Recipes, Dinner casseroles",574,2026-05-22 18:29:47
https://www.pinterest.com/pin/212795151136747916/,"Shrimp Boil Recipe | Recipe | Seafood boil recipes, Shrimp recipes for dinner, Shrimp boil recipe",63,2026-05-22 18:29:47
https://www.pinterest.com/pin/crispy-fish-sandwich--56787645300333829/,"Crispy Fish Sandwich | Recipe | Fish sandwich recipes, Fish sandwich, Fish recipes",244,2026-05-22 18:29:49
https://www.pinterest.com/pin/47710077297553386/,"Olive Garden Chicken Gnocchi Soup | Recipe | Recipes, Soup recipes, Chicken gnocchi soup olive garden",918,2026-05-22 18:29:50
https://www.pinterest.com/pin/47710077297552762/,Homemade Chicken and Dumplings—A Comforting Classic Meal,436,2026-05-22 18:29:51
https://www.pinterest.com/pin/212795151136741646/,"Air Fryer French Fries | Recipe | Air fryer recipes healthy, Air fryer dinner recipes, Healthy recipes",155,2026-05-22 18:29:52
https://www.pinterest.com/pin/tortellini-carbonara--212795151136734482/,"Tortellini Carbonara | Recipe | Tortellini recipes, Tortellini, Favorite pasta recipes",429,2026-05-22 18:29:52
https://www.pinterest.com/pin/212795151136740077/,212795151136740077,2739,2026-05-22 18:29:52
https://www.pinterest.com/pin/212795151136728215/,"Baked Country Style Ribs | Recipe | Baked country style ribs, Boneless ribs, Oven pork ribs",183,2026-05-22 18:29:56
https://www.pinterest.com/pin/56787645300311369/,Creamy Root Beer Rum Cocktail - Tornadough Alli,3337,2026-05-22 18:30:01
https://www.pinterest.com/pin/chocolate-raspberry-cake--56787645300305393/,"Chocolate Raspberry Cake | Recipe | Desserts, Delicious desserts, Chocolate raspberry cake",780,2026-05-22 18:30:03
https://www.pinterest.com/pin/56787645300305319/,"Chicken Fried Chicken—A Southern Comfort Food | Recipes, Fried chicken recipes, Cooking recipes",3315,2026-05-22 18:30:03
https://www.pinterest.com/pin/212795151136710828/,"Chicken Fried Chicken With Country Gravy | Recipes, Delicious, Yummy food",152,2026-05-22 18:30:04
https://www.pinterest.com/pin/212795151136711034/,"Korean Spicy Pork Bowls | Recipe | Spicy pork, Pork dishes, Recipes",164,2026-05-22 18:30:05
https://www.pinterest.com/pin/212795151136708480/,Cinnamon Muffins Recipe - Perfect for Breakfast or Brunch!,419,2026-05-22 18:30:07
https://www.pinterest.com/pin/212795151136710582/,"The BEST Chicken Fried Chicken With Country Gravy | Recipes, Fried chicken recipes, Cooking recipes",232,2026-05-22 18:30:07
https://www.pinterest.com/pin/mini-tacos--212795151136709229/,Mini Tacos—The BEST Appetizer or Dinner Idea!,34,2026-05-22 18:30:07
https://www.pinterest.com/pin/56787645300281484/,Copycat KFC Bowls Recipe | Easy mac 'n' cheese recipes,185,2026-05-22 18:30:11
https://www.pinterest.com/pin/king-cake-recipe--56787645300265897/,"King Cake Recipe | Recipe | King cake recipe, King cake, Cake recipes",55,2026-05-22 18:30:18
https://www.pinterest.com/pin/47710077297488751/,"Tuna Noodle Casserole Recipe | Recipe | Best tuna casserole, Tuna casserole recipes, Tuna noodle casserole",88,2026-05-22 18:30:18
https://www.pinterest.com/pin/212795151136674763/,"Egg Drop Soup | Recipe | Homemade egg drop soup, Egg drop soup easy, Egg drop soup",68,2026-05-22 18:30:18
https://www.pinterest.com/pin/47710077297485228/,Chicken Caesar Pasta Salad | Recipe,340,2026-05-22 18:30:21
https://www.pinterest.com/pin/47710077297485111/,"Olive Garden Chicken Gnocchi Soup | Recipe | Olive garden chicken gnocchi soup recipe, Chicken gnocchi soup, Chicken gnocchi",380,2026-05-22 18:30:21
https://www.pinterest.com/pin/56787645300262360/,"Easy Fruit Pizza—A Delicious Dessert or Breakfast! | Easy fruit pizza, Best dessert recipes, Delicious holiday desserts",148,2026-05-22 18:30:22
https://www.pinterest.com/pin/creamy-potato-soup-recipe-delicious-dish-using-the-most-ver--47710077297484976/,Creamy Potato Soup Recipe: Delicious Dish Using the Most Ver…,107,2026-05-22 18:30:22
https://www.pinterest.com/pin/56787645300262025/,"Mini Pizza Bagels | Recipe | Pizza bagels, Mini pizza, Mini bagel appetizers",21,2026-05-22 18:30:24
https://www.pinterest.com/pin/47710077297484598/,Indulgent Chicken Fried Chicken,502,2026-05-22 18:30:24
https://www.pinterest.com/pin/212795151136668550/,"Easy Chocolate Cake (9x13-inch Pan) | Recipe | Chocolate cake recipe easy, Easy chocolate cake, Easy chocolate",3,2026-05-22 18:30:26
https://www.pinterest.com/pin/212795151136650763/,"Instant Pot Chicken Noodle Soup | Recipe | Instant pot recipes, Instant pot chicken noodle soup recipe, Instant pot soup",31,2026-05-22 18:30:34
https://www.pinterest.com/pin/easy-jambalaya-recipe--47710077297463546/,"Easy Jambalaya Recipe | Recipe | Jambalaya recipe, Jambalaya recipe easy, Jambalaya",38,2026-05-22 18:30:34
https://www.pinterest.com/pin/56787645300233614/,"Chicken Stir Fry | Recipe | Stir fry recipes chicken, Chicken breast recipes, Chicken recipes",43,2026-05-22 18:30:35
https://www.pinterest.com/pin/212795151136648462/,"Copycat Pizza Hut Cheese Sticks | Recipe | Pizza hut cheese, Cheese sticks, Pizza hut",111,2026-05-22 18:30:36
https://www.pinterest.com/pin/212795151136644341/,"Brownie in a Mug—A Single-Serve Dessert | Brownie in a mug, Single serve dessert recipes, Single serve desserts",32,2026-05-22 18:30:40
https://www.pinterest.com/pin/212795151136644550/,"BBQ Chicken Salad | Recipe | Bbq chicken salad recipe, Bbq chicken salad, Favorite recipes dinner",23,2026-05-22 18:30:40
https://www.pinterest.com/pin/212795151136644406/,"Shredded Brussel Sprout Harvest Salad | Recipe | Harvest salad, Soup and salad, Shredded brussel sprouts",42,2026-05-22 18:30:40
https://www.pinterest.com/pin/47710077297450839/,"Chicken Stir Fry | Recipe | Chicken stir fry, Recipes, Stir fry",153,2026-05-22 18:30:43
https://www.pinterest.com/pin/47710077297450617/,"Slow Cooker Zuppa Toscana (Olive Garden Copycat) | Recipe | Easy pasta dishes, Toscana recipe, Slow cooker pork",14,2026-05-22 18:30:43
https://www.pinterest.com/pin/the-best-mississippi-sin-dip-pinwheels--212795151136634105/,"The BEST Mississippi Sin Dip Pinwheels | Pinwheel recipes, Finger foods easy, Appetizers easy",82,2026-05-22 18:30:43
https://www.pinterest.com/pin/56787645300209519/,"Creamy Potato Soup | Recipe | Creamy potato soup, Creamy potato soup recipe, Potato soup",29,2026-05-22 18:30:44
https://www.pinterest.com/pin/56787645300209594/,Wonton Soup Recipe for a Delicious Asian Lunch or Dinner,439,2026-05-22 18:30:44
https://www.pinterest.com/pin/56787645300206582/,"Popcorn Chicken Recipe | Recipe | Popcorn chicken, Popcorn chicken recipe, Chicken recipes",42,2026-05-22 18:30:46
https://www.pinterest.com/pin/56787645300206496/,"Buffalo Chicken Pinwheels | Recipe | Buffalo chicken pinwheels, Chicken pinwheels, Pinwheel recipes",30,2026-05-22 18:30:46
