url,title,saves,timestamp
https://www.pinterest.com/pin/212795151139295977/,212795151139295977,2,2026-05-22 18:23:06
https://www.pinterest.com/pin/212795151139295680/,212795151139295680,1,2026-05-22 18:23:06
https://www.pinterest.com/pin/212795151139293347/,212795151139293347,4,2026-05-22 18:23:07
https://www.pinterest.com/pin/212795151139290830/,212795151139290830,7,2026-05-22 18:23:07
https://www.pinterest.com/pin/212795151139280267/,212795151139280267,1,2026-05-22 18:23:09
https://www.pinterest.com/pin/212795151139280327/,212795151139280327,8,2026-05-22 18:23:09
https://www.pinterest.com/pin/212795151139283147/,212795151139283147,7,2026-05-22 18:23:09
https://www.pinterest.com/pin/212795151139277982/,212795151139277982,14,2026-05-22 18:23:09
https://www.pinterest.com/pin/212795151139275416/,212795151139275416,12,2026-05-22 18:23:09
https://www.pinterest.com/pin/212795151139275266/,212795151139275266,1,2026-05-22 18:23:09
https://www.pinterest.com/pin/212795151139272783/,212795151139272783,15,2026-05-22 18:23:10
https://www.pinterest.com/pin/212795151139265024/,212795151139265024,16,2026-05-22 18:23:10
https://www.pinterest.com/pin/212795151139270085/,212795151139270085,2,2026-05-22 18:23:11
https://www.pinterest.com/pin/212795151139264983/,212795151139264983,1,2026-05-22 18:23:11
https://www.pinterest.com/pin/212795151139270208/,212795151139270208,18,2026-05-22 18:23:11
https://www.pinterest.com/pin/212795151139267664/,212795151139267664,11,2026-05-22 18:23:11
https://www.pinterest.com/pin/212795151139255945/,212795151139255945,13,2026-05-22 18:23:13
https://www.pinterest.com/pin/212795151139253680/,212795151139253680,11,2026-05-22 18:23:13
https://www.pinterest.com/pin/212795151139255674/,212795151139255674,1,2026-05-22 18:23:13
https://www.pinterest.com/pin/212795151139251247/,212795151139251247,16,2026-05-22 18:23:13
https://www.pinterest.com/pin/212795151139248421/,212795151139248421,12,2026-05-22 18:23:14
https://www.pinterest.com/pin/212795151139243573/,Fruity Summer Rhubarb Slush in 2026,16,2026-05-22 18:23:14
https://www.pinterest.com/pin/212795151139250992/,212795151139250992,2,2026-05-22 18:23:14
https://www.pinterest.com/pin/212795151139245877/,212795151139245877,1,2026-05-22 18:23:14
https://www.pinterest.com/pin/212795151139245946/,212795151139245946,17,2026-05-22 18:23:14
https://www.pinterest.com/pin/212795151139241361/,"Grilled Hawaiian Chicken Pineapple Kabobs [Video] in 2026 | Pineapple chicken, Pineapple kabobs, Kabobs",20,2026-05-22 18:23:14
https://www.pinterest.com/pin/212795151139241209/,"Mexican Stuffed Shells for Taco Tuesday Fun in 2026 | Mexican stuffed shells, Stuffed shells, Mexican food recipes",1,2026-05-22 18:23:15
https://www.pinterest.com/pin/212795151139230424/,"Snickers Mini Cheesecakes in 2026 | Snickers cheesecake, Desserts, Baking recipes",18,2026-05-22 18:23:15
https://www.pinterest.com/pin/212795151139230252/,BBQ Chicken Pasta,1,2026-05-22 18:23:16
https://www.pinterest.com/pin/212795151139227802/,"Strawberry Crunch Cake in 2026 | Strawberry crunch cake, Crunch cake, Crunch",19,2026-05-22 18:23:16
https://www.pinterest.com/pin/212795151139233289/,"Summer Grilled Mexican Street Corn in 2026 | Mexican street corn recipe, Recipes, Street corn recipe",25,2026-05-22 18:23:17
https://www.pinterest.com/pin/212795151139235614/,"Strawberry Lemon Donuts in 2026 | Homemade donuts recipe, Homemade donuts, Delicious donuts",1,2026-05-22 18:23:17
https://www.pinterest.com/pin/212795151139225362/,Raspberry Lemonade | Recipe in 2026,1,2026-05-22 18:23:18
https://www.pinterest.com/pin/212795151139225502/,"Slow Cooker Shredded Beef Tacos | Recipe in 2026 | Slow cooker shredded beef, Dinner recipes crockpot, Easy beef stew",19,2026-05-22 18:23:18
https://www.pinterest.com/pin/212795151139223239/,"Limoncello Recipe [Video] | Recipe [Video] in 2026 | Delicious drink recipes, Refreshing desserts, Citrus recipes",8,2026-05-22 18:23:18
https://www.pinterest.com/pin/212795151139215408/,"Mexican Rice Casserole | Recipe in 2026 | Homemade chicken and dumplings, Hot meals, Classic food",31,2026-05-22 18:23:19
https://www.pinterest.com/pin/212795151139220588/,"Pico de Gallo Recipe | Recipe in 2026 | Mexican food recipes, Quick and easy appetizers, Pico recipe",60,2026-05-22 18:23:20
https://www.pinterest.com/pin/212795151139215295/,"Strawberry Dumplings | Recipe in 2026 | Recipes, Strawberry recipes, Pecan sticky buns",2,2026-05-22 18:23:20
https://www.pinterest.com/pin/212795151139220674/,"Hawaiian Chicken Pineapple Kabobs | Recipe in 2026 | Pineapple chicken kabobs, Kabob recipes, Chicken kabob recipes",25,2026-05-22 18:23:20
https://www.pinterest.com/pin/212795151139218132/,"Tuna Pasta Salad | Recipe in 2026 | Healthy salad recipes, Easy salad recipes, Creamy tuna pasta",40,2026-05-22 18:23:20
https://www.pinterest.com/pin/212795151139199897/,"Stuffed Pepper Casserole | Recipe in 2026 | Outdoor cooking recipes, Stuffed pepper casserole, Beef recipes easy",54,2026-05-22 18:23:20
https://www.pinterest.com/pin/212795151139199810/,"Banana Upside Down Cake | Recipe in 2026 | Banana upside down cake, Upside down cake, Easy fruit pizza",3,2026-05-22 18:23:20
https://www.pinterest.com/pin/212795151139197251/,"Slow Cooker Shredded Mexican Chicken | Recipe in 2026 | Chicken crockpot recipes slow cooker, Crockpot recipes mexican, Chicken crockpot recipes",19,2026-05-22 18:23:21
https://www.pinterest.com/pin/212795151139204319/,"Pesto Chicken Salad | Recipe in 2026 | Chicken salad recipe easy, Chicken salad recipes, Recipes",2,2026-05-22 18:23:22
https://www.pinterest.com/pin/212795151139207117/,Red Beans & Rice in the Slow Cooker,19,2026-05-22 18:23:22
https://www.pinterest.com/pin/212795151139202227/,"Limoncello Recipe | Recipe in 2026 | Limoncello recipe, Delicious drink recipes, Citrus recipes",23,2026-05-22 18:23:22
https://www.pinterest.com/pin/212795151139204481/,"Grape Salad [Video] | Recipe [Video] in 2026 | Easy salad recipes, Grape salad, Easy healthy recipes",11,2026-05-22 18:23:22
https://www.pinterest.com/pin/212795151139178754/,"Homemade Strawberry Pop-Tarts | Recipe in 2026 | Pop tarts homemade, Strawberry pop tart, Poptart recipe",17,2026-05-22 18:23:25
https://www.pinterest.com/pin/212795151139181686/,"Baked Pork Chops & Rice | Recipe in 2026 | Baked pork, Easy dinner recipes, Baked pork chops and rice recipe",20,2026-05-22 18:23:25
https://www.pinterest.com/pin/212795151139178673/,"Lemon Crumb Cake in 2026 | Lemon crumb cake, Best cake recipes, Crumb cake",3,2026-05-22 18:23:25
https://www.pinterest.com/pin/212795151139171830/,"Carrot Cake Cookie Cups | Recipe in 2026 | Carrot cake cookies, Carrot recipes dessert, Desserts",2,2026-05-22 18:23:25
https://www.pinterest.com/pin/212795151139172502/,"Orange Rolls | Recipe in 2026 | Orange rolls, Perfect breakfast recipes, Recipes",24,2026-05-22 18:23:25
https://www.pinterest.com/pin/212795151139175721/,Lemon Poppy Seed Cake,28,2026-05-22 18:23:26
https://www.pinterest.com/pin/212795151139169620/,"Chocolate Chip Pancakes - Tornadough Alli | Recipe in 2026 | Chocolate chip pancakes, Chocolate chip pancakes recipe, Brunch cocktail recipes",27,2026-05-22 18:23:26
https://www.pinterest.com/pin/212795151139150458/,"Cake Mix Lemon Squares | Recipe in 2026 | Lemon dessert recipes, Best dessert recipes, Lemon desserts",16,2026-05-22 18:23:28
https://www.pinterest.com/pin/212795151139147742/,"Suppli (Italian Rice Balls) [Video] | Recipe [Video] in 2026 | Delicious snacks recipes, Perfect food, Food lover",16,2026-05-22 18:23:28
https://www.pinterest.com/pin/212795151139150300/,"Cheesy Pull Apart Garlic Bread | Recipe in 2026 | Pull apart garlic bread, Side dishes easy, Recipes",2,2026-05-22 18:23:28
https://www.pinterest.com/pin/212795151139147604/,"The Best Carrot Cake | Recipe in 2026 | Easter dessert, Best carrot cake, Carrot cake",1,2026-05-22 18:23:29
https://www.pinterest.com/pin/212795151139145180/,"Strawberry Mug Cake | Recipe in 2026 | Dessert recipes easy, Scrumptious desserts, Best dessert recipes",14,2026-05-22 18:23:29
https://www.pinterest.com/pin/212795151139144852/,"Banana Cookies | Recipe in 2026 | Banana cookies, Banana dessert, Easy baking",1,2026-05-22 18:23:29
https://www.pinterest.com/pin/212795151139141366/,Chicken Fried Chicken Recipe,15,2026-05-22 18:23:29
https://www.pinterest.com/pin/212795151139144688/,"Classic Deviled Eggs | Recipe in 2026 | Deviled eggs classic, Devilled eggs recipe best, Deviled eggs recipe",4,2026-05-22 18:23:30
https://www.pinterest.com/pin/212795151139141538/,"One Pot Creamy Sausage Gnocchi | Recipe in 2026 | Gnocchi dishes, Gnocchi and sausage recipe, Gnocchi recipes",4,2026-05-22 18:23:30
https://www.pinterest.com/pin/212795151139142361/,"Scalloped Potatoes and Ham | Recipe in 2026 | Scalloped potatoes, Easter side dishes, Ham dinner side dishes",4,2026-05-22 18:23:30
https://www.pinterest.com/pin/212795151139142519/,"Pickle Dip Pinwheels | Recipe in 2026 | Dip recipes appetizers, Easy lunch recipes, Pinwheels",23,2026-05-22 18:23:31
https://www.pinterest.com/pin/212795151139133978/,"Cinnamon Swirl Bread | Recipe in 2026 | Cinnamon swirl bread, Swirled bread, Cinnamon bread",1,2026-05-22 18:23:33
https://www.pinterest.com/pin/212795151139128906/,"Peanut Butter Cake [Video] | Recipe [Video] in 2026 | Peanut butter cake, Sponge cake recipes, Cake recipes",16,2026-05-22 18:23:33
https://www.pinterest.com/pin/212795151139139526/,"Lemon Poppy Seed Bread | Recipe in 2026 | Lemon poppy seed bread recipe, Lemon poppyseed bread, Bread recipes sweet",8,2026-05-22 18:23:33
https://www.pinterest.com/pin/212795151139134127/,"Chocolate Chip Scones | Recipe in 2026 | Scone recipe, Delicious breakfast recipes, Scones",18,2026-05-22 18:23:33
https://www.pinterest.com/pin/212795151139136778/,"Migas Recipe | Recipe in 2026 | Holiday recipes breakfast, Brunch recipes, Recipes",13,2026-05-22 18:23:33
https://www.pinterest.com/pin/212795151139131799/,"Copycat Applebee's Honey Pepper Chicken Mac and Cheese | Recipe in 2026 | Stuffed peppers, Honey pepper chicken, Chicken stuffed peppers",38,2026-05-22 18:23:33
https://www.pinterest.com/pin/212795151139124115/,"Homemade Pizza Rolls | Recipe in 2026 | Recipes, Homemade pizza, Homemade pizza rolls",26,2026-05-22 18:23:34
https://www.pinterest.com/pin/212795151139128657/,"No Bake Energy Bites | Recipe in 2026 | No bake energy bites, Energy ball recipe, Easy snacks",6,2026-05-22 18:23:34
https://www.pinterest.com/pin/212795151139126390/,"Suppli (Italian Rice Balls) | Recipe in 2026 | Quick and easy appetizers, Cheesy recipes, Recipes",12,2026-05-22 18:23:35
https://www.pinterest.com/pin/212795151139124025/,"Nutella Crepes (with Strawberries) | Recipe in 2026 | Peanut butter banana bread, Scrumptious desserts, Nutella",2,2026-05-22 18:23:35
https://www.pinterest.com/pin/212795151139115997/,"Greek Chicken Meatballs | Recipe in 2026 | Chicken main dish recipes, Easy chicken recipes, Main dish recipes",30,2026-05-22 18:23:35
https://www.pinterest.com/pin/212795151139118315/,"Corned Beef Quesadilla | Recipe in 2026 | Corned beef, Main dish recipes, Easy appetizer recipes",1,2026-05-22 18:23:35
https://www.pinterest.com/pin/212795151139121318/,"The Ultimate Easter Menu in 2026 | Spring recipes dinner, Delicious dinner recipes, Easter dinner recipes",14,2026-05-22 18:23:35
https://www.pinterest.com/pin/212795151139118368/,"Sour Cream Pound Cake | Recipe in 2026 | Best cake recipes, Best dessert recipes, Easy summer desserts",12,2026-05-22 18:23:35
https://www.pinterest.com/pin/212795151139111312/,"Baked Italian Subs [Video] | Recipe [Video] in 2026 | Easy lunch recipes, Toast in the oven, Recipes",16,2026-05-22 18:23:37
https://www.pinterest.com/pin/212795151139108484/,"Dirty Irishman | Recipe in 2026 | Homemade eggnog, Irish whiskey, Baileys irish cream coffee",2,2026-05-22 18:23:37
https://www.pinterest.com/pin/212795151139108632/,"Peanut Butter Cake | Recipe in 2026 | Easy homemade desserts, Scrumptious desserts, Best dessert recipes",109,2026-05-22 18:23:37
https://www.pinterest.com/pin/212795151139105647/,"Fall Off The Bone Ribs | Recipe in 2026 | Yummy fall recipes, Comfort food recipes dinners, Recipes",20,2026-05-22 18:23:37
https://www.pinterest.com/pin/212795151139102947/,"Key Lime Pie Bars | Recipe in 2026 | Key lime pie easy, Key lime pie bars, Easy summer desserts",13,2026-05-22 18:23:38
https://www.pinterest.com/pin/212795151139100086/,"BBQ Chicken Pasta Recipe in 2026 | Easy chicken recipes, Chicken pasta recipes, Chicken main dish recipes",15,2026-05-22 18:23:38
https://www.pinterest.com/pin/212795151139102805/,"Cosmic Brownie Cookies | Recipe in 2026 | Cosmic brownies, Brownie cookies, Easy cookies",3,2026-05-22 18:23:38
https://www.pinterest.com/pin/212795151139088125/,"Cheesy Potatoes in the Crockpot in 2026 | Potato side dishes easy, Crockpot side dishes, Recipes",38,2026-05-22 18:23:40
https://www.pinterest.com/pin/212795151139087162/,"Salted Caramel Rolls | Recipe in 2026 | Caramel rolls, Breakfast recipes sweet, Salted caramel",4,2026-05-22 18:23:40
https://www.pinterest.com/pin/212795151139084583/,"Dirty Irishman | Recipe in 2026 | Irish whiskey, Irish recipes, Alcoholic drinks",8,2026-05-22 18:23:40
https://www.pinterest.com/pin/212795151139081249/,"Air Fryer Fried Chicken | Recipe in 2026 | Air fryer fried chicken, Fried chicken, Stuffed peppers",1,2026-05-22 18:23:40
https://www.pinterest.com/pin/212795151139078191/,"Funfetti Mug Cake | Recipe in 2026 | Best dessert recipes, Scrumptious desserts, Fun desserts",11,2026-05-22 18:23:40
https://www.pinterest.com/pin/212795151139081405/,"Banana Cookies | Recipe in 2026 | Banana cookie recipe, Best dessert recipes, Banana cookies",13,2026-05-22 18:23:41
https://www.pinterest.com/pin/212795151139075459/,"Slow Cooker Pork Chops | Recipe in 2026 | Slow cooker pork chops, Pork recipes easy, Main dish recipes",2,2026-05-22 18:23:41
https://www.pinterest.com/pin/212795151139075363/,"Shamrock Shake Recipe (Copycat) | Recipe in 2026 | Shamrock shake recipe, Shake recipes, Copycat drink recipes",9,2026-05-22 18:23:41
https://www.pinterest.com/pin/212795151139068872/,"Chicken Parmesan Soup | Recipe in 2026 | Hearty soup recipes, Chicken parmesan, Soup recipes",1,2026-05-22 18:23:42
https://www.pinterest.com/pin/212795151139072430/,"Chicago Style Deep Dish Pizza [Video] | Recipe [Video] in 2026 | Fun easy recipes, Chicago deep dish pizza, Deep dish pizza",23,2026-05-22 18:23:42
https://www.pinterest.com/pin/212795151139069316/,"Chicken Enchilada Soup | Recipe in 2026 | Chicken enchilada soup recipes, Enchilada soup recipe, Easy soup recipes",15,2026-05-22 18:23:42
https://www.pinterest.com/pin/212795151139066109/,"Copycat KFC Bowls | Recipe in 2026 | Recipes, Cooking recipes, Dinner recipes easy quick",43,2026-05-22 18:23:42
https://www.pinterest.com/pin/212795151139059735/,"Dirty Shirley | Recipe in 2026 | Tropical drink recipes, Cherry flavor, Flavored vodka",3,2026-05-22 18:23:44
https://www.pinterest.com/pin/212795151139062908/,"Homemade Cinnamon Rolls | Recipe in 2026 | Cinnamon rolls homemade, Cinnamon rolls, Baked dishes",4,2026-05-22 18:23:44
https://www.pinterest.com/pin/212795151139056706/,"One Pot Cajun Pasta | Recipe in 2026 | Cajun pasta, Cajun pasta recipes, One pot cajun pasta",24,2026-05-22 18:23:44
https://www.pinterest.com/pin/212795151139056538/,"Pistachio Muffins | Recipe in 2026 | Pistachio muffins, Pistachio recipes, Homemade muffins recipe",228,2026-05-22 18:23:44
https://www.pinterest.com/pin/212795151139053612/,"Irresistible Bread Pudding in 2026 | Bread pudding, Old fashioned bread pudding, Best bread pudding recipe",56,2026-05-22 18:23:45
https://www.pinterest.com/pin/212795151139050808/,"Snickerdoodle Bars [Video] | Recipe [Video] in 2026 | Snickerdoodle bars, Best dessert recipes, Scrumptious desserts",12,2026-05-22 18:23:45
https://www.pinterest.com/pin/212795151139042375/,"Homemade Salsa Recipe | Recipe in 2026 | Salsa recipe, Spicy recipes, Recipes",6,2026-05-22 18:23:46
https://www.pinterest.com/pin/212795151139044793/,"One Pot Creamy Sausage Gnocchi | Recipe in 2026 | Gnocchi dishes, Recipes, Sausage recipes",68,2026-05-22 18:23:46
https://www.pinterest.com/pin/212795151139044673/,"Easy White Hot Chocolate | Recipe in 2026 | White hot chocolate, Hot chocolate, Hot chocolate recipes",1,2026-05-22 18:23:46
https://www.pinterest.com/pin/212795151139050594/,"Air Fryer Cinnamon Roll Casserole | Recipe in 2026 | Favorite breakfast recipes, Instapot recipes, Cinnamon rolls",1,2026-05-22 18:23:46
https://www.pinterest.com/pin/212795151139047631/,"Homemade Salsa Recipe | Recipe in 2026 | Fresh tomato recipes, Homemade salsa recipe, Fresh salsa recipe",33,2026-05-22 18:23:46
https://www.pinterest.com/pin/212795151139041877/,"Easy Beef Stir Fry | Recipe in 2026 | Beef casserole recipes, Easy beef stir fry, Easy dinner",22,2026-05-22 18:23:46
https://www.pinterest.com/pin/212795151139034252/,"Pork Egg Rolls | Recipe in 2026 | Pork egg rolls, Egg roll recipes, Pork egg roll recipes",53,2026-05-22 18:23:46
https://www.pinterest.com/pin/212795151139034058/,"Chicken Stroganoff Recipe | Recipe in 2026 | Recipes, Chicken stroganoff, How to cook chicken",4,2026-05-22 18:23:47
https://www.pinterest.com/pin/212795151139031952/,"Bang Bang Chicken [Video] | Recipe [Video] in 2026 | Chicken main dish recipes, Easy chicken recipes, Entree recipes chicken",11,2026-05-22 18:23:48
https://www.pinterest.com/pin/212795151139036546/,"Cosmic Brownie Cookies | Recipe in 2026 | Cookie recipes homemade, Best dessert recipes, Fun easy recipes",18,2026-05-22 18:23:48
https://www.pinterest.com/pin/212795151139039013/,Ravioli Soup | Recette en 2026,5,2026-05-22 18:23:48
https://www.pinterest.com/pin/212795151139029226/,"Snickerdoodle Bars | Recipe in 2026 | Desserts, Dessert bars, Yummy food",12,2026-05-22 18:23:49
https://www.pinterest.com/pin/212795151139024222/,"King Cake Recipe | Recipe in 2026 | Mardi gras king cake, King cake recipe, Cake recipes",2,2026-05-22 18:23:50
https://www.pinterest.com/pin/212795151139029111/,"Pork Tenderloin Sandwich | Recipe in 2026 | Easy pork tenderloin, Pork tenderloin sandwich, Pork tenderloin",1,2026-05-22 18:23:50
https://www.pinterest.com/pin/212795151139027149/,"Olive Garden Chicken Gnocchi Soup | Recipe in 2026 | Chicken main dish recipes, Entree recipes chicken, Best chicken recipes",24,2026-05-22 18:23:50
https://www.pinterest.com/pin/212795151139024002/,"Red Velvet Cake Roll | Recipe in 2026 | Red velvet cake roll, Cake roll, Red velvet cake",1,2026-05-22 18:23:50
https://www.pinterest.com/pin/212795151139021442/,"Taco Spaghetti | Recipe in 2026 | Cheesy recipes, Fun easy recipes, Homemade chicken and dumplings",14,2026-05-22 18:23:50
https://www.pinterest.com/pin/212795151139020952/,"Easy Fruit Pizza {A Fun Sweet Spin for Pizza Night} | Easy fruit pizza, Fruit pizza, Fruit pizza recipe",6,2026-05-22 18:23:50
https://www.pinterest.com/pin/56787645305298958/,Tuscan White Bean Soup,44,2026-05-22 18:23:50
https://www.pinterest.com/pin/212795151139018227/,"Raspberry Italian Soda | Recipe in 2026 | Italian soda, Soda recipe, Italian sodas recipe",2,2026-05-22 18:23:52
https://www.pinterest.com/pin/56787645305295960/,"Taco Spaghetti | Recipe in 2026 | Favorite pasta recipes, Easy pasta recipes, Recipes",26,2026-05-22 18:23:52
https://www.pinterest.com/pin/56787645305296103/,"Pizza Grilled Cheese | Recipe | Interesting food recipes, Recipes, Foood recipes",8,2026-05-22 18:23:52
https://www.pinterest.com/pin/212795151139018348/,"Air Fryer Fried Chicken | Recipe in 2026 | Chicken main dish recipes, Easy chicken recipes, Entree recipes chicken",14,2026-05-22 18:23:53
https://www.pinterest.com/pin/212795151139016504/,"Mini Tacos | Recipe | Mini tacos, Recipes, Mini tacos recipe",13,2026-05-22 18:23:54
https://www.pinterest.com/pin/56787645305293645/,"Air Fryer Fried Chicken | Recipe in 2026 | Easy chicken recipes, Entree recipes chicken, Best chicken recipes",8,2026-05-22 18:23:54
https://www.pinterest.com/pin/212795151139015421/,"Homemade Chicken Tenders | Recipe in 2026 | Chicken main dish recipes, Entree recipes chicken, Chicken tender recipes",12,2026-05-22 18:23:54
https://www.pinterest.com/pin/212795151139003477/,"Grandma's Butterscotch Cake | Recipe in 2026 | Butterscotch cake, Best dessert recipes, Cake toppings",11,2026-05-22 18:23:56
https://www.pinterest.com/pin/212795151139003391/,"Pistachio Muffins | Recipe in 2026 | Best dessert recipes, Pistachio muffins, Homemade muffins",21,2026-05-22 18:23:56
https://www.pinterest.com/pin/212795151139002411/,"Pork Tenderloin Sandwich | Recipe in 2026 | Pork tenderloin sandwich, Pork sandwich recipes, Pork tenderloin recipes",82,2026-05-22 18:23:56
https://www.pinterest.com/pin/212795151138998502/,"Pork Tenderloin Sandwich | Recipe in 2026 | Fun easy recipes, Pork tenderloin sandwich, Recipes",12,2026-05-22 18:23:56
https://www.pinterest.com/pin/212795151139002019/,"Chicken Stroganoff Recipe | Recipe in 2026 | Best chicken recipes, New chicken recipes, Easy chicken recipes",7,2026-05-22 18:23:57
https://www.pinterest.com/pin/212795151139001462/,"Walking Tacos | Recipe in 2026 | Walking tacos, Fun easy recipes, Taco in a bag",10,2026-05-22 18:23:57
https://www.pinterest.com/pin/56787645305275330/,"Macaroons No bake cookies Food photography M m cake Cake mix cookies Photography Sandwich cookies | Easy no bake cookies, Baking recipes cookies, No bake cookies",6,2026-05-22 18:23:57
https://www.pinterest.com/pin/56787645305274409/,Thunfisch-Nudelsalat – Das beste und einfachste Sommerrezept… | Recipe,14,2026-05-22 18:23:57
https://www.pinterest.com/pin/212795151138995517/,"Cream Cheese Wontons | Recipe in 2026 | Wonton appetizers, Cheese wontons, Wonton recipes",31,2026-05-22 18:23:57
https://www.pinterest.com/pin/212795151138992259/,"Lemon Pepper Wings [Video] | Recipe [Video] in 2026 | Stuffed peppers, Best chicken recipes, Lemon pepper wings",10,2026-05-22 18:23:58
https://www.pinterest.com/pin/212795151138996284/,"The Best Bread Pudding - The Perfect Breakfast Dish! in 2026 | Bread pudding, Old fashioned bread pudding, Best bread pudding recipe",16,2026-05-22 18:23:58
https://www.pinterest.com/pin/212795151138975823/,"Homemade Hash Brown Patties | Recipe in 2026 | Hash brown patties, Homemade hashbrowns, Homemade hash",34,2026-05-22 18:24:00
https://www.pinterest.com/pin/212795151138961104/,"Minestrone Soup Recipe | Recipe in 2026 | Recipes, Vegetarian main dishes, Soup recipes",18,2026-05-22 18:24:00
https://www.pinterest.com/pin/56787645305234258/,"Egg Drop Soup | Recipe in 2026 | Homemade egg drop soup, Egg drop soup, Egg drop",79,2026-05-22 18:24:00
https://www.pinterest.com/pin/212795151138960866/,"Hot and Sour Soup Recipe | Recipe in 2026 | Hot and sour soup, Sour soup, Recipes",17,2026-05-22 18:24:00
https://www.pinterest.com/pin/212795151138948998/,Homemade Cheez-Its - Tornadough Alli | Recipe,19,2026-05-22 18:24:00
https://www.pinterest.com/pin/212795151138919124/,"Sheet Pan Gnocchi | Recipe in 2026 | Recipes, Sheet pan recipes, Breakfast recipes easy",20,2026-05-22 18:24:01
https://www.pinterest.com/pin/212795151138943127/,"Cinnamon Roll Bars | Recipe in 2026 | Cinnamon rolls, Yummy food, Baked dishes",16,2026-05-22 18:24:02
https://www.pinterest.com/pin/212795151138948867/,"Chocolate Bundt Cake Recipe | Recipe in 2026 | Chocolate chip bundt cake, Baking, Chocolate bundt cake",19,2026-05-22 18:24:02
https://www.pinterest.com/pin/212795151138948789/,"Chicken Parmesan Soup | Recipe in 2026 | Shredded chicken recipes, Chicken parmesan, Savory meats",34,2026-05-22 18:24:02
https://www.pinterest.com/pin/212795151138927921/,"Copycat KFC Bowls | Recipe | Chicken bowl recipe, Recipes, Kfc bowls recipe",22,2026-05-22 18:24:02
https://www.pinterest.com/pin/212795151138937458/,"Ground Beef Bulgogi | Recipe in 2026 | Bulgogi beef, Bulgogi, Ground beef",17,2026-05-22 18:24:02
https://www.pinterest.com/pin/212795151138940119/,"Strawberries and Cream Overnight Oats | Rezept in 2026 | Lecker, Lebensmittel essen, Frühstücksideen einfach",20,2026-05-22 18:24:02
https://www.pinterest.com/pin/212795151138902805/,"Chicken Alfredo Casserole | Recipe in 2026 | Chicken alfredo casserole, Easy casserole recipes, Delicious dinner recipes",27,2026-05-22 18:24:02
https://www.pinterest.com/pin/212795151138911553/,"Slow Cooker Shredded Beef Tacos | Recipe in 2026 | Crockpot shredded beef, Shredded beef tacos recipes, Slow cooker shredded beef",31,2026-05-22 18:24:02
https://www.pinterest.com/pin/212795151138883482/,"Eggnog Hot Chocolate | Recipe | Eggnog hot chocolate, Eggnog recipe, Delicious drink recipes",23,2026-05-22 18:24:04
https://www.pinterest.com/pin/212795151138882319/,"Sweet Holiday Chex Mix | Recipe | Chex mix recipes, Chex mix recipes sweet, Chex mix",19,2026-05-22 18:24:05
https://www.pinterest.com/pin/56787645305149556/,"Candied Pecan Recipe | Recipe | Pecan recipes, Candied pecans recipe, Candied pecans",17,2026-05-22 18:24:05
https://www.pinterest.com/pin/212795151138882262/,"Peanut Clusters | Recipe | Peanut clusters, Nut cluster recipe, Recipes",27,2026-05-22 18:24:05
https://www.pinterest.com/pin/212795151138878644/,"Chocolate Sugar Cookies | Recipe | Chocolate sugar cookies, Sugar cookies, Kid friendly meals",16,2026-05-22 18:24:05
https://www.pinterest.com/pin/212795151138876132/,"Fried Cheese (with Balsamic Honey) | Recipe | Breakfast recipes easy, Amazing food, Yummy appetizers",16,2026-05-22 18:24:05
https://www.pinterest.com/pin/56787645305144241/,"Marble Cookies | Recipe | Cinnamon roll cookies, Cookies, Banana cookies",14,2026-05-22 18:24:06
https://www.pinterest.com/pin/212795151138877112/,"Veggie Pizza Pinwheels | Recipe | Food, Cooking, Breakfast recipes easy",27,2026-05-22 18:24:06
