url,title,saves,timestamp
https://www.pinterest.com/pin/212795151135223684/,"Mac and Cheese | Recipe | Easy home made mac and cheese baked, Easy max and cheese recipe baked, Best home made mac and cheese baked",50,2026-06-06 16:17:16
https://www.pinterest.com/pin/212795151135223595/,"Arancini | Recipe | Golden fried arancini, Arancini recipe easy, Fried arancini with tomato sauce",8,2026-06-06 16:17:17
https://www.pinterest.com/pin/212795151135223346/,"Homemade Dumplings Recipe: Impress Anyone with Flat or Drop Dumplings | Old fashioned chicken and dumplings, Homemade chicken and dumplings, Stove top chicken and dumplings",12,2026-06-06 16:17:17
https://www.pinterest.com/pin/212795151135223329/,"Honey Walnut Baked Brie Recipe | Baked brie recipes, Brie puff pastry, Recipes cheesy",7,2026-06-06 16:17:17
https://www.pinterest.com/pin/turkey-moist-maker-sandwich-from-tornadough-alli--56787645297472396/,"Turkey Moist Maker Sandwich from Tornadough Alli | Sandwiches, Breakfast recipes, Wrap sandwiches",14,2026-06-06 16:17:19
https://www.pinterest.com/pin/212795151135219977/,"Melted Snowman Cookies | Recipe | Melted chocolate snowman cookies recipe, Melting snowman cookie recipe, Cookies recipes christmas",8,2026-06-06 16:17:19
https://www.pinterest.com/pin/rumchata-hot-chocolate--56787645297466384/,"RUMCHATA HOT CHOCOLATE | Food drinks, Hot drinks, Hot cocoa",83,2026-06-06 16:17:19
https://www.pinterest.com/pin/212795151135216382/,"Chicken Gnocchi Soup Copycat Olive Garden Soup | Recipe | Easy olive garden chicken gnocchi soup, Copycat chicken gnocchi soup recipe, Olive garden chicken gnocchi soup recipe",13,2026-06-06 16:17:21
https://www.pinterest.com/pin/212795151135212837/,"Olive Garden Chicken Gnocchi Soup | Recipe | Crockpot mashed potatoes, Chicken gnocchi soup recipe, Copycat olive garden chicken gnocchi",4,2026-06-06 16:17:21
https://www.pinterest.com/pin/212795151135212725/,"Christmas Mimosas | Quick drink recipes, Cranberry apple juice, Holiday party drinks",6,2026-06-06 16:17:24
https://www.pinterest.com/pin/56787645297465152/,"Sticky Toffee Pudding | Recipe | Toffee sauce, Sticky toffee pudding recipe",5,2026-06-06 16:17:24
https://www.pinterest.com/pin/easy-shepherds-pie--56787645297447091/,"Easy Shepherds Pie | Recipe | Quick shepards pie ground beef, How to make shepherd's pie with ground beef, Shepherd's pie recipe with ground beef and gravy",83,2026-06-06 16:17:26
https://www.pinterest.com/pin/212795151135195637/,"Creamy Potato Soup | Recipe | Creamy potato soup recipe, Homemade potato soup, Easy potato soup recipe",3,2026-06-06 16:17:26
https://www.pinterest.com/pin/212795151135195535/,"Turkey Moist Maker Sandwich- Ross' Favorite | Recipe | Turkey dressing sandwich recipes, Turkey sandwich recipes cold, Tasty recipes",6,2026-06-06 16:17:26
https://www.pinterest.com/pin/212795151135195514/,"Chewy Sugar Cookies | Recipe | Iced oatmeal cookies, Butter pecan cookies, Delicious cookie recipe",2,2026-06-06 16:17:26
https://www.pinterest.com/pin/212795151135192969/,"Easy Shepherd's Pie | Recipe | Quick shepards pie ground beef, How to make shepherd's pie with ground beef, Shepherd's pie recipe with ground beef and gravy",63,2026-06-06 16:17:27
https://www.pinterest.com/pin/212795151135189187/,"Bourbon Sweet Potato Cake Recipe | Sweet potato rum cake, Sweet potato cake southern, Sweet potato recipes with bourbon",5,2026-06-06 16:17:28
https://www.pinterest.com/pin/crescent-rolls-recipe-tornadough-alli--56787645297440716/,"Crescent Rolls Recipe - Tornadough Alli | Creamy cajun shrimp pasta, Buttery rolls, Stay at home chef",7,2026-06-06 16:17:28
https://www.pinterest.com/pin/easy-stuffing-recipe--212795151135185693/,"Easy Stuffing Recipe | Best easy dinner recipes, Homemade stuffing, Dinner side dish",5,2026-06-06 16:17:28
https://www.pinterest.com/pin/212795151135172956/,"Easy Shepherd’s Pie for Dinner | Recipe | Quick shepards pie ground beef, How to make shepherd's pie with ground beef, Shepherd's pie recipe with ground beef and gravy",6,2026-06-06 16:17:30
https://www.pinterest.com/pin/roasted-turkey-from-tornadough-alli--56787645297416293/,"Roasted Turkey from Tornadough Alli | Turkey recipes, Chicken turkey, Turkey leg",32,2026-06-06 16:17:30
https://www.pinterest.com/pin/56787645297415293/,"Delicious Monster Cookies with Oats, Peanut Butter, and Chocolate Chips | Recipe | Best monster cookie recipe, The best monster cookies, Chewy monster cookies",20,2026-06-06 16:17:31
https://www.pinterest.com/pin/212795151135167753/,"Slow Cooker Wassail Recipe | Winter wassail drink, Easy crockpot wassail, Wassail recipe slow cooker",1,2026-06-06 16:17:31
https://www.pinterest.com/pin/212795151135158138/,"Popovers | Recipe | Popovers recipes americas test kitchen, Mary makes it easy recipes popovers, Traditional passover popovers",10,2026-06-06 16:17:33
https://www.pinterest.com/pin/56787645297403658/,"Korean Spicy Pork Bowls | Spicy pork dish ideas, Korean pork bowl recipe, Spicy pork dinner",12,2026-06-06 16:17:33
https://www.pinterest.com/pin/56787645297398566/,"Smothered Potatoes | Recipe | Stay at home chef, Food content, Delicious potatoes",2,2026-06-06 16:17:35
https://www.pinterest.com/pin/329536897746212726/,"Easy Ground Beef Stir Fry Recipe | Ground meat stir-fry dish, Spicy ground meat stir-fry, Teriyaki ground beef stir fry",2,2026-06-06 16:17:35
https://www.pinterest.com/pin/212795151135148530/,"Creamy Crockpot Mashed Potatoes Recipe | Mashed potatoes recipe crock pot easy, Mashed potatoes in a crockpot, Crockpot mashed potatoes easy",4,2026-06-06 16:17:36
https://www.pinterest.com/pin/delicious-smothered-potatoes-recipe--212795151135142327/,"Delicious Smothered Potatoes Recipe | Smothered potatoes in oven, How to make smothered potatoes, Southern smothered potatoes",9,2026-06-06 16:17:36
https://www.pinterest.com/pin/slow-cooker-cranberry-meatballs--212795151135151156/,"Slow Cooker Cranberry Meatballs | Recipe | Jellied cranberry sauce, Potluck dishes, Side dishes appetizers",8,2026-06-06 16:17:37
https://www.pinterest.com/pin/212795151135148348/,"Buffalo Chicken Mac and Cheese Recipe | Buffalo chicken bacon mac and cheese, High protein buffalo chicken mac and cheese, Mac and cheese with buffalo chicken",5,2026-06-06 16:17:37
https://www.pinterest.com/pin/212795151135141965/,"TikTok Ramen | Recipe | Rice noodle ramen recipe, Ramen dinner recipes, Top ramen recipes",105,2026-06-06 16:17:37
https://www.pinterest.com/pin/french-onion-dip--212795151135137964/,"Classic French Onion Dip Recipe | Ranch french onion dip, French onion chip dip recipes, Easy dip recipes",6,2026-06-06 16:17:38
https://www.pinterest.com/pin/212795151135137501/,"Porcupine Meatball Recipe | Ground beef porcupine meatballs, Porcupine meatballs 12 tomatoes, Porcupine meatballs recipe",6,2026-06-06 16:17:39
https://www.pinterest.com/pin/212795151135137317/,"Cheeseburger Pie Recipe | Southern cheeseburger pie, Cheeseburger pie hot dish, Cheeseburger pie with crust",4,2026-06-06 16:17:40
https://www.pinterest.com/pin/212795151135134472/,"Fall Off The Bone Ribs Recipe | Back rib recipes, Bone in rib recipe, Ribs oven",16998,2026-06-06 16:17:42
https://www.pinterest.com/pin/212795151135134406/,"Apple Fritter Bread | Recipe | Scrumptious desserts, Apple fritter bread recipe, Apple pie",9,2026-06-06 16:17:42
https://www.pinterest.com/pin/212795151135132782/,"Braided Apple Puff Pastry Recipe | Quick and Easy Dessert | Easy apple pastry tutorial, Apple caramel puff pastry braid, Apple butter puff pastry braid",6,2026-06-06 16:17:43
https://www.pinterest.com/pin/56787645297377036/,"Pumpkin Cheesecake Pie | Pumpkin pie cheesecake, Pumpkin cheesecake, Pumpkin pie recipes",5,2026-06-06 16:17:43
https://www.pinterest.com/pin/56787645297372918/,"Cinnamon Crescent Rolls | Recipe | Cinnamon cresent rolls, Super easy breakfast, Crescent roll recipes dessert",42,2026-06-06 16:17:44
https://www.pinterest.com/pin/540361655306039881/,"Pumpkin Patch Cookies | Recipe | Chocolate covered cookies, Halloween food desserts, Halloween food treats",5,2026-06-06 16:17:44
https://www.pinterest.com/pin/360147301464852473/,"Spooky Halloween Dirt Cake Recipe | Halloween dirt cake recipe easy, Spooky dirt cake, Oreo dirt cake halloween",1,2026-06-06 16:17:44
https://www.pinterest.com/pin/212795151135128095/,"Slow Cooker Pizza Recipe | Buffalo chicken sandwiches, Slow cooker meatballs, Homemade pizza dough",3,2026-06-06 16:17:46
https://www.pinterest.com/pin/45036065015285654/,"Delicious Struffoli with Honey and Sprinkles | Recipe | Best struffoli recipe, Baked struffoli recipe, Struffoli recipe traditional",26,2026-06-06 16:17:46
https://www.pinterest.com/pin/212795151135123259/,"Cream Horns: Crunchy, Sweet, and Creamy | Recipe | Chocolate cream horns, Cream horn dessert, Cream horn recipe",60,2026-06-06 16:17:47
https://www.pinterest.com/pin/slow-cooker-pizza--212795151135123249/,"Slow Cooker Pizza Recipe | Homemade pizza, Pizza dough, Pizza pizzazz",51,2026-06-06 16:17:47
https://www.pinterest.com/pin/56787645297364042/,"Butterbeer Recipe | Butterscotch beer recipe, Easy butterbeer, Butterbeer recipe with beer",42,2026-06-06 16:17:47
https://www.pinterest.com/pin/212795151135123027/,"30 Minute Ground Beef Stroganoff Recipe | Beef stroganoff with ground turkey, Ground beef stroganoff recipe healthy, Ground beef stroganoff recipe no mushrooms",7,2026-06-06 16:17:48
https://www.pinterest.com/pin/wendys-chili-recipe--212795151135122558/,"Wendy's Chili Recipe | Wendys chilli recipes, Wendy's chilli, Wendys chili recipe",102,2026-06-06 16:17:48
https://www.pinterest.com/pin/212795151135120112/,"Slow Cooker Shredded Beef Tacos - Tornadough Alli | Recipe | Shredded beef taco recipes, Shredded beef taco tuesday, Shredded beef taco crockpot",11,2026-06-06 16:17:49
https://www.pinterest.com/pin/212795151135110737/,"Creepy and Cute Halloween Dirt Cake | Recipe | Pumpkin patch dirt cake, Halloween dirt cake recipe easy, Halloween dessert cake",7,2026-06-06 16:17:51
https://www.pinterest.com/pin/56787645297346876/,"Twice Baked Sweet Potatoes Recipe | Vegan twice baked sweet potatoes, Twice baked sweet potatoes with caramelized onions, Baked sweet potatoes with rosemary",30,2026-06-06 16:17:51
https://www.pinterest.com/pin/56787645297351545/,"Apple Fritter Bread Recipe | Scrumptious desserts, Apple pie",4,2026-06-06 16:17:51
https://www.pinterest.com/pin/212795151135108389/,"Apple Cider Mimosas Recipe | Apple cider mimosa recipe, Flavored liquor, Fall drink",17,2026-06-06 16:17:52
https://www.pinterest.com/pin/212795151135108081/,"Cinnamon Crescent Rolls: Tornadough Alli | Recipe | Cinnamon cresent rolls, Super easy breakfast, Crescent roll recipes dessert",12,2026-06-06 16:17:52
https://www.pinterest.com/pin/mini-halloween-cheesecakes--212795151135108099/,"Mini Halloween Cheesecakes Recipe | Halloween desserts, Halloween food treats, Like cheesecake",99,2026-06-06 16:17:52
https://www.pinterest.com/pin/212795151135107905/,"Steak Fingers | Recipe | Finger steak batter recipe, Homemade steak fingers, Hand breaded steak fingers",355,2026-06-06 16:17:52
https://www.pinterest.com/pin/212795151135108014/,"Mini Halloween Cheesecakes | Recipe | Cocoa powder cookies, Chocolate whipped cream, Cheesecake flavor",17,2026-06-06 16:17:52
https://www.pinterest.com/pin/212795151135101638/,"Make Your Own Taco Bell Nacho Fries at Home | Recipe | How to make taco bell fries, Taco bell fries ingredients, Taco bell fries recipe",77,2026-06-06 16:17:54
https://www.pinterest.com/pin/easy-beef-stir-fry--212795151135101450/,"Easy Beef Stir Fry | Beef recipes, Ground beef, Beef dish",195,2026-06-06 16:17:55
https://www.pinterest.com/pin/212795151135092129/,"Crescent Roll Apple Dumplings | Recipe | Apple recipe with crescent rolls, Grandmas apple dumplings, Apple and dumplings",6,2026-06-06 16:17:58
https://www.pinterest.com/pin/212795151135092109/,"Sweet Potato Pie Recipe | Easy sweet potato pie recipe simple, Recipe for sweet potato pie without crust, Easy homemade sweet potato pie",5,2026-06-06 16:17:58
https://www.pinterest.com/pin/45036065015254962/,"No Bake Mint Chocolate Cheesecake Recipe | Mint cheesecake topping, Homemade mint cheesecake recipe, Mint chocolate cheesecake no bake",4,2026-06-06 16:17:58
https://www.pinterest.com/pin/45036065015254589/,"Chocolate Chip Pumpkin Pudding Pie Recipe | Pumpkin pie with pudding recipe, Thanksgiving pudding desserts, Chocolate chip pumpkin pie",5,2026-06-06 16:17:59
https://www.pinterest.com/pin/212795151135091979/,"Chocolate Chip Pumpkin Blondies | Recipe | Pumpkin bread pudding, Chocolate chip blondies, Caramel bits",13,2026-06-06 16:17:59
https://www.pinterest.com/pin/slow-cooker-sausage-stuffing--212795151135091718/,"Slow Cooker Sausage Stuffing Recipe | Crockpot sausage stuffing thanksgiving, Crock pot sausage stuffing thanksgiving",2231,2026-06-06 16:17:59
https://www.pinterest.com/pin/crockpot-easy-apple-crumble--56787645297327925/,"Crockpot Easy Apple Crumble | Recipe | Crock pot desserts, Slow cooker desserts, Apple crumble crockpot",7,2026-06-06 16:17:59
https://www.pinterest.com/pin/45036065015254440/,"Pumpkin Truffles - Tornadough Alli | Recipe | Expensive chocolate, Pumpkin spice treats, Truffles recipe",7,2026-06-06 16:18:00
https://www.pinterest.com/pin/pumpkin-patch-cookies--212795151135087367/,"Pumpkin Patch Cookies Recipe | Dog cookies recipe easy pumpkin, How to make pumpkin cookie dough, Pumpkin dog treats no peanut butter",131,2026-06-06 16:18:00
https://www.pinterest.com/pin/212795151135091245/,"German Chocolate Cake Recipe | German chocolate cake with coconut filling, German chocolate cake with cocoa powder, Kenneth temple german chocolate cake",64,2026-06-06 16:18:00
https://www.pinterest.com/pin/47710077295906804/,"Crockpot French Dips | Recipe | Beer french dip slow cooker, Crock pot french dip slow cooker, Easy slow cooker french dip",8,2026-06-06 16:18:00
https://www.pinterest.com/pin/45036065015245872/,"Best Apple Crisp Recipe with Crispy Oatmeal Topping | How to make apple crisp in the oven, How to make apple crisp easy, How to make apple crisp with pecans",7,2026-06-06 16:18:00
https://www.pinterest.com/pin/212795151135077502/,"Pumpkin Patch Cookies: A Fun Fall Dessert Idea | Recipe | Chocolate covered cookies, Halloween food desserts, Halloween food treats",2,2026-06-06 16:18:06
https://www.pinterest.com/pin/maple-dijon-pork-tenderloin-recipe--56787645297312318/,"Maple Dijon Pork Tenderloin Recipe | Pork tenderloin recipes with maple syrup, Maple dijon pork loin recipe, Maple dijon pork tenderloin oven",8,2026-06-06 16:18:06
https://www.pinterest.com/pin/212795151135077494/,"Arancini Recipe | Golden fried arancini, Arancini recipe easy, Fried arancini with tomato sauce",35,2026-06-06 16:18:06
https://www.pinterest.com/pin/212795151135075609/,"Monster Cookies Recipe: Scrumptious Desserts and Sweets | Easy monster cookie baking, How to decorate monster cookies, Pumpkin monster cookies recipe",95,2026-06-06 16:18:06
https://www.pinterest.com/pin/the-best-lasagna-tornadough-alli--56787645297310378/,"The Best Homemade Lasagna | Recipe | Italian lasagna slice on plate, Layered lasagna with meat sauce, Lasagna slice with fresh herbs",8,2026-06-06 16:18:06
https://www.pinterest.com/pin/56787645297306642/,"Cream Horns Recipe | Delicious Pastry Dessert | Pastries recipes dessert, Tasty pastry, Puff pastry cream puffs",11,2026-06-06 16:18:07
https://www.pinterest.com/pin/212795151135075208/,"Delicious Buffalo Chicken Pinwheels | Recipe | Buffalo chicken rolls, Super easy appetizers, Buffalo chicken sliders",24,2026-06-06 16:18:08
https://www.pinterest.com/pin/212795151135070742/,"The Best Lasagna | Recipe | Italian sausage lasagna, Homemade meat sauce, Best lasagna recipe",7,2026-06-06 16:18:08
https://www.pinterest.com/pin/56787645297305928/,"Kringla Recipe: What Is Kringla? | Easy kringla recipe, How to make kringla, Kringla dessert",5,2026-06-06 16:18:08
https://www.pinterest.com/pin/homemade-star-crunch--56787645297302530/,"Homemade Star Crunch: Blogger Recipes We Love | Star crunch copycat recipe, Crunchie fudge recipe, No bake desserts",44,2026-06-06 16:18:10
https://www.pinterest.com/pin/breakfast-sausage--212795151135067160/,"Hearty Breakfast Sausage | Sausage recipes, Sausage homemade, Breakfast sandwiches",101,2026-06-06 16:18:10
https://www.pinterest.com/pin/cinnamon-sugar-mini-donuts-breakfast--212795151135065704/,"Cinnamon Sugar Mini Donuts: Breakfast! | Recipe | Berry pancakes, Chocolate glazed donuts, Pancake bites",10,2026-06-06 16:18:11
https://www.pinterest.com/pin/56787645297301797/,"Chicken Gyros with Homemade Tzatziki Sauce Recipe | Homemade chicken gyro recipe, Greek gyros",8,2026-06-06 16:18:11
https://www.pinterest.com/pin/peanut-butter-halloween-brownies--212795151135063305/,"Peanut Butter Halloween Brownies | Fudge brownie mix, Cookies brownies",135,2026-06-06 16:18:11
https://www.pinterest.com/pin/45036065015224675/,"Braided Apple Puff Pastry: Delicious Desserts | Easy apple puff pastry recipes, Apple strudel recipe puff pastry, Apple recipes with puff pastry",11,2026-06-06 16:18:12
https://www.pinterest.com/pin/45036065015221902/,"Cream Puffs Recipe: Tornadough Alli | Lithuanian curd cheese doughnuts, Traditional lithuanian dessert - skruzdelynas, Serbian pastries",1,2026-06-06 16:18:12
https://www.pinterest.com/pin/56787645297300286/,"Christmas Tree Cookies | Recipe | Christmas food, Christmas desserts, Christmas cookies",5,2026-06-06 16:18:12
https://www.pinterest.com/pin/peppermint-hot-chocolate-recipe-for-winter-nights--56787645297294347/,"Peppermint Hot Chocolate Recipe for Winter Nights | How to make peppermint hot chocolate, Perfect holiday beverage, Christmas hot cocoa",16,2026-06-06 16:18:12
https://www.pinterest.com/pin/56787645297293192/,"Copycat Prantl's Burnt Almond Torte: BHG's Best Recipes | Almond torte cake recipe, Burnt almond torte recipe, Almond desserts",2,2026-06-06 16:18:13
https://www.pinterest.com/pin/56787645297292984/,"Christmas Mimosas Recipe with Cranberry Spritz | Christmas brunch drinks, Christmas mimosas ideas, Christmas cocktails",3,2026-06-06 16:18:15
https://www.pinterest.com/pin/212795151135058436/,"Breakfast Sausage Recipe | Homemade breakfast sausage recipe, Breakfast crunchwrap, Leftover breakfast",2,2026-06-06 16:18:15
https://www.pinterest.com/pin/melted-snowman-cookies-tornadough-alli--212795151135055988/,"Melted Snowman Cookies: Perfect for the Holidays! | Recipe | How to make melted snowman cookies, Melted snowman cookies recipe, Melting snowman cookie recipe",7,2026-06-06 16:18:15
https://www.pinterest.com/pin/copycat-starbucks-medicine-ball-tea-blogger-recipes-we-love--56787645297292658/,"Copycat Starbucks Medicine Ball Tea: Blogger Recipes We Love | Medicine ball drink recipe, Starbucks copycat honey citrus mint tea, Starbucks medicine ball recipe",7,2026-06-06 16:18:15
https://www.pinterest.com/pin/212795151135046673/,"Cranberry Orange Bundt Cake Recipe | Cranberry orange cake easy, Cranberry cake with orange juice, Cranberry orange bundt cake with pineapple",7,2026-06-06 16:18:18
https://www.pinterest.com/pin/56787645297278095/,"Gingerbread Edible Cookie Dough Recipe | Gluten free christmas cookies, Edible sugar cookie dough recipe",2,2026-06-06 16:18:18
https://www.pinterest.com/pin/56787645297277994/,"Slow Cooker Sausage Stuffing: BHG's Best Recipes | Slow cooker sausage stuffing recipe, Bacon wrapped sausages, Crockpot sausage stuffing",2,2026-06-06 16:18:19
https://www.pinterest.com/pin/212795151135045666/,"Burnt Almond Torte | Recipe | Almond torte cake recipe, Burnt almond torte recipe, Almond desserts",292,2026-06-06 16:18:19
https://www.pinterest.com/pin/slow-cooker-shredded-beef-tacos-bhgs-best-recipes--56787645297270910/,"Slow Cooker Shredded Beef Tacos: BHG's Best Recipes | Shredded beef taco recipes, Shredded beef taco tuesday, Shredded beef taco crockpot",4,2026-06-06 16:18:19
https://www.pinterest.com/pin/56787645297274874/,"Melted Snowman Cookies | Recipe | How to make melted snowman cookies, Melted snowman cookies recipe, Melting snowman cookie recipe",5,2026-06-06 16:18:20
https://www.pinterest.com/pin/45036065015200738/,"Cinnamon Sugar Mini Donuts Recipe | Berry pancakes, Chocolate glazed donuts, Pancake bites",3,2026-06-06 16:18:22
https://www.pinterest.com/pin/maple-dijon-pork-tenderloin--212795151135039560/,"Maple Dijon Pork Tenderloin Recipe | Pork tenderloin recipes, Pork dishes",81,2026-06-06 16:18:22
https://www.pinterest.com/pin/212795151135037400/,"Beer Can Chicken: Easy Dinners | Recipe | Beer can chicken sides dishes, Beer can chicken recipe with beer, Best beer can chicken",32,2026-06-06 16:18:22
https://www.pinterest.com/pin/212795151135039530/,"Slow Cooker Sausage Stuffing | Recipe | Slow cooker sausage stuffing recipe, Bacon wrapped sausages, Crockpot sausage stuffing",138,2026-06-06 16:18:23
https://www.pinterest.com/pin/45036065015198774/,"Chocolate Chip Cake: Best Food Blogger Recipes | Homemade ganache, Chocolate chip cake recipe, Marble cake recipes",11,2026-06-06 16:18:23
https://www.pinterest.com/pin/212795151135032831/,"Baked Italian Subs | Flavorful Meats and Cheeses on a Toasted Hoagie Roll | Recipe | Hot hoagie sandwich recipes, Toasted subs sandwiches, Homemade italian subs",217,2026-06-06 16:18:23
https://www.pinterest.com/pin/apple-cider-sangria--56787645297252426/,"Apple Cider Sangria | Recipe | Fall fun food, Sangria fall, Pinot noir sangria",4,2026-06-06 16:18:26
https://www.pinterest.com/pin/pumpkin-chocolate-chip-cupcakes--212795151135022021/,"Pumpkin Chocolate Chip Cupcakes Recipe | Pumpkin puree, Cupcake recipes",127,2026-06-06 16:18:26
https://www.pinterest.com/pin/apple-cider-mimosas--212795151135022006/,"Apple Cider Mimosas | Recipe | How to make a caramel apple mimosa, Fall apple cider mimosa, How to make caramel apple cider mimosas",1,2026-06-06 16:18:26
https://www.pinterest.com/pin/candy-corn-hot-chocolate--212795151135018375/,"Candy Corn Hot Chocolate | Autumn candy drink, Halloween party drink ideas, Hot chocolate recipes",200,2026-06-06 16:18:27
https://www.pinterest.com/pin/45036065015180023/,"Delicious Pumpkin Bread with Maple Glaze | Recipe | Pumpkin bread pudding, Good pie, Pumpkin bread recipe",7,2026-06-06 16:18:27
https://www.pinterest.com/pin/212795151135017912/,"Apple Bread Recipe - Cinnamon Sugar Heaven | Sour dough apple fritter bread, Apple fritter focaccia, Apple fritter loaf cake",102,2026-06-06 16:18:27
https://www.pinterest.com/pin/212795151135017906/,"No Bake Cheesecake Bites: Easy and Delicious Desserts | Recipe | Cheesecake bites recipes no bake, Easy cheesecake bites no bake, No bake cheesecake bites with cream cheese",1255,2026-06-06 16:18:28
https://www.pinterest.com/pin/212795151135017908/,"Delicious No Bake Cookies | Recipe | Large no bake cookies, No bake cookies no peanut butter, No bake cookies chocolate",42781,2026-06-06 16:18:28
https://www.pinterest.com/pin/212795151135008297/,"Irresistible Chocolate Chip Pumpkin Blondies | Recipe | Pumpkin chocolate chip brownies, Pumpkin chocolate chip blondies, Easy pumpkin chocolate chip bars",32,2026-06-06 16:18:28
https://www.pinterest.com/pin/quick-and-easy-instant-pot-spaghetti-recipe--212795151135008252/,"Quick and Easy Instant Pot Spaghetti Recipe | Cheesy pasta recipes, Creamy cajun shrimp pasta, Ground italian sausage",12,2026-06-06 16:18:29
https://www.pinterest.com/pin/212795151135008240/,"Slow Cooker Pork Chops: Tornadough Alli | Recipe | Best slow cooker pork chop recipes, Easy slow cooker pork chops, How to cook pork chops in crock pot",110,2026-06-06 16:18:29
https://www.pinterest.com/pin/56787645297237934/,"Buffalo Chicken Pinwheels | Recipe | Buffalo chicken roll ups recipe, Dinner recipes, Easy dinner",85,2026-06-06 16:18:31
https://www.pinterest.com/pin/212795151135008234/,"Best Chocolate Chip Pumpkin Cupcakes for Fall | Recipe | Chocolate chip pumpkin cupcakes recipe, Chocolate chip pumpkin cupcakes with cream cheese frosting",29,2026-06-06 16:18:31
https://www.pinterest.com/pin/56787645297237927/,"Cozy up with a comforting Hot Toddy Recipe | Sore throat cocktail, Classic hot toddy drink, Hot toddy for sore throat",27,2026-06-06 16:18:31
https://www.pinterest.com/pin/56787645297236940/,"Sopa de pastel de pollo | Sopa de pollo | Recipe | Chicken pot pie soup with potatoes, Best chicken pot pie soup, Chicken pot pie soup with biscuits",164,2026-06-06 16:18:31
https://www.pinterest.com/pin/212795151134999613/,"Bite-Sized Pumpkin Truffles | Recipe | Pumpkin cookie dough truffles, Pumpkin cream cheese truffles, Biscoff pumpkin truffles",31,2026-06-06 16:18:33
https://www.pinterest.com/pin/56787645297228034/,"Pumpkin Banana Bread Recipe: BHG's Best Recipes | Moist pumpkin banana cake bread, Pumpkin and banana bread, No bake pumpkin desserts",6,2026-06-06 16:18:33
https://www.pinterest.com/pin/apple-hand-pies--45036065015162465/,"Apple Hand Pies | Recipe | Apple hand pies, Apple recipes, Hand pies",27,2026-06-06 16:18:34
https://www.pinterest.com/pin/212795151134997172/,"Ground Beef Stroganoff Recipe | How to make beef stroganoff on the stove, Steak and mushroom stroganoff, Easy beef stroganoff recipe from scratch",30,2026-06-06 16:18:35
https://www.pinterest.com/pin/212795151134996629/,"Decadent Brownie Ice Cream Sandwiches | Recipe | Vanilla ice cream brownie bars, Stack of brownies with ice cream, Brownie icecream cake",16,2026-06-06 16:18:35
https://www.pinterest.com/pin/apple-cinnamon-cake--212795151134997479/,"Apple Cinnamon Cake Recipe | Apple desserts, Apple recipes easy",130,2026-06-06 16:18:35
https://www.pinterest.com/pin/56787645297218695/,"TikTok Grinder Sandwich Recipe: Blogger Recipes We Love | Tik tok grinder sandwich recipe, How to make the viral tiktok grinder sandwich, Best sandwich recipes",17,2026-06-06 16:18:38
