url,title,saves,timestamp
https://www.pinterest.com/pin/212795151133995061/,"Eggnog Hot Chocolate | Recipe | Hot eggnog drinks, Christmas hot drinks, Hot chocolate recipes",100,2026-07-12 13:41:55
https://www.pinterest.com/pin/212795151133989959/,"Easy Croissant Breakfast Sandwiches - The Perfect Breakfast! | Recipe | Easy breakfast croissant, Make ahead breakfast sandwiches croissant, Crossaint breakfast sandwiches",7,2026-07-12 13:41:55
https://www.pinterest.com/pin/56787645296094822/,"Olive Garden Copycat Chicken Gnocchi Soup: The BEST EASY Dinner Recipe! | Easy olive garden chicken gnocchi soup, Copycat chicken gnocchi soup recipe, Olive garden chicken gnocchi soup recipe",14,2026-07-12 13:41:59
https://www.pinterest.com/pin/chewy-sugar-cookies--212795151133988228/,"Chewy Sugar Cookies | Sweet cookies, Yummy cookies, Cookie treats",246,2026-07-12 13:41:59
https://www.pinterest.com/pin/tornadough-alli--212795151133986395/,"Frozen Mudslide Recipe - Tornadough Alli | Baileys mudslide recipe, How to make a mudslide drink, Frozen alcohol drinks",5,2026-07-12 13:42:01
https://www.pinterest.com/pin/sweet-potato-casserole--212795151133985451/,"Sweet Potato Casserole Recipe | Mashed sweet potatoes brown sugar, Sweet potato recipes, Roasted sweet potatoes",276,2026-07-12 13:42:02
https://www.pinterest.com/pin/212795151133985332/,"Frozen Mudslide: Tornadough Alli | Recipe | Mud slides drink recipe, Mudslides with baileys, Frozen drinks",4,2026-07-12 13:42:03
https://www.pinterest.com/pin/212795151133978867/,"Copycat Honey Pepper Chicken Mac N' Cheese | Recipe | Applebee's honey pepper chicken mac and cheese recipe, Copycat applebee's honey pepper chicken mac and cheese, Best easy dinner recipes",13,2026-07-12 13:42:03
https://www.pinterest.com/pin/spaghetti-aglio-e-olio-dinner-recipes--212795151133982134/,"Spaghetti Aglio e Olio: Dinner Recipes | Easy aglio olio recipe, Spaghetti aglio e olio for two, Simple aglio olio recipe",34,2026-07-12 13:42:05
https://www.pinterest.com/pin/copycat-ikea-swedish-meatballs--212795151133982097/,"Copycat IKEA Swedish Meatballs Recipe | Beef dishes, Meat dishes, Meatloaf",168,2026-07-12 13:42:05
https://www.pinterest.com/pin/sweet-spicy-boneless-chicken-wings--39195459248433800/,Sweet & Spicy Boneless Chicken Wings Recipe | Fried chicken wings recipes,216,2026-07-12 13:42:07
https://www.pinterest.com/pin/212795151133976979/,"Brown Sugar Bacon Little Smokies: Recipes We Love | Little smokies with bacon brown sugar, Party appetizers, Delicious appetizers",11,2026-07-12 13:42:09
https://www.pinterest.com/pin/212795151133972764/,"Honey Roasted Carrots | Recipe | Easy carrot recipes side dishes, Simple carrot side dish, Easy honeyed carrots recipe",78,2026-07-12 13:42:13
https://www.pinterest.com/pin/56787645296075298/,"Oatmeal Sour Cream Coffee Cake Recipe | Danish coffee cake recipe with sour cream, Cake mix sour cream coffee cake, Coffee cake with yogurt",10,2026-07-12 13:42:15
https://www.pinterest.com/pin/creamy-potato-soup--212795151133971682/,"Creamy Potato Soup with Bacon and Cheese | Cozy soups, Soup recipes, Like soup",246,2026-07-12 13:42:15
https://www.pinterest.com/pin/slow-cooker-green-bean-casserole-tornadough-alli--56787645296071929/,"Slow Cooker Green Bean Casserole Recipe | Thanksgiving crockpot vegetable sides, Thanksgiving green beans crockpot, Green bean casserole crock pot",32,2026-07-12 13:42:17
https://www.pinterest.com/pin/55591376641813286/,"Twice Baked Sweet Potatoes Recipe | Vegan twice baked sweet potatoes, Twice baked sweet potatoes with caramelized onions, Baked sweet potatoes with rosemary",9,2026-07-12 13:42:20
https://www.pinterest.com/pin/212795151133962262/,"Chicken | Recipe | Homemade chicken tenders with ranch, Best homemade chicken tenders, Homemade chicken tenders fried",1015,2026-07-12 13:42:20
https://www.pinterest.com/pin/how-to-make-pumpkin-pie-spice--212795151133961638/,"Homemade Pumpkin Pie Spice Recipe | Make pumpkin pie spice, Pumpkin recipe, How to make pumpkin",211,2026-07-12 13:42:21
https://www.pinterest.com/pin/56787645296039405/,"Smothered Pork Chops: Blogger Recipes We Love | Easy smothered pork chops, Smothered mediterranean pork chops, One skillet creamy mustard pork chops",2,2026-07-12 13:42:28
https://www.pinterest.com/pin/56787645296038907/,"Korean Spicy Pork Bowls | Recipe | Spicy korean meat dish, Traditional korean spicy dish, Pork bulgogi bowl",2,2026-07-12 13:42:28
https://www.pinterest.com/pin/212795151133937788/,"Baked French Fries Recipe - Easy and Delicious | French fry recipe baked, Baked potato wedges oven, Cheesy potatoes crock pot",2,2026-07-12 13:42:29
https://www.pinterest.com/pin/56787645296037727/,"Tater Tot Breakfast Casserole: Recipes We Love | Popular breakfast recipes, Tater tot breakfast casserole recipes, Tator tot casserole",4,2026-07-12 13:42:29
https://www.pinterest.com/pin/halloween-cookie-bars-tornadough-alli--56787645296037194/,"Halloween Cookie Bars: A Recipe We LOVE For Halloween | Halloween bars and cookies, Halloween bars dessert, Halloween bars recipes",14,2026-07-12 13:42:30
https://www.pinterest.com/pin/56787645296036868/,"Easy Croissant Breakfast Sandwiches - Tornadough Alli | Recipe | Easy breakfast croissant, Make ahead breakfast sandwiches croissant, Crossaint breakfast sandwiches",193,2026-07-12 13:42:30
https://www.pinterest.com/pin/212795151133936026/,"Instant Pot Street Tacos | Recipe | How to prepare steak, Stay at home chef, Ground beef dishes",2,2026-07-12 13:42:30
https://www.pinterest.com/pin/slow-cooker-green-bean-casserole-tornadough-alli--212795151133936021/,"Slow Cooker Green Bean Casserole: A Holiday Must-Try! | Recipe | Thanksgiving crockpot vegetable sides, Thanksgiving green beans crockpot, Green bean casserole crock pot",25,2026-07-12 13:42:32
https://www.pinterest.com/pin/212795151133932241/,"Homemade Pumpkin Pie Spice Recipe | Pumpkin pie spice alternative, Pumpkin pie spice ingredients list, Make your own pumpkin pie spice",49,2026-07-12 13:42:34
https://www.pinterest.com/pin/56787645296031807/,"Easy Pecan Sticky Buns: Fall Dessert Recipe | Recipe for pecan sticky buns, Pecan buns recipe easy, Overnight pecan sticky buns",6,2026-07-12 13:42:34
https://www.pinterest.com/pin/212795151133930088/,"Homemade Chicken Pot Pie | Comfort Food Recipe | Eating on a dime chicken pot pie, Plate of chicken pot pie and mashed potatoes, Baked pot pie on plate",4,2026-07-12 13:42:35
https://www.pinterest.com/pin/easy-no-bake-cookies-recipe-tornadough-alli--212795151133929417/,"Easy No Bake Cookies Recipe: Tornadough Alli | No bake cookies without cocoa powder, No bake cookies no cocoa powder, Quick no-bake chocolate snack",10,2026-07-12 13:42:37
https://www.pinterest.com/pin/easy-cheesy-and-a-family-favorite-these-crockpot-cheesy-potatoes-are-a-nofail-recipe-that-is-perfect-for-dinnertime-potlucks-or-when-youre-in-a-hurry-and-wa--212795151133929405/,"Crockpot Cheesy Potatoes | Recipe | Potluck recipes crockpot, Cheesy potatoes recipe, Cheesy potato casserole",4,2026-07-12 13:42:37
https://www.pinterest.com/pin/212795151133929410/,"Easy Ground Beef Enchiladas | Recipe | Make ahead ground beef enchiladas, 5 ingredient enchiladas ground beef, Ground beef & bean enchiladas",3,2026-07-12 13:42:37
https://www.pinterest.com/pin/bhgs-best-recipes--56787645296021250/,"Cozy up with a comforting Hot Toddy Recipe | Sore throat cocktail, Hot toddy for sore throat, Homemade hot toddy ingredients",97,2026-07-12 13:42:39
https://www.pinterest.com/pin/212795151133922765/,"Delicious Oven Fried Chicken Recipe | Oven fried chicken leg recipes, Oven fried chicken legs easy, Chicken dishes recipes",555,2026-07-12 13:42:40
https://www.pinterest.com/pin/slow-cooker-meatloaf--212795151133922198/,"Slow Cooker Meatloaf Recipe | Slow cooker meatloaf easy, Crockpot meatloaf, Meat loaf",226,2026-07-12 13:42:41
https://www.pinterest.com/pin/stuffed-pepper-casserole-tornadough-alli--212795151133922133/,"Stuffed Pepper Casserole: Dinner Recipes | Family favorite casseroles, Easy casserole recipes",180,2026-07-12 13:42:42
https://www.pinterest.com/pin/tater-tot-breakfast-casserole-a-hearty-and-addicting-breakfast-dish--212795151133922129/,"Tater Tot Breakfast Casserole | Recipe | Popular breakfast recipes, Tater tot breakfast casserole recipes, Tator tot casserole",6,2026-07-12 13:42:42
https://www.pinterest.com/pin/monster-cookies--212795151133918498/,"Monster Cookies Recipe for Baking Enthusiasts | Sugar cookies, Cookie craft, Best cookie",104,2026-07-12 13:42:46
https://www.pinterest.com/pin/chicken-fried-chicken-tornadough-alli--56787645296012729/,"Chicken Fried Chicken | Recipe | Country gravy recipe, Creamy cajun shrimp pasta, Large family meals",11,2026-07-12 13:42:47
https://www.pinterest.com/pin/56787645296012220/,"Spaghetti Casserole Recipe | Easy and Delicious | Classic spaghetti casserole, Spaghetti casserole with leftover spaghetti, Spaghetti sauce casserole",13,2026-07-12 13:42:48
https://www.pinterest.com/pin/212795151133915553/,"Pumpkin Bread Pudding: Tornadough Alli | Recipe | Sweet dips, Pumpkin bread pudding recipe, Delicious pumpkin",8,2026-07-12 13:42:49
https://www.pinterest.com/pin/halloween-cookie-bars--212795151133915891/,"Halloween Cookie Bars Recipe | Halloween desserts, Halloween treats, Cookies candy",22,2026-07-12 13:42:49
https://www.pinterest.com/pin/212795151133915242/,"Homemade Spaghetti Sauce with Ground Beef and Sausage | Recipe | Amazing spaghetti sauce, My favorite spaghetti sauce recipe, Best homemade spaghetti",7,2026-07-12 13:42:51
https://www.pinterest.com/pin/235383518015794837/,"7 Layer Dip Recipe | 7 layer dip with cream cheese, Best 7 layer dip recipe, 7 layer chip dip",13,2026-07-12 13:42:52
https://www.pinterest.com/pin/56787645296008011/,"Fireball Hard Cider - An Easy, Fall Drink | Recipe | Summer fireball cider drink, Fireball and apple cider, Fireball whiskey",5,2026-07-12 13:42:52
https://www.pinterest.com/pin/212795151133912537/,"Pecan Pie Cheesecake: Tornadough Alli | Recipe | Pumpkin cheesecake with pecan pie topping, Homemade pumpkin cheesecake with pecans, Easy pecan pie cheesecake",39,2026-07-12 13:42:52
https://www.pinterest.com/pin/212795151133913667/,"Slow Cooker Pumpkin Hot Chocolate - Tornadough Alli | Recipe | White hot chocolate, Fall recipes, Chocolate can",10,2026-07-12 13:42:55
https://www.pinterest.com/pin/copycat-cracker-barrel-meatloaf-recipe-beef-main-dishes--212795151133912962/,"Copycat Cracker Barrel Meatloaf Recipe: Beef Main Dishes | Cracker barrel meatloaf sauce, Cracker barrel meatloaf recipe with ground beef, Cracker barrel meatloaf recipe copycat",1,2026-07-12 13:42:55
https://www.pinterest.com/pin/baked-country-style-ribs--212795151133913657/,"Baked Country Style Ribs: Tornadough Alli | Recipe | Ribs in oven, Boneless ribs, Delicious bbq",2,2026-07-12 13:42:55
https://www.pinterest.com/pin/quick-and-easy-little-smokies-appetizer--212795151133910173/,"Quick and Easy Little Smokies Appetizer | Bbq mini weenies, Stovetop lil smokies, Party food appetizers",3,2026-07-12 13:42:56
https://www.pinterest.com/pin/212795151133899425/,"Olive Garden Chicken Gnocchi Soup | Recipe | Easy olive garden chicken gnocchi soup, Copycat chicken gnocchi soup recipe, Olive garden chicken gnocchi soup recipe",8,2026-07-12 13:42:59
https://www.pinterest.com/pin/56787645295992881/,"Delicious Stuffed Pepper Casserole | Recipe | Stuffed pepper casserole easy, Stuffed pepper hot dish, Casserole recipes",3,2026-07-12 13:43:00
https://www.pinterest.com/pin/mexican-rice-casserole-tornadough-alli--212795151133895620/,"Mexican Rice Casserole | Recipe | Knorr mexican rice casserole, Easy mexican rice casserole, Mexican rice casserole with cheese",6,2026-07-12 13:43:01
https://www.pinterest.com/pin/212795151133898504/,"Crowd-Pleasing Buffalo Chicken Crescent Ring | Recipe | Buffalo chicken croissant, Buffalo crescent rolls, Party appetizers chicken",157,2026-07-12 13:43:01
https://www.pinterest.com/pin/cheeseburger-pie-tornadough-alli--212795151133895516/,"Cheeseburger Pie Recipe | Southern cheeseburger pie, Cheeseburger pie hot dish, Cheeseburger pie with crust",6,2026-07-12 13:43:01
https://www.pinterest.com/pin/chicken-pot-pie-casserole-tornadough-alli--212795151133893328/,"Delicious Chicken Pot Pie Casserole with Cheddar Biscuit Topping | Recipe | Pot pie casserole biscuits, Cheesy chicken pot pie casserole, Chicken pot pie recipes",366,2026-07-12 13:43:04
https://www.pinterest.com/pin/56787645295982081/,"Slow Cooker Sunday Roast Packed with Vegetables and Seasonings | Recipe | Sunday pot roast slow cooker, Six sisters roast crock pot, Dinner pot roast",68,2026-07-12 13:43:05
https://www.pinterest.com/pin/chicken-pot-pie-soup--212795151133891541/,"Chicken Pot Pie Soup Recipe | Chicken potpie soup, Recipes for soup",296,2026-07-12 13:43:07
https://www.pinterest.com/pin/212795151133889603/,"Slow Cooker Pumpkin Hot Chocolate | Recipe | Slow cooker drinks, Hot drinks recipes, Pumpkin flavor",12,2026-07-12 13:43:07
https://www.pinterest.com/pin/cheeseburger-pie--212795151133878888/,"Cheeseburger Pie with Pickles - Easy Dinner Recipe | Cheese burgers, Cheddar cheese, Hamburger",65,2026-07-12 13:43:11
https://www.pinterest.com/pin/vegetable-beef-soup-tornadough-alli--212795151133876200/,"Easy Vegetable Beef Soup | Recipe | Veg beef soup with hamburger, Best homemade vegetable beef soup, Seasonings for vegetable beef soup",8,2026-07-12 13:43:12
https://www.pinterest.com/pin/instant-pot-lasagna-soup--212795151133875079/,"Instant Pot Lasagna Soup Recipe | Lasagna noodles, Pepper lasagna, Soup recipes",227,2026-07-12 13:43:14
https://www.pinterest.com/pin/212795151133875251/,"Asian Crockpot Meatballs | Recipe | Asian meatball recipe crockpot, Asian appetizers, Asian dishes",910,2026-07-12 13:43:14
https://www.pinterest.com/pin/56787645295960922/,"Olive Garden Copycat Recipe | Easy olive garden chicken gnocchi soup, Copycat chicken gnocchi soup recipe, Olive garden chicken gnocchi soup recipe",10,2026-07-12 13:43:14
https://www.pinterest.com/pin/443675000800819138/,"Pumpkin Donuts | Recipe | Cinnamon sugar pumpkin donuts, Baked pumpkin donuts, Pumpkin donuts recipe",6,2026-07-12 13:43:15
https://www.pinterest.com/pin/mexican-rice-casserole--212795151133866410/,"Mexican Rice Casserole Recipe | Rice main dish recipes, White rice, Casserole recipes",388,2026-07-12 13:43:18
https://www.pinterest.com/pin/56787645295950900/,"Delicious Vintage Chocolate Chip Applesauce Cake | Recipe | Chocolate chip applesauce cake recipe, Apple pastry, Apple cakes",2,2026-07-12 13:43:19
https://www.pinterest.com/pin/vintage-applesauce-cake--212795151133863193/,"Vintage Applesauce Cake Recipe | Cake apple, Everything apple, Easy cake recipes",76,2026-07-12 13:43:20
https://www.pinterest.com/pin/56787645295946745/,"Easy Ground Beef Carbonara Recipe | Thrifty meals, New recipes for dinner, Beef pasta recipes",11,2026-07-12 13:43:21
https://www.pinterest.com/pin/47710077294641140/,"Spaghetti Aglio e Olio | Recipe | Easy aglio olio recipe, Spaghetti aglio e olio for two, Simple aglio olio recipe",2,2026-07-12 13:43:21
https://www.pinterest.com/pin/56787645295937894/,"One Pan Stuffed Pepper Casserole | Recipe | Stuffed pepper casserole easy, Stuffed pepper hot dish, Casserole recipes",9,2026-07-12 13:43:24
https://www.pinterest.com/pin/hot-toddy--212795151133852682/,"Hot Toddy Recipe with Lemon and Spices | Hot toddies recipe, Toddy coffee, Food drink",129,2026-07-12 13:43:24
https://www.pinterest.com/pin/45036065014087068/,"Chocolate Chip Pumpkin Pudding Pie | No bake thanksgiving pie, Pumpkin chip cream pie, Classic pumpkin pie",5,2026-07-12 13:43:24
https://www.pinterest.com/pin/212795151133850207/,"Southern Pecan Pie Recipe for Thanksgiving and Christmas | Best easy pecan pie, Best southern pecan pie recipe, The best pecan pie recipe",10,2026-07-12 13:43:26
https://www.pinterest.com/pin/56787645295926116/,"Sausage Rolls Appetizer | Recipe | Easy sausage rolls appetizer, How to make sausage rolls with crescent rolls, Sausage rolls recipes",2,2026-07-12 13:43:29
https://www.pinterest.com/pin/crockpot-mashed-potatoes--212795151133843572/,"Crockpot Mashed Potatoes Recipe | Potato recipes side dishes, Food potatoes, Potatoes veggies",287,2026-07-12 13:43:29
https://www.pinterest.com/pin/pumpkin-bread-with-maple-glaze--212795151133839364/,"Pumpkin Bread with Maple Glaze Recipe | Delicious pumpkin, Pumpkin sweet, Pumpkin recipes dessert",362,2026-07-12 13:43:32
https://www.pinterest.com/pin/56787645295919320/,"Ultimate Thanksgiving Roundup: Delicious Everyday Paleo Favorites | Recipe | All recipes apple pie, White chocolate apple pie, Apple pie in white dish",4,2026-07-12 13:43:35
https://www.pinterest.com/pin/212795151133828780/,"Copycat Applebees Honey Pepper Checking Mac and Cheese | Recipe | Applebee's honey pepper chicken mac and cheese recipe, Copycat applebee's honey pepper chicken mac and cheese, Best easy dinner recipe",91,2026-07-12 13:43:37
https://www.pinterest.com/pin/pumpkin-donuts--212795151133828727/,"Pumpkin Donuts Recipe | Pumpkin sweet, Pumpkin recipes, Everything pumpkin",110,2026-07-12 13:43:37
https://www.pinterest.com/pin/ham-bacon-cheesy-potatoes--212795151133826791/,"Hearty and Cheesy Ham and Bacon Potatoes | Recipe | What goes with ham and cheesy potatoes, Ham and bacon cheesy potatoes, Cheese potato wedges",5,2026-07-12 13:43:40
https://www.pinterest.com/pin/212795151133823178/,"Copycat Cracker Barrel Meatloaf - Tornadough Alli | Cracker barrel meatloaf sauce, Cracker barrel meatloaf recipe with ground beef, Cracker barrel meatloaf recipe copycat",2,2026-07-12 13:43:44
https://www.pinterest.com/pin/glazed-apple-cider-donuts--212795151133821678/,"Glazed Apple Cider Donuts Recipe | Apple cider cinnamon, Apple pie spice, Donut recipes",93,2026-07-12 13:43:45
https://www.pinterest.com/pin/212795151133818553/,"Easy Slow Cooker Beer Brats | Recipe | Beer brats crockpot, Slow cooker brats, Beer brats recipe",280,2026-07-12 13:43:46
https://www.pinterest.com/pin/pumpkin-cupcakes--212795151133820875/,"Delicious Pumpkin Cupcakes with Cream Cheese Frosting | Pumpkin sweet, Pumpkin puree, Pumpkin desserts",128,2026-07-12 13:43:46
https://www.pinterest.com/pin/212795151133818171/,"If you love easy, delicious and boozy this Hot Buttered Rum recipe is the perfect comforting drink that you won't be abl… | Bourbon hot buttered rum recipe, Tiki hot buttered rum drink, Holiday hot bu",78,2026-07-12 13:43:47
https://www.pinterest.com/pin/329536897742848839/,"Creamy, meaty and flavorful this Ground Beef Carbonara is a serious family hit full of flavor and goodness that no one c… | Ground beef carbonara recipe, White pasta with ground beef, Beef pasta recip",1255,2026-07-12 13:43:49
https://www.pinterest.com/pin/212795151133812300/,"Easy Pecan Sticky Buns Recipe | Pecan buns recipe easy, Toffee pecan sticky buns, Sticky buns easy",20,2026-07-12 13:43:50
https://www.pinterest.com/pin/212795151133806670/,"Easy Croissant Breakfast Sandwiches | Recipe | Make ahead breakfast sandwiches croissant, Crossaint breakfast sandwiches, Easy croissant sandwiches",10,2026-07-12 13:43:51
https://www.pinterest.com/pin/212795151133805889/,"The Best Chicken Fried Chicken Recipe | Best easy dinner recipes, Large family meals, Buttermilk chicken",12,2026-07-12 13:43:53
https://www.pinterest.com/pin/229754018483114866/,"The Best Bread Pudding | Recipe | Best bread pudding recipe, Thanksgiving food desserts",20,2026-07-12 13:43:55
https://www.pinterest.com/pin/white-chicken-chili--212795151133803094/,"White Chicken Chili | White chicken chilli in dutch oven, Healthier white chicken chili, White chicken chili crockpot recipes greek yogurt",139,2026-07-12 13:43:55
https://www.pinterest.com/pin/56787645295880016/,"French Toast Waffle Sticks | Recipe | Homemade waffle sticks recipe, Belgian waffle sticks, Baked waffle sticks",74,2026-07-12 13:43:55
https://www.pinterest.com/pin/229754018483118097/,"Decadent Paleo Brownies with Coconut Salted Caramel Sauce | Caramel brownies recipe, Almond flour brownies, Chocolate brownies",8,2026-07-12 13:43:56
https://www.pinterest.com/pin/sweet-potato-pie-recipe-a-delicious-alternative-to-pumpkin-pie--56787645295875825/,"Sweet Potato Pie Recipe - A Delicious Alternative to Pumpkin Pie | Sweet potato pie on cooling rack, Old fashioned sweet potato pie recipes, Sweet potato pie southern",4,2026-07-12 13:43:56
https://www.pinterest.com/pin/212795151133799927/,"Delicious Old-Fashioned Oatmeal Cake | Recipe | Oatmeal cinnamon cake, Desserts using oats, Oatmeal pie cake",18,2026-07-12 13:43:56
https://www.pinterest.com/pin/212795151133789009/,"Maple Chocolate Pecan Pie Bars Recipe | Easy pecan pie bar recipe, Best fall desserts",76,2026-07-12 13:43:59
https://www.pinterest.com/pin/212795151133789006/,"Irresistible Pumpkin Chocolate Chip Cookies | Recipe | Chocolate chip fall treats, Chocolate chip cookie mix with pumpkin, Recipes with pumpkin spice baking chips",47,2026-07-12 13:44:00
https://www.pinterest.com/pin/212795151133788975/,"Cinnamon Swirl Bread Recipe | Loaf pan sizes, Sweet bread, Homemade bread",34,2026-07-12 13:44:00
https://www.pinterest.com/pin/212795151133782787/,"Easy and Delicious Chicken Tortilla Casserole Recipe | Casserole with corn tortillas, Casserole using corn tortillas, Casserole recipes",2,2026-07-12 13:44:01
https://www.pinterest.com/pin/45036065014014322/,"Homemade Oatmeal Cream Pies Recipe | Cake oatmeal, Whoopie pie recipes",6,2026-07-12 13:44:01
https://www.pinterest.com/pin/cinnamon-apple-cheesecake-recipe--212795151133781635/,"Cinnamon Apple Cheesecake Recipe | Apple cinnamon cheesecake recipe, Apple cheesecake with slice missing, Caramel apple cheesecake",76,2026-07-12 13:44:03
https://www.pinterest.com/pin/easy-creamed-potatoes-a-delicious-side-dish-recipe--212795151133781419/,"Creamed Potatoes | Recipe | Creamed potatoes southern, Creamed potatoes recipe, Creamed potatoes old fashioned",51,2026-07-12 13:44:04
https://www.pinterest.com/pin/56787645295835740/,"Pumpkin Donuts - Tornadough Alli | Recipe | Cinnamon sugar pumpkin donuts, Baked pumpkin donuts, Pumpkin donuts recipe",12,2026-07-12 13:44:12
https://www.pinterest.com/pin/peanut-butter-and-jelly-poke-cake--212795151133761023/,"Peanut Butter and Jelly Poke Cake | Poke cake recipes, Pokecake",369,2026-07-12 13:44:12
https://www.pinterest.com/pin/212795151133758643/,"Crockpot Honey BBQ Meatballs | Recipe | Bbq meatballs crockpot, Best party appetizers, Homemade meatloaf",4,2026-07-12 13:44:13
https://www.pinterest.com/pin/slow-cooker-bolognese-sauce--212795151133748592/,"Slow Cooker Bolognese Sauce Recipe | Bolognese pasta with rich sauce, Bolognese sauce crockpot, Slow cooker bolognese recipe",194,2026-07-12 13:44:16
https://www.pinterest.com/pin/56787645295819677/,"Chicken Fried Steak | Recipe | How to cook chicken fried steak, Healthy chicken fried steak, Chicken fried steak with chicken",349,2026-07-12 13:44:16
https://www.pinterest.com/pin/beer-cheese-soup--212795151133748135/,"Beer Cheese Soup with Bacon | Easy beer cheese soup, Beer cheese soup recipes, Soup recipes comfort",114,2026-07-12 13:44:17
https://www.pinterest.com/pin/pumpkin-chocolate-chip-cookies--212795151133744697/,"Pumpkin Chocolate Chip Cookies Recipe | Chocolate chip fall treats, Chocolate chip cookie mix with pumpkin, Recipes with pumpkin spice baking chips",99,2026-07-12 13:44:21
https://www.pinterest.com/pin/212795151133741928/,"Ground Beef Carbonara | Ground beef carbonara recipe, White pasta with ground beef, Beef pasta recipes",18,2026-07-12 13:44:22
https://www.pinterest.com/pin/croissant-breakfast-sandwiches--212795151133736624/,"Croissant Breakfast Sandwiches | Crossaint breakfast sandwiches, Cooking eggs for breakfast sandwiches, Croissant breakfast sandwich recipes",299,2026-07-12 13:44:25
https://www.pinterest.com/pin/212795151133732721/,"Brownie in a Mug Recipe | Brownie mug cake recipe, Mug desserts, Brownies bars",23,2026-07-12 13:44:27
https://www.pinterest.com/pin/blogger-recipes-we-love--56787645295794347/,"Chocolate Chip Pumpkin Pudding Pie - A Twist on a Classic | No bake thanksgiving pie, Pumpkin chip cream pie, Classic pumpkin pie",18,2026-07-12 13:44:28
https://www.pinterest.com/pin/56787645295794011/,"Homemade Chicken Tenders | Recipe | Homemade chicken tenders recipe, Chicken pesto sandwich, Easy chicken",21,2026-07-12 13:44:29
https://www.pinterest.com/pin/47710077294465886/,"Ground Beef Enchiladas | Recipe | Ground beef cheesy enchiladas, Ground beef enchiladas with cheese sauce, Ground beef enchiladas corn tortillas",6,2026-07-12 13:44:30
https://www.pinterest.com/pin/56787645295792914/,"Pickle Dip Pinwheels Recipe | Pickle dip pinwheel recipe, Pinwheel appetizers pickle, Dill pickle pinwheels",16,2026-07-12 13:44:31
https://www.pinterest.com/pin/56787645295789468/,"Baked Pork Chops & Rice | Recipe | Baked pork chops and rice recipe, Baked pork chops oven",7,2026-07-12 13:44:31
https://www.pinterest.com/pin/pumpkin-bars--212795151133725872/,"Easy and Delicious Pumpkin Bars with Cinnamon Cream Cheese Frosting | Homemade pumpkin bar ideas, Easy pumpkin bar baking, Pumpkin bars recipe from scratch",97,2026-07-12 13:44:33
https://www.pinterest.com/pin/the-best-chicken-salad--212795151133724450/,"Best Chicken Salad Recipe | Chicken salad with dill and grapes, Croissant sandwich chicken salad, Chicken salad and croissants",199,2026-07-12 13:44:36
https://www.pinterest.com/pin/nashville-hot-chicken-tenders--212795151133722302/,"Nashville Hot Chicken Tenders Recipe | Homemade chicken tenders, Crispy chicken sandwiches, Buffalo chicken sandwiches",178,2026-07-12 13:44:39
https://www.pinterest.com/pin/212795151133719201/,"Italian Pinwheels Appetizer | Recipe | How to make italian pinwheels, Italian pinwheel roll recipe, Italian pin wheel recipes",14,2026-07-12 13:44:42
