url,title,saves,timestamp
https://www.pinterest.com/pin/212795151139417190/,212795151139417190,3,2026-07-12 13:05:34
https://www.pinterest.com/pin/212795151139415272/,212795151139415272,5,2026-07-12 13:05:34
https://www.pinterest.com/pin/212795151139415127/,212795151139415127,1,2026-07-12 13:05:34
https://www.pinterest.com/pin/212795151139412927/,212795151139412927,4,2026-07-12 13:05:35
https://www.pinterest.com/pin/212795151139400420/,"Cookie Salad for Summer Parties | Cookie salad recipe with cool whip, Easy cookie salad, Crunchy cookies",1,2026-07-12 13:05:37
https://www.pinterest.com/pin/212795151139400453/,"Chicken Salad Pinwheels | Chicken salad roll ups, Chicken pinwheels for lunch, Chicken cranberry pinwheels",28,2026-07-12 13:05:37
https://www.pinterest.com/pin/212795151139405030/,Creamy Frozen Mudslide Cocktail,1,2026-07-12 13:05:38
https://www.pinterest.com/pin/212795151139395555/,"Sweet & Tart Blackberry Rhubarb Crumble Pie | Cottage cheese blackberry rhubarb crumble pie recipe, Crust recipe for blackberry and rhubarb tart, Blackberries and rhubarb crumble pie",12,2026-07-12 13:05:38
https://www.pinterest.com/pin/212795151139398275/,"Popcorn Chicken | Chicken nuggets with popcorn, Fried chicken recipes using popcorm, Chicken nuggets with corn",10,2026-07-12 13:05:38
https://www.pinterest.com/pin/212795151139402884/,Flavor Packed Strawberry Margaritas,11,2026-07-12 13:05:39
https://www.pinterest.com/pin/212795151139395441/,"Refreshing Grape Salad for Summer Gatherings | Grape salad with grapes and pineapple, Easy grape salad recipes, Best grape salad recipe",1,2026-07-12 13:05:39
https://www.pinterest.com/pin/212795151139388026/,"Fresh Vegetable Pizza Pinwheels | Vegetable roll ups appetizers, Vegetable roll ups recipes, Party food ideas",15,2026-07-12 13:05:40
https://www.pinterest.com/pin/212795151139385617/,"Patriotic Fruit Cones | 4th of july party food kids, Fourth of july party food, Fourth of july dessert for kids",8,2026-07-12 13:05:40
https://www.pinterest.com/pin/212795151139390022/,"Mini Cheesecakes with Snickers | Snickers mini cheesecakes, Snickers cheesecake bites, Treats",1,2026-07-12 13:05:40
https://www.pinterest.com/pin/212795151139393058/,"Deliciously Simple Blackberry Jam [Video] | Jam recipes with fresh black berries, Blackberry recipes canning, How to make your own blackberry jam",9,2026-07-12 13:05:40
https://www.pinterest.com/pin/212795151139390369/,"Frozen Mudslide | Frozen drinks with baileys, Frozen alcoholic drinks recipes with liquor, Frozen cocktails with baileys",11,2026-07-12 13:05:40
https://www.pinterest.com/pin/212795151139379750/,"Deliciously Easy Banana Bread Pudding | Recipe | Recipes made with banana bread, Breakfast recipes using old banana bread, Banana pudding with banana bread",11,2026-07-12 13:05:43
https://www.pinterest.com/pin/212795151139381414/,"Lemon Olive Oil Cake: A Zesty Delight for Summer | Recipe | Easy yellow cake recipe with olive oil, Lemon oil cake with oil, Lemon cake made with oil",1,2026-07-12 13:05:43
https://www.pinterest.com/pin/212795151139375976/,"Easy Blackberry Jam Recipe: Sweet and Tart Delight | Blackberry preserves recipe without pectin, How to make jam from blackberries, How to make a blackberry jelly without sure jel",12,2026-07-12 13:05:44
https://www.pinterest.com/pin/212795151139377860/,"Bite Sized Buffalo Chicken Pinwheels [Video] | Recipe | Tortilla roll ups with rotisserie chicken, Tortilla rollup with chicken and buffalo sauce, Buffalo roll ups with chicken",10,2026-07-12 13:05:44
https://www.pinterest.com/pin/212795151139363698/,"Patriotic Jello Shots | Festive Recipe for Summer Celebrations | Jelly shots for july, Red white blue jello shots with strawberries, Fourth of july shooters easy",10,2026-07-12 13:05:45
https://www.pinterest.com/pin/212795151139370728/,"Celebrate Independence Day with a Stunning Tie Dye Cake | Recipe | Color changing tie dye cake, How to make tie dye 4th of july cakes, Tie dye cake 4th of july cake",14,2026-07-12 13:05:45
https://www.pinterest.com/pin/212795151139373410/,"Homemade KFC-Inspired Bowls | Recipe | Chick fil a meal, Quick and easy dinner ideas for family, Easy meal for family of 3",15,2026-07-12 13:05:45
https://www.pinterest.com/pin/212795151139373153/,"Shrimp Tacos with Bold Flavor and Fresh Toppings | Recipe | Shrimp tacos with spicy mayo and avocado, Grilled shrimp street tacos, Tacos with shrimp and crab",3,2026-07-12 13:05:45
https://www.pinterest.com/pin/212795151139365972/,"Nashville Hot Mozzarella Sticks | Recipe | Spicy cheese sticks, Spicy cheese stix, Blueberry goat cheese",10,2026-07-12 13:05:45
https://www.pinterest.com/pin/212795151139367956/,"Pizza Burgers | Recipe | Easy pizza burgers with hamburger patties, Easy recipes for burgers, Pizza burgers recipe",23,2026-07-12 13:05:45
https://www.pinterest.com/pin/212795151139377794/,"Caprese Pasta Salad Recipe for Summer Gatherings | Summer pasta salad recipes with tomatoes, Cold pasta salad for a crowd, Summer meals",1,2026-07-12 13:05:45
https://www.pinterest.com/pin/212795151139367772/,"Buffalo Chicken Mac and Cheese Recipe | Hot chicken mac and cheese, Buffalo chicken mac and cheese with rotisserie, Buffalo chicken mac and cheese recipe rotisserie",1,2026-07-12 13:05:46
https://www.pinterest.com/pin/212795151139355470/,"Summer Picnic Tuna Pasta Salad | Recipe | Pasta tuna salad for lunch, Easy tuna noodle salad recipes, Easy healthy picnic meals with tuna",12,2026-07-12 13:05:49
https://www.pinterest.com/pin/212795151139345499/,"Applebee's Inspired Honey Pepper Chicken Mac & Cheese | Recipe | Applebees honey pepper chicken mac and cheese recipe, Applebee's honey pepper chicken mac and cheese recipe, Copycat applebee's honey p",11,2026-07-12 13:05:49
https://www.pinterest.com/pin/212795151139352646/,"Patriotic Red White & Blue Cookies | Recipe | Cookies for fourth of julie, 4 july desserts easy, 4th of july desserts sugar cookie",6,2026-07-12 13:05:49
https://www.pinterest.com/pin/212795151139352498/,"Crispy Beer Battered Fish | Recipe | Fish breading without flour, Baked fish batter with no bread, Breaded fish without bread",11,2026-07-12 13:05:50
https://www.pinterest.com/pin/212795151139347715/,"Chocolate Chip Coffee Cake for Summer Breakfasts | Recipe | Breakfast with chocolate chips, Chocolate chip coffee cake recipes, Cinnamon pop tart",2,2026-07-12 13:05:50
https://www.pinterest.com/pin/212795151139349797/,"Banana Blondies | Recipe | Easy banana recipes with no butter, What to do with banna, Banana muffins without flour",14,2026-07-12 13:05:51
https://www.pinterest.com/pin/212795151139343522/,Uh oh! Too Many Requests,0,2026-07-12 13:05:51
https://www.pinterest.com/pin/212795151139347718/,"Cheesy Beef Burritos | Recipe | Beef burritos with cheese, How to make beef and cheese burritos, Ground beef burrito",13,2026-07-12 13:05:51
https://www.pinterest.com/pin/212795151139338819/,"Tender Smoked Ribs with a Honey BBQ Sauce Glaze | Recipe | Smoked ribs with honey barbecue sauce, Smoked ribs on the traeger bbq sauce, Ribs in the smoker recipes",13,2026-07-12 13:05:51
https://www.pinterest.com/pin/212795151139343415/,Pinterest - Too Many Requests,0,2026-07-12 13:05:51
https://www.pinterest.com/pin/212795151139338727/,"Colorful Summer Corn Salad | Recipe | Corn salad with peppers and onions, Sweet corn and red onion salad, Corn and peppers and tomatoes salad ideas",1,2026-07-12 13:05:52
https://www.pinterest.com/pin/212795151139336420/,"Indulgent Peanut Butter Icebox Cake | Recipe | Peanut butter ice box cake with gramcrackers, Peanut butter icebox cake with graham crackers, Icebox cake with nutter butter cookies",13,2026-07-12 13:05:52
https://www.pinterest.com/pin/212795151139333775/,"Buffalo Chicken Mac and Cheese | Creamy and Delicious | Recipe | Bufflo chicken and mac and cheese, Buffalo chicken mac and cheese recipe without canned chicken, Chicken and mac & cheese recipes",18,2026-07-12 13:05:52
https://www.pinterest.com/pin/212795151139333697/,"Alcoholic drinks fruity | Recipe | Alcohol drinks for the pool, Limoncello recipe, Passion fruit syrup",3,2026-07-12 13:05:52
https://www.pinterest.com/pin/212795151139329479/,"Strawberry Sugar Cookies | Recipe | Strawberry cookie recipes from scratch, Soft and chewy strawberry sugar cookies, Fresh strawberry cookies with cream cheese frosting",1,2026-07-12 13:05:56
https://www.pinterest.com/pin/212795151139329583/,"Beefy Crockpot French Dip Sandwiches | Recipe | What kind of bread for french dip sandwich, Slow cooker french dip, Tasty french dip sandwiches",18,2026-07-12 13:05:56
https://www.pinterest.com/pin/212795151139327171/,"Richly Flavored Thai Peanut Noodles [Video] | Recipe | Asian flavored rice noodles, Noodle bowl with peanut sauce, Creamy peanut sauce for noodles",15,2026-07-12 13:05:57
https://www.pinterest.com/pin/212795151139324872/,"4th Of July S'Mores Party Dip | Recipe | Easy s’mores for a crowd, S’mores dip without marshmellows, S’mores dip without marshmallows",17,2026-07-12 13:05:57
https://www.pinterest.com/pin/212795151139331927/,"Chocolate Chip Coffee Cake | Recipe | Chocolate chip coffee cake easy, Chocolate coffee cake with coffee, Coffee cake chocolate chips recipe",17,2026-07-12 13:05:57
https://www.pinterest.com/pin/212795151139324854/,"Iconic Lobster Rolls for Summer Gatherings | Recipe | Best lobster meat, Lobster roll recipe with meat only, Crab sandwich recipe lobster rolls",1,2026-07-12 13:05:57
https://www.pinterest.com/pin/212795151139322114/,"Pickle Dip Pinwheels: Creamy and Flavorful Party Appetizer | Recipe | Pickle wrap appetizer recipes, Pickle roll ups appetizer, Pickle dip pinwheel recipe",22,2026-07-12 13:05:57
https://www.pinterest.com/pin/212795151139319949/,"Elevated Crockpot Ranch Mushrooms | Recipe | Mushrooms in the slow cookers, Slow cooker ranch mushrooms for two people, Ranch style mushrooms",18,2026-07-12 13:05:58
https://www.pinterest.com/pin/212795151139319937/,"Southwest Salad: A Perfect Summer Medley | Salad for bbq party, Southwest salads with rotel, Salad to go with bbq",2,2026-07-12 13:05:58
https://www.pinterest.com/pin/212795151139317082/,"Delicious Beer Battered Fish | Recipe | Fry fish with beer, Beer battered fish recipes, Batter for fish with beer",24,2026-07-12 13:05:58
https://www.pinterest.com/pin/212795151139307514/,"Thai Peanut Noodles | Recipe | Thai peanut sauce for noodles with ground beef, Thai noodle with peanut butter topping, Thai noodle dishes",16,2026-07-12 13:06:01
https://www.pinterest.com/pin/212795151139309704/,"Blueberry Lemonade Recipe | Lemonade with blueberries, Blueberry drinks recipes for, Blueberry lemon drinks for crowd",2,2026-07-12 13:06:01
https://www.pinterest.com/pin/212795151139305203/,"Simple Fruit Pizza | Recipe | Fruit pizza with premade cookie crust, Dessert pizza recipes, Easy fruit pizza",19,2026-07-12 13:06:01
https://www.pinterest.com/pin/212795151139304729/,"Delicious Strawberry Pie Recipe | Strawberry pie made with jello, Old fashion strawberries and pie crust, How to make a strawberry pie with jell o mix",4,2026-07-12 13:06:02
https://www.pinterest.com/pin/212795151139306679/,"Cinnamon Sugar Dessert Pizza | Recipe | How to make a dessert pizza, Dessert pizz with cinnamon roll sugar, Cinnamon sugar pizza recipe",16,2026-07-12 13:06:02
https://www.pinterest.com/pin/212795151139300401/,"How to make a rum cocktail with simple ingredients | Recipe | Hurrican drink recipes, Drinks with passion fruit rum, Outdoor picnic food",11,2026-07-12 13:06:02
https://www.pinterest.com/pin/212795151139300361/,"Grilled Hawaiian Chicken Pineapple Kabobs for Summer | Recipe | Chicken with pineapple in the oven, Barbecue chicken and pineapple kabobs in the oven, Bbq chicken kabobs",3,2026-07-12 13:06:03
https://www.pinterest.com/pin/212795151139295680/,"Berry Ricotta Cake to Satisfy Your Sweet Cravings | Recipe | Ricotta and berry cake, Recipes that use ricotta cheese, Ricotta cheese and berries",1,2026-07-12 13:06:03
https://www.pinterest.com/pin/212795151139295977/,"Smoky Grilled Corn on the Cob | Recipe | Grilled corn on the cob with bacon, Smoky butter corn cooked on smoker, Smoked corn on the cob",12,2026-07-12 13:06:03
https://www.pinterest.com/pin/212795151139290830/,"Delicious Lemon Bundt Cake with Cream Cheese Frosting | Recipe | Lemon cream cheese cake with boxed mix, Cream cheese frosting for lemon cake, Lemon cheesecake with cake mix",13,2026-07-12 13:06:03
https://www.pinterest.com/pin/212795151139293347/,"Easy Lunch Crispy Chicken Caesar Sandwiches [Video] | Recipe | Simple lunch meals with chicken, Healthy fast easy recipes, Fast and easy dinner recipes simple",23,2026-07-12 13:06:04
https://www.pinterest.com/pin/212795151139298012/,"Breakfast Burritos | Recipe | What do you eat eggs for breakfast, Eggs for breakfast burritos with cheese, Egg and cheese breakfast burritos for one",20,2026-07-12 13:06:04
https://www.pinterest.com/pin/212795151139285864/,"Slow Cooker Sunday Roast | Recipe | Slow cooker sunday roast recipes, Sunday slow cooker meals, Easy oven roast dinner",1,2026-07-12 13:06:06
https://www.pinterest.com/pin/212795151139275416/,"How to Make a Caprese Pasta Salad [Video] | Recipe | Salad with pasta and mozz, Summer cold pasta dishes, Easy pasta recipes cold",15,2026-07-12 13:06:07
https://www.pinterest.com/pin/212795151139280267/,"Summer Tortellini Salad | Recipe | Tortellini salad recipes cold with feta sauce, Cold tortellini salad recipes easy, Summer corn salad",6,2026-07-12 13:06:07
https://www.pinterest.com/pin/212795151139280327/,"Blackened Shrimp | Recipe | What can i do with shrimp, How long to cook blackened shrimp, Blackened shrimp with canned veggies",14,2026-07-12 13:06:07
https://www.pinterest.com/pin/212795151139277982/,"Crispy & Crunchy Chicken Fried Chicken | Recipe | Breading for fried chicken, How to make crispy chicken fried chicken, Crispy chicken fried chicken with sauce",23,2026-07-12 13:06:08
https://www.pinterest.com/pin/212795151139275266/,"Smoky Corn on the Cob | Recipe | Smoked corn on the cob with butter and cheese, Grilled corn on the cob on grill with butter and corn syrup, Smoked corn on the cob in butter",2,2026-07-12 13:06:08
https://www.pinterest.com/pin/212795151139283147/,"Blueberry Lemonade | Recipe | Lemonade with blueberries, Lemonade with blueberry juice, Homemade blueberry lemonade recipe",10,2026-07-12 13:06:08
https://www.pinterest.com/pin/212795151139272783/,"Crispy Chicken Caesar Sandwiches | Recipe | Ceaser chicken sandwhich with coctle sauce, Caesar salad with chickenc, Crispy chicken ceaser and grilled",19,2026-07-12 13:06:08
https://www.pinterest.com/pin/212795151139270208/,"Family Favorite Crockpot Cheesy Potatoes | Recipe | Quick easy cheese potatoes, Crockpot cheesy potatoes easy for a crowd, Easy cheese potatoes for a crowd",29,2026-07-12 13:06:09
https://www.pinterest.com/pin/212795151139270085/,"Avocado Ranch: The Perfect Dipping Sauce | Recipe | Avacado ranch dressing, Avocado ranch sauce with mayo, Healthy avocado ranch dip with mayo",2,2026-07-12 13:06:10
https://www.pinterest.com/pin/212795151139264983/,"Lemon Pepper Chicken Kabobs | Chicken kabobs for a crowd, Chicken breast kabobs recipes with peppers, Chicken kabobs on the grill",2,2026-07-12 13:06:10
https://www.pinterest.com/pin/212795151139265024/,"No Fold Blanket Dumplings | Dumplings without folding dough, Easy dumpling no folding with dough sheet, Homemade chicken and dumplings",17,2026-07-12 13:06:11
https://www.pinterest.com/pin/212795151139267664/,"Must Try Crispy Fried Green Beans | Recipe | Fried fresh green beans and cheese, Fried green beans with flour, Air fry green beans",16,2026-07-12 13:06:11
https://www.pinterest.com/pin/212795151139260089/,"Vietnamese Egg Coffee | Recipe | Coffe made with egg yolks, Coffee recipes with egg, Liquid eggs",2,2026-07-12 13:06:12
https://www.pinterest.com/pin/212795151139258312/,"Crowd Pleasing Strawberry Crunch Cake [Video] | Recipe | Strawberry crunch with cool whip icing, Easy strawberry crunch cake with coolwhip frosting, Strawberry crunch cake icing",119,2026-07-12 13:06:13
https://www.pinterest.com/pin/212795151139255945/,"Caprese Pasta Salad | Light and Delicious Side Dish | Recipe | Easy side dishes for lunch pot luck, Cold salads for bbq lunch, Summer caprese pasta salad recipe",22,2026-07-12 13:06:13
https://www.pinterest.com/pin/212795151139255674/,"Savory Grilled Mushrooms | Recipe | Mushroom and onion on the grill, Grilled mushrooms with butter and garlic, Grilled mushrooms on the bbq",1,2026-07-12 13:06:14
https://www.pinterest.com/pin/212795151139253680/,"Strawberry Pie Made Simple | Strawberry pie filling without clear jel, Strawberry pies with canned strawberry pie filling, Strawberry pie recipe",14,2026-07-12 13:06:14
https://www.pinterest.com/pin/212795151139248421/,"Homemade Avocado Ranch | Recipe | Ranch with avocado, Homemade avocado ranch dipping sauce for tacos, Avocado ranch dip recipe",21,2026-07-12 13:06:14
https://www.pinterest.com/pin/212795151139245946/,"Quick and Delicious Peanut Butter Mug Cake | Recipe | Mug cake with peanut butter chips, Peanut butter chip microwave cake, Peanut butter microwave cup",20,2026-07-12 13:06:14
https://www.pinterest.com/pin/212795151139250992/,"Strawberry Crunch Cake | Recipe | Crushed strawberry topping for cake, Strawberry cake with crushed strawberries on top, Strawberry crunch topping",3,2026-07-12 13:06:15
https://www.pinterest.com/pin/212795151139251247/,"Big Mac Inspired Smash Burger Tacos | Recipe | Ground beef and tortillas dinners, Burger tacos with lettuce, Ground beef taco recipes with lettuce",21,2026-07-12 13:06:15
https://www.pinterest.com/pin/212795151139245877/,"Refreshing Strawberry Piña Colada Recipe | Tropical smoothie cafe frozen pineapple punch recipe, How to make strawberry pina colada, Strawberry pina colada drink recipe",1,2026-07-12 13:06:15
https://www.pinterest.com/pin/212795151139243573/,"Refreshing Rhubarb Slush | Recipe | Frozen drink with rhubarb, What to do with rhubarb, Rhubarb drink with alcohol",53,2026-07-12 13:06:15
https://www.pinterest.com/pin/212795151139241361/,"Grilled Hawaiian Chicken Pineapple Kabobs [Video] | Recipe | Chicken and pineapple kabobs, Pineapple chicken kabobs on the grill, Hawaiian chicken kabobs on the grill",64,2026-07-12 13:06:16
https://www.pinterest.com/pin/212795151139238973/,"Mexican Style Shrimp Tacos | Recipe | Shrimp tacos grilled mexican, Summer party appetizers, Restaurant style recipes",23,2026-07-12 13:06:16
https://www.pinterest.com/pin/212795151139235677/,"Homemade Popcorn Chicken Bowl | Recipe | Mash potatoes and chicken breast, Mashed potatoes and chicken bowl recipe, Mashed potatoes bowl meals",44,2026-07-12 13:06:18
https://www.pinterest.com/pin/212795151139235614/,"Strawberry Lemon Donuts | Colorful and Delicious Breakfast | Recipe | Donuts with sprinkles, Coulours food, Food pictures",1,2026-07-12 13:06:19
https://www.pinterest.com/pin/212795151139227802/,"Strawberry Crunch Cake | Recipe | What to make with crushed strawberry’s, Strawberry cake with cream cheese icing, Strawberry cake with strawberry crunch topping",27,2026-07-12 13:06:20
https://www.pinterest.com/pin/212795151139233289/,"Summer Grilled Mexican Street Corn | Recipe | Best sides for bbq chicken on the grill mexican street corn, Corn elote recipe, Mexican street corn recipe",29,2026-07-12 13:06:20
https://www.pinterest.com/pin/212795151139225502/,"Minimal Effort Shredded Beef Tacos | Taco with cooked beef, How to make tacos in slow cooker, Slow cooked beef",33,2026-07-12 13:06:20
https://www.pinterest.com/pin/212795151139230424/,"Snickers Mini Cheesecakes | Recipe | Mini snickers cheesecakes, Snickers cheesecake recipe, Homemade snickers cheesecake",20,2026-07-12 13:06:21
https://www.pinterest.com/pin/212795151139230252/,"BBQ Chicken Pasta | Recipe | Easy chicken barbecued pasta sauce, Easy bbq chicken and pasta, Bbq chicken with pasta",1,2026-07-12 13:06:21
https://www.pinterest.com/pin/212795151139225362/,"Raspberry Lemonade | Recipe | Berry punch recipe for kids, Nonalcoholic berry punch, Simple summer drink recipes",1,2026-07-12 13:06:21
https://www.pinterest.com/pin/212795151139220674/,"Hawaiian Chicken Pineapple Kabobs | Recipe | Pineapple chicken cabobs, Easy chicken and pineapple kabobs, Chicken pineapple kabobs on the grill",31,2026-07-12 13:06:21
https://www.pinterest.com/pin/212795151139223239/,"Refreshing Citrus Liqueur [Video] | Recipe | Lemon and everclear, Recipes that use everclear, Outdoor picnic food",10,2026-07-12 13:06:21
https://www.pinterest.com/pin/212795151139218132/,"Quick & Creamy Tuna Pasta Salad | Recipe | Salad with tuna and cream cheese, Pasta salad recipes with tuna and red onion, Pasta salad with canned tuna and mayonnaise",51,2026-07-12 13:06:22
https://www.pinterest.com/pin/212795151139220588/,"Pico de Gallo Creation Made Easy | Recipe | Picanha recipe mexican, Easy mexican pico, Mexican pico de gallo recipe",61,2026-07-12 13:06:22
https://www.pinterest.com/pin/212795151139215408/,"Zesty Mexican Rice Casserole | Recipe | Mexican rice casserole in crockpot, Mexican rice casserole recipe with rotel, Cold weather food",44,2026-07-12 13:06:23
https://www.pinterest.com/pin/212795151139207117/,"Red Beans & Rice in the Slow Cooker | Recipe | Southern red beans and rice with canned beans recipe crockpot, Crockpot red beans and rice dry, Crockpot red beans and rice with smoked turkey wing",19,2026-07-12 13:06:25
https://www.pinterest.com/pin/212795151139209629/,"Vietnamese Egg Coffee | Recipe | Vietnamese egg coffee made with instant coffee, How to make the perfect cup of coffee with a egg, What is in vietnamese egg coffee",10,2026-07-12 13:06:25
https://www.pinterest.com/pin/212795151139209490/,"Orange Rolls | Recipe | Baking recipes for the home, Sweet breakfasts to make at home, Baked goods for sale easy",2,2026-07-12 13:06:25
https://www.pinterest.com/pin/212795151139204319/,"The Best Chicken Salad Recipe | Creamy and Delicious | Lunch ideas to go, Cold lunch ideas, Chicken salads with pesto",2,2026-07-12 13:06:25
https://www.pinterest.com/pin/212795151139204481/,"Effortless Grape Salad [Video] | Grape salad with pecans and walnuts, What is the best way to clean fresh grapes, Outdoor picnic food",13,2026-07-12 13:06:26
https://www.pinterest.com/pin/212795151139202227/,"Limoncello | Recipe | Limoncello recipe made with everclear, Everclear and lime recipes, Making limoncello",23,2026-07-12 13:06:26
https://www.pinterest.com/pin/212795151139194106/,"Delicious Grilled Bacon Wrapped Asparagus Recipe | Bacon wrapped asparagus spears recipes, Asparagus and bacon recipe, Bacon wrapped asparagus on the grill",2,2026-07-12 13:06:27
https://www.pinterest.com/pin/212795151139199810/,"Banana Upside Down Cake | Easy banana upside down cake made with all purpose flour, What is a good substitute for a pineapple upside down cake mix, Upside down banana cake with buttermilk",3,2026-07-12 13:06:27
https://www.pinterest.com/pin/212795151139199897/,"Easy to Make Stuffed Pepper Casserole | Recipe | Healthy ground beef bell pepper recipes, Stuffed bell peppers casserole with ground turkey, Ground beef and rice with bell peppers",93,2026-07-12 13:06:28
https://www.pinterest.com/pin/212795151139197251/,"Flavorful Slow Cooker Mexican Chicken | Recipe | Crock pot chicken with enchalada sauce and taco seasoning, Crockpot chicken with enchilada sauce and taco seasoning, Slow cooker chicken breast taco",23,2026-07-12 13:06:28
https://www.pinterest.com/pin/212795151139194265/,"Magnolia Bakery Inspired Banana Pudding | Recipe | Banana pudding recipe with vanilla wafers, Molly yeh banana pudding with vanilla wafer, Restaurant inspired recipes",25,2026-07-12 13:06:28
https://www.pinterest.com/pin/212795151139184204/,"Blueberry Vodka Smash | Recipe | Drinks with blueberry vodka, Blueberry vodka punch, Vodka cocktails woth blueberries",1,2026-07-12 13:06:30
https://www.pinterest.com/pin/212795151139178754/,"Homemade Strawberry Pop Tarts Recipe | How to make strawberry pop tarts with jam, Pop tarts homemade with strawberry jam, Pop tarts filling with jam and glaze",17,2026-07-12 13:06:30
https://www.pinterest.com/pin/212795151139181686/,"Herb-Infused Baked Pork Chops | Recipe | Pork chop and rice in oven, Oven pork chops and rice recipes, Baked pork chops and rice recipe",22,2026-07-12 13:06:30
https://www.pinterest.com/pin/212795151139178673/,"Lemon Crumb Cake | Recipe | Lemon cake with frosting with lemon crumb, Cakes for summer, Light and fluffy lemon crumb cake by tondoughallie",3,2026-07-12 13:06:31
https://www.pinterest.com/pin/212795151139175721/,"Lemon Poppy Seed Cake | Recipe | Lemon poppy seed cake with lemon curd and buttermilk, Easy poppy seed cake without cake mix, Easy lemon poppyseed cake from scratch",31,2026-07-12 13:06:31
https://www.pinterest.com/pin/212795151139169620/,"Simple Ingredient Chocolate Chip Pancakes | Recipe | Chocolate chip pancakes for kids, Pancake recipe with chocolate chips, Easy simple recipes for breakfast",34,2026-07-12 13:06:31
https://www.pinterest.com/pin/212795151139171830/,"Carrot Cake Cookie Cups Recipe | Carrot cake cookie cups no egg, Cinnamon roll cookie cups with frosting, Cookie cup flavors",2,2026-07-12 13:06:31
https://www.pinterest.com/pin/212795151139172502/,"Orange Rolls | Recipe | Breakfast recipes that start with an o, Orange rolls with dried orange slices, Orange roll with cake mix",25,2026-07-12 13:06:31
https://www.pinterest.com/pin/212795151139166816/,"Single Serving Strawberry Mug Cake [Video] | Recipe | Easy desserts in a cup for one microwave, Single serving dessert with microwave, Chocolate chip mug cake",16,2026-07-12 13:06:32
