url,title,saves,timestamp
https://www.pinterest.com/pin/212795151139363698/,212795151139363698,5,2026-06-20 13:48:38
https://www.pinterest.com/pin/212795151139361120/,212795151139361120,4,2026-06-20 13:48:38
https://www.pinterest.com/pin/212795151139365972/,212795151139365972,4,2026-06-20 13:48:38
https://www.pinterest.com/pin/212795151139363491/,212795151139363491,1,2026-06-20 13:48:38
https://www.pinterest.com/pin/212795151139347718/,"Cheesy Beef Burritos | Seasoned ground beef, Homemade beef, Quick meal",10,2026-06-20 13:48:40
https://www.pinterest.com/pin/212795151139349797/,Banana Blondies,11,2026-06-20 13:48:40
https://www.pinterest.com/pin/212795151139347715/,Chocolate Chip Coffee Cake for Summer Breakfasts | Rich chocolate,2,2026-06-20 13:48:40
https://www.pinterest.com/pin/212795151139352498/,Crispy Beer Battered Fish,1,2026-06-20 13:48:41
https://www.pinterest.com/pin/212795151139345499/,"Applebee's Inspired Honey Pepper Chicken Mac & Cheese | Applebees honey pepper chicken mac and cheese recipe, Tender chicken, Creamy mac and cheese",11,2026-06-20 13:48:41
https://www.pinterest.com/pin/212795151139343522/,"Cast Iron Skillet S'mores Dip [Video] | S’more dip in a cast iron, Tasty recipes, Amazing dessert recipes",10,2026-06-20 13:48:41
https://www.pinterest.com/pin/212795151139338819/,"Tender Smoked Ribs with a Honey BBQ Sauce Glaze | Smoked ribs with honey barbecue sauce, Smoked ribs on the traeger bbq sauce, Smoked ribs recipe",13,2026-06-20 13:48:42
https://www.pinterest.com/pin/212795151139343415/,"Lemon Bundt Cake | Lemon bundt cake with cream cheese frosting and sour cream, Easy lemon cake with butter, Bundt cake recipes lemon with cream cheese icing and sour cream",1,2026-06-20 13:48:42
https://www.pinterest.com/pin/212795151139341418/,"Viral Pickle Sandwich | How to make viral pickle sandwiches, Pickle sandwiches with cream cheese and turkey, Sandwich recipe",11,2026-06-20 13:48:42
https://www.pinterest.com/pin/212795151139336420/,"Indulgent Peanut Butter Icebox Cake | Peanut butter ice box cake with gramcrackers, Peanut butter icebox cake with graham crackers, Peanut butter whipped cream",11,2026-06-20 13:48:42
https://www.pinterest.com/pin/212795151139333775/,"Buffalo Chicken Mac and Cheese | Creamy and Delicious | Bufflo chicken and mac and cheese, Buffalo chicken mac and cheese recipe without canned chicken, Chicken and mac & cheese recipes",14,2026-06-20 13:48:42
https://www.pinterest.com/pin/212795151139338727/,"Colorful Summer Corn Salad | Corn salad with peppers and onions, Sweet corn and red onion salad, Corn and peppers and tomatoes salad ideas",1,2026-06-20 13:48:42
https://www.pinterest.com/pin/212795151139329479/,"Strawberry Sugar Cookies | Recipe | Strawberry cookie recipes from scratch, Soft and chewy strawberry sugar cookies, Fresh strawberry cookies with cream cheese frosting",1,2026-06-20 13:48:44
https://www.pinterest.com/pin/212795151139327171/,"Richly Flavored Thai Peanut Noodles [Video] | Recipe | Asian flavored rice noodles, Noodle bowl with peanut sauce, Creamy peanut sauce for noodles",12,2026-06-20 13:48:44
https://www.pinterest.com/pin/212795151139324872/,"4th Of July S'Mores Party Dip | Recipe | Easy s’mores for a crowd, S’mores dip without marshmellows, S’mores dip without marshmallows",11,2026-06-20 13:48:45
https://www.pinterest.com/pin/212795151139322114/,"Pickle Dip Pinwheels: Creamy and Flavorful Party Appetizer | Recipe | Pickle wrap appetizer recipes, Pickle roll ups appetizer, Pickle dip pinwheel recipe",19,2026-06-20 13:48:45
https://www.pinterest.com/pin/212795151139324854/,"Iconic Lobster Rolls for Summer Gatherings | Recipe | Best lobster meat, Lobster roll recipe with meat only, Crab sandwich recipe lobster rolls",1,2026-06-20 13:48:45
https://www.pinterest.com/pin/212795151139319949/,"Elevated Crockpot Ranch Mushrooms | Recipe | Mushrooms in the slow cookers, Slow cooker ranch mushrooms for two people, Ranch style mushrooms",15,2026-06-20 13:48:45
https://www.pinterest.com/pin/212795151139319937/,"Southwest Salad: A Perfect Summer Medley | Recipe | Salad for bbq party, Southwest salads with rotel, Salad to go with bbq",2,2026-06-20 13:48:46
https://www.pinterest.com/pin/212795151139314830/,"Delicious Jalapeño Cheese Scones | Recipe | Savory scones with jalapeño cheese, Jalapeño scones with cheddar, Chedder jalapeño cheese scone",1,2026-06-20 13:48:46
https://www.pinterest.com/pin/212795151139309718/,"Moist Lemon Cream Cheese Bundt Cake [Video] | Recipe | Lemon bundt cake with cream cheese icing, Lemon bundt cake recipe with cream cheese frosting, Lemon pie",11,2026-06-20 13:48:46
https://www.pinterest.com/pin/212795151139317082/,"Delicious Beer Battered Fish | Recipe | Fry fish with beer, Beer battered fish recipes, Batter for fish with beer",18,2026-06-20 13:48:47
https://www.pinterest.com/pin/212795151139312775/,"Simple Bread Pudding Recipe with Cinnamon and Nutmeg | Bread pudding for kids using french bread, Easy simple bread pudding, Best bread pudding recipe simple",76,2026-06-20 13:48:47
https://www.pinterest.com/pin/212795151139314886/,"Strawberry Sugar Cookies | Recipe | Fresh strawberry cookies with cake mix, Strawberry snickerdoodle cake mixes, Delicious desserts",13,2026-06-20 13:48:47
https://www.pinterest.com/pin/212795151139307514/,"Thai Peanut Noodles | Recipe | Thai peanut sauce for noodles with ground beef, Thai noodle with peanut butter topping, Thai noodle dishes",16,2026-06-20 13:48:47
https://www.pinterest.com/pin/212795151139305203/,"Simple Fruit Pizza | Fruit pizza with premade cookie crust, Dessert pizza recipes, Easy fruit pizza",17,2026-06-20 13:48:47
https://www.pinterest.com/pin/212795151139306679/,"Cinnamon Sugar Dessert Pizza | Recipe | How to make a dessert pizza, Dessert pizz with cinnamon roll sugar, Dessert pizza recipes",7,2026-06-20 13:48:47
https://www.pinterest.com/pin/212795151139304729/,"Delicious Strawberry Pie Recipe | Strawberry pie made with jello, Old fashion strawberries and pie crust, How to make a strawberry pie with jell o mix",4,2026-06-20 13:48:49
https://www.pinterest.com/pin/212795151139300401/,"How to make a rum cocktail with simple ingredients | Recipe | Hurrican drink recipes, Drinks with passion fruit rum, Outdoor picnic food",11,2026-06-20 13:48:49
https://www.pinterest.com/pin/212795151139300361/,"Grilled Hawaiian Chicken Pineapple Kabobs for Summer | Recipe | Chicken with pineapple in the oven, Barbecue chicken and pineapple kabobs in the oven, Bbq chicken kabobs",2,2026-06-20 13:48:50
https://www.pinterest.com/pin/212795151139298012/,"Breakfast Burritos | Recipe | What do you eat eggs for breakfast, Eggs for breakfast burritos with cheese, Egg and cheese breakfast burritos for one",20,2026-06-20 13:48:50
https://www.pinterest.com/pin/212795151139295977/,"Smoky Grilled Corn on the Cob | Grilled corn on the cob with bacon, Smoky butter corn cooked on smoker, Smoked corn on the cob",12,2026-06-20 13:48:50
https://www.pinterest.com/pin/212795151139295680/,"Berry Ricotta Cake to Satisfy Your Sweet Cravings | Ricotta and berry cake, Recipes that use ricotta cheese, Ricotta cheese and berries",1,2026-06-20 13:48:51
https://www.pinterest.com/pin/212795151139290830/,"Delicious Lemon Bundt Cake with Cream Cheese Frosting | Recipe | Lemon cream cheese cake with boxed mix, Cream cheese frosting for lemon cake, Lemon cheesecake with cake mix",13,2026-06-20 13:48:52
https://www.pinterest.com/pin/212795151139293347/,"Easy Lunch Crispy Chicken Caesar Sandwiches [Video] | Recipe | Simple lunch meals with chicken, Healthy fast easy recipes, Fast and easy dinner recipes simple",16,2026-06-20 13:48:52
https://www.pinterest.com/pin/212795151139290616/,"Sausage and Egg Breakfast Burritos | Recipe | Breakfast burrito for 25 people, Breakfast burritos for large crowd, Bodega breakfast burrito ingredients",2,2026-06-20 13:48:52
https://www.pinterest.com/pin/212795151139288653/,"Tender Ribs that Fall Off the Bone | Recipe | How to cook boneless spare ribs with skin on, Fall off the bone ribs in oven easy, Fall off the bone ribs recipe",15,2026-06-20 13:48:52
https://www.pinterest.com/pin/212795151139286163/,"Aromatic Summer Corn Salad | Recipe | Grilled corn and tomatoes, Corn and tomato and pepper salad, Sweet potato chili",15,2026-06-20 13:48:52
https://www.pinterest.com/pin/212795151139277982/,"Crispy & Crunchy Chicken Fried Chicken | Recipe | Breading for fried chicken, How to make crispy chicken fried chicken, Crispy chicken fried chicken with sauce",19,2026-06-20 13:48:52
https://www.pinterest.com/pin/212795151139285864/,"Slow Cooker Sunday Roast | Recipe | Slow cooker sunday roast recipes, Sunday slow cooker meals, Easy oven roast dinner",1,2026-06-20 13:48:52
https://www.pinterest.com/pin/212795151139275266/,"Smoky Corn on the Cob | Smoked corn on the cob with butter and cheese, Grilled corn on the cob on grill with butter and corn syrup, Smoked corn on the cob in butter",2,2026-06-20 13:48:52
https://www.pinterest.com/pin/212795151139275416/,"How to Make a Caprese Pasta Salad [Video] | Recipe | Salad with pasta and mozz, Summer cold pasta dishes, Easy pasta recipes cold",14,2026-06-20 13:48:53
https://www.pinterest.com/pin/212795151139280267/,"Summer Tortellini Salad | Tortellini salad recipes cold with feta sauce, Cold tortellini salad recipes easy, Summer corn salad",6,2026-06-20 13:48:55
https://www.pinterest.com/pin/212795151139272783/,"Crispy Chicken Caesar Sandwiches | Recipe | Ceaser chicken sandwhich with coctle sauce, Caesar salad with chickenc, Crispy chicken ceaser and grilled",16,2026-06-20 13:48:55
https://www.pinterest.com/pin/212795151139270208/,"Family Favorite Crockpot Cheesy Potatoes | Recipe | Quick easy cheese potatoes, Crockpot cheesy potatoes easy for a crowd, Easy cheese potatoes for a crowd",26,2026-06-20 13:48:55
https://www.pinterest.com/pin/212795151139270085/,"Avocado Ranch: The Perfect Dipping Sauce | Recipe | Avacado ranch dressing, Avocado ranch sauce with mayo, Healthy avocado ranch dip with mayo",2,2026-06-20 13:48:55
https://www.pinterest.com/pin/212795151139267664/,Must Try Crispy Fried Green Beans,15,2026-06-20 13:48:55
https://www.pinterest.com/pin/212795151139265024/,"No Fold Blanket Dumplings | Recipe | Dumplings without folding dough, Easy dumpling no folding with dough sheet, Homemade chicken tenders",16,2026-06-20 13:48:56
https://www.pinterest.com/pin/212795151139264983/,"Lemon Pepper Chicken Kabobs | Chicken kabobs for a crowd, Chicken breast kabobs recipes with peppers, Chicken kabobs on the grill",2,2026-06-20 13:48:56
https://www.pinterest.com/pin/212795151139260089/,"Vietnamese Egg Coffee | Recipe | Coffe made with egg yolks, Coffee recipes with egg, Best party food",2,2026-06-20 13:48:57
https://www.pinterest.com/pin/212795151139262280/,"Cookie Salad | No bake chocolate pudding cookie salad, Pudding salad with buttermilk, Pudding cool whip buttermilk recipe",11,2026-06-20 13:48:57
https://www.pinterest.com/pin/212795151139260247/,"Mouthwatering Mushroom & Swiss Burger | Recipe | Swiss cheese burger topping, Swiss cheese burgers on stovetop, Grilled swiss cheese burgers",26,2026-06-20 13:48:57
https://www.pinterest.com/pin/212795151139253680/,"Strawberry Pie Made Simple | Recipe | Strawberry pie filling without clear jel, Strawberry pies with canned strawberry pie filling, Strawberry cheesecake chimichangas",14,2026-06-20 13:48:57
https://www.pinterest.com/pin/212795151139251247/,"Big Mac Inspired Smash Burger Tacos | Recipe | Ground beef and tortillas dinners, Burger tacos with lettuce, Ground beef taco recipes with lettuce",19,2026-06-20 13:48:57
https://www.pinterest.com/pin/212795151139250992/,"Strawberry Crunch Cake | Recipe | Crushed strawberry topping for cake, Strawberry cake with crushed strawberries on top, Strawberry crunch topping",3,2026-06-20 13:48:58
https://www.pinterest.com/pin/212795151139255674/,"Savory Grilled Mushrooms | Mushroom and onion on the grill, Grilled mushrooms with butter and garlic, Grilled mushrooms on the bbq",1,2026-06-20 13:49:00
https://www.pinterest.com/pin/212795151139245946/,"Quick and Delicious Peanut Butter Mug Cake | Recipe | Mug cake with peanut butter chips, Peanut butter chip microwave cake, Peanut butter microwave cup",20,2026-06-20 13:49:00
https://www.pinterest.com/pin/212795151139248421/,"Homemade Avocado Ranch | Recipe | Ranch with avocado, Homemade avocado ranch dipping sauce for tacos, Avocado ranch dip recipe",20,2026-06-20 13:49:00
https://www.pinterest.com/pin/212795151139241361/,"Grilled Hawaiian Chicken Pineapple Kabobs [Video] | Recipe | Chicken and pineapple kabobs, Pineapple chicken kabobs on the grill, Hawaiian chicken kabobs on the grill",46,2026-06-20 13:49:01
https://www.pinterest.com/pin/212795151139241209/,"Mexican Stuffed Shells for Taco Tuesday Fun | Recipe | Stuffed shells with beef mexican, Mexican stuffed shells ground beef, Stuffed shells with beef recipes for dinners",1,2026-06-20 13:49:01
https://www.pinterest.com/pin/212795151139245877/,"Refreshing Strawberry Piña Colada Recipe | Tropical smoothie cafe frozen pineapple punch recipe, How to make strawberry pina colada, Strawberry pina colada drink recipe",1,2026-06-20 13:49:01
https://www.pinterest.com/pin/212795151139243573/,"Refreshing Rhubarb Slush | Recipe | Frozen drink with rhubarb, What to do with rhubarb, Rhubarb drink with alcohol",41,2026-06-20 13:49:01
https://www.pinterest.com/pin/212795151139238973/,"Mexican Style Shrimp Tacos | Recipe | Shrimp tacos grilled mexican, Summer party appetizers, Pork nachos",21,2026-06-20 13:49:01
https://www.pinterest.com/pin/212795151139235677/,"Homemade Popcorn Chicken Bowl | Mash potatoes and chicken breast, Mashed potatoes and chicken bowl recipe, Mashed potatoes bowl meals",33,2026-06-20 13:49:02
https://www.pinterest.com/pin/212795151139233289/,"Summer Grilled Mexican Street Corn | Recipe | Best sides for bbq chicken on the grill mexican street corn, Corn elote recipe, Mexican street corn recipe",28,2026-06-20 13:49:02
https://www.pinterest.com/pin/212795151139230252/,"BBQ Chicken Pasta | Recipe | Easy chicken barbecued pasta sauce, Easy bbq chicken and pasta, Bbq chicken with pasta",1,2026-06-20 13:49:03
https://www.pinterest.com/pin/212795151139230424/,"Snickers Mini Cheesecakes | Mini snickers cheesecakes, Snickers cheesecake recipe, Homemade snickers cheesecake",20,2026-06-20 13:49:03
https://www.pinterest.com/pin/212795151139227802/,"Strawberry Crunch Cake | Recipe | What to make with crushed strawberry’s, Strawberry cake with cream cheese icing, Strawberry cake with strawberry crunch topping",22,2026-06-20 13:49:05
https://www.pinterest.com/pin/212795151139225502/,"Minimal Effort Shredded Beef Tacos | Recipe | Taco with cooked beef, How to make tacos in slow cooker, Slow cooked beef",30,2026-06-20 13:49:05
https://www.pinterest.com/pin/212795151139225362/,"Raspberry Lemonade | Recipe | Berry punch recipe for kids, Nonalcoholic berry punch, Simple summer drink recipes",1,2026-06-20 13:49:05
https://www.pinterest.com/pin/212795151139223239/,"Refreshing Citrus Liqueur [Video] | Recipe | Lemon and everclear, Recipes that use everclear, Outdoor picnic food",10,2026-06-20 13:49:05
https://www.pinterest.com/pin/212795151139220674/,"Hawaiian Chicken Pineapple Kabobs | Recipe | Pineapple chicken cabobs, Easy chicken and pineapple kabobs, Chicken pineapple kabobs on the grill",30,2026-06-20 13:49:05
https://www.pinterest.com/pin/212795151139220588/,"Pico de Gallo Creation Made Easy | Recipe | Picanha recipe mexican, Easy mexican pico, Mexican pico de gallo recipe",61,2026-06-20 13:49:05
https://www.pinterest.com/pin/212795151139218132/,"Quick & Creamy Tuna Pasta Salad | Salad with tuna and cream cheese, Pasta salad recipes with tuna and red onion, Pasta salad with canned tuna and mayonnaise",48,2026-06-20 13:49:06
https://www.pinterest.com/pin/212795151139215408/,"Zesty Mexican Rice Casserole | Recipe | Mexican rice casserole in crockpot, Mexican rice casserole recipe with rotel, Cozy winter recipes",43,2026-06-20 13:49:07
https://www.pinterest.com/pin/212795151139215295/,"Strawberry Dumpling | Recipe | Strawberry pastry with cream, Baked strawberry dumplings with puff pastry, Summer fruit dumplings",2,2026-06-20 13:49:07
https://www.pinterest.com/pin/212795151139204319/,"The Best Chicken Salad Recipe | Creamy and Delicious | Lunch ideas to go, Cold lunch ideas, Chicken salads with pesto",2,2026-06-20 13:49:08
https://www.pinterest.com/pin/212795151139202227/,"Limoncello | Recipe | Limoncello recipe made with everclear, Everclear and lime recipes, Making limoncello",23,2026-06-20 13:49:08
https://www.pinterest.com/pin/212795151139199897/,"Easy to Make Stuffed Pepper Casserole | Recipe | Healthy ground beef bell pepper recipes, Stuffed bell peppers casserole with ground turkey, Ground beef and rice with bell peppers",78,2026-06-20 13:49:09
https://www.pinterest.com/pin/212795151139199810/,"Banana Upside Down Cake | Recipe | Easy banana upside down cake made with all purpose flour, What is a good substitute for a pineapple upside down cake mix, Upside down banana cake with buttermilk",3,2026-06-20 13:49:09
https://www.pinterest.com/pin/212795151139197251/,"Flavorful Slow Cooker Mexican Chicken | Recipe | Crock pot chicken with enchalada sauce and taco seasoning, Crockpot chicken with enchilada sauce and taco seasoning, Slow cooker chicken breast taco",23,2026-06-20 13:49:09
https://www.pinterest.com/pin/212795151139194265/,"Magnolia Bakery Inspired Banana Pudding | Recipe | Banana pudding recipe with vanilla wafers, Molly yeh banana pudding with vanilla wafer, Restaurant inspired recipes",25,2026-06-20 13:49:10
https://www.pinterest.com/pin/212795151139194106/,"Delicious Grilled Bacon Wrapped Asparagus Recipe | Bacon wrapped asparagus spears recipes, Asparagus and bacon recipe, Bacon wrapped asparagus on the grill",2,2026-06-20 13:49:10
https://www.pinterest.com/pin/212795151139191663/,"Sausage Ragu | Recipe | Pasta with sausage recipes, Spaghetti sauce recipes with sausage, Easy sausage pasta with spaghetti sauce",15,2026-06-20 13:49:10
https://www.pinterest.com/pin/212795151139189337/,"Simple Ingredient Strawberry Pancakes | Recipe | Strawberry pancakes with strawberries, Pancakes recipe easy with strawberries, Pancakes with strawberies",16,2026-06-20 13:49:11
https://www.pinterest.com/pin/212795151139189106/,"Lemon Poppy Seed Cake Everyone Will Adore | Recipe | Lemon and poppy seed cake, Lemon poppy seed cake with oil, Poppy seed cake with lemon frosting",3,2026-06-20 13:49:11
https://www.pinterest.com/pin/212795151139184303/,"Grape Salad | Grape and green salad, Grapes salad with green grapes, Summertime salads",17,2026-06-20 13:49:11
https://www.pinterest.com/pin/212795151139184204/,"Blueberry Vodka Smash | Recipe in 2026 | Easy summer drinks, Blueberry vodka, Sweet drinks",1,2026-06-20 13:49:11
https://www.pinterest.com/pin/212795151139186714/,"Refreshing Tequila Sunrise Cocktail [Video] | Tequila and orange juice drink, Cocktail drinks alcohol with tequila, Tequila sunrise drink",8,2026-06-20 13:49:11
https://www.pinterest.com/pin/212795151139181686/,"Herb-Infused Baked Pork Chops | Pork chop and rice in oven, Oven pork chops and rice recipes, Baked pork chops and rice recipe",22,2026-06-20 13:49:11
https://www.pinterest.com/pin/212795151139178754/,"Homemade Strawberry Pop Tarts Recipe | How to make strawberry pop tarts with jam, Pop tarts homemade with strawberry jam, Pop tarts filling with jam and glaze",17,2026-06-20 13:49:12
https://www.pinterest.com/pin/212795151139178673/,"Lemon Crumb Cake | Recipe | Lemon cake with frosting with lemon crumb, Cakes for summer, Light and fluffy lemon crumb cake by tondoughallie",3,2026-06-20 13:49:12
https://www.pinterest.com/pin/212795151139175721/,"Lemon Poppy Seed Cake | Recipe | Lemon poppy seed cake with lemon curd and buttermilk, Easy poppy seed cake without cake mix, Easy lemon poppyseed cake from scratch",31,2026-06-20 13:49:14
https://www.pinterest.com/pin/212795151139172502/,"Orange Rolls | Recipe | Breakfast recipes that start with an o, Orange rolls with dried orange slices, Orange roll with cake mix",25,2026-06-20 13:49:14
https://www.pinterest.com/pin/212795151139171830/,"Carrot Cake Cookie Cups Recipe | Carrot cake cookie cups no egg, Cinnamon roll cookie cups with frosting, Cookie cup flavors",2,2026-06-20 13:49:14
https://www.pinterest.com/pin/212795151139166816/,"Single Serving Strawberry Mug Cake [Video] | Easy desserts in a cup for one microwave, Single serving dessert with microwave, Homemade cheez its",16,2026-06-20 13:49:14
https://www.pinterest.com/pin/212795151139166626/,"Chocolate Chip Scones | Recipe | Chocolate scone from scratch, Buttery chocolate chip scones, How to make a chocolate chip scone",7,2026-06-20 13:49:15
https://www.pinterest.com/pin/212795151139169620/,"Simple Ingredient Chocolate Chip Pancakes | Recipe | Chocolate chip pancakes for kids, Pancake recipe with chocolate chips, Easy simple recipes for breakfast",31,2026-06-20 13:49:15
https://www.pinterest.com/pin/212795151139161909/,"Irresistible Veggie Pizza Pinwheels | Recipe | Vegetables for a party, Veggie pizza roll ups with ranch, Appetizers with vegies",20,2026-06-20 13:49:15
https://www.pinterest.com/pin/212795151139164345/,"Refreshing Tequila Sunrise with Orange Juice and Cherries | Tequila sunset drinks, Tequilla sunset, Tequila sunrise cocktail",11,2026-06-20 13:49:15
https://www.pinterest.com/pin/212795151139159394/,"Fruit Pizza with a Sugar Cookie Crust | Fruit pizza with store bought cookie crust, Fruit pizza recipes with store bought sugar cookies, Brunch cocktail recipes",19,2026-06-20 13:49:16
https://www.pinterest.com/pin/212795151139156303/,"Grilled Sweet Potatoes | Recipe | Grilled sweet potatos and chicken, Whole sweet potato recipes grilled, Grilling sweet potatoes",20,2026-06-20 13:49:16
https://www.pinterest.com/pin/212795151139153541/,"Korean Fried Chicken | Recipe | Asian fried chicken recipes, Korean chicken with green onions recipes, Fried chicken with green onions",24,2026-06-20 13:49:16
https://www.pinterest.com/pin/212795151139156227/,"Low Carb Baked Ham Recipe with Citrusy Glaze | Pineapple and ham baked, Glazes for ham with pineapple, Oven baked ham with pineapple",2,2026-06-20 13:49:16
https://www.pinterest.com/pin/212795151139161816/,"Honey Roasted Carrots | Recipe | Roasted carrots with honey and brown sugar, Roasted honey carrots side dish, Easter dinner carrots side",3,2026-06-20 13:49:16
https://www.pinterest.com/pin/212795151139147742/,"Deep Fried Italian Rice Balls [Video] | Breaded and fried rice and cheese balls, Fried rice and parmesan balls, What can be done with leftover fried rice",20,2026-06-20 13:49:17
https://www.pinterest.com/pin/212795151139147604/,"Easter Dessert: Carrot Cake | Recipe | Carrot cake recipes for easter, Quick easter desserts easy carrot cake, Easter carrot cake simple",1,2026-06-20 13:49:17
https://www.pinterest.com/pin/212795151139145180/,"Strawberry Mug Cake in 2026 | Dessert recipes easy, Best dessert recipes, Best mug cake recipes",14,2026-06-20 13:49:17
https://www.pinterest.com/pin/212795151139150300/,"Cheesy Pull Apart Garlic Bread | Healthy Foods Recipes | Cheese filled garlic bread, Pull apart cheese bread video, Garlic bread for a crowd parties",2,2026-06-20 13:49:19
https://www.pinterest.com/pin/212795151139144852/,"Banana Cookie with Cream Cheese Frosting | Recipe | Banana nut cookie with cream cheese frosting, Banana nut cookies with cream cheese icing, Cinnamon cream cheese frosting",1,2026-06-20 13:49:19
https://www.pinterest.com/pin/212795151139142361/,"Easter Side Dish: Savory Scalloped Potato and Ham | Recipe | Scolloped potatoes and ham, Ham and scalloped potatoes, Easter potatoes scalloped",4,2026-06-20 13:49:20
https://www.pinterest.com/pin/212795151139144688/,"Easter Appetizer: Classic Deviled Eggs | Recipe | Easter appetizer eggs, Deviled eggs with mayonnaise and mustard recipe, Deviled eggs easter",4,2026-06-20 13:49:20
https://www.pinterest.com/pin/212795151139142519/,"Savory Pickle Dip Pinwheels | Recipe | Cold pinwheels appetizers, Cold appetizers for wedding, Appetizers for a crowd pickle",22,2026-06-20 13:49:20
https://www.pinterest.com/pin/212795151139141538/,"Creamy Tomato Sausage Gnocchi: A Flavorful One-Pan Delight | Ground sausage gnocchi with sausage, Ground sausage and gnocchi recipe, Italian sausage gnocchi dish",5,2026-06-20 13:49:20
https://www.pinterest.com/pin/212795151139141318/,"Homemade Chicken Tenders Recipe | Chicken tenders party food, Batter dipped chicken tenders, Crispy chicken tenders platter",19,2026-06-20 13:49:21
https://www.pinterest.com/pin/212795151139139685/,"Cake Mix Cream Cheese Carrot Cake Cookies | Carrot cake cookies cake mix with cream cheese, Carrot and white chocolate cookie recipe made from a cake mix, Cake box cookie with carrit",37,2026-06-20 13:49:22
https://www.pinterest.com/pin/212795151139126390/,"Italian Rice Balls | Recipes using cooked rice, Appetizers made with rice, Rice balls with tomato sauce and cheese",12,2026-06-20 13:49:22
https://www.pinterest.com/pin/212795151139124115/,"Make Your Own Pepperoni Pizza Rolls | Recipe | Pizza dough for pepperoni pizza, Homemade pepperoni rolls without pizza dough, Pizza dough recipes for pepperoni rolls",29,2026-06-20 13:49:22
https://www.pinterest.com/pin/212795151139141366/,"Chicken Fried Chicken Recipe | Traditional fried chicken meal, Classic fried chicken meal, Chicken fried chicken easy",18,2026-06-20 13:49:22
https://www.pinterest.com/pin/212795151139124025/,"Nutella Crepes with Strawberries | Recipe | Crepes with strawberries and nutella, Crepe with strawberry and nutella, Peanut butter banana bread",2,2026-06-20 13:49:22
