url,title,saves,timestamp
https://www.pinterest.com/pin/212795151137136083/,"Baked Beans with Ground Beef | Recipe | Bbq beans with ground beef, Southern baked beans with ground turkey, Beans side dish",24,2026-07-12 13:12:52
https://www.pinterest.com/pin/212795151137131125/,"Thai Pineapple Fried Rice Recipe | Thai sides, Thai pineapple pork fried rice, Rice side",228,2026-07-12 13:12:52
https://www.pinterest.com/pin/smoked-ribs--212795151137123066/,"Juicy Smoked Ribs | Recipe | How to make fall off the bone ribs, Oven ribs fall off the bone pork, Easy fall off the bone ribs",570,2026-07-12 13:12:52
https://www.pinterest.com/pin/212795151137136186/,"Valentine's Day Strawberry Shortcake Cupcakes Recipe | Shortcake cupcake recipe, Strawberry cupcake recipes, Best strawberry shortcake",33,2026-07-12 13:12:54
https://www.pinterest.com/pin/56787645303113937/,"Homemade BBQ Sauce: Tangy, Sweet, and Smoky Goodness | Recipe | Homemade barbeque sauce easy, Homemade barbecue sauce meal, Home made bbq sauce easy",36,2026-07-12 13:12:57
https://www.pinterest.com/pin/212795151137110144/,"Cheesy Taco Dip Recipe | Mexican Food Appetizer | Easy mexican dip with cream cheese, Taco dip recipe with cream cheese, Cold taco dip with cream cheese",340,2026-07-12 13:12:57
https://www.pinterest.com/pin/212795151137098285/,"Homemade Onion Rings Recipe - One Kitchen A Thousand Ideas | Beer battered appetizers, Beer battered onion rings recipe",1642,2026-07-12 13:13:01
https://www.pinterest.com/pin/212795151137098167/,"Strawberry Pina Colada Recipe for Summer | Fruity summer drinks, Cocktail drinks alcoholic, Pineapple juice",2726,2026-07-12 13:13:01
https://www.pinterest.com/pin/212795151137098148/,"Easy Summer Corn Salad—An Easy Pasta Side for Summer! | Recipe | Corn pasta salad recipe, Corn pasta salad with dressing, Salad side dishes",1045,2026-07-12 13:13:02
https://www.pinterest.com/pin/212795151137098112/,"Ham and Bacon Cheesy Potatoes | Delicious Side Dish | Recipe | Cheesy ham dinner idea, Creamy ham potato recipe, Casserole dish",195,2026-07-12 13:13:02
https://www.pinterest.com/pin/212795151137098106/,"Creamy Sausage Gnocchi Recipe | One Pot Meal | Cheesy sausage one pot gnocchi, One pot creamy sausage gnocchi, One pan sausage gnocchi recipe",590,2026-07-12 13:13:04
https://www.pinterest.com/pin/212795151137097777/,"Summer Tortellini Salad Recipe | Tortellini recipes summer, Summer tortellini salad ideas, Pasta salad recipes",243,2026-07-12 13:13:04
https://www.pinterest.com/pin/212795151137097616/,"Kool Aid Pickles | Recipe | Koolaid pickles how to make, Red hot candy pickles, Homemade kool-aid pickles",24,2026-07-12 13:13:04
https://www.pinterest.com/pin/212795151137096130/,"Mixed Berry Danishes | Recipe | How to make berry danishes, Fruit-topped breakfast pastry, Delicious desserts",11,2026-07-12 13:13:06
https://www.pinterest.com/pin/212795151137095024/,"Chicken Caesar Pasta Salad | Recipe | Chicken ceasar salad with pasta, Pasta salad with chicken caesar dressing, Cheddar's chicken caesar pasta salad",47,2026-07-12 13:13:06
https://www.pinterest.com/pin/baked-beans-with-ground-beef--212795151137094684/,"Baked Beans With Ground Beef | Recipe | Bbq beans with ground beef, Southern baked beans with ground turkey, Beans side dish",4,2026-07-12 13:13:09
https://www.pinterest.com/pin/212795151137094454/,"Creamy Garlic Parmesan Tortellini Salad Recipe | Sides for tortellini dinners, Tortellini side dish recipes, Pasta salad recipes",82,2026-07-12 13:13:09
https://www.pinterest.com/pin/56787645303016844/,"Delicious Icebox Cake Recipe | Icebox cake recipe easy, Icebox cake recipe with cream cheese, Chocolate icebox cake",58,2026-07-12 13:13:09
https://www.pinterest.com/pin/56787645303016888/,"Blackberry Bourbon Smash Recipe | Blackberry lemon bourbon smash, How to make blackberry bourbon smash, Blackberry basil bourbon smash recipe",71,2026-07-12 13:13:09
https://www.pinterest.com/pin/212795151137088481/,"Easy and Delicious Chicken Fried Chicken Recipe | Homemade chicken fried chicken, Fried chicken with gravy, Homemade fried chicken with sauce",206,2026-07-12 13:13:10
https://www.pinterest.com/pin/212795151137088061/,"Easy Grilled Salmon with Corn Puree and Fennel Salad | Recipe | Salmon and fennel dinner salad, Sweet corn puree recipe, Broiled salmon with fennel salad",32,2026-07-12 13:13:13
https://www.pinterest.com/pin/212795151137087990/,"Horseradish Pickles Recipe | Horse radish pickles, Horseradish refrigerator pickles, Pickle recipes homemade",130,2026-07-12 13:13:13
https://www.pinterest.com/pin/47710077298002172/,"Lemon Pepper Chicken Kabobs | Good kabob recipes, Healthy kabobs, Baked kabob recipes",281,2026-07-12 13:13:13
https://www.pinterest.com/pin/sheet-pan-shrimp-boil--212795151137081078/,"Sheet Pan Shrimp Boil | Easy Summer Recipe | Shrimp boil in a pan, Shrimp boil in oven on baking sheet, Shrimp recipes",38,2026-07-12 13:13:14
https://www.pinterest.com/pin/56787645302970393/,"Easy Strawberry Margarita Jello Shots Recipe | Red jello shots recipe, Strawberry tequila jello shots, Fun jello shots",198,2026-07-12 13:13:14
https://www.pinterest.com/pin/47710077297995184/,"Fall Off The Bone Ribs {The Only Rib Recipe You'll Need} | How to make fall off the bone ribs, Oven ribs fall off the bone pork, Easy fall off the bone ribs",292,2026-07-12 13:13:15
https://www.pinterest.com/pin/212795151137072664/,"Korean Spicy Pork Bowls {A Sweet Heat Dish that is Full of Flavor} | Recipe | Spicy pork dish ideas, Korean pork bowl recipe, Spicy pork dinner",700,2026-07-12 13:13:16
https://www.pinterest.com/pin/212795151137045662/,"Raspberry Lemonade Floats | Recipe | Homemade slushie floats, Raspberry lemon sorbet mocktail recipe, Yummy drinks",14,2026-07-12 13:13:17
https://www.pinterest.com/pin/212795151137045664/,"Supreme Pizza Egg Rolls | Recipe | Egg roll pizza rolls, Pizza egg roll recipe, Eggrolls",147,2026-07-12 13:13:17
https://www.pinterest.com/pin/212795151137045657/,"Delicious Malibu Sunset Layer Cake | Recipe | Hawaiian sunset cake recipe, Summer fruit layered cake, Summer berry vanilla layer cake",26,2026-07-12 13:13:17
https://www.pinterest.com/pin/56787645302927583/,"Fancy Bourbon Smash Cocktail Recipe | Bourbon cocktails with fruit, Blackberry lemon bourbon smash, Bourbon berry cocktail",17,2026-07-12 13:13:19
https://www.pinterest.com/pin/56787645302927686/,"Delicious Key Lime Pie Bars | Recipe | Key lime pie squares bar recipes, Key lime pie bars recipe food dolls, 3 layer key lime pie bars",27,2026-07-12 13:13:19
https://www.pinterest.com/pin/lemon-brownies--212795151137045540/,"Lemon Brownies | Recipe | Easy lemon blondies, Homemade lemon blondie recipe, Lemon dessert recipes",44,2026-07-12 13:13:20
https://www.pinterest.com/pin/212795151137045533/,"Raspberry Icebox Cake for Summer | Recipe | Icebox cake with graham crackers, Raspberry icebox dessert, Chocolate raspberry icebox cake",21,2026-07-12 13:13:20
https://www.pinterest.com/pin/56787645302927466/,"The BEST Marry Me Chicken Recipe | How to cook chicken tikka masala, How to make marry me chicken keto, Marry me dinner recipes",217,2026-07-12 13:13:21
https://www.pinterest.com/pin/strawberry-sugar-cookies--56787645302927423/,"Strawberry Sugar Cookies—Great for Summer! | Recipe | Strawberry flavored cookies, Summer flavor cookies, Sugar cookie strawberry dessert",126,2026-07-12 13:13:21
https://www.pinterest.com/pin/212795151137045223/,"Garlic Butter Grilled Mushrooms Recipe | Grilling recipes mushrooms, Best mushrooms to grill, Mushroom grill recipes",24,2026-07-12 13:13:22
https://www.pinterest.com/pin/212795151137025435/,"Lemon Pepper Chicken {The Easiest and Best Grilled Chicken Recipe} | Lemon pepper chicken meal ideas, Lemon pepper chicken healthy, Chicken parmesan",46,2026-07-12 13:13:27
https://www.pinterest.com/pin/212795151137025368/,"Juicy Lucy Recipe - Tornadough Alli | How to make a juicy lucy, Juicy lucy burger ingredients, The best burger",32,2026-07-12 13:13:28
https://www.pinterest.com/pin/steak-kabobs-perfect-for-summer-grilling--212795151137019254/,"Steak Kabobs - Perfect for Summer Grilling | Recipe | Steak marinade for kabobs, Baked steak kabobs, Steak kabob recipes oven",2,2026-07-12 13:13:29
https://www.pinterest.com/pin/212795151137005216/,"Horseradish Pickles | Horseradish pickles recipe, Horseradish refrigerator pickles, Sweet and spicy horseradish pickles",268,2026-07-12 13:13:29
https://www.pinterest.com/pin/56787645302181672/,"Baked Pork Chops & Rice | Recipe | Baked pork chops oven boneless with rice, Baked pork chops and rice oven, Baked pork chops and rice recipe",3084,2026-07-12 13:13:30
https://www.pinterest.com/pin/56787645302181539/,"Pineapple Margaritas Recipe | Pineapples and cream margarita, Big batch pineapple margaritas recipe, Pineapple drinks",398,2026-07-12 13:13:30
https://www.pinterest.com/pin/56787645302181534/,"Slow Cooker Pulled BBQ Chicken Recipe | Pulled chicken crock pot recipes bbq, Bbq chicken pulled crockpot, Pulled chicken crockpot recipes",102,2026-07-12 13:13:31
https://www.pinterest.com/pin/56787645302176331/,"Fresh Strawberry Pie | Strawberry pie recipe with honey, Strawberry almond pie recipe, Easy strawberry pie recipe",1012,2026-07-12 13:13:35
https://www.pinterest.com/pin/56787645302176306/,"Lemon Pepper Chicken Kabobs - Tornadough Alli | Good kabob recipes, Healthy kabobs, Baked kabob recipes",1479,2026-07-12 13:13:35
https://www.pinterest.com/pin/56787645302171877/,"Chocolate Chip Banana Bread—Great for Mother's Day Breakfast or Brunch! | Recipe | Brunch ideas with chocolate chips, Banana bread recipe chocolate chip cinnamon, Chocolate chip banana bread variation",28,2026-07-12 13:13:36
https://www.pinterest.com/pin/212795151136989943/,"Chocolate Icebox Cake Recipe | Easy No Bake Dessert | Icebox cake recipe with chocolate pudding, Icebox cake with graham crackers, Chocolate dessert",40,2026-07-12 13:13:37
https://www.pinterest.com/pin/56787645302169622/,"Easy Slow Cooker Beer Brats | Recipe | Brats crockpot recipes, Loaded brats, Beer brats recipe",32,2026-07-12 13:13:37
https://www.pinterest.com/pin/212795151136992352/,"Slow Cooker Beer Brats Recipe | Beer brat slow cooker, Beer brats in crock pot, Best dinner recipes",36,2026-07-12 13:13:39
https://www.pinterest.com/pin/56787645302171991/,"Grilled Italian Sausage Sandwiches | Recipe | Italian sausage sub sandwich, Grilled italian sausage recipes, How to make italian sausage sandwiches",27,2026-07-12 13:13:39
https://www.pinterest.com/pin/212795151136989801/,"Homemade Baked Beans - Tornadough Alli | Recipe | Homemade bbq baked beans, From scratch baked beans, Baked beans recipe oven",115,2026-07-12 13:13:40
https://www.pinterest.com/pin/212795151136989860/,"Homemade Lemon Brownies | Recipe | Fudgy lemon brownies recipe, Easy lemon brownies recipe, Lemon flavor",60,2026-07-12 13:13:40
https://www.pinterest.com/pin/56787645302169509/,"3-Ingredient Strawberry Mousse Recipe | Strawberry puree desserts, Strawberry mousse recipe from scratch, Strawberry mousse dessert with sauce",39,2026-07-12 13:13:40
https://www.pinterest.com/pin/212795151136974936/,"Fall Off The Bone Ribs | Recipe | Fall ribs recipe, How to make fall off the bone ribs, Oven ribs fall off the bone pork",399,2026-07-12 13:13:45
https://www.pinterest.com/pin/47710077297779902/,"Tender Fall Off The Bone Ribs | Recipe | Fall off the bone ribs in oven, Fall off the bone ribs recipe, Tender ribs",1163,2026-07-12 13:13:45
https://www.pinterest.com/pin/56787645302154502/,"Easiest Fruit Pizza | Recipe | Baked fruit desserts healthy, Healthy fruit pizza ideas, Best sugar cookie recipe for fruit pizza",105,2026-07-12 13:13:46
https://www.pinterest.com/pin/56787645302154445/,"Homemade Pancake Muffins | Recipe | Muffins from pancake mix recipes, Pancake mix banana muffins, Homemade banana muffins in pan",113,2026-07-12 13:13:46
https://www.pinterest.com/pin/no-bake-coconut-cheesecake--56787645302138108/,"Easy No Bake Coconut Cheesecake | Recipe | Coconut food recipes, Coconut cream cheesecake no bake, Easy coconut cheesecake",291,2026-07-12 13:13:46
https://www.pinterest.com/pin/56787645302154365/,"Delicious Blueberry Jam | Recipe | Best blueberry jam, Easy homemade blueberry jam, Blueberry jam recipes",48,2026-07-12 13:13:47
https://www.pinterest.com/pin/56787645302137751/,"Copycat Wendy's Frosty Recipe | Wendys copycat frosty, Wendy's frosty copycat recipe, Dessert recipes",107,2026-07-12 13:13:47
https://www.pinterest.com/pin/212795151136957829/,"Garlic Butter Pasta | Recipe | Garlic butter pasta with vegetables, Quick butter pasta meal, Butter and garlic pasta",22,2026-07-12 13:13:48
https://www.pinterest.com/pin/212795151136963286/,"How to Make Blueberry Jam | Recipe | Homemade blueberry jam recipe, Blueberry jam with pectin, Strawberry jam recipes",18,2026-07-12 13:13:49
https://www.pinterest.com/pin/parmesan-crusted-chicken-recipe--212795151136969098/,"Parmesan Crusted Chicken Recipe | 3 ingredient parmesan crusted chicken, Parmesan crusted chicken meal, Parmesan crusted chicken no bread crumbs",34,2026-07-12 13:13:50
https://www.pinterest.com/pin/212795151136968392/,"Lemon Pepper Chicken {The Easiest and Best Grilled Chicken Recipe} | Grilled lemon pepper chicken, Grilled chicken recipes easy, Chicken parmesan",29,2026-07-12 13:13:50
https://www.pinterest.com/pin/56787645302058404/,"Tender and Juicy Marry Me Chicken | Recipe | How to cook chicken tikka masala, How to make marry me chicken keto, Marry me dinner recipes",485,2026-07-12 13:13:53
https://www.pinterest.com/pin/56787645302058341/,"Easy Homemade Fruit Pizza | Recipe | Homemade fruit pizza dessert, Simple fruit pizza, Fruit pizza with homemade crust",75,2026-07-12 13:13:53
https://www.pinterest.com/pin/56787645302058389/,"Overnight French Toast Bake {An Easy Breakfast Solution} | Recipe | Baked french toast recipe overnight, French toast bake not overnight",413,2026-07-12 13:13:54
https://www.pinterest.com/pin/56787645302058218/,"Strawberry Cupcakes | Strawberry cupcakes with strawberry filling, Strawberries & cream cupcakes, Cupcake with strawberry and straw",48,2026-07-12 13:13:54
https://www.pinterest.com/pin/bacon-ranch-pasta-salad--56787645302058150/,"Bacon Ranch Pasta Salad | Recipe | Bacon ranch pasta salad recipes cold, Pickle bacon ranch pasta salad, Easy pasta salad",76,2026-07-12 13:13:54
https://www.pinterest.com/pin/56787645301947197/,"Homemade Baked Beans—Great for Summer! | Recipe | Baked beans dish with herbs, Baked beans recipe using bushes baked beans, Easy jack daniels baked beans",97,2026-07-12 13:13:55
https://www.pinterest.com/pin/212795151136937648/,"The BEST Strawberry Pop-Tarts—Great for Snack Time, Breakfast, and Brunch! | Recipe | Recipe with strawberry jam, Strawberry jam dessert recipes, Delicious strawberry",163,2026-07-12 13:13:56
https://www.pinterest.com/pin/56787645301498041/,"Hearty Tater Tot Breakfast Casserole with Bacon, Sausage, and Cheese | Breakfast casserole with tater tots and bacon, Bacon tator tot breakfast casserole, Breakfast recipes casserole",310,2026-07-12 13:13:59
https://www.pinterest.com/pin/212795151136933960/,"Creamy Root Beer Rum Cocktail - Tornadough Alli | Homemade root beer drink, Creamy alcoholic drinks recipes, Rootbeer cocktail recipes",3337,2026-07-12 13:14:01
https://www.pinterest.com/pin/mojo-pork-chops-with-cilantro-sour-cream-rice-recipe--212795151136929759/,"Mojo Pork Chops with Cilantro Sour Cream Rice Recipe | Pork chop dinner side dishes, Mexican pork chop dinner ideas, Pork chops and rice recipes",130,2026-07-12 13:14:04
https://www.pinterest.com/pin/tiktok-grinder-sandwich--212795151136926103/,"TikTok Grinder Sandwich | Recipe | Tik tok grinder sandwich recipe, Best sandwich recipes",334,2026-07-12 13:14:08
https://www.pinterest.com/pin/212795151136925970/,"Chicken Fried Chicken - Tornadough Alli | Recipe | Traditional fried chicken meal, Classic fried chicken meal, Southern fried chicken and gravy",7431,2026-07-12 13:14:08
https://www.pinterest.com/pin/212795151136919595/,"How to Make Walking Tacos | Recipe | Walking tacos recipe, Taco recipes ground beef, Night time snacks",46,2026-07-12 13:14:08
https://www.pinterest.com/pin/212795151136913104/,"Easy Dirty Soda | Recipe | Dirty soda recipe non alcoholic, Creamer in soda, Dirty soda drink ideas",169,2026-07-12 13:14:11
https://www.pinterest.com/pin/212795151136912801/,"Almond Croissants Recipe with Almond Cream Filling | Almond croissant recipe easy, Almond croissant recipe from scratch, Homemade almond croissants",80,2026-07-12 13:14:11
https://www.pinterest.com/pin/56787645301473495/,"Southern Banana Pudding | Classic Dessert Recipe | Southern banana pudding recipe homemade, How to make banana pudding with vanilla pudding, Vanilla wafer pudding",1559,2026-07-12 13:14:11
https://www.pinterest.com/pin/212795151136910848/,"Creamy Bacon Cheddar Ranch Pasta Salad | Recipe | Bacon ranch pasta salad recipe, Bacon ranch pasta salad with mayo, Dinner recipes",7,2026-07-12 13:14:12
https://www.pinterest.com/pin/212795151136910244/,"Easy cheesecake bar ideas | Recipe | Cheesecake bar treats, Cheesecake bar recipes easy, Dessert bars",343,2026-07-12 13:14:12
https://www.pinterest.com/pin/how-to-make-the-perfect-chicken-tenders--47710077297713496/,"How to Make the Perfect Chicken Tenders | Recipe | Homemade chicken tenders with ranch, Best homemade chicken tenders, Homemade chicken tenders fried",536,2026-07-12 13:14:13
https://www.pinterest.com/pin/47710077297710376/,"Marry Me Chicken | Recipe | Oven roasted dinners, Marry me chicken recipe oven, What to serve with marry me chicken",68,2026-07-12 13:14:13
https://www.pinterest.com/pin/the-best-dirty-sodagreat-for-summer--212795151136904925/,"The BEST Dirty Soda—Great for Summer! | Recipe | Dirty soda recipe non alcoholic, Creamer in soda, Dirty soda drink ideas",13,2026-07-12 13:14:14
https://www.pinterest.com/pin/56787645301456797/,"Easy Strawberry Mousse Recipe | Fluffy strawberry mousse recipe, Easy strawberry mousse dessert, Strawberry mousse dessert recipe",19,2026-07-12 13:14:16
https://www.pinterest.com/pin/56787645301456751/,"Slow Cooker Shredded Mexican Chicken | Recipe | Mexican style shredded chicken, Mexican shredded chicken stovetop, Mexican chicken recipe",18,2026-07-12 13:14:17
https://www.pinterest.com/pin/tuna-melt-recipe--56787645301456650/,"Tuna Melt Recipe | Tuna melt sandwich ideas, How to make a tuna melt with tomato, Easy tuna melt",46,2026-07-12 13:14:19
https://www.pinterest.com/pin/56787645301453401/,"New York Cheesecake with Cherries | Recipe | Cheesecake bars with cherry filling, Cheesecake bars with cherry topping, Cherry cheesecake bars recipe",45,2026-07-12 13:14:20
https://www.pinterest.com/pin/212795151136892097/,"Irish Coffee Recipe | Easy and Delicious | Best whiskey for irish coffee, Jameson irish coffee recipe, Homemade irish coffee ingredients",36,2026-07-12 13:14:22
https://www.pinterest.com/pin/muffuletta-sandwich-recipe--212795151136889640/,"Muffuletta Recipe | Easy muffuletta sandwich, Muffuletta sandwich ideas, Muffaletta sandwich near me",3,2026-07-12 13:14:25
https://www.pinterest.com/pin/212795151136889186/,"Vanilla Bean Pistachio Cake {A Delicious, Light, Flavorful Cake} | Recipe | Vanilla pistachio cake, Pistachio birthday cake recipe, Pistachio buttercream cake",486,2026-07-12 13:14:26
https://www.pinterest.com/pin/212795151136888952/,"Creamy and Fluffy Strawberry Mousse | Recipe | Strawberry puree desserts, Strawberry mousse dessert with sauce, Fluffy strawberry mousse recipe",36,2026-07-12 13:14:28
https://www.pinterest.com/pin/212795151136885409/,"The Ultimate Easter Menu | Easter dinner menu with ham, Easter meats besides ham, Typical easter meal",14,2026-07-12 13:14:29
https://www.pinterest.com/pin/212795151136882388/,"Fruit Pizza | Recipe | Easy fruit pizza, Fruit pizza dessert, Fruit pizza ideas",2691,2026-07-12 13:14:32
https://www.pinterest.com/pin/56787645301433670/,"Traditional Carrot Cake Recipe with Cream Cheese Buttercream | Best frosting for carrot cake, Best icing for carrot cake, Best carrot cake for parties",256,2026-07-12 13:14:33
https://www.pinterest.com/pin/56787645301433764/,"Easy Fruit Pizza | Recipe | Easy fruit pizza recipe, Fruit pizza with cream cheese, Homemade pizza with fruit",152,2026-07-12 13:14:33
https://www.pinterest.com/pin/56787645300917247/,"Strawberries and Cream Oatmeal Recipe | Strawberry oatmeal with oats, Homemade strawberry oatmeal, Strawberry oatmeal with fresh fruit",31,2026-07-12 13:14:39
https://www.pinterest.com/pin/56787645300917199/,"Easy and Tart Lemon Brownies | Recipe | Fudgy lemon brownies recipe, Moist fudgy lemon brownies, Easy lemon brownie recipe",87,2026-07-12 13:14:41
https://www.pinterest.com/pin/56787645300917021/,"Homemade Strawberry Pop Tarts Recipe | Strawberry pop tart recipe, How to make strawberry pop tarts, Strawberry pop tarts breakfast",46,2026-07-12 13:14:42
https://www.pinterest.com/pin/56787645300916905/,"Bisquick Quiche | Easy Breakfast Recipe | Breakfast with bisquick, Bisquick quiche recipes simple, Bisquick impossible quiche recipe",435,2026-07-12 13:14:42
https://www.pinterest.com/pin/easy-fruit-pizzaperfect-for-breakfast-brunch-or-dessert-in-2024--212795151136851474/,"Easy Fruit Pizza—Perfect for Breakfast, Brunch, or Dessert! | Recipe | Simple fruit pizza recipe, Dessert pizza with fruit, Homemade pizza with fruit",112,2026-07-12 13:14:42
https://www.pinterest.com/pin/56787645300639000/,"Easter Menu Inspiration: Explore Delicious Options for Your Perfect Meal | Best easter dinner, Easter dinner ideas pinterest, Easter dinner menus",119,2026-07-12 13:14:44
https://www.pinterest.com/pin/56787645300638975/,"Easy Strawberry Mousse | Recipe | Strawberry puree desserts, Strawberry mousse dessert with sauce, Fluffy strawberry mousse recipe",23,2026-07-12 13:14:46
https://www.pinterest.com/pin/56787645300638958/,"Instant Pot BBQ Ribs | Recipe | Best instant pot bbq ribs, Easy instant pot bbq ribs, Instant pot ribs recipe",24,2026-07-12 13:14:46
https://www.pinterest.com/pin/212795151136845720/,"Easy Summer Corn Salad | Recipe | Corn salad with tomatoes and onions, Grilled corn and tomato salad, Two-corn summer salad",33,2026-07-12 13:14:47
https://www.pinterest.com/pin/212795151136845749/,"Strawberry Shortcake Bars Recipe | Simple vanilla icing, Easy strawberry shortcake, Make strawberry shortcake",31,2026-07-12 13:14:47
https://www.pinterest.com/pin/56787645300427147/,"Delicious Strawberry Dumplings | Recipe | Easy strawberry dumplings, How to make strawberry dumplings, Easy and delicious",259,2026-07-12 13:14:48
https://www.pinterest.com/pin/212795151136846874/,"Refreshing Malibu Bay Breeze Cocktail | Recipe | Easy mixed drinks with malibu rum, Fruity drinks with malibu, Summer cocktail recipes",23,2026-07-12 13:14:48
https://www.pinterest.com/pin/212795151136845354/,"Tortellini Carbonara | Recipe | Amazing dinners, Summer meal ideas dinners, Tortellini carbonara pasta dish",527,2026-07-12 13:14:51
https://www.pinterest.com/pin/47710077297643879/,"Copycat Olive Garden Chicken Gnocchi Soup Recipe—A Comforting, Warm Meal! | Simple chicken gnocchi soup, Chicken gnocchi soup with artichokes, Chicken an gnocchi soup",701,2026-07-12 13:14:51
https://www.pinterest.com/pin/56787645300410429/,"Homemade Chicken Tenders | Recipe | Homemade chicken tenders with ranch, Best homemade chicken tenders, Homemade chicken tenders fried",537,2026-07-12 13:14:52
https://www.pinterest.com/pin/212795151136836586/,"Easy Lemon Brownies | Recipe | Fudgy lemon brownies recipe, Moist fudgy lemon brownies, Easy lemon brownie recipe",15,2026-07-12 13:14:53
https://www.pinterest.com/pin/212795151136834813/,"Tuna Melt Recipe | What goes good with a tuna melt, Tuna melt recipe sandwiches, Easy tuna melt",289,2026-07-12 13:14:53
https://www.pinterest.com/pin/56787645300410580/,"Club Sandwich Recipe - Tornadough Alli | Best club sandwich, Classic club sandwich, Deluxe sandwich",75,2026-07-12 13:14:53
https://www.pinterest.com/pin/212795151136820534/,"Hibachi Noodles Recipe - Easy Asian Dish | Simple asian noodles, Hibachi noodles at home, Homemade chinese noodles",21,2026-07-12 13:14:58
https://www.pinterest.com/pin/212795151136820833/,"Sourdough Pop Tarts with Brown Sugar Cinnamon and Frosted Strawberry Fillings | Recipe | Sourdough discard pop tarts brown sugar, Sourdough poptarts, Pop tart filling ideas",302,2026-07-12 13:14:59
https://www.pinterest.com/pin/slow-cooker-shredded-mexican-chicken-recipe--212795151136820260/,"Slow Cooker Shredded Mexican Chicken Recipe | Mexican shredded chicken recipes crockpot, Mexican chicken slow cooker recipes, Mexican shredded chicken crockpot easy",158,2026-07-12 13:14:59
https://www.pinterest.com/pin/56787645300400697/,"Strawberry Banana Poke Cake: A Fun Flavorful Summertime Dessert | Strawberry banana desserts easy, Strawberry banana poke cake recipe, Delicious desserts",171,2026-07-12 13:14:59
https://www.pinterest.com/pin/56787645300390673/,"Crispy Air Fryer Frozen French Fries in Minutes | Recipe | Frozen fries in deep fryer, Frozen fry recipes, Frozen fries in air fryer",183,2026-07-12 13:15:05
https://www.pinterest.com/pin/47710077297612488/,"Marry Me Chicken—Tender and Savory! | Recipe | How to cook chicken tikka masala, How to make marry me chicken keto, Marry me dinner recipes",1354,2026-07-12 13:15:05
https://www.pinterest.com/pin/classic-irish-coffee-recipe-with-whisky--212795151136804113/,"Classic Irish Coffee Recipe with Whisky | Homemade irish coffee recipe, Traditional irish coffee recipe, Coffee drinks",3,2026-07-12 13:15:06
https://www.pinterest.com/pin/212795151136802744/,"Cinnamon Sugar Muffins Recipe: Easy and Delicious | Cinnamon roll muffins, Donut muffins, Cinamon muffins",31,2026-07-12 13:15:08
