url,title,saves,timestamp
https://www.pinterest.com/pin/212795151135134437/,"Delicious Smothered Potatoes Recipe | Smothered potatoes in oven, How to make smothered potatoes, Southern smothered potatoes",22,2026-05-26 19:52:32
https://www.pinterest.com/pin/212795151135134472/,"Fall Off The Bone Ribs Recipe | Back rib recipes, Bone in rib recipe, Ribs oven",17001,2026-05-26 19:52:32
https://www.pinterest.com/pin/212795151135134406/,"Apple Fritter Bread | Recipe | Scrumptious desserts, Apple fritter bread recipe, Apple pie",9,2026-05-26 19:52:32
https://www.pinterest.com/pin/212795151135132782/,"Braided Apple Puff Pastry Recipe | Quick and Easy Dessert | Easy apple pastry tutorial, Apple caramel puff pastry braid, Apple butter puff pastry braid",6,2026-05-26 19:52:32
https://www.pinterest.com/pin/56787645297377036/,"Pumpkin Cheesecake Pie | Pumpkin pie cheesecake, Pumpkin cheesecake, Pumpkin pie recipes",5,2026-05-26 19:52:33
https://www.pinterest.com/pin/56787645297376791/,Olive Garden Chicken Gnocchi Soup: Best Recipes,359,2026-05-26 19:52:33
https://www.pinterest.com/pin/540361655306039881/,"Pumpkin Patch Cookies | Recipe | Chocolate covered cookies, Halloween food desserts, Halloween food treats",5,2026-05-26 19:52:34
https://www.pinterest.com/pin/212795151135128095/,"Slow Cooker Pizza Recipe | Buffalo chicken sandwiches, Slow cooker meatballs, Homemade pizza dough",3,2026-05-26 19:52:37
https://www.pinterest.com/pin/45036065015285654/,"Delicious Struffoli with Honey and Sprinkles | Recipe | Best struffoli recipe, Baked struffoli recipe, Struffoli recipe traditional",26,2026-05-26 19:52:37
https://www.pinterest.com/pin/slow-cooker-pizza--212795151135123249/,"Slow Cooker Pizza Recipe | Homemade pizza, Pizza dough, Pizza pizzazz",51,2026-05-26 19:52:37
https://www.pinterest.com/pin/212795151135123259/,"Cream Horns: Crunchy, Sweet, and Creamy | Recipe | Chocolate cream horns, Cream horn dessert, Cream horn recipe",60,2026-05-26 19:52:37
https://www.pinterest.com/pin/212795151135123027/,"30 Minute Ground Beef Stroganoff Recipe | Beef stroganoff with ground turkey, Ground beef stroganoff recipe healthy, Ground beef stroganoff recipe no mushrooms",7,2026-05-26 19:52:37
https://www.pinterest.com/pin/56787645297364042/,"Butterbeer Recipe | Butterscotch beer recipe, Easy butterbeer, Butterbeer recipe with beer",42,2026-05-26 19:52:38
https://www.pinterest.com/pin/wendys-chili-copycat--212795151135122558/,"Wendy's Chili Recipe | Wendys chilli recipes, Wendy's chilli, Wendys chili recipe",102,2026-05-26 19:52:39
https://www.pinterest.com/pin/56787645297351545/,"Apple Fritter Bread Recipe | Scrumptious desserts, Apple pie",4,2026-05-26 19:52:41
https://www.pinterest.com/pin/mini-halloween-cheesecakes--212795151135108099/,"Mini Halloween Cheesecakes Recipe | Halloween desserts, Halloween food treats, Like cheesecake",99,2026-05-26 19:52:41
https://www.pinterest.com/pin/212795151135108389/,"Apple Cider Mimosas Recipe | Apple cider mimosa recipe, Flavored liquor, Fall drink",17,2026-05-26 19:52:41
https://www.pinterest.com/pin/56787645297346876/,"Twice Baked Sweet Potatoes Recipe | Vegan twice baked sweet potatoes, Twice baked sweet potatoes with caramelized onions, Baked sweet potatoes with rosemary",30,2026-05-26 19:52:41
https://www.pinterest.com/pin/212795151135108081/,"Cinnamon Crescent Rolls: Tornadough Alli | Recipe | Cinnamon cresent rolls, Super easy breakfast, Crescent roll recipes dessert",11,2026-05-26 19:52:41
https://www.pinterest.com/pin/212795151135110737/,"Creepy and Cute Halloween Dirt Cake | Recipe | Pumpkin patch dirt cake, Halloween dirt cake recipe easy, Halloween dessert cake",7,2026-05-26 19:52:41
https://www.pinterest.com/pin/212795151135108014/,"Mini Halloween Cheesecakes | Recipe | Cocoa powder cookies, Chocolate whipped cream, Cheesecake flavor",17,2026-05-26 19:52:41
https://www.pinterest.com/pin/212795151135107905/,"Steak Fingers | Recipe | Finger steak batter recipe, Homemade steak fingers, Hand breaded steak fingers",354,2026-05-26 19:52:41
https://www.pinterest.com/pin/212795151135101638/,"Make Your Own Taco Bell Nacho Fries at Home | Recipe | How to make taco bell fries, Taco bell fries ingredients, Taco bell fries recipe",77,2026-05-26 19:52:44
https://www.pinterest.com/pin/easy-beef-stir-fry--212795151135101450/,"Easy Beef Stir Fry | Beef recipes, Ground beef, Beef dish",195,2026-05-26 19:52:45
https://www.pinterest.com/pin/212795151135101324/,"Maple Dijon Pork Tenderloin Recipe | Stuffed pork tenderloin, Baked pork chops, Best pork tenderloin recipe",4,2026-05-26 19:52:46
https://www.pinterest.com/pin/212795151135092109/,"Sweet Potato Pie Recipe | Easy sweet potato pie recipe simple, Recipe for sweet potato pie without crust, Easy homemade sweet potato pie",5,2026-05-26 19:52:48
https://www.pinterest.com/pin/45036065015254962/,"No Bake Mint Chocolate Cheesecake Recipe | Mint cheesecake topping, Homemade mint cheesecake recipe, Mint chocolate cheesecake no bake",4,2026-05-26 19:52:48
https://www.pinterest.com/pin/212795151135091979/,"Chocolate Chip Pumpkin Blondies | Recipe | Pumpkin bread pudding, Chocolate chip blondies, Caramel bits",13,2026-05-26 19:52:48
https://www.pinterest.com/pin/45036065015254589/,"Chocolate Chip Pumpkin Pudding Pie Recipe | Pumpkin pie with pudding recipe, Thanksgiving pudding desserts, Chocolate chip pumpkin pie",5,2026-05-26 19:52:48
https://www.pinterest.com/pin/slow-cooker-sausage-stuffing--212795151135091718/,"Slow Cooker Sausage Stuffing Recipe | Crockpot sausage stuffing thanksgiving, Crock pot sausage stuffing thanksgiving",2232,2026-05-26 19:52:49
https://www.pinterest.com/pin/45036065015254440/,"Pumpkin Truffles - Tornadough Alli | Recipe | Expensive chocolate, Pumpkin spice treats, Truffles recipe",7,2026-05-26 19:52:49
https://www.pinterest.com/pin/crock-pot-easy-apple-crumble--56787645297327925/,"Crockpot Easy Apple Crumble | Recipe | Crock pot desserts, Slow cooker desserts, Apple crumble crockpot",7,2026-05-26 19:52:49
https://www.pinterest.com/pin/212795151135091245/,"German Chocolate Cake Recipe | German chocolate cake with coconut filling, German chocolate cake with cocoa powder, Kenneth temple german chocolate cake",64,2026-05-26 19:52:50
https://www.pinterest.com/pin/apple-cinnamon-cake--212795151135089499/,Apple Cinnamon Cake - Tornadough Alli,4,2026-05-26 19:52:50
https://www.pinterest.com/pin/47710077295906804/,"Crockpot French Dips | Recipe | Beer french dip slow cooker, Crock pot french dip slow cooker, Easy slow cooker french dip",8,2026-05-26 19:52:50
https://www.pinterest.com/pin/pumpkin-patch-cookies--212795151135087367/,"Pumpkin Patch Cookies Recipe | Dog cookies recipe easy pumpkin, How to make pumpkin cookie dough, Pumpkin dog treats no peanut butter",131,2026-05-26 19:52:50
https://www.pinterest.com/pin/212795151135085061/,"Pumpkin Bread Pudding Recipe: A Fall Delight for Brunch or Dessert! | Easy pumpkin bread pudding, Pumpkin bread pudding recipes, Pumpkin custard",847,2026-05-26 19:52:51
https://www.pinterest.com/pin/212795151135084489/,"Easy Beef Stir Fry Recipe | New recipes for dinner, Tender beef, Simple stir fry",4,2026-05-26 19:52:51
https://www.pinterest.com/pin/212795151135085211/,"Slow Cooker Beer Brats | Food and drink, Cooking methods, Slow cooking | Recipe | Beer brats recipe, Brats dinner, Slow cooker brats",7,2026-05-26 19:52:51
https://www.pinterest.com/pin/212795151135084510/,"Arancini | Recipe | Arancini recipe, Fried mac and cheese, Italian appetizers",2,2026-05-26 19:52:53
https://www.pinterest.com/pin/45036065015245872/,"Best Apple Crisp Recipe with Crispy Oatmeal Topping | How to make apple crisp in the oven, How to make apple crisp easy, How to make apple crisp with pecans",7,2026-05-26 19:52:54
https://www.pinterest.com/pin/212795151135077502/,"Pumpkin Patch Cookies: A Fun Fall Dessert Idea | Recipe | Chocolate covered cookies, Halloween food desserts, Halloween food treats",2,2026-05-26 19:52:57
https://www.pinterest.com/pin/212795151135077494/,"Arancini Recipe | Golden fried arancini, Arancini recipe easy, Fried arancini with tomato sauce",35,2026-05-26 19:52:57
https://www.pinterest.com/pin/212795151135075609/,"Monster Cookies Recipe: Scrumptious Desserts and Sweets | Easy monster cookie baking, How to decorate monster cookies, Pumpkin monster cookies recipe",95,2026-05-26 19:52:57
https://www.pinterest.com/pin/the-best-lasagna-tornadough-alli--56787645297310378/,"The Best Homemade Lasagna | Recipe | Italian lasagna slice on plate, Layered lasagna with meat sauce, Lasagna slice with fresh herbs",8,2026-05-26 19:52:57
https://www.pinterest.com/pin/56787645297306642/,"Cream Horns Recipe | Delicious Pastry Dessert | Pastries recipes dessert, Tasty pastry, Puff pastry cream puffs",11,2026-05-26 19:52:58
https://www.pinterest.com/pin/56787645297305928/,"Kringla Recipe: What Is Kringla? | Easy kringla recipe, How to make kringla, Kringla dessert",5,2026-05-26 19:52:58
https://www.pinterest.com/pin/212795151135070742/,"The Best Lasagna | Recipe | Italian sausage lasagna, Homemade meat sauce, Best lasagna recipe",7,2026-05-26 19:52:58
https://www.pinterest.com/pin/212795151135070684/,"Pumpkin Patch Cookies: Easy No Bake Recipe | Pumpkin patch cookie ideas, Halloween pumpkin cookies and candy, Pumpkin patch themed cookies",15,2026-05-26 19:52:59
https://www.pinterest.com/pin/56787645297303735/,"TikTok Grinder Sandwich | Recipe | Tik tok grinder sandwich recipe, How to make the viral tiktok grinder sandwich, Best sandwich recipes",13,2026-05-26 19:53:00
https://www.pinterest.com/pin/the-best-lasagna--212795151135067888/,"Best Lasagna Recipe with Homemade Meat Sauce | Italian lasagna slice on plate, Layered lasagna with meat sauce, Lasagna slice with fresh herbs",61,2026-05-26 19:53:01
https://www.pinterest.com/pin/breakfast-sausage-recipe--56787645297303462/,"Breakfast Sausage Recipe: Best Recipes | Homemade breakfast sausage recipe, Breakfast crunchwrap, Leftover breakfast",19,2026-05-26 19:53:01
https://www.pinterest.com/pin/212795151135068049/,"Delicious Slow Cooker Jambalaya Recipe | Jambalaya crock pot recipe healthy, Slow cooker chicken jambalaya, Forgotten jambalaya",19,2026-05-26 19:53:01
https://www.pinterest.com/pin/homemade-star-crunch--56787645297302530/,"Homemade Star Crunch: Blogger Recipes We Love | Star crunch copycat recipe, Crunchie fudge recipe, No bake desserts",44,2026-05-26 19:53:01
https://www.pinterest.com/pin/peanut-butter-halloween-brownies--212795151135063305/,"Peanut Butter Halloween Brownies | Fudge brownie mix, Cookies brownies",135,2026-05-26 19:53:04
https://www.pinterest.com/pin/212795151135061103/,"Homemade Star Crunch Recipe | Star crunch copycat recipe, Crunchie fudge recipe, No bake desserts",17,2026-05-26 19:53:04
https://www.pinterest.com/pin/45036065015224675/,"Braided Apple Puff Pastry: Delicious Desserts | Easy apple puff pastry recipes, Apple strudel recipe puff pastry, Apple recipes with puff pastry",11,2026-05-26 19:53:04
https://www.pinterest.com/pin/56787645297292984/,"Christmas Mimosas Recipe with Cranberry Spritz | Christmas brunch drinks, Christmas mimosas ideas, Christmas cocktails",3,2026-05-26 19:53:05
https://www.pinterest.com/pin/peppermint-hot-chocolate--56787645297294347/,"Peppermint Hot Chocolate Recipe for Winter Nights | How to make peppermint hot chocolate, Perfect holiday beverage, Christmas hot cocoa",16,2026-05-26 19:53:06
https://www.pinterest.com/pin/copycat-starbucks-medicine-ball-tea--56787645297292658/,"Copycat Starbucks Medicine Ball Tea: Blogger Recipes We Love | Medicine ball drink recipe, Starbucks copycat honey citrus mint tea, Starbucks medicine ball recipe",7,2026-05-26 19:53:06
https://www.pinterest.com/pin/56787645297293192/,"Copycat Prantl's Burnt Almond Torte: BHG's Best Recipes | Almond torte cake recipe, Burnt almond torte recipe, Almond desserts",2,2026-05-26 19:53:06
https://www.pinterest.com/pin/45036065015221902/,"Cream Puffs Recipe: Tornadough Alli | Lithuanian curd cheese doughnuts, Traditional lithuanian dessert - skruzdelynas, Serbian pastries",1,2026-05-26 19:53:06
https://www.pinterest.com/pin/212795151135058436/,"Breakfast Sausage Recipe | Homemade breakfast sausage recipe, Breakfast crunchwrap, Leftover breakfast",2,2026-05-26 19:53:06
https://www.pinterest.com/pin/melted-snowman-cookies-tornadough-alli--212795151135055988/,"Melted Snowman Cookies: Perfect for the Holidays! | Recipe | How to make melted snowman cookies, Melted snowman cookies recipe, Melting snowman cookie recipe",7,2026-05-26 19:53:09
https://www.pinterest.com/pin/slow-cooker-shredded-beef-tacos--212795151135055342/,"Slow Cooker Shredded Beef Tacos | Taco toppings, Tacos burritos, Beef dinner",170,2026-05-26 19:53:09
https://www.pinterest.com/pin/212795151135055257/,"Fireball Hard Cider | Recipe | Summer fireball cider drink, Fireball and apple cider, Fireball whiskey",72,2026-05-26 19:53:09
https://www.pinterest.com/pin/212795151135055299/,"Homemade Breakfast Sausage Recipe | Best breakfast sausage options, How to cook breakfast sausage links, Sausage recipies",37,2026-05-26 19:53:09
https://www.pinterest.com/pin/56787645297288415/,"Delicious Chewy Molasses Cookies | Recipe | Crumbl cookie copycat molasses, Homemade molasses cookies, Sugar spun run molasses cookies",2,2026-05-26 19:53:10
https://www.pinterest.com/pin/45036065015215414/,"Grinch Cookie Bars - Festive Christmas Dessert Recipe | Grinch cookie dough, Grinch bars, Christmas desserts",3,2026-05-26 19:53:10
https://www.pinterest.com/pin/56787645297284586/,Pumpkin Chocolate Chip Cookies: Blogger Recipes We Love,3,2026-05-26 19:53:10
https://www.pinterest.com/pin/212795151135049262/,"Melted Snowman Cookies | Recipe | How to make melted snowman cookies, Melted snowman cookies recipe, Melting snowman cookie recipe",5,2026-05-26 19:53:11
https://www.pinterest.com/pin/56787645297280241/,"Chewy Sugar Cookies | Recipe | Chewy sugar cookies, Chewy sugar cookie recipe, Easy cookie recipes",1,2026-05-26 19:53:11
https://www.pinterest.com/pin/212795151135046673/,"Cranberry Orange Bundt Cake Recipe | Cranberry orange cake easy, Cranberry cake with orange juice, Cranberry orange bundt cake with pineapple",7,2026-05-26 19:53:12
https://www.pinterest.com/pin/110338259614576803/,"Easy Banana Bread Recipe: Tornadough Alli | Easy banana bread recipe 4 bananas, Easy quick banana bread, Easy homemade banana bread",18,2026-05-26 19:53:14
https://www.pinterest.com/pin/slow-cooker-shredded-beef-tacos--56787645297270910/,"Slow Cooker Shredded Beef Tacos: BHG's Best Recipes | Shredded beef taco recipes, Shredded beef taco tuesday, Shredded beef taco crockpot",4,2026-05-26 19:53:14
https://www.pinterest.com/pin/45036065015200738/,"Cinnamon Sugar Mini Donuts Recipe | Berry pancakes, Chocolate glazed donuts, Pancake bites",3,2026-05-26 19:53:14
https://www.pinterest.com/pin/maple-dijon-pork-tenderloin--212795151135039560/,"Maple Dijon Pork Tenderloin Recipe | Pork tenderloin recipes, Pork dishes",81,2026-05-26 19:53:16
https://www.pinterest.com/pin/45036065015198774/,"Chocolate Chip Cake: Best Food Blogger Recipes | Homemade ganache, Chocolate chip cake recipe, Marble cake recipes",11,2026-05-26 19:53:17
https://www.pinterest.com/pin/212795151135037400/,"Beer Can Chicken: Easy Dinners | Recipe | Beer can chicken sides dishes, Beer can chicken recipe with beer, Best beer can chicken",32,2026-05-26 19:53:17
https://www.pinterest.com/pin/212795151135032831/,"Baked Italian Subs | Flavorful Meats and Cheeses on a Toasted Hoagie Roll | Recipe | Hot hoagie sandwich recipes, Toasted subs sandwiches, Homemade italian subs",216,2026-05-26 19:53:17
https://www.pinterest.com/pin/56787645297256120/,"Veggie Pizza Pinwheels Recipe | Vegetable roll ups for party, Veggie pinwheel appetizers, Vegetable pizza",10,2026-05-26 19:53:19
https://www.pinterest.com/pin/56787645297254387/,"Apple Cider Mimosas: Tornadough Alli | Recipe | How to make a caramel apple mimosa, Fall apple cider mimosa, How to make caramel apple cider mimosas",5,2026-05-26 19:53:20
https://www.pinterest.com/pin/47710077295840856/,"TikTok Grinder Sandwich: BHG's Best Recipes | Tik tok grinder sandwich recipe, How to make the viral tiktok grinder sandwich, Best sandwich recipes",516,2026-05-26 19:53:20
https://www.pinterest.com/pin/56787645297254905/,The BEST Fireball Hard Cider,4,2026-05-26 19:53:20
https://www.pinterest.com/pin/56787645297252796/,"Peanut Butter &amp; Jelly Poke Cake | Peanut butter and jelly poke cake, Poke cake recipes, Peanut butter frosting",6,2026-05-26 19:53:21
https://www.pinterest.com/pin/212795151135017906/,"No Bake Cheesecake Bites: Easy and Delicious Desserts | Recipe | Cheesecake bites recipes no bake, Easy cheesecake bites no bake, No bake cheesecake bites with cream cheese",1255,2026-05-26 19:53:23
https://www.pinterest.com/pin/56787645297245493/,"Maple Bourbon Pecan Pie: Blogger Recipes We Love | Maple bourbon recipes, Bourbon maple pecan pie, Pie recipe with bourbon",2,2026-05-26 19:53:23
https://www.pinterest.com/pin/chocolate-chip-pumpkin-cupcakes-tornadough-alli--56787645297244899/,"Best Chocolate Chip Pumpkin Cupcakes for Fall | Recipe | Chocolate chip cupcakes recipe, Homemade chocolate buttercream frosting, Cake mix cupcakes",3,2026-05-26 19:53:23
https://www.pinterest.com/pin/56787645297235050/,"Classic Ground Beef Stroganoff Recipe | How to make beef stroganoff on the stove, Steak and mushroom stroganoff, Easy beef stroganoff recipe from scratch",7,2026-05-26 19:53:30
https://www.pinterest.com/pin/hot-buttered-rum--56787645297233667/,"Hot Buttered Rum: Best Recipes | Hot buttered rum recipe, Strawberry mojito, Rum drinks easy",27,2026-05-26 19:53:30
https://www.pinterest.com/pin/56787645297235720/,"Halloween Cookie Bars | Recipe | Halloween bars and cookies, Halloween bars dessert, Halloween bars recipes",6,2026-05-26 19:53:30
https://www.pinterest.com/pin/56787645297233186/,"Delicious Pumpkin Bread with Maple Glaze | Recipe | Pumpkin bread pudding, Good pie, Pumpkin bread recipe",7,2026-05-26 19:53:31
https://www.pinterest.com/pin/56787645297231565/,"Irresistible Almond Cheesecake Bars for a Sweet Tooth Fix! | Recipe | Almond cream cheese bars, Slice of almond cheesecake, Almond desserts",10,2026-05-26 19:53:31
https://www.pinterest.com/pin/229754018487237638/,"Easy No Bake Banana Cheesecake Bars | Recipe | Easy banana cheesecake, Banana cheesecake recipe no bake, Banana cream cheesecake",14,2026-05-26 19:53:32
https://www.pinterest.com/pin/easy-chocolate-waffles--212795151135000082/,"Decadent Chocolate Waffles | Recipe | How to make chocolate waffles with bisquick, Homemade chocolate waffles recipe, Pancakes waffles",24,2026-05-26 19:53:32
https://www.pinterest.com/pin/47710077295814196/,"Pizza Grilled Cheese | Delicious Sandwich Recipe | Grilled cheese sandwich hacks, How to make grilled cheese sandwich with pepperoni, Pizza grilled cheese recipes",10,2026-05-26 19:53:34
https://www.pinterest.com/pin/56787645297228034/,"Pumpkin Banana Bread Recipe: BHG's Best Recipes | Moist pumpkin banana cake bread, Pumpkin and banana bread, No bake pumpkin desserts",6,2026-05-26 19:53:34
https://www.pinterest.com/pin/45036065015163038/,"Irresistible Chocolate Chip Pumpkin Blondies | Recipe | Pumpkin chocolate chip brownies, Pumpkin chocolate chip blondies, Easy pumpkin chocolate chip bars",10,2026-05-26 19:53:34
https://www.pinterest.com/pin/apple-hand-pies--45036065015162465/,"Apple Hand Pies | Recipe | Apple hand pies, Apple recipes, Hand pies",27,2026-05-26 19:53:35
https://www.pinterest.com/pin/apple-cinnamon-cake--212795151134997479/,"Apple Cinnamon Cake Recipe | Apple desserts, Apple recipes easy",130,2026-05-26 19:53:36
https://www.pinterest.com/pin/212795151134997172/,"Ground Beef Stroganoff Recipe | How to make beef stroganoff on the stove, Steak and mushroom stroganoff, Easy beef stroganoff recipe from scratch",30,2026-05-26 19:53:36
https://www.pinterest.com/pin/56787645297215739/,"Bubble Tea Recipe (Boba Tea): The Busy Mama's Go-To Recipes | Boba tea flavor options, Bubble tea flavor options, Easy bubble tea recipe",4,2026-05-26 19:53:38
https://www.pinterest.com/pin/56787645297216324/,"Braided Apple Puff Pastry Recipe: Tornadough Alli | Easy apple puff pastry recipes, Apple strudel recipe puff pastry, Apple recipes with puff pastry",39,2026-05-26 19:53:38
https://www.pinterest.com/pin/slow-cooker-pumpkin-hot-chocolate--56787645297216352/,"Slow Cooker Pumpkin Hot Chocolate: !Delicious Recipes! | Pumpkin spice hot chocolate crockpot, Hot chocolate recipes, Pumpkin recipes",32,2026-05-26 19:53:39
https://www.pinterest.com/pin/56787645297212688/,"Egg in a Hole - Quick & Easy Breakfast Recipe: Tornadough Alli | Egg in a hole recipe easy, Egg in a hole skillet, Eggs and toast",5,2026-05-26 19:53:39
https://www.pinterest.com/pin/pizza-grilled-cheese--212795151134984454/,"Pizza Grilled Cheese - A Delicious Twist on a Classic Sandwich | Grilled cheese sandwiches, Pizza sauce, Grilled cheese recipes",210,2026-05-26 19:53:39
https://www.pinterest.com/pin/56787645297210696/,Tortellini alla Panna,1,2026-05-26 19:53:41
https://www.pinterest.com/pin/212795151134972920/,"Homemade Slow Cooker Barbacoa Beef Recipe | How to make barbacoa recipes, What is barbacoa beef, How to make barbacoa slow cooker",10,2026-05-26 19:53:43
https://www.pinterest.com/pin/212795151134971106/,"Creamy and Hearty Tortellini alla Panna Recipe | Tortellini and ham recipes, Tortellini carbonara pasta dish, Ham and tortellini pasta",1,2026-05-26 19:53:43
https://www.pinterest.com/pin/56787645297201808/,"Classic Apple Pie Recipe | All recipes apple pie, White chocolate apple pie, Apple pie in white dish",8,2026-05-26 19:53:44
https://www.pinterest.com/pin/45036065015138155/,Apple Fritter Bread Recipe: Scrumptious Desserts and Sweets | Apple pie,10,2026-05-26 19:53:45
https://www.pinterest.com/pin/56787645297196714/,"Taco Spaghetti Recipe: The BEST EASY dinner recipes | One pot cajun pasta, Chicken pesto sandwich, Creamy cajun shrimp pasta",11,2026-05-26 19:53:47
https://www.pinterest.com/pin/56787645297196640/,"Cheese Grits: Best Food Blogger Recipes Out There | Crispy fried chicken breast, Cheese grits recipe, Grits recipe creamy",6,2026-05-26 19:53:47
https://www.pinterest.com/pin/yellow-cake--45036065015137631/,"The BEST Yellow Cake Recipe: Delicious Desserts | Gold cake recipe, How to make yellow cake, Yellow cake homemade",4,2026-05-26 19:53:47
https://www.pinterest.com/pin/45036065015137448/,"Hello Dolly Bars: Delicious Recipes | Perfect bar recipe, Classic brownies recipe, Sweet treats",5,2026-05-26 19:53:47
https://www.pinterest.com/pin/56787645297189006/,"Beef steak recipes | Hawaiian dishes, Creamed onions, Loco moco recipe",36,2026-05-26 19:53:49
https://www.pinterest.com/pin/212795151134959735/,"Applebee's Honey Pepper Chicken Mac and Cheese: The Best Easy Dinner Recipes | Applebee's honey pepper chicken mac and cheese recipe, Copycat applebee's honey pepper chicken mac and cheese",6,2026-05-26 19:53:50
https://www.pinterest.com/pin/212795151134959173/,"Olive Garden Chicken Gnocchi Soup Copycat Recipe | Olive garden chicken gnocchi soup recipe, Copycat olive garden chicken gnocchi",676,2026-05-26 19:53:50
https://www.pinterest.com/pin/tiktok-ramen--212795151134956407/,"Upgrade Your Ramen with This TikTok Recipe | How to make tiktok ramen, Tiktok ramen noodles, Ramen dinner",45,2026-05-26 19:53:52
https://www.pinterest.com/pin/56787645297187237/,"Fudge Brownies | Recipe | Fudge brownies, Desserts, Scrumptious desserts",5,2026-05-26 19:53:52
https://www.pinterest.com/pin/212795151134955527/,"Migas Recipe | How to make migas with tortillas, How to make migas with chorizo, Migas recipe mexican breakfast",32,2026-05-26 19:53:52
https://www.pinterest.com/pin/apple-hand-pies--212795151134955490/,"Apple Hand Pies Recipe | Mini pumpkin apple pies, Pumpkin apple hand pies, Homemade pumpkin hand pies",25,2026-05-26 19:53:52
https://www.pinterest.com/pin/56787645297182703/,"Baked Italian Subs: BHG's Best Recipes | How to make italian sub in a tub, Oven baked italian subs, Hot italian sub recipe",16,2026-05-26 19:53:53
https://www.pinterest.com/pin/212795151134952775/,"Honey Bun Bread Pudding: Dessert Recipes | Bread pudding recipe, Honey buns, Pudding sweet",4,2026-05-26 19:53:54
https://www.pinterest.com/pin/hot-honey-with-chicken-tenders--56787645297172057/,"Hot Honey (with Chicken Tenders): BHG's Best Recipes | Homemade chicken tenders, Hot honey chicken, Fried breaded chicken tenders",42,2026-05-26 19:53:57
https://www.pinterest.com/pin/212795151134945176/,"Easy Apple Dumplings with a Twist of Sprite! | Recipe | Apple dumplings with crescent rolls, Crescent roll apple dumplings recipe",8,2026-05-26 19:53:57
https://www.pinterest.com/pin/45036065015117410/,"Funnel Cakes Recipe with Strawberries | Baked funnel cake recipe, How to make funnel cake with pancake batter, Funnel cake recipe no eggs",11,2026-05-26 19:53:57
https://www.pinterest.com/pin/56787645297168084/,"Fall Off The Bone Ribs | Recipe | Stay at home chef, Bbq dinner, Beef",13,2026-05-26 19:53:59
https://www.pinterest.com/pin/212795151134938857/,"5 Seriously Good Gin and Prosecco Cocktails to Raise a Glass To! | Recipe | Bellini with peach juice, Peach mango bellini drink, Bellini with peach nectar",11,2026-05-26 19:53:59
https://www.pinterest.com/pin/apple-cinnamon-muffins--56787645297165430/,"Delicious Apple Cinnamon Muffins Recipe | Fall apple cinnamon muffins, Moist apple cinnamon muffins, Stack of apple muffins",5,2026-05-26 19:53:59
https://www.pinterest.com/pin/212795151134938835/,"Hot Honey (with Chicken Tenders) | Recipe | Homemade chicken tenders, Hot honey chicken, Fried breaded chicken tenders",12,2026-05-26 19:54:00
