url,title,saves,timestamp
https://www.pinterest.com/pin/212795151139347718/,212795151139347718,5,2026-06-14 13:50:18
https://www.pinterest.com/pin/212795151139347715/,212795151139347715,1,2026-06-14 13:50:18
https://www.pinterest.com/pin/212795151139349797/,212795151139349797,3,2026-06-14 13:50:18
https://www.pinterest.com/pin/212795151139345499/,212795151139345499,7,2026-06-14 13:50:18
https://www.pinterest.com/pin/212795151139336420/,212795151139336420,8,2026-06-14 13:50:20
https://www.pinterest.com/pin/212795151139333775/,212795151139333775,10,2026-06-14 13:50:20
https://www.pinterest.com/pin/212795151139331927/,212795151139331927,13,2026-06-14 13:50:20
https://www.pinterest.com/pin/212795151139338727/,212795151139338727,1,2026-06-14 13:50:20
https://www.pinterest.com/pin/212795151139333697/,212795151139333697,1,2026-06-14 13:50:20
https://www.pinterest.com/pin/212795151139329479/,212795151139329479,1,2026-06-14 13:50:20
https://www.pinterest.com/pin/212795151139327171/,212795151139327171,9,2026-06-14 13:50:20
https://www.pinterest.com/pin/212795151139329583/,212795151139329583,10,2026-06-14 13:50:20
https://www.pinterest.com/pin/212795151139319949/,212795151139319949,13,2026-06-14 13:50:20
https://www.pinterest.com/pin/212795151139324872/,Uh oh! Too Many Requests,0,2026-06-14 13:50:21
https://www.pinterest.com/pin/212795151139309704/,212795151139309704,2,2026-06-14 13:50:22
https://www.pinterest.com/pin/212795151139309718/,212795151139309718,11,2026-06-14 13:50:22
https://www.pinterest.com/pin/212795151139312775/,212795151139312775,65,2026-06-14 13:50:22
https://www.pinterest.com/pin/212795151139305203/,212795151139305203,17,2026-06-14 13:50:22
https://www.pinterest.com/pin/212795151139306679/,212795151139306679,7,2026-06-14 13:50:22
https://www.pinterest.com/pin/212795151139307514/,212795151139307514,15,2026-06-14 13:50:22
https://www.pinterest.com/pin/212795151139304729/,212795151139304729,4,2026-06-14 13:50:22
https://www.pinterest.com/pin/212795151139300401/,Hurricane Cocktail,11,2026-06-14 13:50:22
https://www.pinterest.com/pin/212795151139300361/,Grilled Hawaiian Chicken Pineapple Kabobs for Summer,1,2026-06-14 13:50:23
https://www.pinterest.com/pin/212795151139285864/,"Slow Cooker Sunday Roast | Slow cooker sunday roast recipes, Sunday slow cooker meals",1,2026-06-14 13:50:25
https://www.pinterest.com/pin/212795151139286163/,"Aromatic Summer Corn Salad | Grilled corn and tomatoes, Corn and tomato and pepper salad",14,2026-06-14 13:50:25
https://www.pinterest.com/pin/212795151139290616/,Hearty Breakfast Burrito Recipe for Busy Mornings,2,2026-06-14 13:50:25
https://www.pinterest.com/pin/212795151139288653/,Tender Ribs that Fall Off the Bone,11,2026-06-14 13:50:25
https://www.pinterest.com/pin/212795151139283147/,"Blueberry Lemonade | Lemonade with blueberries, Lemonade with blueberry juice, Homemade blueberry lemonade recipe",8,2026-06-14 13:50:25
https://www.pinterest.com/pin/212795151139280327/,"Blackened Shrimp | What can i do with shrimp, How long to cook blackened shrimp, Blackened shrimp with canned veggies",10,2026-06-14 13:50:25
https://www.pinterest.com/pin/212795151139280267/,"Summer Tortellini Salad | Tortellini salad recipes cold with feta sauce, Cold tortellini salad recipes easy, Fresh vegetables",6,2026-06-14 13:50:25
https://www.pinterest.com/pin/212795151139275416/,"How to Make a Caprese Pasta Salad [Video] | Salad with pasta and mozz, Summer cold pasta dishes, Easy pasta recipes cold",13,2026-06-14 13:50:25
https://www.pinterest.com/pin/212795151139277982/,"Crispy & Crunchy Chicken Fried Chicken | Breading for fried chicken, How to make crispy chicken fried chicken, Crispy chicken fried chicken with sauce",15,2026-06-14 13:50:25
https://www.pinterest.com/pin/212795151139275266/,"Smoky Corn on the Cob | Smoked corn on the cob with butter and cheese, Grilled corn on the cob on grill with butter and corn syrup, Smoked corn on the cob in butter",2,2026-06-14 13:50:26
https://www.pinterest.com/pin/212795151139272783/,"Crispy Chicken Caesar Sandwiches | Ceaser chicken sandwhich with coctle sauce, Caesar salad with chickenc, Crispy chicken ceaser and grilled",15,2026-06-14 13:50:26
https://www.pinterest.com/pin/212795151139270208/,"Family Favorite Crockpot Cheesy Potatoes | Quick easy cheese potatoes, Crockpot cheesy potatoes easy for a crowd, Easy cheese potatoes for a crowd",26,2026-06-14 13:50:26
https://www.pinterest.com/pin/212795151139264983/,"Lemon Pepper Chicken Kabobs | Chicken kabobs for a crowd, Chicken breast kabobs recipes with peppers, Chicken kabobs on the grill",1,2026-06-14 13:50:28
https://www.pinterest.com/pin/212795151139260089/,"Vietnamese Egg Coffee | Coffe made with egg yolks, Coffee recipes with egg, Best party food",2,2026-06-14 13:50:28
https://www.pinterest.com/pin/212795151139260247/,"Mouthwatering Mushroom & Swiss Burger | Swiss cheese burger topping, Swiss cheese burgers on stovetop, Grilled swiss cheese burgers",24,2026-06-14 13:50:28
https://www.pinterest.com/pin/212795151139262280/,"Cookie Salad | No bake chocolate pudding cookie salad, Pudding salad with buttermilk, Pudding cool whip buttermilk recipe",11,2026-06-14 13:50:28
https://www.pinterest.com/pin/212795151139253680/,"Strawberry Pie Made Simple | Strawberry pie filling without clear jel, Strawberry pies with canned strawberry pie filling, Strawberry cheesecake chimichangas",13,2026-06-14 13:50:28
https://www.pinterest.com/pin/212795151139258312/,"Crowd Pleasing Strawberry Crunch Cake [Video] | Strawberry crunch with cool whip icing, Easy strawberry crunch cake with coolwhip frosting, Strawberry crunch cake icing",96,2026-06-14 13:50:28
https://www.pinterest.com/pin/212795151139255674/,"Savory Grilled Mushrooms | Mushroom and onion on the grill, Grilled mushrooms with butter and garlic, Grilled mushrooms on the bbq",1,2026-06-14 13:50:29
https://www.pinterest.com/pin/212795151139255945/,"Caprese Pasta Salad | Light and Delicious Side Dish | Easy side dishes for lunch pot luck, Cold salads for bbq lunch, Summer caprese pasta salad recipe",22,2026-06-14 13:50:29
https://www.pinterest.com/pin/212795151139251247/,"Big Mac Inspired Smash Burger Tacos | Ground beef and tortillas dinners, Burger tacos with lettuce, Ground beef taco recipes with lettuce",19,2026-06-14 13:50:29
https://www.pinterest.com/pin/212795151139248421/,"Homemade Avocado Ranch | Ranch with avocado, Homemade avocado ranch dipping sauce for tacos, Avocado ranch dip recipe",18,2026-06-14 13:50:29
https://www.pinterest.com/pin/212795151139250992/,"Strawberry Crunch Cake | Crushed strawberry topping for cake, Strawberry cake with crushed strawberries on top, Strawberry crunch topping",3,2026-06-14 13:50:30
https://www.pinterest.com/pin/212795151139238973/,"Mexican Style Shrimp Tacos | Recipe | Shrimp tacos grilled mexican, Outdoor picnic food, Summer party appetizers",21,2026-06-14 13:50:31
https://www.pinterest.com/pin/212795151139235677/,"Homemade Popcorn Chicken Bowl | Mash potatoes and chicken breast, Mashed potatoes and chicken bowl recipe, Mashed potatoes bowl meals",30,2026-06-14 13:50:31
https://www.pinterest.com/pin/212795151139241209/,"Mexican Stuffed Shells for Taco Tuesday Fun | Stuffed shells with beef mexican, Mexican stuffed shells ground beef, Stuffed shells with beef recipes for dinners",1,2026-06-14 13:50:31
https://www.pinterest.com/pin/212795151139235614/,"Strawberry Lemon Donuts | Colorful and Delicious Breakfast | Recipe | Donuts with sprinkles, Coulours food, Food pictures",1,2026-06-14 13:50:31
https://www.pinterest.com/pin/212795151139233289/,"Summer Grilled Mexican Street Corn | Recipe | Best sides for bbq chicken on the grill mexican street corn, Mexican street corn recipe, Corn on the cob",27,2026-06-14 13:50:31
https://www.pinterest.com/pin/212795151139225502/,"Minimal Effort Shredded Beef Tacos | Recipe | Taco with cooked beef, How to make tacos in slow cooker, Slow cooked beef",29,2026-06-14 13:50:31
https://www.pinterest.com/pin/212795151139230252/,"BBQ Chicken Pasta | Recipe | Easy chicken barbecued pasta sauce, Easy bbq chicken and pasta, Bbq chicken with pasta",1,2026-06-14 13:50:31
https://www.pinterest.com/pin/212795151139230424/,"Snickers Mini Cheesecakes | Recipe | Mini snickers cheesecakes, Snickers cheesecake recipe, Homemade snickers cheesecake",20,2026-06-14 13:50:31
https://www.pinterest.com/pin/212795151139227802/,"Strawberry Crunch Cake | Recipe | What to make with crushed strawberry’s, Strawberry cake with cream cheese icing, Strawberry cake with strawberry crunch topping",21,2026-06-14 13:50:32
https://www.pinterest.com/pin/212795151139225362/,"Raspberry Lemonade | Recipe | Berry punch recipe for kids, Nonalcoholic berry punch, Simple summer drink recipes",1,2026-06-14 13:50:32
https://www.pinterest.com/pin/212795151139223239/,"Refreshing Citrus Liqueur [Video] | Recipe | Lemon and everclear, Recipes that use everclear, Outdoor picnic food",10,2026-06-14 13:50:32
https://www.pinterest.com/pin/212795151139220674/,"Hawaiian Chicken Pineapple Kabobs | Recipe | Pineapple chicken cabobs, Easy chicken and pineapple kabobs, Chicken pineapple kabobs on the grill",31,2026-06-14 13:50:33
https://www.pinterest.com/pin/212795151139209629/,"Vietnamese Egg Coffee | Recipe | Vietnamese egg coffee made with instant coffee, How to make the perfect cup of coffee with a egg, What is in vietnamese egg coffee",10,2026-06-14 13:50:34
https://www.pinterest.com/pin/212795151139215295/,"Strawberry Dumpling | Strawberry pastry with cream, Baked strawberry dumplings with puff pastry, Summer fruit dumplings",2,2026-06-14 13:50:34
https://www.pinterest.com/pin/212795151139212325/,"Lemon Olive Oil Cake Recipe | Torte Test Kitchen | What to bake with olive oil, Olive oil cake with lemons, Desserts with olive oil",15,2026-06-14 13:50:34
https://www.pinterest.com/pin/212795151139209490/,"Orange Rolls | Baking recipes for the home, Sweet breakfasts to make at home, Baked goods for sale easy",2,2026-06-14 13:50:34
https://www.pinterest.com/pin/212795151139207117/,"Red Beans & Rice in the Slow Cooker | Recipe | Southern red beans and rice with canned beans recipe crockpot, Crockpot red beans and rice dry, Crockpot red beans and rice with smoked turkey wing",19,2026-06-14 13:50:34
https://www.pinterest.com/pin/212795151139204319/,"The Best Chicken Salad Recipe | Creamy and Delicious | Lunch ideas to go, Cold lunch ideas, Chicken salads with pesto",2,2026-06-14 13:50:34
https://www.pinterest.com/pin/212795151139204481/,Effortless Grape Salad,13,2026-06-14 13:50:34
https://www.pinterest.com/pin/212795151139199897/,"Easy to Make Stuffed Pepper Casserole | Healthy ground beef bell pepper recipes, Stuffed bell peppers casserole with ground turkey, Ground beef and rice with bell peppers",73,2026-06-14 13:50:34
https://www.pinterest.com/pin/212795151139202227/,"Limoncello | Recipe | Limoncello recipe made with everclear, Everclear and lime recipes, Making limoncello",23,2026-06-14 13:50:35
https://www.pinterest.com/pin/212795151139197251/,"Flavorful Slow Cooker Mexican Chicken | Recipe | Crock pot chicken with enchalada sauce and taco seasoning, Crockpot chicken with enchilada sauce and taco seasoning, Slow cooker chicken breast taco",22,2026-06-14 13:50:35
https://www.pinterest.com/pin/212795151139194265/,"Magnolia Bakery Inspired Banana Pudding | Recipe | Banana pudding recipe with vanilla wafers, Molly yeh banana pudding with vanilla wafer, Homemade banana pudding recipe",25,2026-06-14 13:50:35
https://www.pinterest.com/pin/212795151139199810/,"Banana Upside Down Cake | Recipe | Easy banana upside down cake made with all purpose flour, What is a good substitute for a pineapple upside down cake mix, Upside down banana cake with buttermilk",3,2026-06-14 13:50:35
https://www.pinterest.com/pin/212795151139186714/,"Refreshing Tequila Sunrise Cocktail [Video] | Recipe | Tequila and orange juice drink, Cocktail drinks alcohol with tequila, Tequila sunrise drink",8,2026-06-14 13:50:37
https://www.pinterest.com/pin/212795151139189106/,"Lemon Poppy Seed Cake Everyone Will Adore | Lemon and poppy seed cake, Lemon poppy seed cake with oil, Poppy seed cake with lemon frosting",3,2026-06-14 13:50:37
https://www.pinterest.com/pin/212795151139184303/,"Grape Salad | Recipe | Grape and green salad, Grapes salad with green grapes, Outdoor picnic food",17,2026-06-14 13:50:37
https://www.pinterest.com/pin/212795151139184204/,"Blueberry Vodka Smash | Recipe in 2026 | Easy summer drinks, Blueberry vodka, Sweet drinks",1,2026-06-14 13:50:37
https://www.pinterest.com/pin/212795151139181686/,"Herb-Infused Baked Pork Chops | Recipe | Pork chop and rice in oven, Oven pork chops and rice recipes, Baked pork chops and rice recipe",22,2026-06-14 13:50:37
https://www.pinterest.com/pin/212795151139178754/,"Homemade Strawberry Pop Tarts Recipe | How to make strawberry pop tarts with jam, Pop tarts homemade with strawberry jam, Pop tarts filling with jam and glaze",17,2026-06-14 13:50:37
https://www.pinterest.com/pin/212795151139178673/,"Lemon Crumb Cake | Recipe | Lemon cake with frosting with lemon crumb, Cakes for summer, Light and fluffy lemon crumb cake by tondoughallie",3,2026-06-14 13:50:37
https://www.pinterest.com/pin/212795151139175721/,"Lemon Poppy Seed Cake | Lemon poppy seed cake with lemon curd and buttermilk, Easy poppy seed cake without cake mix, Easy lemon poppyseed cake from scratch",31,2026-06-14 13:50:38
https://www.pinterest.com/pin/212795151139172502/,"Orange Rolls | Breakfast recipes that start with an o, Orange rolls with dried orange slices, Orange roll with cake mix",25,2026-06-14 13:50:38
https://www.pinterest.com/pin/212795151139166816/,"Single Serving Strawberry Mug Cake [Video] | Recipe | Easy desserts in a cup for one microwave, Single serving dessert with microwave, Homemade cheez its",16,2026-06-14 13:50:38
https://www.pinterest.com/pin/212795151139169620/,"Simple Ingredient Chocolate Chip Pancakes | Recipe | Chocolate chip pancakes for kids, Pancake recipe with chocolate chips, Easy simple recipes for breakfast",30,2026-06-14 13:50:39
https://www.pinterest.com/pin/212795151139171830/,"Carrot Cake Cookie Cups Recipe | Carrot cake cookie cups no egg, Cinnamon roll cookie cups with frosting, Cookie cup flavors",2,2026-06-14 13:50:39
https://www.pinterest.com/pin/212795151139156227/,"Low Carb Baked Ham Recipe with Citrusy Glaze | Pineapple and ham baked, Glazes for ham with pineapple, Oven baked ham with pineapple",2,2026-06-14 13:50:40
https://www.pinterest.com/pin/212795151139159394/,"Fruit Pizza with a Sugar Cookie Crust | Recipe | Fruit pizza with store bought cookie crust, Fruit pizza recipes with store bought sugar cookies, Easy fruit pizza",19,2026-06-14 13:50:40
https://www.pinterest.com/pin/212795151139156303/,"Grilled Sweet Potatoes | Recipe | Grilled sweet potatos and chicken, Whole sweet potato recipes grilled, Grilling sweet potatoes",20,2026-06-14 13:50:40
https://www.pinterest.com/pin/212795151139153541/,"Korean Fried Chicken | Recipe | Asian fried chicken recipes, Korean chicken with green onions recipes, Fried chicken with green onions",24,2026-06-14 13:50:40
https://www.pinterest.com/pin/212795151139150458/,"Zesty Spring Lemon Squares | Recipe | Yellow lemon cake mix recipes with butter and lemon zest, Lemon cake mix squares for a crowd, Homemade cheez its",16,2026-06-14 13:50:41
https://www.pinterest.com/pin/212795151139150300/,"Cheesy Pull Apart Garlic Bread | Healthy Foods Recipes | Cheese filled garlic bread, Pull apart cheese bread video, Garlic bread for a crowd parties",2,2026-06-14 13:50:41
https://www.pinterest.com/pin/212795151139147742/,"Deep Fried Italian Rice Balls [Video] | Recipe | Breaded and fried rice and cheese balls, Fried rice and parmesan balls, What can be done with leftover fried rice",20,2026-06-14 13:50:41
https://www.pinterest.com/pin/212795151139144688/,"Easter Appetizer: Classic Deviled Eggs | Recipe | Easter appetizer eggs, Deviled eggs with mayonnaise and mustard recipe, Deviled eggs easter",4,2026-06-14 13:50:41
https://www.pinterest.com/pin/212795151139147604/,"Easter Dessert: Carrot Cake | Recipe | Carrot cake recipes for easter, Quick easter desserts easy carrot cake, Easter carrot cake simple",1,2026-06-14 13:50:42
https://www.pinterest.com/pin/212795151139145180/,"Strawberry Mug Cake | Recipe in 2026 | Dessert recipes easy, Scrumptious desserts, Best dessert recipes",14,2026-06-14 13:50:42
https://www.pinterest.com/pin/212795151139144852/,"Banana Cookie with Cream Cheese Frosting | Recipe | Banana nut cookie with cream cheese frosting, Banana nut cookies with cream cheese icing, Cinnamon cream cheese frosting",1,2026-06-14 13:50:42
https://www.pinterest.com/pin/212795151139141538/,"Creamy Tomato Sausage Gnocchi: A Flavorful One-Pan Delight | Recipe | Ground sausage gnocchi with sausage, Ground sausage and gnocchi recipe, Italian sausage gnocchi dish",4,2026-06-14 13:50:43
https://www.pinterest.com/pin/212795151139141318/,"Homemade Chicken Tenders Recipe | Chicken tenders party food, Batter dipped chicken tenders, Crispy chicken tenders platter",19,2026-06-14 13:50:44
https://www.pinterest.com/pin/212795151139136778/,"Migas: A Hearty Tex-Mex Breakfast | Recipe | Mexican egg casserole with tortilla chips, ""tortilla chip and scrambled egg recipes for a crowd""., Crockpot french toast",13,2026-06-14 13:50:44
https://www.pinterest.com/pin/212795151139139685/,"Cake Mix Cream Cheese Carrot Cake Cookies | Recipe | Carrot cake cookies cake mix with cream cheese, Carrot and white chocolate cookie recipe made from a cake mix, Cake box cookie with carrit",37,2026-06-14 13:50:44
https://www.pinterest.com/pin/212795151139134127/,"Chocolate Chip Scones | Recipe | How to make chocolate chip scones, Chocolate chip scones with buttermilk, Scone recipes",18,2026-06-14 13:50:44
https://www.pinterest.com/pin/212795151139133978/,"Cinnamon Swirl Bread Recipe for Sweet Mornings | Cinnamon bread with no yeast, Cinnamon rolls with bread mix, Cinnamon bread using yeast bread mix and brown sugar",1,2026-06-14 13:50:44
https://www.pinterest.com/pin/212795151139139526/,"Lemon Poppy Seed Bread Recipe | Quick easy poppy seed bread, Recipe for lemon and poppy seed loaf, Poppyseed bread recipe",8,2026-06-14 13:50:44
https://www.pinterest.com/pin/212795151139128906/,"Deliciously Simple Peanut Butter Cake [Video] | Recipe | Peanut butter cake with no eggs, Yellow cake with peanut butter frosting, Peanut butter cake from box cake mix",16,2026-06-14 13:50:44
https://www.pinterest.com/pin/212795151139126390/,"Italian Rice Balls | Recipe | Recipes using cooked rice, Appetizers made with rice, Rice balls with tomato sauce and cheese",12,2026-06-14 13:50:45
https://www.pinterest.com/pin/212795151139124115/,"Make Your Own Pepperoni Pizza Rolls | Recipe | Pizza dough for pepperoni pizza, Homemade pepperoni rolls without pizza dough, Pizza dough recipes for pepperoni rolls",29,2026-06-14 13:50:45
https://www.pinterest.com/pin/212795151139128657/,"Protein Balls | Peanut Butter Chocolate Chip with 10g of Protein | Recipe | Chocolate oatmeal peanut butter balls without chocolate chips, Peanut butter oat chocolate chips energy balls, No bake oats ",6,2026-06-14 13:50:45
https://www.pinterest.com/pin/212795151139124025/,"Nutella Crepes with Strawberries | Recipe | Crepes with strawberries and nutella, Crepe with strawberry and nutella, Peanut butter banana bread",2,2026-06-14 13:50:45
https://www.pinterest.com/pin/212795151139115997/,"Greek Chicken Meatballs | Recipe | Simple healthy dinner recipes mediterranean, Healthy chicken meatball dinner recipes, Simple dinners with chicken breast",31,2026-06-14 13:50:47
https://www.pinterest.com/pin/212795151139118315/,"Corned Beef Quesadilla Recipe | Quesadilla with corn beef, Corned beef and swiss cheese quesadilla, Savory corned beef quesadilla",1,2026-06-14 13:50:47
https://www.pinterest.com/pin/212795151139113712/,"Bacon Wrapped Asparagus: Heavenly Oven-Baked Side Dish | Recipe | How to cook asparagus spears wrapped in bacon in the oven, Asparagus and bacon in the oven, Elevated asparagus",26,2026-06-14 13:50:47
https://www.pinterest.com/pin/212795151139113612/,"Mint Cheesecake Trifles for St. Patrick's Day Fun | Recipe | St patricks day desserts easy with oreo, St pattys day desserts easy, Oreo trifle",1,2026-06-14 13:50:47
https://www.pinterest.com/pin/212795151139111312/,"Italian Subs Toasted in the Oven [Video] | Recipe | Italian sub recipes in oven, Italian sub sandwiches in the oven, Baked italian subs",17,2026-06-14 13:50:47
https://www.pinterest.com/pin/212795151139108484/,"Dirty Irishman Cocktail | Recipe | Baileys drinks for a crowd, Drinks made with irish whiskey, St patty day alcoholic drinks whiskey",2,2026-06-14 13:50:47
https://www.pinterest.com/pin/212795151139105647/,"Tender Fall Off The Bone Ribs | Recipe | Fall off the bone ribs in toaster oven, Oven roasted fall off the bone ribs, Homemade chicken and dumplings",20,2026-06-14 13:50:47
https://www.pinterest.com/pin/212795151139108632/,"Peanut Butter Cake | Recipe | Best rated peanut butter cake recipes, Simple peanut butter cake from box mix, Peanut butter cake from 1975 using buttermilk",113,2026-06-14 13:50:48
https://www.pinterest.com/pin/212795151139100086/,"BBQ Chicken Pasta Recipe | Barbecue chicken pasta recipes, Healthy dinner recipes barbecue, Chicken pasta with barbeque sauce",16,2026-06-14 13:50:48
https://www.pinterest.com/pin/212795151139102947/,"Deliciously Easy Key Lime Pie Bars | Recipe | Key lime bars easy with graham crackers, Key lime pie with graham, Classic brownies recipe",13,2026-06-14 13:50:48
https://www.pinterest.com/pin/212795151139102805/,"Cosmic Brownie Cookies | Recipe | Simple cosmic brownie cookie, Chocolate with sprinkles, Cookie recipe for cosmic brownies",3,2026-06-14 13:50:48
https://www.pinterest.com/pin/212795151139092966/,"Irresistible Chicken Enchilada Soup [Video] | Recipe | Chicken enchilada soup with rotisserie, Soups for a large crowd winter, Chicken enchiladas soup for large crowd",17,2026-06-14 13:50:50
https://www.pinterest.com/pin/212795151139089973/,"Baked Italian Subs | Recipe | Sub sandwhiches baked in oven, Italian sub sandwiches in the oven, How to make a sub sandwich with salami meat and provolone cheese in oven",16,2026-06-14 13:50:50
https://www.pinterest.com/pin/212795151139092849/,"Crockpot Taco Chili | Recipe | Slow cooker chili recipe ground beef, Easy crock pot chili with hamburger and beans, Best chili with ground beef crock pot recipes",2,2026-06-14 13:50:50
https://www.pinterest.com/pin/56787645305379931/,"Easy Bread Pudding Recipe | Best bread pudding recipe simple, Icing for bread pudding, Sauce for bread pudding easy",1,2026-06-14 13:50:50
https://www.pinterest.com/pin/212795151139088125/,"Creamy Crockpot Cheesy Potatoes Recipe | Crockpot cheese potatoes with cream soup, Creamy cheese potatoes in a crockpot, Cheesy potatoes in the crockpot with cream soup",42,2026-06-14 13:50:50
https://www.pinterest.com/pin/212795151139087162/,"Salted Caramel Rolls | Salted carmel buns with pie filling, Salted caramel rolls with canned biscuits, Caramel for caramel rolls",4,2026-06-14 13:50:50
https://www.pinterest.com/pin/212795151139084583/,"Dirty Irishman Cocktail Recipe | Drinks alcoholic for st patrick's, St patrick day cocktail dirty irishman, Baileys and whiskey drinks",8,2026-06-14 13:50:50
https://www.pinterest.com/pin/212795151139081405/,"Banana Cookies | Recipe | Banana nut cookies recipe with cream cheese frosting, Easy banana cookies, Banana desserts",13,2026-06-14 13:50:50
https://www.pinterest.com/pin/212795151139075363/,"Copycat Shamrock Shake for St Patrick's Day | Recipe | Mcdonald’s st partricks day shake, How to make a shamrock shake at home, St patricks day mint shake",10,2026-06-14 13:50:50
https://www.pinterest.com/pin/212795151139075459/,"Tender Slow Cooker Pork Chops | Recipe | Slow cooker recipes smothered pork chops, Smothered pork chops and potatoes with tomato soup in crockpot, Slow cooker smothered pork chops and red potatoes",2,2026-06-14 13:50:50
https://www.pinterest.com/pin/212795151139059735/,"Dirty Shirley Cocktail | Recipe | Dirty shirley temple drink, Alcoholic drink shirley temple, Vodka grenadine",3,2026-06-14 13:50:52
https://www.pinterest.com/pin/212795151139065932/,"Taco Spaghetti | Recipe | Spaghetti noodles with ground beef, Beef taco spagetti, Ground beef and spaghetti noodles recipes",3,2026-06-14 13:50:52
https://www.pinterest.com/pin/212795151139062965/,"Rainbow Frosting for Vibrant Desserts | Recipe | Color full icing, How to make bright rainbow frosting, Homemade colored icing",20,2026-06-14 13:50:52
https://www.pinterest.com/pin/212795151139059853/,"Cheeseburger Tater Tot Casserole | Recipe | Tater tots with hamburger and egg casserole, Ground beef tater tot casserole, Cheeseburger tater tot casserole with egg",29,2026-06-14 13:50:52
https://www.pinterest.com/pin/212795151139062908/,"Homemade Cinnamon Rolls | Recipe | How to make a cinamom roll from scratch, Cinnamon rolls from scratch, How to make cinnamon buns from scratch",4,2026-06-14 13:50:53
https://www.pinterest.com/pin/212795151139056538/,"Pistachio Muffins | Recipe | Pistachio muffins easy, Green muffin recipes, Pistachio muffins recipe with pudding",295,2026-06-14 13:50:53
https://www.pinterest.com/pin/212795151139056706/,"One Pot Cajun Sausage Pasta Recipe | Easy cajun pasta with chicken thighs, Healthy cajun dishes, Healthy one pot meals cajun",24,2026-06-14 13:50:53
https://www.pinterest.com/pin/212795151139053612/,"Bread Pudding with Vanilla Sauce Recipe | Bread pudding with cinnamon and nuts, Bread pudding recipes with no nuts, Bread pudding made with cinnamon bread",56,2026-06-14 13:50:53
