url,title,saves,timestamp
https://www.pinterest.com/pin/212795151133976979/,"Brown Sugar Bacon Little Smokies: Recipes We Love | Little smokies with bacon brown sugar, Appetizer recipes, Amazing appetizers",11,2026-05-26 20:00:52
https://www.pinterest.com/pin/212795151133961100/,"Sweet Potato Casserole Recipe with Delicious Streusel Topping | The best sweet potato casserole ever, Best sweet potato casserole with pecans, Sweet potato recipes casserole",70,2026-05-26 20:01:01
https://www.pinterest.com/pin/oatmeal-sour-cream-coffee-cake--212795151133958798/,"Oatmeal Sour Cream Coffee Cake | Coffee cake, Sour cream coffee cake, Baking recipes",64,2026-05-26 20:01:01
https://www.pinterest.com/pin/jalepeo-honey-cornbread-casserole--212795151133954976/,"Jalapeño Honey Cornbread Casserole Recipe | Easy family dinner recipes, Jalapeu00f1o honey cornbread casserole, Spicy cornbread recipe",245,2026-05-26 20:01:02
https://www.pinterest.com/pin/443675000801043747/,"Easy Pumpkin Bread with Maple Glaze | Recipe | Pumpkin loaf maple glaze, Pumpkin banana bread with maple glaze, Pumpkin bread with maple icing",26,2026-05-26 20:01:03
https://www.pinterest.com/pin/oven-fried-chicken-in-2021--56787645296053565/,"Delicious Oven Fried Chicken Recipe | Oven fried chicken leg recipes, Oven fried chicken legs easy, Chicken dishes recipes",11,2026-05-26 20:01:03
https://www.pinterest.com/pin/212795151133954459/,"Chewy Monster Cookies | Recipe | Easy monster cookie baking, How to decorate monster cookies, Pumpkin monster cookies recipe",15201,2026-05-26 20:01:03
https://www.pinterest.com/pin/baked-country-style-ribs--212795151133947280/,"Baked Country Style Ribs | Recipe | Creamy cajun shrimp pasta, Ribs in oven, Delicious bbq",2,2026-05-26 20:01:05
https://www.pinterest.com/pin/212795151133947057/,"Peanut Clusters | Recipe | Easy peanut clusters, How to make peanut clusters, Peanut clusters recipe",120,2026-05-26 20:01:05
https://www.pinterest.com/pin/brown-sugar-bacon-little-smokies--212795151133946554/,"Brown Sugar Bacon Little Smokies Recipe | Bacon recipes, Brown sugar little smokies",397,2026-05-26 20:01:06
https://www.pinterest.com/pin/oatmeal-sour-cream-coffee-cake-tornadough-alli--212795151133946289/,"Oatmeal Sour Cream Coffee Cake Recipe | Danish coffee cake recipe with sour cream, Cake mix sour cream coffee cake, Coffee cake with yogurt",28,2026-05-26 20:01:06
https://www.pinterest.com/pin/212795151133946780/,"Delicious Chicken Pot Pie Casserole with Cheddar Biscuit Topping | Recipe | Pot pie casserole biscuits, Cheesy chicken pot pie casserole, Chicken pot pie recipes",4,2026-05-26 20:01:07
https://www.pinterest.com/pin/56787645296039405/,"Smothered Pork Chops: Blogger Recipes We Love | Easy smothered pork chops, Smothered pork chops and mashed potatoes, Smothered mediterranean pork chops",2,2026-05-26 20:01:09
https://www.pinterest.com/pin/56787645296038907/,"Korean Spicy Pork Bowls | Recipe | Spicy korean meat dish, Traditional korean spicy dish, Pork bulgogi bowl",2,2026-05-26 20:01:09
https://www.pinterest.com/pin/56787645296037727/,"Tater Tot Breakfast Casserole: Recipes We Love | Breakfast lovers, Tater tot breakfast casserole recipes, Tator tot casserole",4,2026-05-26 20:01:09
https://www.pinterest.com/pin/212795151133937788/,"Baked French Fries Recipe - Easy and Delicious | Baked potato wedges oven, Dried potatoes, French fries in the oven",2,2026-05-26 20:01:09
https://www.pinterest.com/pin/halloween-cookie-bars-tornadough-alli--56787645296037194/,"Halloween Cookie Bars: A Recipe We LOVE For Halloween | Halloween bars and cookies, Halloween bars dessert, Halloween bars recipes",14,2026-05-26 20:01:10
https://www.pinterest.com/pin/56787645296036868/,"Easy Croissant Breakfast Sandwiches - Tornadough Alli | Recipe | Easy breakfast croissant, Make ahead breakfast sandwiches croissant, Crossaint breakfast sandwiches",192,2026-05-26 20:01:10
https://www.pinterest.com/pin/easy-cheesy-and-a-family-favorite-these-crockpot-cheesy-potatoes-are-a-nofail-recipe-that-is-perfect-for-dinnertime-potlucks-or-when-youre-in-a-hurry-and-wa--212795151133929405/,"Crockpot Cheesy Potatoes | Recipe | Potluck recipes crockpot, Cheesy potatoes recipe, Cheesy potato casserole",4,2026-05-26 20:01:11
https://www.pinterest.com/pin/56787645296029148/,"Vegetable Beef Soup: Best Recipe! | Veg beef soup with hamburger, Best homemade vegetable beef soup, Seasonings for vegetable beef soup",4,2026-05-26 20:01:11
https://www.pinterest.com/pin/slow-cooker-green-bean-casserole-tornadough-alli--212795151133936021/,"Slow Cooker Green Bean Casserole: A Holiday Must-Try! | Recipe | Thanksgiving crockpot vegetable sides, Thanksgiving green beans crockpot, Green bean casserole crock pot",25,2026-05-26 20:01:11
https://www.pinterest.com/pin/212795151133936026/,"Instant Pot Street Tacos | How to prepare steak, Stay at home chef, Ground beef dishes",2,2026-05-26 20:01:11
https://www.pinterest.com/pin/56787645296031807/,"Easy Pecan Sticky Buns: Fall Dessert Recipe | Recipe for pecan sticky buns, Pecan buns recipe easy, Overnight pecan sticky buns",7,2026-05-26 20:01:13
https://www.pinterest.com/pin/212795151133930088/,"Homemade Chicken Pot Pie | Comfort Food Recipe | Eating on a dime chicken pot pie, Plate of chicken pot pie and mashed potatoes, Baked pot pie on plate",4,2026-05-26 20:01:13
https://www.pinterest.com/pin/easy-no-bake-cookies-tornadough-alli--212795151133929417/,"Easy No Bake Cookies Recipe: Tornadough Alli | No bake cookies without cocoa powder, No bake cookies no cocoa powder, Quick no-bake chocolate snack",10,2026-05-26 20:01:13
https://www.pinterest.com/pin/212795151133929410/,"Easy Ground Beef Enchiladas | Recipe | Make ahead ground beef enchiladas, 5 ingredient enchiladas ground beef, Ground beef & bean enchiladas",3,2026-05-26 20:01:14
https://www.pinterest.com/pin/56787645296028112/,"Pecan Pie Cheesecake | Recipe | Pumpkin cheesecake with pecan pie topping, Homemade pumpkin cheesecake with pecans, Easy pecan pie cheesecake",5,2026-05-26 20:01:15
https://www.pinterest.com/pin/bhgs-best-recipes--56787645296021250/,"Cozy up with a comforting Hot Toddy Recipe | Sore throat cocktail, Classic hot toddy drink, Hot toddy for sore throat",97,2026-05-26 20:01:17
https://www.pinterest.com/pin/212795151133922768/,"Cranberry and orange flavors collide in this easy and delicious Cranberry Orange Bundt Cake. Sweet orange juice and tart… | Cranberry orange cake easy, Cranberry cake with orange juice, Cranberry oran",536,2026-05-26 20:01:18
https://www.pinterest.com/pin/slow-cooker-meatloaf--212795151133922198/,"Slow Cooker Meatloaf Recipe | Slow cooker meatloaf easy, Crockpot meatloaf, Meat loaf",226,2026-05-26 20:01:18
https://www.pinterest.com/pin/stuffed-pepper-casserole-tornadough-alli--212795151133922133/,"Stuffed Pepper Casserole: Dinner Recipes | Family favorite casseroles, Easy casserole recipes",181,2026-05-26 20:01:19
https://www.pinterest.com/pin/halloween-cookie-bars--212795151133915891/,"Halloween Cookie Bars Recipe | Halloween desserts, Halloween treats, Cookies candy",22,2026-05-26 20:01:20
https://www.pinterest.com/pin/212795151133915553/,"Pumpkin Bread Pudding: Tornadough Alli | Recipe | Pumpkin cheesecake dip, Banana bread pudding, Pumpkin bread pudding recipe",8,2026-05-26 20:01:20
https://www.pinterest.com/pin/212795151133915242/,"Homemade Spaghetti Sauce with Ground Beef and Sausage | Amazing spaghetti sauce, My favorite spaghetti sauce recipe, The best spaghetti sauce",7,2026-05-26 20:01:22
https://www.pinterest.com/pin/sausage-rolls-an-easy-fun-party-appetizer--56787645296008999/,"Easy Sausage Rolls Appetizer | How to make sausage rolls with crescent rolls, Sausage rolls recipes",11,2026-05-26 20:01:22
https://www.pinterest.com/pin/212795151133913667/,"Slow Cooker Pumpkin Hot Chocolate - Tornadough Alli | Recipe | Spiced whipped cream, Fall recipes, Chocolate can",10,2026-05-26 20:01:22
https://www.pinterest.com/pin/baked-country-style-ribs--212795151133913657/,"Baked Country Style Ribs: Tornadough Alli | Recipe | Ribs in oven, Boneless ribs, Delicious bbq",2,2026-05-26 20:01:22
https://www.pinterest.com/pin/212795151133909126/,"Spaghetti Casserole Recipe | Easy and Delicious | Classic spaghetti casserole, Spaghetti casserole with leftover spaghetti, Spaghetti sauce casserole",74,2026-05-26 20:01:25
https://www.pinterest.com/pin/212795151133906211/,"Ultimate Peanut Butter Brownies | Recipe | Peanutbutter brownie recipes, Best peanut butter brownies, Peanut butter topping for brownies",190,2026-05-26 20:01:25
https://www.pinterest.com/pin/twice-baked-sweet-potatoes--212795151133909024/,Twice Baked Sweet Potatoes Recipe | Sweet potato recipes,248,2026-05-26 20:01:25
https://www.pinterest.com/pin/slow-cooker-chicken-cacciatore--212795151133906513/,"Slow Cooker Chicken Cacciatore | Recipe | Quick chicken cacciatore, Homemade chicken cacciatore dinner, Easy homemade chicken cacciatore",44,2026-05-26 20:01:25
https://www.pinterest.com/pin/halloween-dirt-cake--212795151133899852/,"Halloween Dirt Cake with Spooky Ghost Decorations | Halloween desserts, Halloween treat ideas, Cookies ghost",218,2026-05-26 20:01:27
https://www.pinterest.com/pin/fireball-hard-cider--212795151133902388/,"Fireball Hard Cider | Fireball whiskey, Whiskey apple cider, Alcohol drink recipes",109,2026-05-26 20:01:27
https://www.pinterest.com/pin/212795151133886591/,"Three Street Tacos with Salsa and Cilantro | Recipe | Street tacos in crockpot, Street tacos recipe crockpot, Crock pot street tacos",2,2026-05-26 20:01:32
https://www.pinterest.com/pin/56787645295977754/,"Peanut Butter & Jelly Poke Cake | Peanut butter and jelly poke cake, Poke cake recipes, Peanut butter frosting",8,2026-05-26 20:01:33
https://www.pinterest.com/pin/butter-pecan-cookies--212795151133883849/,"Butter Pecan Cookies Recipe | Pecan recipes, Butter cookies easy, Recipes for cookies",534,2026-05-26 20:01:33
https://www.pinterest.com/pin/212795151133883833/,"Easy Vegetable Beef Soup | Recipe | Veg beef soup with hamburger, Best homemade vegetable beef soup, Seasonings for vegetable beef soup",4,2026-05-26 20:01:34
https://www.pinterest.com/pin/cheeseburger-pie--212795151133878888/,"Cheeseburger Pie with Pickles - Easy Dinner Recipe | Cheese burgers, Cheddar cheese, Hamburger",65,2026-05-26 20:01:35
https://www.pinterest.com/pin/instant-pot-lasagna-soup--212795151133875079/,"Instant Pot Lasagna Soup Recipe | Lasagna noodles, Pepper lasagna, Soup recipes",227,2026-05-26 20:01:36
https://www.pinterest.com/pin/56787645295960922/,"Olive Garden Copycat Recipe | Easy olive garden chicken gnocchi soup, Copycat chicken gnocchi soup recipe, Olive garden chicken gnocchi soup recipe",10,2026-05-26 20:01:36
https://www.pinterest.com/pin/212795151133875251/,"Asian Crockpot Meatballs | Recipe | Asian meatball recipe crockpot, Asian appetizers, Asian dishes",910,2026-05-26 20:01:37
https://www.pinterest.com/pin/56787645295958675/,"Ground Beef Carbonara | Recipe | Thrifty meals, Pasta carbonara recipe, New recipes for dinner",14,2026-05-26 20:01:39
https://www.pinterest.com/pin/443675000800819138/,"Pumpkin Donuts | Recipe | Cinnamon sugar pumpkin donuts, Baked pumpkin donuts, Pumpkin donuts recipe",6,2026-05-26 20:01:39
https://www.pinterest.com/pin/212795151133866008/,"Mexican Rice Casserole | Recipe | Knorr mexican rice casserole, Easy mexican rice casserole, Mexican rice casserole with cheese",151,2026-05-26 20:01:41
https://www.pinterest.com/pin/56787645295950900/,"Delicious Vintage Chocolate Chip Applesauce Cake | Recipe | Chocolate chip applesauce cake recipe, Apple pastry, Apple cakes",2,2026-05-26 20:01:42
https://www.pinterest.com/pin/vintage-applesauce-cake--212795151133863193/,"Vintage Applesauce Cake Recipe | Cake apple, Everything apple, Easy cake recipes",76,2026-05-26 20:01:42
https://www.pinterest.com/pin/56787645295946745/,"Easy Ground Beef Carbonara Recipe | Thrifty meals, Pasta carbonara recipe, New recipes for dinner",11,2026-05-26 20:01:43
https://www.pinterest.com/pin/iced-oatmeal-cookies--212795151133859709/,"Iced Oatmeal Cookies Recipe | Oatmeal dessert recipes, Old fashioned oats",252,2026-05-26 20:01:44
https://www.pinterest.com/pin/47710077294641140/,"Spaghetti Aglio e Olio | Recipe | Easy aglio olio recipe, Spaghetti aglio e olio for two, Simple aglio olio recipe",2,2026-05-26 20:01:44
https://www.pinterest.com/pin/212795151133854071/,"Olive Garden Chicken Gnocchi Soup | Recipe | Easy olive garden chicken gnocchi soup, Copycat chicken gnocchi soup recipe, Olive garden chicken gnocchi soup recipe",124,2026-05-26 20:01:45
https://www.pinterest.com/pin/443675000800772523/,"Slow Cooker Pumpkin Hot Chocolate | Recipe | Slow cooker drinks, Hot drinks recipes, Pumpkin flavor",12,2026-05-26 20:01:46
https://www.pinterest.com/pin/hot-toddy--212795151133852682/,"Hot Toddy Recipe with Lemon and Spices | Hot toddies recipe, Toddy coffee, Food drink",129,2026-05-26 20:01:46
https://www.pinterest.com/pin/56787645295937894/,"One Pan Stuffed Pepper Casserole | Stuffed pepper casserole easy, Stuffed pepper hot dish, Casserole recipes",9,2026-05-26 20:01:46
https://www.pinterest.com/pin/212795151133850207/,"Southern Pecan Pie Recipe for Thanksgiving and Christmas | Best easy pecan pie, Best southern pecan pie recipe, The best pecan pie recipe",10,2026-05-26 20:01:48
https://www.pinterest.com/pin/crockpot-mashed-potatoes--212795151133843572/,"Crockpot Mashed Potatoes Recipe | Potato recipes side dishes, Food potatoes, Potatoes veggies",287,2026-05-26 20:01:50
https://www.pinterest.com/pin/56787645295926116/,"Sausage Rolls Appetizer | Recipe | Easy sausage rolls appetizer, How to make sausage rolls with crescent rolls, Sausage rolls recipes",2,2026-05-26 20:01:50
https://www.pinterest.com/pin/pumpkin-bread-with-maple-glaze--212795151133839364/,Pumpkin Bread with Maple Glaze,362,2026-05-26 20:01:52
https://www.pinterest.com/pin/56787645295919320/,"Ultimate Thanksgiving Roundup: Delicious Everyday Paleo Favorites | Recipe | All recipes apple pie, White chocolate apple pie, Apple pie in white dish",4,2026-05-26 20:01:52
https://www.pinterest.com/pin/329536897742898769/,"Lemon Pepper Chicken Kabobs Recipe- Tornadough Alli | Chicken kabob side dishes, Sides for chicken kabobs, Yogurt chicken kabobs",55,2026-05-26 20:01:53
https://www.pinterest.com/pin/329536897742907800/,"Copycat Cracker Barrel Meatloaf | Recipe | Cracker barrel meatloaf sauce, Cracker barrel meatloaf recipe with ground beef, Cracker barrel meatloaf recipe copycat",836,2026-05-26 20:01:53
https://www.pinterest.com/pin/cornbread-muffins--212795151133829146/,"Cornbread Muffins Recipe | Corn bread recipe, Yellow cornmeal, Cupcakes muffins",102,2026-05-26 20:01:56
https://www.pinterest.com/pin/212795151133829072/,"The BEST Fall Off the Bone Ribs! | How to make fall off the bone ribs, Oven ribs fall off the bone pork, Easy fall off the bone ribs",7,2026-05-26 20:01:57
https://www.pinterest.com/pin/212795151133823604/,"The Best Homemade Sloppy Joes - Tornadough Alli | Recipe | Spicy meat sandwich recipe, Savory sloppy joe recipe, How to make spicy sloppy joes",3,2026-05-26 20:02:00
https://www.pinterest.com/pin/212795151133823407/,"Chicken Fried Chicken | Country gravy recipe, Creamy cajun shrimp pasta, Large family meals",16,2026-05-26 20:02:01
https://www.pinterest.com/pin/212795151133823178/,"Copycat Cracker Barrel Meatloaf - Tornadough Alli | Recipe | Cracker barrel meatloaf sauce, Cracker barrel meatloaf recipe with ground beef, Cracker barrel meatloaf recipe copycat",2,2026-05-26 20:02:01
https://www.pinterest.com/pin/56787645295902159/,"Easy Easy Croissant Breakfast Sandwiches | Recipe | Make ahead breakfast sandwiches croissant, Crossaint breakfast sandwiches, Easy croissant sandwiches",18,2026-05-26 20:02:01
https://www.pinterest.com/pin/glazed-apple-cider-donuts--212795151133821678/,"Glazed Apple Cider Donuts Recipe | Apple cider cinnamon, Apple pie spice, Donut recipes",93,2026-05-26 20:02:02
https://www.pinterest.com/pin/pumpkin-cupcakes--212795151133820875/,"Delicious Pumpkin Cupcakes with Cream Cheese Frosting | Pumpkin sweet, Pumpkin puree, Pumpkin desserts",128,2026-05-26 20:02:02
https://www.pinterest.com/pin/212795151133815431/,"Sweet and Savory Candied Sweet Potatoes | Candied sweet potato recipes, Southern candied sweet potatoes, Sweet potato side dish recipes",283,2026-05-26 20:02:04
https://www.pinterest.com/pin/tuna-noodle-casserole--212795151133815388/,"Tuna Noodle Casserole Recipe | One pot tuna noodle casserole, One pan tuna noodle casserole, Tuna noodle casserole elbow macaroni",167,2026-05-26 20:02:04
https://www.pinterest.com/pin/vegetable-lo-mein--212795151133814949/,"Vegetable Lo Mein | Recipe | Easy vegetable lo mein, Low mein recipe vegetable, Recipes for food",41,2026-05-26 20:02:04
https://www.pinterest.com/pin/329536897742848839/,"Ground Beef Carbonara an Easy Flavorful Pasta Recipe | Ground beef carbonara recipe, White pasta with ground beef, Beef pasta recipes",1256,2026-05-26 20:02:05
https://www.pinterest.com/pin/pasta-e-fagioli-soup--212795151133812806/,"Pasta e Fagioli Soup Recipe with Fresh Herbs and Carrots | Ministroni soup recipe italian crockpot, Easy classic minestrone soup, Classic homemade minestrone soup recipe",92,2026-05-26 20:02:05
https://www.pinterest.com/pin/212795151133793301/,"Vegetable Frittata | Recipe | Vegetable frittata with salad, Vegetable frittata with tomatoes and spinach, Green vegetable frittata in skillet",140,2026-05-26 20:02:12
https://www.pinterest.com/pin/56787645295867316/,"Baked Tortellini | Recipe | How to make baked tortellini, Easy oven tortellini dish, Tortellini oven dish recipe",1,2026-05-26 20:02:12
https://www.pinterest.com/pin/56787645295865402/,"Slow Cooker Pork Carnitas | Recipe | Pulled pork carnitas slow cooker, Pork loin carnitas slow cooker, Easy pork carnitas slow cooker",6,2026-05-26 20:02:12
https://www.pinterest.com/pin/212795151133789009/,"Maple Chocolate Pecan Pie Bars Recipe | Easy pecan pie bar recipe, Best fall desserts",76,2026-05-26 20:02:13
https://www.pinterest.com/pin/212795151133788975/,"Cinnamon Swirl Bread Recipe | Cinnamon roll bread, Sweet bread, Homemade bread",34,2026-05-26 20:02:14
https://www.pinterest.com/pin/cinnamon-apple-cheesecake--212795151133781635/,"Cinnamon Apple Cheesecake Recipe | Apple cinnamon cheesecake recipe, Apple cheesecake with slice missing, Caramel apple cheesecake",77,2026-05-26 20:02:15
https://www.pinterest.com/pin/easy-creamed-potatoes-a-delicious-side-dish-recipe--212795151133781419/,"Creamed Potatoes | Recipe | Creamed potatoes southern, Creamed potatoes recipe, Creamed potatoes old fashioned",51,2026-05-26 20:02:17
https://www.pinterest.com/pin/443675000800578668/,"Chocolate Chip Pumpkin Pudding Pie - A Twist on a Classic | Recipe | No bake thanksgiving pie, Pumpkin chip cream pie, Classic pumpkin pie",18,2026-05-26 20:02:17
https://www.pinterest.com/pin/56787645295845408/,"Delicious Old-Fashioned Oatmeal Cake | Oatmeal cinnamon cake, Desserts using oats, Oatmeal cookie cake",3,2026-05-26 20:02:20
https://www.pinterest.com/pin/212795151133769059/,"Sweet Potato Pie Recipe - A Delicious Alternative to Pumpkin Pie | Sweet potato pie on cooling rack, Old fashioned sweet potato pie recipes, Sweet potato pie southern",1,2026-05-26 20:02:20
https://www.pinterest.com/pin/56787645295842287/,"French Onion Chicken with Caramelized Onions and Cheese | Recipe | French onion stuffed chicken casserole, Cheesy french onion chicken, French onion soup chicken dish",92,2026-05-26 20:02:20
https://www.pinterest.com/pin/212795151133767818/,"Sloppy Joe Casserole | Recipe | Sloppy joe pasta bake with cream cheese, Sloppy joe casserole with noodles, Casserole recipes",507,2026-05-26 20:02:21
https://www.pinterest.com/pin/212795151133768289/,"Sweet & Spicy Slow Cooker Chicken Wings Recipe | Slow cooker hot wings, Chicken wings in slow cooker, Food chicken wings",79,2026-05-26 20:02:21
https://www.pinterest.com/pin/brussel-sprout-casserole--56787645295841491/,"Brussel Sprout Casserole | Recipe | Easy brussel sprout casserole, Brussel sprouts casserole recipes, Easy casserole recipes",111,2026-05-26 20:02:22
https://www.pinterest.com/pin/212795151133758643/,"Crockpot Honey BBQ Meatballs | Recipe | Bbq meatballs crockpot, Dip recipes appetizers, Best party appetizers",4,2026-05-26 20:02:23
https://www.pinterest.com/pin/212795151133758590/,"Reminiscent of your favorite childhood sandwich, this Peanut Butter and Jelly Poke Cake is an easy doctored up cake mix,… | Poke cake recipes, Peanut butter frosting, Peanut butter jelly time",498,2026-05-26 20:02:26
https://www.pinterest.com/pin/56787645295816447/,"Delicious Cheesecake Bars | Recipe | Sopapilla dessert ideas, Sopapilla cheesecake bars recipe pioneer woman, Keto sopapilla cheesecake bars",100,2026-05-26 20:02:29
https://www.pinterest.com/pin/crock-pot-easy-apple-crumble--212795151133745176/,"Crock Pot Easy Apple Crumble Recipe | Apple crumble crockpot recipe, Apple crumble in crockpot, Apple desserts",191,2026-05-26 20:02:29
https://www.pinterest.com/pin/212795151133744701/,"Tender Slow Cooker Beef Short Ribs Recipe | How to cook beef short ribs slow cooker, Slow cooker beef short ribs crock pots, Slow cooker beef short ribs recipes",49,2026-05-26 20:02:29
https://www.pinterest.com/pin/pepperoni-pizza-rolls--212795151133744714/,"Pepperoni Pizza Rolls | Recipe | Pepperoni pizza rolls, Pizza rolls, Pepperoni",24,2026-05-26 20:02:30
https://www.pinterest.com/pin/pumpkin-chocolate-chip-cookies--212795151133744697/,"Pumpkin Chocolate Chip Cookies Recipe | Chocolate chip fall treats, Chocolate chip cookie mix with pumpkin, Recipes with pumpkin spice baking chips",99,2026-05-26 20:02:31
https://www.pinterest.com/pin/croissant-breakfast-sandwiches--212795151133736624/,"Croissant Breakfast Sandwiches | Crossaint breakfast sandwiches, Cooking eggs for breakfast sandwiches, Croissant breakfast sandwich recipes",296,2026-05-26 20:02:32
https://www.pinterest.com/pin/212795151133741928/,"Ground Beef Carbonara | Recipe | Ground beef carbonara recipe, White pasta with ground beef, Beef pasta recipes",18,2026-05-26 20:02:32
https://www.pinterest.com/pin/oatmeal-cream-pies--212795151133736056/,"Oatmeal Cream Pies Recipe | Homemade oatmeal cream pie cookies, How to make homemade oatmeal cream pies, Oatmeal crème pies",2989,2026-05-26 20:02:34
https://www.pinterest.com/pin/slow-cooker-meatloaf-tornadough-alli--56787645295799087/,"Slow Cooker Meatloaf | Salmon patties recipe, Ground beef dishes, Slow cooker meatloaf recipe",3,2026-05-26 20:02:36
https://www.pinterest.com/pin/pickle-dip-pinwheels--212795151133725480/,"Pickle Dip Pinwheels Recipe | Pickle wrap pinwheels, Pinwheel appetizers pickle, Pickle tortilla roll ups",1427,2026-05-26 20:02:37
https://www.pinterest.com/pin/56787645295789073/,"Chicken Gnocchi Soup - An Olive Garden Copycat | Recipe | Easy olive garden chicken gnocchi soup, Copycat chicken gnocchi soup recipe, Olive garden chicken gnocchi soup recipe",10,2026-05-26 20:02:38
https://www.pinterest.com/pin/the-best-chicken-salad--212795151133724450/,"Best Chicken Salad Recipe | Chicken salad with dill and grapes, Cheese and chicken salad croissant, Croissant sandwich chicken salad",199,2026-05-26 20:02:39
https://www.pinterest.com/pin/212795151133719201/,"Italian Pinwheels Appetizer | Recipe | How to make italian pinwheels, Italian pinwheel roll recipe, Italian pin wheel recipes",14,2026-05-26 20:02:42
https://www.pinterest.com/pin/329536897742606741/,"Easy Pumpkin Donuts | Recipe | Cinnamon sugar pumpkin donuts, Baked pumpkin donuts, Pumpkin donuts recipe",4,2026-05-26 20:02:42
https://www.pinterest.com/pin/pumpkin-bread-pudding--212795151133718842/,"Pumpkin Bread Pudding Recipe for Thanksgiving | Pumpkin bread pudding recipe easy, Autumn bread pudding dish, Pumpkin recipes dessert",3766,2026-05-26 20:02:42
https://www.pinterest.com/pin/ground-beef-carbonara--212795151133717908/,"Ground Beef Carbonara Recipe | White pasta with ground beef, White sauce spaghetti with ground beef, Creamy mushroom stroganoff with pasta",492,2026-05-26 20:02:42
https://www.pinterest.com/pin/slow-cooker-grape-jelly-meatballs--212795151133716138/,"Slow Cooker Grape Jelly Meatballs Recipe | Homemade grape jelly meatballs, Meatballs and jelly, Appetizer meatballs",1118,2026-05-26 20:02:42
https://www.pinterest.com/pin/apple-monkey-bread--212795151133712593/,"Apple Monkey Bread Recipe | Apple walnut monkey bread rolls, Apple monkey bread with cinnamon rolls, Easy apple monkey bread",401,2026-05-26 20:02:44
https://www.pinterest.com/pin/pumpkin-cheesecake-pie--212795151133712255/,"Pumpkin Cheesecake Pie with Whipped Cream and Cinnamon Sticks | Homemade pumpkin pie cheesecake, Pumpkin and cheesecake pie, Pumpkin pie with cheesecake layer",277,2026-05-26 20:02:46
https://www.pinterest.com/pin/212795151133712097/,"Slow Cooker Meatloaf with Delicious Glaze | Salmon patties recipe, Ground beef dishes, Slow cooker meatloaf recipe",3,2026-05-26 20:02:46
https://www.pinterest.com/pin/212795151133712254/,"Chocolate Chip Pumpkin Pudding Pie | Recipe | No bake thanksgiving pie, Pumpkin chip cream pie, Classic pumpkin pie",4,2026-05-26 20:02:46
https://www.pinterest.com/pin/329536897742586235/,"Mini Air Fryer Pizza Recipe | Quick and Delicious | How long to cook mini pizza in air fryer, Air fryer dinner recipes",4,2026-05-26 20:02:47
https://www.pinterest.com/pin/56787645295768471/,"Gluten-Free Peach Crumb Bars with a Summery Twist | Recipe | Peach crumble cheesecake bars, Peach pie cheesecake bars, Peach cobbler cheesecake bars",14,2026-05-26 20:02:47
https://www.pinterest.com/pin/56787645295764534/,"Fall Off The Bone Ribs Recipe | Fall ribs recipe, How to make fall off the bone ribs, Oven ribs fall off the bone pork",286,2026-05-26 20:02:48
