url,title,saves,timestamp
https://www.pinterest.com/pin/212795151135272705/,"Custard Pie | Recipe | Kinds of pie, Refrigerated pie crust, Food content",10,2026-06-14 14:04:02
https://www.pinterest.com/pin/212795151135263321/,"Chicken Alfredo Casserole | Recipe | Leftover chicken alfredo ideas, Leftover rotisserie chicken recipes pasta alfredo sauce, Easy alfredo casserole",80,2026-06-14 14:04:02
https://www.pinterest.com/pin/56787645297519438/,"Crème Anglaise | Recipe | Quick puddings, Custard sauce, Souffle recipes",15,2026-06-14 14:04:03
https://www.pinterest.com/pin/212795151135268067/,"Sweet Holiday Chex Mix | Chex mix recipes, Snack mix recipes, Sweet chex mix",16,2026-06-14 14:04:03
https://www.pinterest.com/pin/212795151135262808/,"KFC Bowls: COPYCAT | Kfc famous bowl recipe crock pot, Kfc famous bowl recipe casserole easy, Kfc bowls copycat",45,2026-06-14 14:04:05
https://www.pinterest.com/pin/212795151135255983/,"Brown Sugar Cinnamon Pop-Tarts Recipe | Homemade flaky poptarts, Brown sugar poptart recipe, Homemade pop tarts",55,2026-06-14 14:04:05
https://www.pinterest.com/pin/212795151135260262/,"Loaded Potato Skins Appetizer | Recipe | Loaded potato skins with toppings, Loaded breakfast potato skins, Loaded potato skins with cheese and bacon",39,2026-06-14 14:04:05
https://www.pinterest.com/pin/212795151135252700/,"Breakfast Sausage Recipe | Recipe | Breakfast sausage recipes, Homemade breakfast sausage, Homemade breakfast sausage recipe",27,2026-06-14 14:04:05
https://www.pinterest.com/pin/212795151135252524/,"Cranberry Brie Flatbread | Recipe | Recipes, Holiday appetizers, Flatbread recipes",10,2026-06-14 14:04:05
https://www.pinterest.com/pin/212795151135251702/,"Homemade Fudge Recipe | Best homemade fudge, Homemade fudge christmas, Homemade fudge with walnuts",19,2026-06-14 14:04:05
https://www.pinterest.com/pin/56787645297496965/,"Sweets & Meats Inspired Sweet Potato Casserole Recipe | Perfect for Easter! | The best sweet potato casserole ever, Best sweet potato casserole with pecans, Sweet potato recipes casserole",21,2026-06-14 14:04:07
https://www.pinterest.com/pin/212795151135245535/,"Delicious Fall Off The Bone Ribs | Recipe | Fall off the bone ribs in oven, Fall off the bone ribs recipe, Tender ribs",229,2026-06-14 14:04:07
https://www.pinterest.com/pin/212795151135242546/,"Frozen Mudslides | Recipe | Mud slides drink recipe, Mudslides with baileys, Frozen mudslide recipe",9,2026-06-14 14:04:07
https://www.pinterest.com/pin/212795151135241489/,"Delicious White Chicken Chili Recipe | What goes with white chicken chili, Which chicken chili, Chicken chili with toppings",23,2026-06-14 14:04:08
https://www.pinterest.com/pin/easy-stuffing-recipe-from-tornadough-alli--56787645297493726/,"Easy Stuffing Recipe from Tornadough Alli | Home made stuffing, Recipes side dishes, Homemade everything",32,2026-06-14 14:04:08
https://www.pinterest.com/pin/212795151135238928/,"Homemade Bailey's Irish Cream | Recipe | Homemade baileys irish cream, Homemade drinks recipes",2,2026-06-14 14:04:08
https://www.pinterest.com/pin/homemade-fudge--212795151135238947/,"Homemade Fudge | Recipe | Easy homemade fudge dessert, Homemade fudge christmas, Fudge recipes",48,2026-06-14 14:04:08
https://www.pinterest.com/pin/hot-spinach-artichoke-dip--212795151135238592/,"Hot Spinach Artichoke Dip | Recipe | Hot spinach dip recipe, Creamy spinach dip, Spinach artichoke dip recipe",1,2026-06-14 14:04:08
https://www.pinterest.com/pin/chicken-katsu-recipe-with-flavorful-sauce--212795151135238569/,"Chicken Katsu Recipe with Flavorful Sauce | Chicken katsu rice, Fried chicken katsu, Recipes to cook",4,2026-06-14 14:04:09
https://www.pinterest.com/pin/212795151135223684/,"Mac and Cheese | Recipe | Easy home made mac and cheese baked, Easy max and cheese recipe baked, Best home made mac and cheese baked",50,2026-06-14 14:04:10
https://www.pinterest.com/pin/212795151135223723/,"Hot Toddy Recipe - Soothing Drink with Whiskey | Best cold remedies, Hot alcoholic drinks, A hot toddy",9,2026-06-14 14:04:11
https://www.pinterest.com/pin/212795151135223346/,"Homemade Dumplings Recipe: Impress Anyone with Flat or Drop Dumplings | Old fashioned chicken and dumplings, Homemade chicken and dumplings, Stove top chicken and dumplings",12,2026-06-14 14:04:11
https://www.pinterest.com/pin/212795151135223595/,"Arancini | Recipe | Golden fried arancini, Arancini recipe easy, Fried arancini with tomato sauce",8,2026-06-14 14:04:11
https://www.pinterest.com/pin/turkey-moist-maker-sandwich-from-tornadough-alli--56787645297472396/,"Turkey Moist Maker Sandwich from Tornadough Alli | Sandwiches, Breakfast recipes, Wrap sandwiches",14,2026-06-14 14:04:11
https://www.pinterest.com/pin/212795151135223329/,"Honey Walnut Baked Brie Recipe | Baked brie recipes, Brie puff pastry, Recipes cheesy",7,2026-06-14 14:04:11
https://www.pinterest.com/pin/212795151135220075/,"Linzer Cookies | Recipe | Easy linzer cookies recipe, Christmas no bake treats, Classic christmas treats",5,2026-06-14 14:04:13
https://www.pinterest.com/pin/212795151135219977/,"Melted Snowman Cookies | Recipe | Melted chocolate snowman cookies recipe, Melting snowman cookie recipe, Cookies recipes christmas",8,2026-06-14 14:04:13
https://www.pinterest.com/pin/rum-balls--212795151135219946/,"Rum Balls | Recipe | Good rum, Spiced pecans, Easy rum balls",19,2026-06-14 14:04:13
https://www.pinterest.com/pin/56787645297471968/,"Crescent Rolls Recipe - Tornadough Alli | Creamy cajun shrimp pasta, Buttery rolls, Stay at home chef",7,2026-06-14 14:04:13
https://www.pinterest.com/pin/rumchata-hot-chocolate--56787645297466384/,"RUMCHATA HOT CHOCOLATE | Food drinks, Hot drinks, Hot cocoa",83,2026-06-14 14:04:15
https://www.pinterest.com/pin/212795151135213441/,"Reindeer Cookies | Recipe | Holiday cookie exchange, Pretzel twists, Holiday treats",5,2026-06-14 14:04:15
https://www.pinterest.com/pin/212795151135213034/,"The BEST Chicken Fried Chicken Recipe | Large family meals, Buttermilk chicken, Fried chicken recipes",7,2026-06-14 14:04:15
https://www.pinterest.com/pin/eggnog-hot-chocolate--212795151135212773/,"Eggnog Hot Chocolate | Recipe | Hot eggnog recipe, Hot eggnog drinks, Holiday drinks",17,2026-06-14 14:04:16
https://www.pinterest.com/pin/212795151135212837/,"Olive Garden Chicken Gnocchi Soup | Recipe | Crockpot mashed potatoes, Chicken gnocchi soup recipe, Copycat olive garden chicken gnocchi",4,2026-06-14 14:04:16
https://www.pinterest.com/pin/56787645297465152/,"Sticky Toffee Pudding | Recipe | Toffee sauce, Sticky toffee pudding recipe",5,2026-06-14 14:04:16
https://www.pinterest.com/pin/212795151135195637/,"Creamy Potato Soup | Recipe | Creamy potato soup recipe, Homemade potato soup, Easy potato soup recipe",3,2026-06-14 14:04:18
https://www.pinterest.com/pin/212795151135192969/,"Easy Shepherd's Pie | Recipe | Quick shepards pie ground beef, How to make shepherd's pie with ground beef, Shepherd's pie recipe with ground beef and gravy",63,2026-06-14 14:04:18
https://www.pinterest.com/pin/212795151135195535/,"Turkey Moist Maker Sandwich- Ross' Favorite | Recipe | Turkey dressing sandwich recipes, Turkey sandwich recipes cold, Tasty recipes",6,2026-06-14 14:04:18
https://www.pinterest.com/pin/212795151135195514/,"Chewy Sugar Cookies | Recipe | Iced oatmeal cookies, Butter pecan cookies, Delicious cookie recipe",2,2026-06-14 14:04:18
https://www.pinterest.com/pin/212795151135189187/,"Bourbon Sweet Potato Cake Recipe | Sweet potato rum cake, Sweet potato cake southern, Sweet potato recipes with bourbon",7,2026-06-14 14:04:18
https://www.pinterest.com/pin/212795151135190915/,"Olive Garden Chicken Gnocchi Soup | Recipe | Skirt steak soup recipes, Soups and stews",5777,2026-06-14 14:04:18
https://www.pinterest.com/pin/56787645297440455/,"Whiskey Glazed Turkey Breast Recipe for an Unforgettable Thanksgiving Feast | Rolled turkey breast roast, Small turkey breast recipes, Baked boneless turkey breast",27,2026-06-14 14:04:18
https://www.pinterest.com/pin/easy-stuffing-recipe--212795151135185693/,"Easy Stuffing Recipe | Best easy dinner recipes, Homemade stuffing, Dinner side dish",5,2026-06-14 14:04:18
https://www.pinterest.com/pin/56787645297398566/,"Smothered Potatoes | Recipe | Stay at home chef, Food content, Delicious potatoes",2,2026-06-14 14:04:25
https://www.pinterest.com/pin/212795151135151625/,"Popovers | Recipe | Popovers recipes americas test kitchen, Mary makes it easy recipes popovers, Traditional passover popovers",2,2026-06-14 14:04:25
https://www.pinterest.com/pin/329536897746212726/,"Easy Ground Beef Stir Fry Recipe | Ground meat stir-fry dish, Spicy ground meat stir-fry, Teriyaki ground beef stir fry",2,2026-06-14 14:04:25
https://www.pinterest.com/pin/212795151135148530/,"Creamy Crockpot Mashed Potatoes Recipe | Mashed potatoes recipe crock pot easy, Mashed potatoes in a crockpot, Crockpot mashed potatoes easy",4,2026-06-14 14:04:26
https://www.pinterest.com/pin/slow-cooker-cranberry-meatballs--212795151135151156/,"Slow Cooker Cranberry Meatballs | Recipe | Jellied cranberry sauce, Potluck dishes, Side dishes appetizers",8,2026-06-14 14:04:26
https://www.pinterest.com/pin/212795151135141984/,"Slow Cooker Stuffing with Sausage and Apples | Recipe | Crockpot sausage stuffing thanksgiving, Crock pot sausage stuffing thanksgiving, Slow cooker sausage stuffing recipe",8,2026-06-14 14:04:26
https://www.pinterest.com/pin/delicious-smothered-potatoes-recipe--212795151135142327/,"Delicious Smothered Potatoes Recipe | Smothered potatoes in oven, How to make smothered potatoes, Southern smothered potatoes",9,2026-06-14 14:04:27
https://www.pinterest.com/pin/212795151135138860/,"Smothered Chicken Recipe | Crispy Chicken in Delicious Gravy | Best smothered chicken recipe, How to make smothered chicken, Southern smothered chicken",3,2026-06-14 14:04:29
https://www.pinterest.com/pin/german-chocolate-cake--212795151135141880/,"German Chocolate Cake | German baking, Baking chocolate, Cake recipes",137,2026-06-14 14:04:29
https://www.pinterest.com/pin/212795151135138808/,"DIY Corn Muffin Mix Recipe - Every Day with Rachael Ray | Preppy kitchen cornbread, Fluffy cornbread muffins, Preppy kitchen muffins",7,2026-06-14 14:04:29
https://www.pinterest.com/pin/212795151135138856/,"Chewy Sugar Cookies | Soft and Irresistible | Recipe | Thick and chewy sugar cookies, Chewy rolled sugar cookies, Easy cookie recipe",7,2026-06-14 14:04:29
https://www.pinterest.com/pin/212795151135138786/,"Pumpkin Banana Bread | Recipe | Moist pumpkin banana cake bread, Pumpkin and banana bread, Pumpkin banana bread recipe",4,2026-06-14 14:04:29
https://www.pinterest.com/pin/212795151135138349/,"Homemade Croutons - Elevate Your Salads! | Recipe | Diy croutons for dinner, Easy croutons recipe, Homemade croutons for salads",3,2026-06-14 14:04:29
https://www.pinterest.com/pin/212795151135138229/,"Best Chocolate Chip Pumpkin Cupcakes for Fall | Recipe | Chocolate chip cupcakes recipe, Homemade chocolate buttercream frosting, Cake mix cupcakes",8,2026-06-14 14:04:29
https://www.pinterest.com/pin/212795151135138458/,"Delicious Slow Cooker Jambalaya Recipe | Jambalaya crock pot recipe healthy, Slow cooker chicken jambalaya, Forgotten jambalaya",10,2026-06-14 14:04:30
https://www.pinterest.com/pin/212795151135138168/,"Oreo Ice Cream Pie | Recipe | Oreo ice cream pie recipe easy, Cookies and cream ice cream pie, Homemade oreo ice cream",8,2026-06-14 14:04:30
https://www.pinterest.com/pin/212795151135138048/,"Sopa de pastel de pollo | Sopa de pollo | Recipe | Chicken pot pie soup with potatoes, Best chicken pot pie soup, Chicken pot pie soup with biscuits",6,2026-06-14 14:04:31
https://www.pinterest.com/pin/212795151135137802/,"Copycat IKEA Swedish Meatballs | Recipe | Ikea copycat recipes, Homemade swedish meatballs dinner, Copycat ikea meatballs",29,2026-06-14 14:04:31
https://www.pinterest.com/pin/212795151135137501/,"Porcupine Meatball Recipe | Ground beef porcupine meatballs, Porcupine meatballs 12 tomatoes, Porcupine meatballs recipe",6,2026-06-14 14:04:31
https://www.pinterest.com/pin/french-onion-dip--212795151135137964/,"Classic French Onion Dip Recipe | Ranch french onion dip, French onion chip dip recipes, Easy dip recipes",6,2026-06-14 14:04:31
https://www.pinterest.com/pin/212795151135135455/,"Maple Dijon Pork Tenderloin Recipe | Pork tenderloin recipes with maple syrup, Maple dijon pork loin recipe, Maple dijon pork tenderloin oven",5,2026-06-14 14:04:31
https://www.pinterest.com/pin/212795151135134634/,"Sun-Dried Tomato Cheese Ball Recipe | Cheese ball with sun dried tomatoes, Sun dried tomato cheese ball dip, Cheese ball recipes easy",2,2026-06-14 14:04:33
https://www.pinterest.com/pin/brown-sugar-bacon-little-smokies--212795151135134528/,"Brown Sugar Bacon Little Smokies | Recipe | Little smokies with bacon brown sugar, Appetizer recipes, Amazing appetizers",3,2026-06-14 14:04:33
https://www.pinterest.com/pin/212795151135134406/,"Apple Fritter Bread | Recipe | Scrumptious desserts, Apple fritter bread recipe, Apple pie",9,2026-06-14 14:04:33
https://www.pinterest.com/pin/212795151135134517/,"Pesto Tortellini Recipe | Tortellini recipes with pesto, Pesto tortellini pasta recipe, Pesto tortellini dish",17,2026-06-14 14:04:33
https://www.pinterest.com/pin/212795151135134472/,"Fall Off The Bone Ribs Recipe | Back rib recipes, Bone in rib recipe, Ribs oven",16998,2026-06-14 14:04:33
https://www.pinterest.com/pin/212795151135132782/,"Braided Apple Puff Pastry Recipe | Quick and Easy Dessert | Easy apple pastry tutorial, Apple caramel puff pastry braid, Apple butter puff pastry braid",6,2026-06-14 14:04:34
https://www.pinterest.com/pin/56787645297377036/,"Pumpkin Cheesecake Pie | Pumpkin pie cheesecake, Pumpkin cheesecake, Pumpkin pie recipes",5,2026-06-14 14:04:34
https://www.pinterest.com/pin/slow-cooker-pizza--212795151135123249/,"Slow Cooker Pizza Recipe | Homemade pizza, Pizza dough, Pizza pizzazz",51,2026-06-14 14:04:35
https://www.pinterest.com/pin/212795151135128394/,"Butterbeer Recipe | Easy butterbeer recipe, Homemade butterbeer, Butter beer recipe harry potter",4,2026-06-14 14:04:36
https://www.pinterest.com/pin/212795151135128095/,"Slow Cooker Pizza Recipe | Buffalo chicken sandwiches, Slow cooker meatballs, Homemade pizza dough",3,2026-06-14 14:04:37
https://www.pinterest.com/pin/45036065015285654/,"Delicious Struffoli with Honey and Sprinkles | Recipe | Best struffoli recipe, Baked struffoli recipe, Struffoli recipe traditional",26,2026-06-14 14:04:37
https://www.pinterest.com/pin/212795151135123259/,"Cream Horns: Crunchy, Sweet, and Creamy | Recipe | Chocolate cream horns, Cream horn dessert, Cream horn recipe",60,2026-06-14 14:04:37
https://www.pinterest.com/pin/212795151135123027/,"30 Minute Ground Beef Stroganoff Recipe | Beef stroganoff with ground turkey, Ground beef stroganoff recipe healthy, Ground beef stroganoff recipe no mushrooms",7,2026-06-14 14:04:37
https://www.pinterest.com/pin/butterbeer-recipe--56787645297364042/,"Butterbeer Recipe | Butterscotch beer recipe, Easy butterbeer, Butterbeer recipe with beer",42,2026-06-14 14:04:38
https://www.pinterest.com/pin/wendys-chili-recipe--212795151135122558/,"Wendy's Chili Recipe | Wendys chilli recipes, Wendy's chilli, Wendys chili recipe",102,2026-06-14 14:04:38
https://www.pinterest.com/pin/56787645297354517/,"Mini Halloween Cheesecakes | Recipe | Cocoa powder cookies, Chocolate whipped cream, Cheesecake flavor",16,2026-06-14 14:04:40
https://www.pinterest.com/pin/56787645297351722/,"Apple Hand Pies: Portable Homemade Dessert | Recipe | Homemade apple hand pies, Fried apple pies homemade, Southern hand pies",10,2026-06-14 14:04:40
https://www.pinterest.com/pin/56787645297351580/,"Chicken Fried Chicken Recipe | Chicken recipes, Fried chicken recipes, Recipes",29,2026-06-14 14:04:40
https://www.pinterest.com/pin/212795151135110737/,"Creepy and Cute Halloween Dirt Cake | Recipe | Pumpkin patch dirt cake, Halloween dirt cake recipe easy, Halloween dessert cake",7,2026-06-14 14:04:40
https://www.pinterest.com/pin/212795151135108389/,"Apple Cider Mimosas Recipe | Apple cider mimosa recipe, Flavored liquor, Fall drink",17,2026-06-14 14:04:40
https://www.pinterest.com/pin/56787645297351545/,"Apple Fritter Bread Recipe | Scrumptious desserts, Apple pie",4,2026-06-14 14:04:40
https://www.pinterest.com/pin/56787645297346876/,"Twice Baked Sweet Potatoes Recipe | Vegan twice baked sweet potatoes, Twice baked sweet potatoes with caramelized onions, Baked sweet potatoes with rosemary",30,2026-06-14 14:04:40
https://www.pinterest.com/pin/212795151135108081/,"Cinnamon Crescent Rolls: Tornadough Alli | Recipe | Cinnamon cresent rolls, Super easy breakfast, Crescent roll recipes dessert",12,2026-06-14 14:04:41
https://www.pinterest.com/pin/mini-halloween-cheesecakes--212795151135108099/,"Mini Halloween Cheesecakes Recipe | Halloween desserts, Halloween food treats, Like cheesecake",99,2026-06-14 14:04:41
https://www.pinterest.com/pin/56787645297342741/,"Fluffy Buttermilk Pancake Recipe | Buttermilk pancakes with butter, Ingredients for buttermilk pancakes, Pancake recipe image",9,2026-06-14 14:04:42
https://www.pinterest.com/pin/212795151135101386/,"Chicken Fried Chicken Recipe | Traditional fried chicken meal, Classic fried chicken meal, Chicken fried chicken easy",27083,2026-06-14 14:04:44
https://www.pinterest.com/pin/212795151135101638/,"Make Your Own Taco Bell Nacho Fries at Home | Recipe | How to make taco bell fries, Taco bell fries ingredients, Taco bell fries recipe",77,2026-06-14 14:04:44
https://www.pinterest.com/pin/easy-beef-stir-fry--212795151135101450/,"Easy Beef Stir Fry | Beef recipes, Ground beef, Beef dish",195,2026-06-14 14:04:44
https://www.pinterest.com/pin/212795151135101324/,"Maple Dijon Pork Tenderloin Recipe | Stuffed pork tenderloin, Baked pork chops, Best pork tenderloin recipe",4,2026-06-14 14:04:45
https://www.pinterest.com/pin/45036065015263151/,Burnt Almond Torte Cake Recipe,175,2026-06-14 14:04:45
https://www.pinterest.com/pin/colorful-mini-halloween-cheesecakes-with-oreo-crumble-crust--212795151135100855/,"Colorful Mini Halloween Cheesecakes with Oreo Crumble Crust | Recipe | Halloween mini cheesecakes, Halloween party dessert ideas, Halloween treats",112,2026-06-14 14:04:45
https://www.pinterest.com/pin/56787645297337871/,"Chicken Sheet Pan Quesadillas | Recipe | Loaded sheet pan quesadillas, Sheet pan cheese quesadillas, Buffalo chicken sheet pan quesadilla",154,2026-06-14 14:04:46
https://www.pinterest.com/pin/56787645297331366/,"German Chocolate Cake Recipe - Tornadough Alli | German chocolate cake with coconut filling, German chocolate cake with cocoa powder, Kenneth temple german chocolate cake",4,2026-06-14 14:04:46
https://www.pinterest.com/pin/212795151135091979/,"Chocolate Chip Pumpkin Blondies | Recipe | Pumpkin bread pudding, Chocolate chip blondies, Caramel bits",13,2026-06-14 14:04:48
https://www.pinterest.com/pin/45036065015254589/,"Chocolate Chip Pumpkin Pudding Pie Recipe | Pumpkin pie with pudding recipe, Thanksgiving pudding desserts, Chocolate chip pumpkin pie",5,2026-06-14 14:04:48
https://www.pinterest.com/pin/crockpot-easy-apple-crumble--56787645297327925/,"Crockpot Easy Apple Crumble | Recipe | Crock pot desserts, Slow cooker desserts, Apple crumble crockpot",7,2026-06-14 14:04:48
https://www.pinterest.com/pin/45036065015254440/,"Pumpkin Truffles - Tornadough Alli | Recipe | Expensive chocolate, Pumpkin spice treats, Truffles recipe",7,2026-06-14 14:04:48
https://www.pinterest.com/pin/slow-cooker-sausage-stuffing--212795151135091718/,"Slow Cooker Sausage Stuffing Recipe | Crockpot sausage stuffing thanksgiving, Crock pot sausage stuffing thanksgiving",2231,2026-06-14 14:04:48
https://www.pinterest.com/pin/212795151135091245/,"German Chocolate Cake Recipe | German chocolate cake with coconut filling, German chocolate cake with cocoa powder, Kenneth temple german chocolate cake",64,2026-06-14 14:04:48
https://www.pinterest.com/pin/47710077295906804/,"Crockpot French Dips | Recipe | Beer french dip slow cooker, Crock pot french dip slow cooker, Easy slow cooker french dip",8,2026-06-14 14:04:48
https://www.pinterest.com/pin/212795151135085211/,"Slow Cooker Beer Brats | Food and drink, Cooking methods, Slow cooking | Recipe | Beer brats recipe, Brats dinner, Slow cooker brats",7,2026-06-14 14:04:48
https://www.pinterest.com/pin/212795151135085061/,"Pumpkin Bread Pudding Recipe: A Fall Delight for Brunch or Dessert! | Easy pumpkin bread pudding, Pumpkin bread pudding recipes, Pumpkin custard",847,2026-06-14 14:04:49
https://www.pinterest.com/pin/45036065015245872/,"Best Apple Crisp Recipe with Crispy Oatmeal Topping | How to make apple crisp in the oven, How to make apple crisp easy, How to make apple crisp with pecans",7,2026-06-14 14:04:51
https://www.pinterest.com/pin/56787645297317446/,"Smoked Corn on the Cob Recipe for Summer Cookouts | How to make mexican street corn, Mexican street corn on the cob, Corn recipes",67,2026-06-14 14:04:51
https://www.pinterest.com/pin/229754018487453357/,"Homemade Star Crunch: Blogger Recipes We Love | Star crunch copycat recipe, Crunchie fudge recipe, No bake desserts",44,2026-06-14 14:04:52
https://www.pinterest.com/pin/212795151135078567/,"Cosmic Brownie Cookies | Recipe | Chocolate cosmic cookies, Copycat cosmic brownie cookies, Homemade cosmic brownie cookies",24,2026-06-14 14:04:53
https://www.pinterest.com/pin/212795151135078543/,"Gingerbread Edible Cookie Dough Recipe | Gluten free christmas cookies, Edible sugar cookie dough recipe",1,2026-06-14 14:04:53
https://www.pinterest.com/pin/no-bake-mint-chocolate-cheesecake--212795151135078509/,"No Bake Mint Chocolate Cheesecake Recipe | Mint cheesecake topping, Homemade mint cheesecake recipe, Mint chocolate cheesecake no bake",2,2026-06-14 14:04:53
https://www.pinterest.com/pin/212795151135078557/,Slow Cooker Green Bean Casserole,25,2026-06-14 14:04:53
https://www.pinterest.com/pin/212795151135077502/,"Pumpkin Patch Cookies: A Fun Fall Dessert Idea | Recipe | Chocolate covered cookies, Halloween food desserts, Halloween food treats",2,2026-06-14 14:04:55
https://www.pinterest.com/pin/56787645297306642/,"Cream Horns Recipe | Delicious Pastry Dessert | Pastries recipes dessert, Tasty pastry, Puff pastry cream puffs",11,2026-06-14 14:04:55
https://www.pinterest.com/pin/212795151135075609/,"Monster Cookies Recipe: Scrumptious Desserts and Sweets | Easy monster cookie baking, How to decorate monster cookies, Pumpkin monster cookies recipe",95,2026-06-14 14:04:55
https://www.pinterest.com/pin/the-best-lasagna-tornadough-alli--56787645297310378/,"The Best Homemade Lasagna | Recipe | Italian lasagna slice on plate, Layered lasagna with meat sauce, Lasagna slice with fresh herbs",8,2026-06-14 14:04:55
https://www.pinterest.com/pin/212795151135077494/,"Arancini Recipe | Golden fried arancini, Arancini recipe easy, Fried arancini with tomato sauce",35,2026-06-14 14:04:55
https://www.pinterest.com/pin/the-best-lasagna--212795151135067888/,"Best Lasagna Recipe with Homemade Meat Sauce | Italian lasagna slice on plate, Layered lasagna with meat sauce, Lasagna slice with fresh herbs",61,2026-06-14 14:04:57
https://www.pinterest.com/pin/breakfast-sausage-recipe-best-recipes--56787645297303462/,"Breakfast Sausage Recipe: Best Recipes | Homemade breakfast sausage recipe, Breakfast crunchwrap, Leftover breakfast",19,2026-06-14 14:04:58
https://www.pinterest.com/pin/breakfast-sausage--212795151135067160/,"Hearty Breakfast Sausage | Sausage recipes, Sausage homemade, Breakfast sandwiches",101,2026-06-14 14:04:59
https://www.pinterest.com/pin/56787645297293192/,"Copycat Prantl's Burnt Almond Torte: BHG's Best Recipes | Almond torte cake recipe, Burnt almond torte recipe, Almond desserts",2,2026-06-14 14:05:01
https://www.pinterest.com/pin/copycat-starbucks-medicine-ball-tea-blogger-recipes-we-love--56787645297292658/,Copycat Starbucks Medicine Ball Tea: Blogger Recipes We Love,7,2026-06-14 14:05:02
https://www.pinterest.com/pin/212795151135055299/,"Homemade Breakfast Sausage Recipe | Best breakfast sausage options, How to cook breakfast sausage links, Sausage recipies",37,2026-06-14 14:05:02
https://www.pinterest.com/pin/212795151135061103/,"Homemade Star Crunch Recipe | Star crunch copycat recipe, Crunchie fudge recipe, No bake desserts",17,2026-06-14 14:05:02
https://www.pinterest.com/pin/212795151135046673/,"Cranberry Orange Bundt Cake Recipe | Cranberry orange cake easy, Cranberry cake with orange juice, Cranberry orange bundt cake with pineapple",7,2026-06-14 14:05:02
https://www.pinterest.com/pin/melted-snowman-cookies-tornadough-alli--212795151135055988/,"Melted Snowman Cookies: Perfect for the Holidays! | Recipe | How to make melted snowman cookies, Melted snowman cookies recipe, Melting snowman cookie recipe",7,2026-06-14 14:05:02
https://www.pinterest.com/pin/slow-cooker-shredded-beef-tacos--212795151135055342/,"Slow Cooker Shredded Beef Tacos | Taco toppings, Tacos burritos, Beef dinner",170,2026-06-14 14:05:02
https://www.pinterest.com/pin/212795151135058436/,"Breakfast Sausage Recipe | Homemade breakfast sausage recipe, Breakfast crunchwrap, Leftover breakfast",2,2026-06-14 14:05:02
https://www.pinterest.com/pin/56787645297292984/,"Christmas Mimosas Recipe with Cranberry Spritz | Christmas brunch drinks, Christmas mimosas ideas, Christmas cocktails",3,2026-06-14 14:05:03
https://www.pinterest.com/pin/45036065015221902/,"Cream Puffs Recipe: Tornadough Alli | Lithuanian curd cheese doughnuts, Traditional lithuanian dessert - skruzdelynas, Serbian pastries",1,2026-06-14 14:05:03
https://www.pinterest.com/pin/212795151135049262/,"Melted Snowman Cookies | Recipe | How to make melted snowman cookies, Melted snowman cookies recipe, Melting snowman cookie recipe",5,2026-06-14 14:05:05
