url,title,saves,timestamp
https://www.pinterest.com/pin/56787645302172643/,"Chicken Fried Chicken | Recipe | Large family meals, Chicken dishes recipes, Fried chicken recipe southern",279,2026-06-06 16:05:18
https://www.pinterest.com/pin/56787645302172387/,"Baked Queso Dip - Tornadough Alli | Recipe | Baked queso dip easy, Baked queso dip for party, Queso dip in oven",44,2026-06-06 16:05:19
https://www.pinterest.com/pin/56787645302172411/,"Muffuletta Sandwich Recipe | Bread for muffaletta, Giant muffaletta italian sandwich, Jason’s deli muffuletta",37,2026-06-06 16:05:19
https://www.pinterest.com/pin/212795151136989783/,"Juicy Lucy Recipe - Tornadough Alli | How to make a juicy lucy, Juicy lucy burger ingredients, The best burger",32,2026-06-06 16:05:21
https://www.pinterest.com/pin/212795151136989763/,"Lemon Pepper Chicken {The Easiest and Best Grilled Chicken Recipe} | Lemon pepper chicken meal ideas, Lemon pepper chicken healthy, Chicken parmesan",46,2026-06-06 16:05:21
https://www.pinterest.com/pin/56787645302169162/,"Fresh Strawberry Pie | Recipe | Strawberry pie recipe with honey, Strawberry almond pie recipe, Easy strawberry pie recipe",1012,2026-06-06 16:05:22
https://www.pinterest.com/pin/212795151136988417/,"Chocolate Chip Banana Bread—Great for Mother's Day Breakfast or Brunch! | Recipe | Brunch ideas with chocolate chips, Banana bread recipe chocolate chip cinnamon, Chocolate chip banana bread variation",28,2026-06-06 16:05:23
https://www.pinterest.com/pin/212795151136988757/,"Grilled Italian Sausage Sandwiches | Recipe | Italian sausage sub sandwich, How to make italian sausage sandwiches, Italian sausage and pepper sandwich",27,2026-06-06 16:05:23
https://www.pinterest.com/pin/slow-cooker-beer-brats-tornadough-alli--212795151136986108/,"Slow Cooker Beer Brats | Recipe | Easy slow cooker, Breakfast recipes easy, Slow cooker",31,2026-06-06 16:05:23
https://www.pinterest.com/pin/56787645302130186/,"Limoncello for Summer | Recipe | Lemoncello drink recipe, Summer drink ideas with limoncello, Limoncello recipe",220,2026-06-06 16:05:29
https://www.pinterest.com/pin/212795151136951748/,"Hollandaise Sauce | Recipe | Things to make with egg yolks, Homemade hollandaise sauce easy, Classic recipe",12,2026-06-06 16:05:29
https://www.pinterest.com/pin/56787645302061458/,"Fall Off The Bone Ribs | Recipe | Fall ribs recipe, How to make fall off the bone ribs, Oven ribs fall off the bone pork",399,2026-06-06 16:05:30
https://www.pinterest.com/pin/212795151136940677/,"Copycat Olive Garden Chicken Gnocchi Soup Recipe—A Comforting, Warm Meal! | Simple chicken gnocchi soup, Chicken gnocchi soup with artichokes, Chicken an gnocchi soup",705,2026-06-06 16:05:30
https://www.pinterest.com/pin/212795151136941217/,"Limoncello | Recipe | Summer drink ideas with limoncello, Lemoncello drink, Non alcoholic limoncello recipe",6,2026-06-06 16:05:31
https://www.pinterest.com/pin/212795151136937681/,"Easiest Fruit Pizza | Recipe | Baked fruit desserts healthy, Healthy fruit pizza ideas, Best sugar cookie recipe for fruit pizza",105,2026-06-06 16:05:33
https://www.pinterest.com/pin/212795151136937665/,"Homemade Pancake Muffins | Recipe | Muffins from pancake mix recipes, Pancake mix banana muffins, Homemade banana muffins in pan",112,2026-06-06 16:05:33
https://www.pinterest.com/pin/212795151136937540/,"Strawberry Dumplings—Great for Summer! | Fruit dumplings easy recipes, Strawberry dumplings with crumble topping, Strawberry dumplings with sauce",50,2026-06-06 16:05:34
https://www.pinterest.com/pin/56787645301947026/,"Creamy Root Beer Rum Cocktail - Tornadough Alli | Recipe | Easy whiskey drink ideas, Homemade root beer drink, Creamy alcoholic drinks recipes",3336,2026-06-06 16:05:34
https://www.pinterest.com/pin/212795151136937570/,"Nutella French Toast Sticks - A Delicious Breakfast Treat! | Recipe | Easy at home breakfast ideas, Easy breakfast for mom, Nutella breakfast recipes",114,2026-06-06 16:05:34
https://www.pinterest.com/pin/212795151136937648/,"The BEST Strawberry Pop-Tarts—Great for Snack Time, Breakfast, and Brunch! | Strawberry jam dessert recipes, Strawberry pop tarts, Delicious strawberry",164,2026-06-06 16:05:34
https://www.pinterest.com/pin/tender-and-juicy-marry-me-chicken--212795151136937506/,"Tender and Juicy Marry Me Chicken | Recipe | How to cook chicken tikka masala, How to make marry me chicken keto, Marry me dinner recipes",486,2026-06-06 16:05:34
https://www.pinterest.com/pin/212795151136937482/,"Overnight French Toast Bake {An Easy Breakfast Solution} | Recipe | Baked french toast recipe overnight, French toast bake not overnight",412,2026-06-06 16:05:34
https://www.pinterest.com/pin/56787645301946949/,"Lemon Pepper Chicken Kabobs - Tornadough Alli | Recipe | Lemon pepper chicken skewers, Lemon pepper chicken recipe, Easy recipes",83,2026-06-06 16:05:35
https://www.pinterest.com/pin/56787645301946917/,"Beer Can Chicken | Recipe | Beer can chicken sides dishes, Beer can chicken recipe with beer, Best beer can chicken",38,2026-06-06 16:05:36
https://www.pinterest.com/pin/212795151136934026/,"Parmesan Crusted Chicken | Recipe | 3 ingredient parmesan crusted chicken, Parmesan crusted chicken meal, Parmesan crusted chicken no bread crumbs",34,2026-06-06 16:05:37
https://www.pinterest.com/pin/212795151136933962/,"Homemade Baked Beans—Great for Summer! | Recipe | Baked beans dish with herbs, Baked beans recipe using bushes baked beans, Easy jack daniels baked beans",96,2026-06-06 16:05:38
https://www.pinterest.com/pin/212795151136925970/,"Chicken Fried Chicken - Tornadough Alli | Recipe | Traditional fried chicken meal, Classic fried chicken meal, Southern fried chicken and gravy",7453,2026-06-06 16:05:41
https://www.pinterest.com/pin/tiktok-grinder-sandwich--212795151136926103/,"TikTok Grinder Sandwich | Recipe | Tik tok grinder sandwich recipe, Best sandwich recipes",334,2026-06-06 16:05:42
https://www.pinterest.com/pin/mojo-pork-chops-with-cilantro-sour-cream-rice-recipe--212795151136929759/,"Mojo Pork Chops with Cilantro Sour Cream Rice Recipe | Pork chop dinner side dishes, Summer pork chop recipes, Pork chops and rice recipes",128,2026-06-06 16:05:42
https://www.pinterest.com/pin/212795151136919595/,"How to Make Walking Tacos | Recipe | Walking tacos recipe, Crock pot tacos, Taco night",46,2026-06-06 16:05:43
https://www.pinterest.com/pin/chocolate-chip-banana-bread-recipe--56787645301479976/,"Chocolate Chip Banana Bread Recipe | Banana bread with chocolate chips moist, Chocolate chip banana bread recipe moist, Chocolate chip banana bread variations",215,2026-06-06 16:05:44
https://www.pinterest.com/pin/212795151136914771/,"Baked Queso Dip | Recipe | Baked queso dip easy, Baked queso dip for party, Queso dip in oven",10,2026-06-06 16:05:44
https://www.pinterest.com/pin/dirty-soda--56787645301479715/,"Easy Dirty Soda | Recipe | Dirty soda recipe non alcoholic, Creamer in soda, Dirty soda drink ideas",170,2026-06-06 16:05:44
https://www.pinterest.com/pin/56787645301479364/,"Almond Croissants Recipe with Almond Cream Filling | Almond croissant recipe easy, Almond croissant recipe from scratch, Homemade almond croissants",80,2026-06-06 16:05:44
https://www.pinterest.com/pin/212795151136910848/,"Creamy Bacon Cheddar Ranch Pasta Salad | Recipe | Bacon ranch pasta salad recipe, Bacon ranch pasta salad with mayo, Dinner recipes",7,2026-06-06 16:05:46
https://www.pinterest.com/pin/how-to-make-the-perfect-chicken-tenders--47710077297713496/,"How to Make the Perfect Chicken Tenders | Recipe | Homemade chicken tenders with ranch, Best homemade chicken tenders, Easy homemade chicken tenders",539,2026-06-06 16:05:47
https://www.pinterest.com/pin/56787645301473495/,"Southern Banana Pudding | Classic Dessert Recipe | Southern banana pudding recipe homemade, How to make banana pudding with vanilla pudding, Vanilla wafer pudding",1560,2026-06-06 16:05:47
https://www.pinterest.com/pin/47710077297710376/,"Marry Me Chicken | Recipe | Oven roasted dinners, Marry me chicken recipe oven, Marry me chicken for a crowd",68,2026-06-06 16:05:47
https://www.pinterest.com/pin/tuna-melt-recipe--56787645301456650/,"Tuna Melt Recipe | Tuna melt sandwich ideas, How to make a tuna melt with tomato, Easy tuna melt recipe",46,2026-06-06 16:05:49
https://www.pinterest.com/pin/56787645301453401/,"New York Cheesecake with Cherries | Recipe | Cheesecake bars with cherry filling, Cheesecake bars with cherry topping, Cherry cheesecake bars recipe",45,2026-06-06 16:05:51
https://www.pinterest.com/pin/212795151136892097/,"Irish Coffee Recipe | Easy and Delicious | Best whiskey for irish coffee, Jameson irish coffee recipe, Homemade irish coffee ingredients",36,2026-06-06 16:05:51
https://www.pinterest.com/pin/212795151136892085/,"Strawberry Pie - The Most Addicting Pie Ever | Recipe | Vegan strawberry dessert recipes, Vegan strawberry pie, Fresh strawberry pie recipe",1135,2026-06-06 16:05:51
https://www.pinterest.com/pin/212795151136892084/,"Pizza Grilled Cheese | Delicious Sandwich Recipe | Grilled cheese sandwich hacks, How to make grilled cheese sandwich with pepperoni, Pizza grilled cheese recipes",250,2026-06-06 16:05:51
https://www.pinterest.com/pin/212795151136892088/,"TikTok Grinder Sandwich | Recipe | Grinder sandwich ingredients, Grinder sandwich recipe, How to make a grinder sandwich",140,2026-06-06 16:05:51
https://www.pinterest.com/pin/212795151136892082/,"Sourdough Pop Tarts with Brown Sugar Cinnamon and Frosted Strawberry Fillings | Recipe | Sourdough poptarts, Sourdough discard pop tarts brown sugar, Sourdough discard valentines",47,2026-06-06 16:05:51
https://www.pinterest.com/pin/muffuletta-sandwich-recipe--212795151136889640/,"Muffuletta Sandwich Recipe | Recipe | Muffuletta sandwich, Muffuletta, Muffuletta recipe",3,2026-06-06 16:05:53
https://www.pinterest.com/pin/212795151136889186/,"Vanilla Bean Pistachio Cake {A Delicious, Light, Flavorful Cake} | Recipe | Vanilla pistachio cake, Pistachio birthday cake recipe, Pistachio buttercream cake",455,2026-06-06 16:05:54
https://www.pinterest.com/pin/212795151136888952/,"Creamy and Fluffy Strawberry Mousse | Recipe | Strawberry puree desserts, Strawberry mousse dessert with sauce, Fluffy strawberry mousse recipe",36,2026-06-06 16:05:56
https://www.pinterest.com/pin/212795151136888790/,"Deliciously Cheesy Crockpot Potatoes: A Family Favorite Recipe | Easy cheesy potatoes crock pot, Crockpot potatoes cheesy, Cheesey potatoes crock pot",953,2026-06-06 16:05:56
https://www.pinterest.com/pin/47710077297689064/,"Applebee's Honey Pepper Chicken Mac and Cheese - The Perfect Copycat! | Recipe | Applebee's honey pepper chicken mac and cheese recipe, Copycat applebee's honey pepper chicken mac and cheese, Easy din",61,2026-06-06 16:05:56
https://www.pinterest.com/pin/212795151136885409/,"The Ultimate Easter Menu | Easter dinner menu with ham, Easter meats besides ham, Typical easter meal",14,2026-06-06 16:05:58
https://www.pinterest.com/pin/212795151136872862/,"Easy Walking Tacos | Recipe | Walking tacos recipe, Crock pot tacos, Taco night",3,2026-06-06 16:06:01
https://www.pinterest.com/pin/212795151136871006/,"Easy Fruit Pizza | Recipe | Fruit pizza with cream cheese, Homemade pizza with fruit, Cream cheese frosting for fruit pizza",151,2026-06-06 16:06:01
https://www.pinterest.com/pin/212795151136870870/,"Traditional Carrot Cake Recipe with Cream Cheese Buttercream | Best frosting for carrot cake, Best icing for carrot cake, Best carrot cake for parties",258,2026-06-06 16:06:01
https://www.pinterest.com/pin/carrot-cake-cupcakes--56787645301430834/,"Delicious Carrot Cake Cupcakes | Recipe | Easy carrot cupcake recipe, Homemade carrot cupcakes recipe, Classic carrot cupcakes",60,2026-06-06 16:06:01
https://www.pinterest.com/pin/56787645301404485/,"Easy Crispy Buffalo Shrimp Recipe | Baked buffalo shrimp dip, How to make buffalo shrimp tacos, Spicy buffalo shrimp dip",231,2026-06-06 16:06:03
https://www.pinterest.com/pin/56787645300917247/,"Strawberries and Cream Oatmeal Recipe | Strawberry oatmeal with oats, Homemade strawberry oatmeal, Strawberry oatmeal with fresh fruit",31,2026-06-06 16:06:06
https://www.pinterest.com/pin/56787645300917199/,"Easy and Tart Lemon Brownies | Recipe | Fudgy lemon brownies recipe, Moist fudgy lemon brownies, Easy lemon brownie recipe",87,2026-06-06 16:06:06
https://www.pinterest.com/pin/212795151136848803/,"Lemon Baked Donuts Recipe | Glazed lemon donuts, How to make lemon donuts, Glazed donut recipe",40,2026-06-06 16:06:07
https://www.pinterest.com/pin/56787645300639080/,"Mouth-Watering TikTok Grinder Sandwich Recipe | Tik tok grinder sandwich recipe, How to make the viral tiktok grinder sandwich, Best sandwich recipes",285,2026-06-06 16:06:08
https://www.pinterest.com/pin/56787645300639000/,"Easter Menu Inspiration: Explore Delicious Options for Your Perfect Meal | Best easter dinner, Easter dinner ideas pinterest, Easter dinner menus",119,2026-06-06 16:06:11
https://www.pinterest.com/pin/56787645300638975/,"Easy Strawberry Mousse | Recipe | Strawberry puree desserts, Strawberry mousse dessert with sauce, Fluffy strawberry mousse recipe",23,2026-06-06 16:06:11
https://www.pinterest.com/pin/212795151136845605/,"Delicious Strawberry Cupcakes with Strawberry Puree Filling | Recipe | Moist cupcake recipes, Leftover strawberries, Fancy cupcakes",25,2026-06-06 16:06:12
https://www.pinterest.com/pin/212795151136845720/,"Easy Summer Corn Salad | Recipe | Corn salad with tomatoes and onions, Grilled corn and tomato salad, Two-corn summer salad",33,2026-06-06 16:06:12
https://www.pinterest.com/pin/56787645300638958/,"Instant Pot BBQ Ribs | Recipe | Instant pot ribs recipe, Rib recipes, Instant pot dinner recipes",24,2026-06-06 16:06:12
https://www.pinterest.com/pin/212795151136845354/,"Tortellini Carbonara | Recipe | Tortellini recipes, Entree recipes, Recipes",527,2026-06-06 16:06:15
https://www.pinterest.com/pin/212795151136836586/,"Easy Lemon Brownies | Recipe | Fudgy lemon brownies recipe, Moist fudgy lemon brownies, Easy lemon brownie recipe",15,2026-06-06 16:06:16
https://www.pinterest.com/pin/212795151136834813/,"Tuna Melt Recipe | What goes good with a tuna melt, Tuna melt recipe sandwiches, Easy tuna melt recipe",289,2026-06-06 16:06:16
https://www.pinterest.com/pin/212795151136827724/,"Instant Pot BBQ Ribs | Recipe | Best instant pot bbq ribs, Easy instant pot bbq ribs, Instant pot ribs recipe",4,2026-06-06 16:06:19
https://www.pinterest.com/pin/212795151136825486/,"Club Sandwich Recipe - Tornadough Alli | Best club sandwich, Classic club sandwich, Deluxe sandwich",74,2026-06-06 16:06:19
https://www.pinterest.com/pin/212795151136825265/,"Tender Fall Off The Bone Ribs | Recipe | Fall off the bone ribs in oven, Fall off the bone ribs recipe, Tender ribs",1165,2026-06-06 16:06:19
https://www.pinterest.com/pin/212795151136825137/,"Breakfast Pigs in a Blanket Recipe - Tornadough Alli | Sausage in a blanket breakfast, Brunch pigs in a blanket, Breakfast cinnamon roll pigs in a blanket",392,2026-06-06 16:06:21
https://www.pinterest.com/pin/56787645300400488/,"Fruit Pizza | Recipe | Easy fruit pizza, Fruit pizza dessert, Fruit pizza ideas",2628,2026-06-06 16:06:21
https://www.pinterest.com/pin/212795151136820534/,"Hibachi Noodles Recipe - Easy Asian Dish | Simple asian noodles, Hibachi noodles at home, Hibachi noodles recipe easy",21,2026-06-06 16:06:23
https://www.pinterest.com/pin/slow-cooker-shredded-mexican-chicken-recipe--212795151136820260/,"Slow Cooker Shredded Mexican Chicken Recipe | Mexican shredded chicken recipes crockpot, Mexican chicken slow cooker recipes, Mexican shredded chicken crockpot easy",159,2026-06-06 16:06:23
https://www.pinterest.com/pin/47710077297612488/,"Marry Me Chicken—Tender and Savory! | Recipe | How to cook chicken tikka masala, How to make marry me chicken keto, Marry me dinner recipes",1355,2026-06-06 16:06:26
https://www.pinterest.com/pin/56787645300390673/,"Crispy Air Fryer Frozen French Fries in Minutes | Frozen fries in deep fryer, Frozen fry recipes, Frozen fries in air fryer",185,2026-06-06 16:06:26
https://www.pinterest.com/pin/classic-irish-coffee-recipe-with-whisky--212795151136804113/,"Classic Irish Coffee Recipe with Whisky | Homemade irish coffee recipe, Traditional irish coffee recipe, Coffee drinks",3,2026-06-06 16:06:27
https://www.pinterest.com/pin/homemade-tartar-sauce--56787645300386999/,"Homemade Tartar Sauce | Delicious Condiment for Any Dish | Recipe | Simple homemade tartar sauce, Quick tartar sauce, How do you make homemade tartar sauce",846,2026-06-06 16:06:28
https://www.pinterest.com/pin/56787645300386968/,"The BEST Mini Tacos | Recipe | Mini taco appetizer, Mini tacos recipe, Simple taco",1945,2026-06-06 16:06:28
https://www.pinterest.com/pin/56787645300383972/,"The Best Bread Pudding EVER! | Recipe | Best bread pudding recipe simple, Breadpudding dessert, Homemade bread pudding recipes",225,2026-06-06 16:06:30
https://www.pinterest.com/pin/56787645300383942/,"Summer Fancy Toast with Stella® Cheese | Deviled egg potato salad for a crowd, Deviled egg potato salad recipe",48,2026-06-06 16:06:30
https://www.pinterest.com/pin/212795151136798360/,"Homemade Strawberry Pop Tarts Recipe | Strawberry pop tart recipe, How to make strawberry pop tarts, Strawberry pop tarts breakfast",121,2026-06-06 16:06:30
https://www.pinterest.com/pin/56787645300383797/,"Creamy Slow Cooker Mashed Potatoes | Instant mashed potatoes in crockpot, Crockpot mashed potatoes without chicken broth, Slow cooker mashed potatoes pioneer woman",123,2026-06-06 16:06:31
https://www.pinterest.com/pin/212795151136795325/,"Fried Shrimp Recipe | Tornadough Alli | Chinese fried shrimp recipes, Homemade fried seafood appetizer, Spicy fried seafood appetizer",95,2026-06-06 16:06:32
https://www.pinterest.com/pin/212795151136794409/,"Chicken Fried Chicken with Gravy and Ranch Sauce | Recipe | Homemade country fried chicken, Easy chicken frying tips, Homemade chicken frying tips",2039,2026-06-06 16:06:33
https://www.pinterest.com/pin/212795151136790609/,"Easy One-Pan Stuffed Pepper Casserole: A Twist on a Classic Recipe | Stuffed pepper casserole easy, Pepper casserole recipes",574,2026-06-06 16:06:34
https://www.pinterest.com/pin/212795151136769887/,"Tuna Melt | Recipe | What goes good with a tuna melt, Tuna melt recipe sandwiches, Easy tuna melt recipe",5,2026-06-06 16:06:38
https://www.pinterest.com/pin/56787645300358772/,"Homemade French Crullers | Perfect Breakfast Recipe | French crullers doughnut, French crullers recipe, Cruller donut recipe",1018,2026-06-06 16:06:40
https://www.pinterest.com/pin/56787645300358701/,"Simple Bread Pudding Recipe with Cinnamon and Nutmeg | Best bread pudding recipe simple, Sauce for bread pudding easy, Bread pudding sauce recipe",46,2026-06-06 16:06:41
https://www.pinterest.com/pin/56787645300355173/,"Delicious Carrot Cake Recipe with Cream Cheese Frosting | Carrot cake recipe with pecans, The most amazing carrot cake, Decorate a carrot cake",29,2026-06-06 16:06:41
https://www.pinterest.com/pin/212795151136764580/,"Homemade Chicken and Dumplings | Recipe | Homemade chicken and dumplings, Recipes, Chicken and dumplings",436,2026-06-06 16:06:43
https://www.pinterest.com/pin/56787645300348819/,"McDonald's Copycat Shamrock Shake | Recipe | Copycat shamrock shake recipe, Mcdonald's shamrock shake, Mcdonalds shamrock shake recipe",62,2026-06-06 16:06:45
https://www.pinterest.com/pin/56787645300340325/,"Smothered Pork Chops Recipe in Under 40 Minutes | Easy smothered pork chops in oven, Pork chops buttermilk, Smothered pork chops dinner",56,2026-06-06 16:06:46
https://www.pinterest.com/pin/212795151136748023/,"Savory and Juicy Slow Cooker Pork Chops | Recipe | Peach pork chops crock pot, Lemon pepper pork chops slow cooker, Keto slow cooker pork chops",1182,2026-06-06 16:06:48
https://www.pinterest.com/pin/212795151136747916/,"Homemade Shrimp Boil | Recipe | How to make a shrimp boil with vegetables, Simple shrimp boil recipe, Shrimp recipes for dinner",64,2026-06-06 16:06:49
https://www.pinterest.com/pin/212795151136747657/,"Homemade Chocolate Raspberry Cake | Recipe | Chocolate raspberry cake decorating ideas, Chocolate raspberry cake recipe, Raspberry buttercream",121,2026-06-06 16:06:49
https://www.pinterest.com/pin/47710077297553386/,"Olive Garden Chicken Gnocchi Soup | Recipe | Recipes, Soup recipes, Chicken gnocchi soup olive garden",917,2026-06-06 16:06:51
https://www.pinterest.com/pin/212795151136742060/,"Crispy Fish Sandwich with Tartar Sauce and Cheese | Recipe | Slaw for fish sandwiches, Homemade crispy fish sandwich, Fish hoagie",245,2026-06-06 16:06:51
https://www.pinterest.com/pin/212795151136741740/,"Homemade Tartar Sauce Recipe for Fish & More | Simple homemade tartar sauce, Quick tartar sauce, How do you make homemade tartar sauce",409,2026-06-06 16:06:52
https://www.pinterest.com/pin/212795151136741646/,"Best Air Fryer French Fries Recipe | French fry air fryer recipes, Ninja air fryer french fries, French fries recipe air fryer",155,2026-06-06 16:06:53
https://www.pinterest.com/pin/212795151136737982/,Homemade Pizza Grilled Cheese,17100,2026-06-06 16:06:54
https://www.pinterest.com/pin/tortellini-carbonara-recipe-with-spinach-and-bacon--212795151136734482/,"Tortellini Carbonara Recipe with Spinach and Bacon | Tortellini carbonara pasta dish, Chicken tortellini carbonara, Creamy tortellini carbonara",428,2026-06-06 16:06:56
https://www.pinterest.com/pin/56787645300317460/,Copycat Olive Garden Chicken Gnocchi Soup,917,2026-06-06 16:06:57
https://www.pinterest.com/pin/mini-tacos--212795151136718776/,"Easy Mini Tacos—A Bite-Sized Side or Appetizer! | Recipe | Easy mini taco recipe, Mini tacos for kids, Simple taco",694,2026-06-06 16:07:03
https://www.pinterest.com/pin/chocolate-raspberry-cake--56787645300305393/,"Valentine's Day Chocolate Raspberry Cake—Great for Crowds! | Recipe | Chocolate raspberry cake recipe, Raspberry layer cake, Raspberry buttercream",780,2026-06-06 16:07:04
https://www.pinterest.com/pin/56787645300305244/,"Chicken Fried Chicken With Country Gravy | Recipe | Country gravy recipe, Creamy cajun shrimp pasta, Large family meals",152,2026-06-06 16:07:06
https://www.pinterest.com/pin/56787645300305319/,"Indulgent Chicken Fried Chicken | Recipe | Fast and easy chicken dinners, Traditional fried chicken meal, Classic fried chicken meal",3314,2026-06-06 16:07:06
https://www.pinterest.com/pin/212795151136697574/,"Cinnamon Muffins Recipe - Perfect for Breakfast or Brunch! | Best cinnamon muffin recipe, Cinnamon breakfast muffins, Quick cinnamon muffins",88,2026-06-06 16:07:11
https://www.pinterest.com/pin/212795151136691603/,"Air Fryer French Fries | Air fryer recipes healthy, Air fryer dinner recipes, Air fryer recipes easy",260,2026-06-06 16:07:14
https://www.pinterest.com/pin/212795151136684950/,"Valentine's Day Chocolate Raspberry Cake | Recipe | Chocolate raspberry cake recipe, Raspberry layer cake, Raspberry buttercream",37,2026-06-06 16:07:15
https://www.pinterest.com/pin/47710077297500490/,"Korean Spicy Pork Bowls | Delicious Asian Recipes | Korean pork rice bowl recipe, Pork bulgogi bowl, Spicy pork bulgogi",164,2026-06-06 16:07:15
https://www.pinterest.com/pin/212795151136684881/,"Baked Pork Chop Recipes: Delicious and Easy! | Pork chops and rice recipes in oven, Easy pork chop and rice recipes, Pork chop and rice casserole easy",312,2026-06-06 16:07:16
https://www.pinterest.com/pin/212795151136684843/,"Classic French Onion Chicken | Recipe | Cheesy french onion chicken, French onion chicken delish, French onion chicken recipe allrecipes",396,2026-06-06 16:07:16
https://www.pinterest.com/pin/homemade-chicken-tenders--47710077297500200/,"Homemade Chicken Tenders | Recipe | Homemade chicken tenders with ranch, Best homemade chicken tenders, How to make ranch chicken tenders in oven",590,2026-06-06 16:07:16
https://www.pinterest.com/pin/47710077297488751/,"Delicious Tuna Casserole with Creamy Homemade Sauce | Recipe | Tuna casserole from scratch, Homemade tuna casserole recipe, Tuna noodle casserole with bread crumbs",88,2026-06-06 16:07:18
https://www.pinterest.com/pin/212795151136674763/,"Egg Drop Soup—A Healthy Winter Meal | Recipe | Quick homemade egg drop soup, Homemade egg soup recipe, Recipe for egg drop soup",68,2026-06-06 16:07:18
https://www.pinterest.com/pin/the-best-king-cake-recipegreat-for-mardi-gras--56787645300265897/,"The BEST King Cake Recipe—Great for Mardi Gras! | Moist king cake recipe, King cake birthday cake, Mardi gras king cake",55,2026-06-06 16:07:20
https://www.pinterest.com/pin/creamy-potato-soup-recipe-delicious-dish-using-the-most-versatile-ingredient--47710077297484976/,"Creamy Potato Soup Recipe: Delicious Dish Using the Most Versatile Ingredient | Vegetable beef soup, Chicken gnocchi soup, Soup and stew",107,2026-06-06 16:07:23
https://www.pinterest.com/pin/56787645300262025/,"Mini Pizza Bagels | Recipe | Mini bagel pizzas, How to make bagels with pizza dough, Mini bagel appetizers",21,2026-06-06 16:07:23
https://www.pinterest.com/pin/212795151136669616/,"Easy Fruit Pizza—A Delicious Dessert or Breakfast! | Recipe | Homemade fruit pizza dessert, Fruit pizza with homemade crust, Dessert pizza with fruit",148,2026-06-06 16:07:25
https://www.pinterest.com/pin/47710077297473570/,"Wholesome Sweet Potato Chili: Quick, Easy, and Delicious | Recipe | Healthy sweet potato chili, Chili recipe with sweet potatoes, Best sweet potato",27,2026-06-06 16:07:28
https://www.pinterest.com/pin/212795151136650763/,"Instant Pot Chicken Noodle Soup | Easy and Delicious Recipe | Instapot chicken noodle soup, Insta pot chicken noodle soup easy, Chicken noodle soup recipe",31,2026-06-06 16:07:34
