url,title,saves,timestamp
https://www.pinterest.com/pin/212795151139305203/,212795151139305203,5,2026-05-26 19:35:23
https://www.pinterest.com/pin/212795151139304729/,212795151139304729,1,2026-05-26 19:35:23
https://www.pinterest.com/pin/212795151139302431/,212795151139302431,3,2026-05-26 19:35:23
https://www.pinterest.com/pin/212795151139300401/,212795151139300401,6,2026-05-26 19:35:24
https://www.pinterest.com/pin/212795151139290830/,Lemon Cream Cheese Poke Cake,11,2026-05-26 19:35:25
https://www.pinterest.com/pin/212795151139293347/,Easy Lunch Crispy Chicken Caesar Sandwiches [Video],9,2026-05-26 19:35:25
https://www.pinterest.com/pin/212795151139290616/,Hearty Breakfast Burrito Recipe for Busy Mornings,1,2026-05-26 19:35:26
https://www.pinterest.com/pin/212795151139288653/,Tender Ribs that Fall Off the Bone,8,2026-05-26 19:35:26
https://www.pinterest.com/pin/212795151139286163/,"Aromatic Summer Corn Salad | Grilled corn and tomatoes, Corn and tomato and pepper salad",13,2026-05-26 19:35:26
https://www.pinterest.com/pin/212795151139285864/,"Slow Cooker Sunday Roast | Slow cooker sunday roast recipes, Sunday slow cooker meals",1,2026-05-26 19:35:26
https://www.pinterest.com/pin/212795151139283147/,"Blueberry Lemonade | Lemonade with blueberries, Lemonade with blueberry juice, Homemade blueberry lemonade recipe",7,2026-05-26 19:35:26
https://www.pinterest.com/pin/212795151139280327/,"Blackened Shrimp | What can i do with shrimp, How long to cook blackened shrimp, Blackened shrimp with canned veggies",10,2026-05-26 19:35:27
https://www.pinterest.com/pin/212795151139280267/,"Summer Tortellini Salad | Tortellini salad recipes cold with feta sauce, Cold tortellini salad recipes easy, Fresh vegetables",1,2026-05-26 19:35:27
https://www.pinterest.com/pin/212795151139275266/,"Smoky Corn on the Cob | Smoked corn on the cob with butter and cheese, Grilled corn on the cob on grill with butter and corn syrup, Smoked corn on the cob in butter",1,2026-05-26 19:35:28
https://www.pinterest.com/pin/212795151139275416/,"How to Make a Caprese Pasta Salad [Video] | Salad with pasta and mozz, Summer cold pasta dishes, Easy pasta recipes cold",13,2026-05-26 19:35:28
https://www.pinterest.com/pin/212795151139277982/,"Crispy & Crunchy Chicken Fried Chicken | Breading for fried chicken, How to make crispy chicken fried chicken, Crispy chicken fried chicken with sauce",14,2026-05-26 19:35:28
https://www.pinterest.com/pin/212795151139264983/,"Lemon Pepper Chicken Kabobs | Chicken kabobs for a crowd, Chicken breast kabobs recipes with peppers, Chicken kabobs on the grill",1,2026-05-26 19:35:29
https://www.pinterest.com/pin/212795151139265024/,"No Fold Blanket Dumplings | Dumplings without folding dough, Easy dumpling no folding with dough sheet, Homemade chicken tenders",16,2026-05-26 19:35:30
https://www.pinterest.com/pin/212795151139262280/,"Cookie Salad | No bake chocolate pudding cookie salad, Pudding salad with buttermilk, Pudding cool whip buttermilk recipe",10,2026-05-26 19:35:30
https://www.pinterest.com/pin/212795151139260247/,"Mouthwatering Mushroom & Swiss Burger | Swiss cheese burger topping, Swiss cheese burgers on stovetop, Grilled swiss cheese burgers",14,2026-05-26 19:35:30
https://www.pinterest.com/pin/212795151139260089/,"Vietnamese Egg Coffee | Coffe made with egg yolks, Coffee recipes with egg, Best party food",2,2026-05-26 19:35:31
https://www.pinterest.com/pin/212795151139255945/,"Caprese Pasta Salad | Light and Delicious Side Dish | Easy side dishes for lunch pot luck, Cold salads for bbq lunch, Summer caprese pasta salad recipe",16,2026-05-26 19:35:31
https://www.pinterest.com/pin/212795151139258312/,"Crowd Pleasing Strawberry Crunch Cake [Video] | Strawberry crunch with cool whip icing, Easy strawberry crunch cake with coolwhip frosting, Strawberry crunch cake icing",65,2026-05-26 19:35:31
https://www.pinterest.com/pin/212795151139255674/,"Savory Grilled Mushrooms | Mushroom and onion on the grill, Grilled mushrooms with butter and garlic, Grilled mushrooms on the bbq",1,2026-05-26 19:35:31
https://www.pinterest.com/pin/212795151139253680/,"Strawberry Pie Made Simple | Strawberry pie filling without clear jel, Strawberry pies with canned strawberry pie filling, Strawberry cheesecake chimichangas",11,2026-05-26 19:35:31
https://www.pinterest.com/pin/212795151139251247/,"Big Mac Inspired Smash Burger Tacos | Ground beef and tortillas dinners, Burger tacos with lettuce, Ground beef taco recipes with lettuce",17,2026-05-26 19:35:32
https://www.pinterest.com/pin/212795151139245946/,"Quick and Delicious Peanut Butter Mug Cake | Mug cake with peanut butter chips, Peanut butter chip microwave cake, Peanut butter microwave cup",17,2026-05-26 19:35:32
https://www.pinterest.com/pin/212795151139250992/,"Strawberry Crunch Cake | Crushed strawberry topping for cake, Strawberry cake with crushed strawberries on top, Strawberry crunch topping",3,2026-05-26 19:35:32
https://www.pinterest.com/pin/212795151139245877/,"Refreshing Strawberry Piña Colada Recipe | Tropical smoothie cafe frozen pineapple punch recipe, How to make strawberry pina colada, Strawberry pina colada drink recipe",1,2026-05-26 19:35:32
https://www.pinterest.com/pin/212795151139243573/,"Refreshing Rhubarb Slush | Frozen drink with rhubarb, What to do with rhubarb, Rhubarb drink with alcohol",24,2026-05-26 19:35:33
https://www.pinterest.com/pin/212795151139241209/,"Mexican Stuffed Shells for Taco Tuesday Fun | Stuffed shells with beef mexican, Mexican stuffed shells ground beef, Stuffed shells with beef recipes for dinners",1,2026-05-26 19:35:33
https://www.pinterest.com/pin/212795151139241361/,"Grilled Hawaiian Chicken Pineapple Kabobs [Video] | Chicken and pineapple kabobs, Pineapple chicken kabobs on the grill, Hawaiian chicken kabobs on the grill",27,2026-05-26 19:35:34
https://www.pinterest.com/pin/212795151139238973/,"Mexican Style Shrimp Tacos | Recipe | Shrimp tacos grilled mexican, Outdoor picnic food, Summer party appetizers",16,2026-05-26 19:35:34
https://www.pinterest.com/pin/212795151139235677/,"Homemade Popcorn Chicken Bowl | Mash potatoes and chicken breast, Mashed potatoes and chicken bowl recipe, Mashed potatoes bowl meals",22,2026-05-26 19:35:34
https://www.pinterest.com/pin/212795151139235614/,"Strawberry Lemon Donuts | Colorful and Delicious Breakfast | Recipe | Donuts with sprinkles, Coulours food, Food pictures",1,2026-05-26 19:35:34
https://www.pinterest.com/pin/212795151139233289/,"Summer Grilled Mexican Street Corn | Recipe | Best sides for bbq chicken on the grill mexican street corn, Mexican street corn recipe, Corn on the cob",25,2026-05-26 19:35:35
https://www.pinterest.com/pin/212795151139220588/,"Pico de Gallo Creation Made Easy | Recipe | Picanha recipe mexican, Easy mexican pico, Mexican pico de gallo recipe",61,2026-05-26 19:35:36
https://www.pinterest.com/pin/212795151139218132/,"Quick & Creamy Tuna Pasta Salad | Recipe | Salad with tuna and cream cheese, Pasta salad recipes with tuna and red onion, Pasta salad with canned tuna and mayonnaise",42,2026-05-26 19:35:37
https://www.pinterest.com/pin/212795151139215408/,"Zesty Mexican Rice Casserole | Recipe | Mexican rice casserole in crockpot, Mexican rice casserole recipe with rotel, Cold weather food",31,2026-05-26 19:35:37
https://www.pinterest.com/pin/212795151139215295/,"Strawberry Dumpling | Strawberry pastry with cream, Baked strawberry dumplings with puff pastry, Summer fruit dumplings",2,2026-05-26 19:35:37
https://www.pinterest.com/pin/212795151139212325/,"Lemon Olive Oil Cake Recipe | Torte Test Kitchen | What to bake with olive oil, Olive oil cake with lemons, Desserts with olive oil",13,2026-05-26 19:35:37
https://www.pinterest.com/pin/212795151139209629/,"Vietnamese Egg Coffee | Recipe | Vietnamese egg coffee made with instant coffee, How to make the perfect cup of coffee with a egg, What is in vietnamese egg coffee",10,2026-05-26 19:35:38
https://www.pinterest.com/pin/212795151139209490/,"Orange Rolls | Baking recipes for the home, Sweet breakfasts to make at home, Baked goods for sale easy",2,2026-05-26 19:35:38
https://www.pinterest.com/pin/212795151139207117/,"Red Beans & Rice in the Slow Cooker | Recipe | Southern red beans and rice with canned beans recipe crockpot, Crockpot red beans and rice dry, Crockpot red beans and rice with smoked turkey wing",19,2026-05-26 19:35:38
https://www.pinterest.com/pin/212795151139204481/,"Effortless Grape Salad [Video] | Recipe | Grape salad with pecans and walnuts, What is the best way to clean fresh grapes, Summer party appetizers",11,2026-05-26 19:35:39
https://www.pinterest.com/pin/212795151139204319/,"The Best Chicken Salad Recipe | Creamy and Delicious | Lunch ideas to go, Cold lunch ideas, Chicken salads with pesto",2,2026-05-26 19:35:39
https://www.pinterest.com/pin/212795151139199897/,"Easy to Make Stuffed Pepper Casserole | Healthy ground beef bell pepper recipes, Stuffed bell peppers casserole with ground turkey, Ground beef and rice with bell peppers",56,2026-05-26 19:35:39
https://www.pinterest.com/pin/212795151139199810/,"Banana Upside Down Cake | Recipe | Easy banana upside down cake made with all purpose flour, What is a good substitute for a pineapple upside down cake mix, Upside down banana cake with buttermilk",3,2026-05-26 19:35:40
https://www.pinterest.com/pin/212795151139202227/,"Limoncello | Recipe | Limoncello recipe made with everclear, Everclear and lime recipes, Making limoncello",23,2026-05-26 19:35:40
https://www.pinterest.com/pin/212795151139191663/,"Sausage Ragu | Recipe | Pasta with sausage recipes, Spaghetti sauce recipes with sausage, Easy sausage pasta with spaghetti sauce",13,2026-05-26 19:35:41
https://www.pinterest.com/pin/212795151139189337/,"Simple Ingredient Strawberry Pancakes | Recipe | Strawberry pancakes with strawberries, Pancakes recipe easy with strawberries, Pancakes with strawberies",15,2026-05-26 19:35:42
https://www.pinterest.com/pin/212795151139189106/,"Lemon Poppy Seed Cake Everyone Will Adore | Lemon and poppy seed cake, Lemon poppy seed cake with oil, Poppy seed cake with lemon frosting",3,2026-05-26 19:35:42
https://www.pinterest.com/pin/212795151139186714/,"Refreshing Tequila Sunrise Cocktail [Video] | Recipe | Tequila and orange juice drink, Cocktail drinks alcohol with tequila, Tequila sunrise drink",8,2026-05-26 19:35:42
https://www.pinterest.com/pin/212795151139184303/,"Grape Salad | Recipe | Grape and green salad, Grapes salad with green grapes, Outdoor picnic food",17,2026-05-26 19:35:42
https://www.pinterest.com/pin/212795151139178673/,"Lemon Crumb Cake | Recipe | Lemon cake with frosting with lemon crumb, Cakes for summer, Light and fluffy lemon crumb cake by tondoughallie",3,2026-05-26 19:35:43
https://www.pinterest.com/pin/212795151139178754/,"Homemade Strawberry Pop Tarts Recipe | How to make strawberry pop tarts with jam, Pop tarts homemade with strawberry jam, Pop tarts filling with jam and glaze",17,2026-05-26 19:35:43
https://www.pinterest.com/pin/212795151139175721/,"Lemon Poppy Seed Cake | Lemon poppy seed cake with lemon curd and buttermilk, Easy poppy seed cake without cake mix, Easy lemon poppyseed cake from scratch",28,2026-05-26 19:35:43
https://www.pinterest.com/pin/212795151139172502/,"Orange Rolls | Breakfast recipes that start with an o, Orange rolls with dried orange slices, Orange roll with cake mix",24,2026-05-26 19:35:43
https://www.pinterest.com/pin/212795151139184204/,"Blueberry Vodka Smash | Recipe in 2026 | Easy summer drinks, Blueberry vodka, Sweet drinks",1,2026-05-26 19:35:44
https://www.pinterest.com/pin/212795151139181686/,"Herb-Infused Baked Pork Chops | Recipe | Pork chop and rice in oven, Oven pork chops and rice recipes, Baked pork chops and rice recipe",20,2026-05-26 19:35:44
https://www.pinterest.com/pin/212795151139171830/,"Carrot Cake Cookie Cups Recipe | Carrot cake cookie cups no egg, Cinnamon roll cookie cups with frosting, Cookie cup flavors",2,2026-05-26 19:35:44
https://www.pinterest.com/pin/212795151139156303/,"Grilled Sweet Potatoes | Recipe | Grilled sweet potatos and chicken, Whole sweet potato recipes grilled, Grilling sweet potatoes",20,2026-05-26 19:35:44
https://www.pinterest.com/pin/212795151139153541/,"Korean Fried Chicken | Recipe | Asian fried chicken recipes, Korean chicken with green onions recipes, Fried chicken with green onions",23,2026-05-26 19:35:45
https://www.pinterest.com/pin/212795151139156227/,"Low Carb Baked Ham Recipe with Citrusy Glaze | Pineapple and ham baked, Glazes for ham with pineapple, Oven baked ham with pineapple",2,2026-05-26 19:35:46
https://www.pinterest.com/pin/212795151139164345/,"Refreshing Tequila Sunrise with Orange Juice and Cherries | Recipe | Tequila sunset drinks, Tequilla sunset, Tequila sunrise cocktail",11,2026-05-26 19:35:47
https://www.pinterest.com/pin/212795151139166626/,"Chocolate Chip Scones | Recipe | Chocolate scone from scratch, Buttery chocolate chip scones, How to make a chocolate chip scone",7,2026-05-26 19:35:47
https://www.pinterest.com/pin/212795151139161909/,"Irresistible Veggie Pizza Pinwheels | Recipe | Vegetables for a party, Veggie pizza roll ups with ranch, Appetizers with vegies",17,2026-05-26 19:35:47
https://www.pinterest.com/pin/212795151139161816/,"Honey Roasted Carrots | Recipe | Roasted carrots with honey and brown sugar, Roasted honey carrots side dish, Easter dinner carrots side",3,2026-05-26 19:35:47
https://www.pinterest.com/pin/212795151139159394/,"Fruit Pizza with a Sugar Cookie Crust | Recipe | Fruit pizza with store bought cookie crust, Fruit pizza recipes with store bought sugar cookies, Easy fruit pizza",18,2026-05-26 19:35:48
https://www.pinterest.com/pin/212795151139150458/,"Zesty Spring Lemon Squares | Recipe | Yellow lemon cake mix recipes with butter and lemon zest, Lemon cake mix squares for a crowd, Homemade cheez its",16,2026-05-26 19:35:48
https://www.pinterest.com/pin/212795151139147742/,"Deep Fried Italian Rice Balls [Video] | Recipe | Breaded and fried rice and cheese balls, Fried rice and parmesan balls, What can be done with leftover fried rice",16,2026-05-26 19:35:49
https://www.pinterest.com/pin/212795151139150300/,"Cheesy Pull Apart Garlic Bread | Healthy Foods Recipes | Cheese filled garlic bread, Pull apart cheese bread video, Garlic bread for a crowd parties",2,2026-05-26 19:35:49
https://www.pinterest.com/pin/212795151139142361/,"Easter Side Dish: Savory Scalloped Potato and Ham | Recipe | Scolloped potatoes and ham, Easter potatoes scalloped, How to make scalloped potatoes and ham",4,2026-05-26 19:35:51
https://www.pinterest.com/pin/212795151139141538/,"Creamy Tomato Sausage Gnocchi: A Flavorful One-Pan Delight | Recipe | Ground sausage gnocchi with sausage, Ground sausage and gnocchi recipe, Italian sausage gnocchi dish",4,2026-05-26 19:35:51
https://www.pinterest.com/pin/212795151139141366/,"Chicken Fried Chicken Recipe | Traditional fried chicken meal, Classic fried chicken meal, Chicken fried chicken easy",16,2026-05-26 19:35:51
https://www.pinterest.com/pin/212795151139141318/,"Homemade Chicken Tenders Recipe | Chicken tenders party food, Batter dipped chicken tenders, Crispy chicken tenders platter",16,2026-05-26 19:35:51
https://www.pinterest.com/pin/212795151139139685/,"Cake Mix Cream Cheese Carrot Cake Cookies | Recipe | Carrot cake cookies cake mix with cream cheese, Carrot and white chocolate cookie recipe made from a cake mix, Cake box cookie with carrit",37,2026-05-26 19:35:51
https://www.pinterest.com/pin/212795151139136778/,"Migas: A Hearty Tex-Mex Breakfast | Recipe | Mexican egg casserole with tortilla chips, ""tortilla chip and scrambled egg recipes for a crowd""., Crockpot french toast",13,2026-05-26 19:35:52
https://www.pinterest.com/pin/212795151139139526/,"Lemon Poppy Seed Bread Recipe | Quick easy poppy seed bread, Recipe for lemon and poppy seed loaf, Poppyseed bread recipe",8,2026-05-26 19:35:52
https://www.pinterest.com/pin/212795151139134127/,"Chocolate Chip Scones | Recipe | How to make chocolate chip scones, Chocolate chip scones with buttermilk, Scone recipes",18,2026-05-26 19:35:53
https://www.pinterest.com/pin/212795151139131799/,"Honey Pepper Chicken Mac & Cheese | Recipe | Applebee’s chicken and mac and cheese recipe, Copycat applebees honey pepper chicken and mac and cheese, Honey glazed chicken mac and cheese",38,2026-05-26 19:35:53
https://www.pinterest.com/pin/212795151139128657/,"Protein Balls | Peanut Butter Chocolate Chip with 10g of Protein | Recipe | Chocolate oatmeal peanut butter balls without chocolate chips, Peanut butter oat chocolate chips energy balls, No bake oats ",6,2026-05-26 19:35:54
https://www.pinterest.com/pin/212795151139118315/,"Corned Beef Quesadilla Recipe | Quesadilla with corn beef, Corned beef and swiss cheese quesadilla, Savory corned beef quesadilla",1,2026-05-26 19:35:54
https://www.pinterest.com/pin/212795151139128906/,"Deliciously Simple Peanut Butter Cake [Video] | Recipe | Peanut butter cake with no eggs, Yellow cake with peanut butter frosting, Peanut butter cake from box cake mix",16,2026-05-26 19:35:54
https://www.pinterest.com/pin/212795151139118368/,"Sour Cream Pound Cake | Recipe | Pound cake with sour cream easy, Sour cream pound cake recipes from scratch, Homemade sour cream",12,2026-05-26 19:35:54
https://www.pinterest.com/pin/212795151139133978/,Cinnamon Swirl Bread,1,2026-05-26 19:35:54
https://www.pinterest.com/pin/212795151139115997/,"Greek Chicken Meatballs | Recipe | Simple healthy dinner recipes mediterranean, Healthy chicken meatball dinner recipes, Simple dinners with chicken breast",30,2026-05-26 19:35:54
https://www.pinterest.com/pin/212795151139121318/,"Family Favorite Easter Menu Ideas | Easter menu with ham, Easter meals family gathering, Easter dinner ideas families",14,2026-05-26 19:35:56
https://www.pinterest.com/pin/212795151139113712/,"Bacon Wrapped Asparagus: Heavenly Oven-Baked Side Dish | Recipe | How to cook asparagus spears wrapped in bacon in the oven, Asparagus and bacon in the oven, Elevated asparagus",26,2026-05-26 19:35:57
https://www.pinterest.com/pin/212795151139108632/,"Peanut Butter Cake | Recipe | Best rated peanut butter cake recipes, Simple peanut butter cake from box mix, Peanut butter cake from 1975 using buttermilk",111,2026-05-26 19:35:57
https://www.pinterest.com/pin/212795151139113612/,"Mint Cheesecake Trifles for St. Patrick's Day Fun | Recipe | St patricks day desserts easy with oreo, St pattys day desserts easy, Oreo trifle",1,2026-05-26 19:35:58
https://www.pinterest.com/pin/212795151139111312/,"Italian Subs Toasted in the Oven [Video] | Recipe | Italian sub recipes in oven, Italian sub sandwiches in the oven, Baked italian subs",16,2026-05-26 19:35:58
https://www.pinterest.com/pin/212795151139105647/,"Tender Fall Off The Bone Ribs | Recipe | Fall off the bone ribs in toaster oven, Oven roasted fall off the bone ribs, Homemade chicken and dumplings",20,2026-05-26 19:35:58
https://www.pinterest.com/pin/212795151139102947/,"Deliciously Easy Key Lime Pie Bars | Recipe | Key lime bars easy with graham crackers, Key lime pie with graham, Classic brownies recipe",13,2026-05-26 19:35:58
https://www.pinterest.com/pin/212795151139108484/,"Dirty Irishman Cocktail | Recipe | Baileys drinks for a crowd, Drinks made with irish whiskey, St patty day alcoholic drinks whiskey",2,2026-05-26 19:35:58
https://www.pinterest.com/pin/212795151139102805/,"Cosmic Brownie Cookies | Recipe | Simple cosmic brownie cookie, Chocolate with sprinkles, Cookie recipe for cosmic brownies",3,2026-05-26 19:35:58
https://www.pinterest.com/pin/148548487704550075/,"Easy Bread Pudding Recipe | Best bread pudding recipe simple, Icing for bread pudding, Sauce for bread pudding easy",1,2026-05-26 19:35:58
https://www.pinterest.com/pin/212795151139095557/,"Comforting Chicken Fried Chicken | Recipe | What goes good with fried chicken, What to serve with chicken fried chicken, What to eat with fried chicken",16,2026-05-26 19:35:58
https://www.pinterest.com/pin/56787645305380793/,"Homemade Sausage Rolls | Easy Crowd-Pleasing Recipe | Easy sausage rolls appetizer, Homemade sausage rolls appetizer, Sausage rolls recipe",1,2026-05-26 19:36:00
https://www.pinterest.com/pin/212795151139092849/,"Crockpot Taco Chili | Recipe | Slow cooker chili recipe ground beef, Easy crock pot chili with hamburger and beans, Best chili with ground beef crock pot recipes",2,2026-05-26 19:36:00
https://www.pinterest.com/pin/212795151139088125/,"Creamy Crockpot Cheesy Potatoes Recipe | Crockpot cheese potatoes with cream soup, Creamy cheese potatoes in a crockpot, Cheesy potatoes in the crockpot with cream soup",39,2026-05-26 19:36:01
https://www.pinterest.com/pin/212795151139089973/,"Baked Italian Subs | Recipe | Sub sandwhiches baked in oven, Italian sub sandwiches in the oven, How to make a sub sandwich with salami meat and provolone cheese in oven",16,2026-05-26 19:36:01
https://www.pinterest.com/pin/212795151139087162/,"Salted Caramel Rolls | Salted carmel buns with pie filling, Salted caramel rolls with canned biscuits, Caramel for caramel rolls",4,2026-05-26 19:36:01
https://www.pinterest.com/pin/212795151139092966/,"Irresistible Chicken Enchilada Soup [Video] | Recipe | Chicken enchilada soup with rotisserie, Soups for a large crowd winter, Chicken enchiladas soup for large crowd",16,2026-05-26 19:36:01
https://www.pinterest.com/pin/212795151139084583/,"Dirty Irishman Cocktail Recipe | Drinks alcoholic for st patrick's, St patrick day cocktail dirty irishman, Baileys and whiskey drinks",8,2026-05-26 19:36:01
https://www.pinterest.com/pin/212795151139072430/,"Step by Step Guide to Chicago Deep Dish Pizza [Video] | Recipe | Best chicago deep dish pizza recipe, Chicago style deep dish pizza, Chicago style pizza crust recipe",25,2026-05-26 19:36:03
https://www.pinterest.com/pin/212795151139068872/,"Hearty Chicken Parmesan Soup | Recipe | Chicken parmesan soup with pasta, Easy chicken parmesan soup, Chickwn parmesan soup",1,2026-05-26 19:36:03
https://www.pinterest.com/pin/212795151139069316/,"Creamy Chicken Enchilada Soup Recipe | Spicy chicken enchillada soup, Enchilada soup with chicken, Soup for a crowd chicken",15,2026-05-26 19:36:03
https://www.pinterest.com/pin/212795151139066109/,"KFC Inspired Bowl Recipe | Recipes with mashed potato and corn, Mashed potatoes and gravy bowl, Kfc chicken and mashed potatoes recipe",43,2026-05-26 19:36:04
https://www.pinterest.com/pin/212795151139065932/,"Taco Spaghetti | Recipe | Spaghetti noodles with ground beef, Beef taco spagetti, Ground beef and spaghetti noodles recipes",3,2026-05-26 19:36:04
https://www.pinterest.com/pin/212795151139062908/,"Homemade Cinnamon Rolls | Recipe | How to make a cinamom roll from scratch, Cinnamon rolls from scratch, How to make cinnamon buns from scratch",4,2026-05-26 19:36:04
https://www.pinterest.com/pin/212795151139062965/,"Rainbow Frosting for Vibrant Desserts | Recipe | Color full icing, How to make bright rainbow frosting, Homemade colored icing",19,2026-05-26 19:36:04
https://www.pinterest.com/pin/212795151139059853/,"Cheeseburger Tater Tot Casserole | Recipe | Tater tots with hamburger and egg casserole, Ground beef tater tot casserole, Cheeseburger tater tot casserole with egg",29,2026-05-26 19:36:04
https://www.pinterest.com/pin/212795151139059735/,"Dirty Shirley Cocktail | Recipe | Dirty shirley temple drink, Alcoholic drink shirley temple, Vodka grenadine",3,2026-05-26 19:36:05
https://www.pinterest.com/pin/212795151139053612/,"Bread Pudding with Vanilla Sauce Recipe | Bread pudding with cinnamon and nuts, Bread pudding recipes with no nuts, Bread pudding made with cinnamon bread",56,2026-05-26 19:36:05
https://www.pinterest.com/pin/212795151139056706/,"One Pot Cajun Sausage Pasta Recipe | Easy cajun pasta with chicken thighs, Healthy cajun dishes, Healthy one pot meals cajun",24,2026-05-26 19:36:05
https://www.pinterest.com/pin/212795151139056538/,"Pistachio Muffins | Recipe | Pistachio muffins easy, Green muffin recipes, Pistachio muffins recipe with pudding",245,2026-05-26 19:36:06
https://www.pinterest.com/pin/212795151139044673/,"Easy White Hot Chocolate | Recipe in 2026 | White hot chocolate, Hot chocolate, Hot chocolate recipes",1,2026-05-26 19:36:06
https://www.pinterest.com/pin/212795151139042375/,"Fresh Homemade Salsa | Recipe | Canned salsa with fresh tomatoes and onions, Homemade salsa with onions and cilantro, Easy homemade salsa",6,2026-05-26 19:36:06
https://www.pinterest.com/pin/212795151139041877/,"Protein Packed Beef Stir Fry | Recipe | Healthy beef stir fry recipes with beef sirloin, High protein beef and broccoli stir fry, Easy beef stir fry",22,2026-05-26 19:36:07
https://www.pinterest.com/pin/212795151139039128/,"Chicago Style Deep Dish Pizza | Recipe | Deep dish pizza with canned sauce, Pizza with can tomato, How to make a chicago style deep dish pizza",35,2026-05-26 19:36:07
https://www.pinterest.com/pin/212795151139039013/,"Ravioli Soup | Recipe | Ravioli in a bowl, Ravioli with broth, Ravioli with tomato soup",5,2026-05-26 19:36:07
https://www.pinterest.com/pin/212795151139036546/,"Cosmic Brownie Cookies | Recipe | Brownie cookies for kids to eat for a party, Brownie cookies with candy on top, Brownie cookies with m&m",18,2026-05-26 19:36:07
https://www.pinterest.com/pin/212795151139034252/,"Busy Weeknight Homemade Pork Egg Rolls | Recipe | Egg roll wrapper recipes ground pork, Easy egg roll recipes ground beef, Egg roll recipe with ground pork",53,2026-05-26 19:36:07
https://www.pinterest.com/pin/212795151139029226/,"Snickerdoodle Blondies | Easy Dessert Recipe | Desserts with a hint of cinnamon, Snickerdoodle cookie bars, Snickerdoodle bars recipe",12,2026-05-26 19:36:08
