url,title,saves,timestamp
https://www.pinterest.com/pin/212795151136891827/,"Slow Cooker Shredded Mexican Chicken | Recipe | Mexican style shredded chicken, Mexican restaurant shredded chicken, Mexican chicken recipe",16,2026-05-26 19:41:05
https://www.pinterest.com/pin/212795151136892097/,"Irish Coffee Recipe | Easy and Delicious | Best whiskey for irish coffee, Jameson irish coffee recipe, Homemade irish coffee ingredients",36,2026-05-26 19:41:05
https://www.pinterest.com/pin/212795151136892088/,"TikTok Grinder Sandwich | Recipe | Grinder sandwich ingredients, Grinder sandwich recipe, How to make a grinder sandwich",140,2026-05-26 19:41:05
https://www.pinterest.com/pin/212795151136891886/,"Easy Strawberry Mousse Recipe | Fluffy strawberry mousse recipe, Easy strawberry mousse dessert, Strawberry mousse dessert recipe",19,2026-05-26 19:41:07
https://www.pinterest.com/pin/muffuletta-sandwich-recipe--212795151136889640/,"Muffuletta Sandwich Recipe | Recipe | Muffuletta sandwich, Muffuletta, Muffuletta recipe",3,2026-05-26 19:41:08
https://www.pinterest.com/pin/212795151136889186/,"Vanilla Bean Pistachio Cake {A Delicious, Light, Flavorful Cake} | Recipe | Vanilla pistachio cake, Pistachio birthday cake recipe, Pistachio buttercream cake",442,2026-05-26 19:41:08
https://www.pinterest.com/pin/212795151136885409/,"The Ultimate Easter Menu | Easter dinner menu with ham, Easter meats besides ham, Typical easter meal",14,2026-05-26 19:41:10
https://www.pinterest.com/pin/47710077297689256/,"Chicken Fried Chicken - Tornadough Alli | Recipe | Traditional fried chicken meal, Classic fried chicken meal, Southern fried chicken and gravy",7454,2026-05-26 19:41:10
https://www.pinterest.com/pin/212795151136882538/,"How to Make Walking Tacos | Recipe | Walking tacos recipe, Crock pot tacos, Taco night",46,2026-05-26 19:41:11
https://www.pinterest.com/pin/212795151136882388/,"Fruit Pizza | Recipe | Easy fruit pizza, Fruit pizza dessert, Fruit pizza ideas",2622,2026-05-26 19:41:11
https://www.pinterest.com/pin/56787645301433670/,"Traditional Carrot Cake Recipe with Cream Cheese Buttercream | Best frosting for carrot cake, Best icing for carrot cake, Best carrot cake for parties",258,2026-05-26 19:41:11
https://www.pinterest.com/pin/56787645301433764/,"Easy Fruit Pizza | Recipe | Fruit pizza with cream cheese, Homemade pizza with fruit, Cream cheese frosting for fruit pizza",151,2026-05-26 19:41:11
https://www.pinterest.com/pin/212795151136872862/,"Easy Walking Tacos | Recipe | Walking tacos recipe, Crock pot tacos, Taco night",3,2026-05-26 19:41:13
https://www.pinterest.com/pin/carrot-cake-cupcakes--56787645301430834/,"Delicious Carrot Cake Cupcakes | Recipe | Easy carrot cupcake recipe, Homemade carrot cupcakes recipe, Classic carrot cupcakes",60,2026-05-26 19:41:14
https://www.pinterest.com/pin/212795151136868347/,"Delicious Chicken Bacon Ranch Sliders Recipe | Chicken ranch sliders recipes kings hawaiian, Bacon bits, Chicken sandwich",128,2026-05-26 19:41:16
https://www.pinterest.com/pin/212795151136870762/,"TikTok Grinder Sandwich | Recipe | Tik tok grinder sandwich recipe, Best sandwich recipes",334,2026-05-26 19:41:16
https://www.pinterest.com/pin/56787645300917395/,"Delicious Cream Cheese Wontons | Recipe | Wonton wrapper recipes, Delicious recipes, Dinner recipes",1239,2026-05-26 19:41:16
https://www.pinterest.com/pin/56787645300917247/,"Strawberries and Cream Oatmeal Recipe | Strawberry oatmeal with oats, Homemade strawberry oatmeal, Strawberry oatmeal with fresh fruit",31,2026-05-26 19:41:18
https://www.pinterest.com/pin/56787645300917199/,"Easy and Tart Lemon Brownies | Recipe | Fudgy lemon brownies recipe, Moist fudgy lemon brownies, Easy lemon brownie recipe",87,2026-05-26 19:41:18
https://www.pinterest.com/pin/56787645300639000/,"Easter Menu Inspiration: Explore Delicious Options for Your Perfect Meal | Best easter dinner, Easter dinner ideas pinterest, Easter dinner menus",119,2026-05-26 19:41:20
https://www.pinterest.com/pin/56787645300638975/,"Easy Strawberry Mousse | Recipe | Strawberry puree desserts, Strawberry mousse dessert with sauce, Fluffy strawberry mousse recipe",23,2026-05-26 19:41:20
https://www.pinterest.com/pin/212795151136848348/,"Homemade Strawberry Pop Tarts Recipe | Strawberry pop tart recipe, How to make strawberry pop tarts, Strawberry pop tarts breakfast",46,2026-05-26 19:41:21
https://www.pinterest.com/pin/56787645300638958/,"Instant Pot BBQ Ribs | Recipe | Instant pot ribs recipe, Rib recipes, Instant pot dinner recipes",24,2026-05-26 19:41:21
https://www.pinterest.com/pin/212795151136845749/,"Strawberry Shortcake Bars Recipe | Simple vanilla icing, Easy strawberry shortcake, Make strawberry shortcake",31,2026-05-26 19:41:22
https://www.pinterest.com/pin/212795151136842707/,"Delicious Strawberry Dumplings | Easy strawberry dumplings, How to make strawberry dumplings, Easy and delicious",259,2026-05-26 19:41:23
https://www.pinterest.com/pin/212795151136845354/,"Tortellini Carbonara | Recipe | Tortellini recipes, Entree recipes, Recipes",526,2026-05-26 19:41:24
https://www.pinterest.com/pin/212795151136836586/,"Easy Lemon Brownies | Recipe | Fudgy lemon brownies recipe, Moist fudgy lemon brownies, Easy lemon brownie recipe",15,2026-05-26 19:41:24
https://www.pinterest.com/pin/212795151136834813/,"Tuna Melt Recipe | What goes good with a tuna melt, Tuna melt recipe sandwiches, Easy tuna melt recipe",288,2026-05-26 19:41:25
https://www.pinterest.com/pin/56787645300410245/,"Tender Fall Off The Bone Ribs | Recipe | Fall off the bone ribs in oven, Fall off the bone ribs recipe, Tender ribs",1166,2026-05-26 19:41:27
https://www.pinterest.com/pin/212795151136827724/,"Instant Pot BBQ Ribs | Recipe | Best instant pot bbq ribs, Easy instant pot bbq ribs, Instant pot ribs recipe",4,2026-05-26 19:41:28
https://www.pinterest.com/pin/212795151136825486/,"Club Sandwich Recipe - Tornadough Alli | Best club sandwich, Classic club sandwich, Deluxe sandwich",74,2026-05-26 19:41:28
https://www.pinterest.com/pin/56787645300390673/,"Crispy Air Fryer Frozen French Fries in Minutes | Frozen fries in deep fryer, Frozen fry recipes, Frozen fries in air fryer",185,2026-05-26 19:41:35
https://www.pinterest.com/pin/47710077297612488/,"Marry Me Chicken—Tender and Savory! | Recipe | How to cook chicken tikka masala, How to make marry me chicken keto, Marry me dinner recipes",1355,2026-05-26 19:41:35
https://www.pinterest.com/pin/irish-coffee-recipe--212795151136804113/,"Classic Irish Coffee Recipe with Whisky | Homemade irish coffee recipe, Traditional irish coffee recipe, Coffee drinks",3,2026-05-26 19:41:36
https://www.pinterest.com/pin/homemade-tartar-sauce--56787645300386999/,"Homemade Tartar Sauce | Delicious Condiment for Any Dish | Recipe | Simple homemade tartar sauce, Quick tartar sauce, How do you make homemade tartar sauce",846,2026-05-26 19:41:36
https://www.pinterest.com/pin/212795151136802744/,"Cinnamon Sugar Muffins Recipe: Easy and Delicious | Homemade blueberry muffins, Banana smoothie bowl, Cinamon muffins",31,2026-05-26 19:41:37
https://www.pinterest.com/pin/56787645300383942/,"Summer Fancy Toast with Stella® Cheese | Deviled egg potato salad for a crowd, Deviled egg potato salad recipe",48,2026-05-26 19:41:39
https://www.pinterest.com/pin/56787645300383972/,"The Best Bread Pudding EVER! | Recipe | Best bread pudding recipe simple, Breadpudding dessert, Homemade bread pudding recipes",225,2026-05-26 19:41:39
https://www.pinterest.com/pin/56787645300383797/,"Creamy Slow Cooker Mashed Potatoes | Instant mashed potatoes in crockpot, Crockpot mashed potatoes without chicken broth, Slow cooker mashed potatoes pioneer woman",123,2026-05-26 19:41:40
https://www.pinterest.com/pin/212795151136794409/,"Chicken Fried Chicken with Gravy and Ranch Sauce | Recipe | Homemade country fried chicken, Easy chicken frying tips, Homemade chicken frying tips",2039,2026-05-26 19:41:42
https://www.pinterest.com/pin/47710077297599137/,"Hibachi Noodles Recipe - Easy Asian Dish | Simple asian noodles, Hibachi noodles at home, Hibachi noodles recipe easy",21,2026-05-26 19:41:42
https://www.pinterest.com/pin/212795151136790609/,"Easy One-Pan Stuffed Pepper Casserole: A Twist on a Classic Recipe | Stuffed pepper casserole easy, Pepper casserole recipes",573,2026-05-26 19:41:43
https://www.pinterest.com/pin/212795151136786008/,"Indulgent Chicken Fried Chicken | Recipe | Fast and easy chicken dinners, Traditional fried chicken meal, Classic fried chicken meal",815,2026-05-26 19:41:44
https://www.pinterest.com/pin/212795151136769887/,"Tuna Melt | Recipe | What goes good with a tuna melt, Tuna melt recipe sandwiches, Easy tuna melt recipe",5,2026-05-26 19:41:46
https://www.pinterest.com/pin/212795151136764580/,"Homemade Chicken and Dumplings | Recipe | Homemade chicken and dumplings, Recipes, Chicken and dumplings",436,2026-05-26 19:41:49
https://www.pinterest.com/pin/212795151136764479/,"Simple Bread Pudding Recipe with Cinnamon and Nutmeg | Best bread pudding recipe simple, Sauce for bread pudding easy, Bread pudding sauce recipe",46,2026-05-26 19:41:49
https://www.pinterest.com/pin/56787645300348819/,"McDonald's Copycat Shamrock Shake | Recipe | Copycat shamrock shake recipe, Mcdonald's shamrock shake, Mcdonalds shamrock shake recipe",62,2026-05-26 19:41:52
https://www.pinterest.com/pin/212795151136748023/,"Savory and Juicy Slow Cooker Pork Chops | Recipe | Peach pork chops crock pot, Lemon pepper pork chops slow cooker, Keto slow cooker pork chops",1183,2026-05-26 19:41:53
https://www.pinterest.com/pin/212795151136747916/,"Homemade Shrimp Boil | Recipe | How to make a shrimp boil with vegetables, Simple shrimp boil recipe, Shrimp recipes for dinner",64,2026-05-26 19:41:54
https://www.pinterest.com/pin/212795151136742060/,"Crispy Fish Sandwich with Tartar Sauce and Cheese | Recipe | Slaw for fish sandwiches, Homemade crispy fish sandwich, Fish hoagie",244,2026-05-26 19:41:56
https://www.pinterest.com/pin/47710077297553386/,"Olive Garden Chicken Gnocchi Soup | Recipe | Recipes, Soup recipes, Chicken gnocchi soup olive garden",918,2026-05-26 19:41:56
https://www.pinterest.com/pin/212795151136741740/,"Homemade Tartar Sauce Recipe for Fish & More | Simple homemade tartar sauce, Quick tartar sauce, How do you make homemade tartar sauce",409,2026-05-26 19:41:57
https://www.pinterest.com/pin/212795151136741646/,"Best Air Fryer French Fries Recipe | French fry air fryer recipes, Ninja air fryer french fries, French fries recipe air fryer",155,2026-05-26 19:41:57
https://www.pinterest.com/pin/tortellini-carbonara--212795151136734482/,"Tortellini Carbonara Recipe with Spinach and Bacon | Tortellini carbonara pasta dish, Chicken tortellini carbonara, Creamy tortellini carbonara",429,2026-05-26 19:42:00
https://www.pinterest.com/pin/212795151136728215/,"Baked Ribs Recipe | Best country style ribs in oven, Country style ribs recipe oven, Baked country style ribs",183,2026-05-26 19:42:02
https://www.pinterest.com/pin/korean-dessert-food-photography-food-photo-frozen-drinks-frozen-alcoholic-drinks-punch-recipes-fruity-mixed-dr--212795151136724717/,"Pineapple Margaritas Recipe | Pineapples and cream margarita, Big batch pineapple margaritas recipe, Summer drinks",398,2026-05-26 19:42:04
https://www.pinterest.com/pin/56787645300311731/,"Easy Mini Tacos—A Bite-Sized Side or Appetizer! | Recipe | Easy mini taco recipe, Mini tacos for kids, Simple taco",695,2026-05-26 19:42:06
https://www.pinterest.com/pin/56787645300311369/,"Creamy Root Beer Rum Cocktail - Tornadough Alli | Recipe | Easy whiskey drink ideas, Homemade root beer drink, Creamy alcoholic drinks recipes",3337,2026-05-26 19:42:07
https://www.pinterest.com/pin/212795151136710828/,"Chicken Fried Chicken With Country Gravy | Recipe | Country gravy recipe, Creamy cajun shrimp pasta, Large family meals",152,2026-05-26 19:42:11
https://www.pinterest.com/pin/212795151136710723/,"Homemade Chicken Tenders | Recipe | Homemade chicken tenders with ranch, Best homemade chicken tenders, How to make ranch chicken tenders in oven",590,2026-05-26 19:42:11
https://www.pinterest.com/pin/212795151136708480/,"Cinnamon Muffins Recipe - Perfect for Breakfast or Brunch! | Best cinnamon muffin recipe, Cinnamon breakfast muffins, Quick cinnamon muffins",419,2026-05-26 19:42:12
https://www.pinterest.com/pin/mini-tacos--212795151136709229/,"Mini Tacos—The BEST Appetizer or Dinner Idea! | Recipe | Easy mini taco recipe, Mini tacos for kids, Simple taco",34,2026-05-26 19:42:12
https://www.pinterest.com/pin/212795151136695478/,"Savory Veggie Pizza Pinwheels - A Crowd-Pleasing Appetizer! | Recipe | No meat pinwheels, Meatless pinwheels, Party foods",684,2026-05-26 19:42:17
https://www.pinterest.com/pin/212795151136691603/,"Air Fryer French Fries | Air fryer recipes healthy, Air fryer dinner recipes, Air fryer recipes easy",261,2026-05-26 19:42:19
https://www.pinterest.com/pin/47710077297500490/,"Korean Spicy Pork Bowls | Delicious Asian Recipes | Korean pork rice bowl recipe, Pork bulgogi bowl, Spicy pork bulgogi",164,2026-05-26 19:42:21
https://www.pinterest.com/pin/212795151136684950/,"Valentine's Day Chocolate Raspberry Cake | Recipe | Chocolate raspberry cake recipe, Raspberry layer cake, Raspberry buttercream",37,2026-05-26 19:42:21
https://www.pinterest.com/pin/212795151136684881/,"Baked Pork Chop Recipes: Delicious and Easy! | Pork chops and rice recipes in oven, Easy pork chop and rice recipes, Pork chop and rice casserole easy",312,2026-05-26 19:42:22
https://www.pinterest.com/pin/212795151136684843/,"Classic French Onion Chicken | Recipe | Cheesy french onion chicken, French onion chicken delish, French onion chicken recipe allrecipes",396,2026-05-26 19:42:22
https://www.pinterest.com/pin/shredded-brussel-sprout-harvest-salad--212795151136674596/,"Delicious Shredded Brussel Sprout Harvest Salad Recipe | Shredded brussel sprout recipes salad, Shaved brussel sprout salad thanksgiving, Salad dressings",42,2026-05-26 19:42:25
https://www.pinterest.com/pin/47710077297485111/,"Olive Garden Chicken Gnocchi Soup Recipe | Easy olive garden chicken gnocchi soup, Copycat chicken gnocchi soup recipe",380,2026-05-26 19:42:26
https://www.pinterest.com/pin/212795151136674293/,"Easy Chocolate Cake Recipe (9x13-inch Pan) | Light and fluffy chocolate cake, Simple moist chocolate cake, Chocolate cake with fluffy frosting",559,2026-05-26 19:42:27
https://www.pinterest.com/pin/47710077297485228/,"Chicken Caesar Pasta Salad | Recipe | Quick and easy pasta recipes, Chicken caesar salad pasta recipe, Pasta salad with chicken caesar dressing",340,2026-05-26 19:42:27
https://www.pinterest.com/pin/56787645300262360/,"Easy Fruit Pizza—A Delicious Dessert or Breakfast! | Recipe | Homemade fruit pizza dessert, Fruit pizza with homemade crust, Dessert pizza with fruit",148,2026-05-26 19:42:27
https://www.pinterest.com/pin/creamy-potato-soup-recipe-delicious-dish-using-the-most-ver--47710077297484976/,"Creamy Potato Soup Recipe: Delicious Dish Using the Most Versatile Ingredient | Vegetable beef soup, Chicken gnocchi soup, Soup and stew",107,2026-05-26 19:42:29
https://www.pinterest.com/pin/212795151136671789/,"The BEST King Cake Recipe—Great for Mardi Gras! | Moist king cake recipe, King cake birthday cake, Mardi gras king cake",55,2026-05-26 19:42:30
https://www.pinterest.com/pin/56787645300262025/,"Mini Pizza Bagels | Recipe | Mini bagel pizzas, How to make bagels with pizza dough, Mini bagel appetizers",21,2026-05-26 19:42:30
https://www.pinterest.com/pin/212795151136662718/,"Egg Drop Soup—A Healthy Winter Meal | Recipe | Quick homemade egg drop soup, Homemade egg soup recipe, Recipe for egg drop soup",68,2026-05-26 19:42:32
https://www.pinterest.com/pin/47710077297473570/,"Wholesome Sweet Potato Chili: Quick, Easy, and Delicious | Recipe | Healthy sweet potato chili, Chili recipe with sweet potatoes, Best sweet potato",27,2026-05-26 19:42:33
https://www.pinterest.com/pin/56787645300241018/,"Easy Supreme Pizza Egg Rolls for Festive Occasions | Recipe | Pizza egg rolls recipes, Creative egg roll recipes, Hot dog egg rolls",984,2026-05-26 19:42:35
https://www.pinterest.com/pin/212795151136656689/,"The Best Funfetti Cupcakes Recipe - Pretty. Simple. Sweet. | Hannaford cupcakes, Best confetti cupcakes, Cupcake recipes with frosting",41,2026-05-26 19:42:35
https://www.pinterest.com/pin/56787645300240676/,"Slow Cooker Tortellini Soup Recipe | Crockpot meals tortellini, Crockpot recipes tortellini, Tortellini soup crockpot cream cheese",305,2026-05-26 19:42:35
https://www.pinterest.com/pin/212795151136650812/,"Easy Steak Quesadilla Recipe | Cheese steak quesadilla recipes, Steak and cheese quesadilla, Best steak quesadilla recipe",24,2026-05-26 19:42:37
https://www.pinterest.com/pin/212795151136650763/,"Instant Pot Chicken Noodle Soup | Easy and Delicious Recipe | Instapot chicken noodle soup, Insta pot chicken noodle soup easy, Chicken noodle soup recipe",31,2026-05-26 19:42:37
https://www.pinterest.com/pin/212795151136650813/,"Quick and Easy Seven Layer Salad Recipe | Summertime salads, Fresh salads",23,2026-05-26 19:42:37
https://www.pinterest.com/pin/easy-jambalaya-recipe--47710077297463546/,"Easy Jambalaya Recipe | Easy jambalaya recipes, Quick jambalaya dinner, Quick jambalaya meal",38,2026-05-26 19:42:38
https://www.pinterest.com/pin/212795151136650046/,"Delicious Tuna Casserole with Creamy Homemade Sauce | Recipe | Tuna casserole from scratch, Homemade tuna casserole recipe, Tuna noodle casserole with bread crumbs",24,2026-05-26 19:42:39
https://www.pinterest.com/pin/56787645300233614/,"Quick and Healthy Chicken Stir Fry | Recipe | Low calorie chicken stir fry recipes, Low carb chicken stir fry recipes, Recipe for chicken stir fry",43,2026-05-26 19:42:40
https://www.pinterest.com/pin/56787645300233633/,"Crockpot Chicken Wild Rice Soup | Recipe | Cooker recipes, Slow cooker soup, Wild rice soup recipes | Crockpot recipes with celery and carrots, Spicy chicken wild rice soup, Easy creamy chicken wild r",612,2026-05-26 19:42:40
https://www.pinterest.com/pin/212795151136644550/,"BBQ Chicken Salad | Recipe | Wildfire chicken salad, Spicy bbq chicken salad, Hot honey bbq chicken salad",23,2026-05-26 19:42:43
https://www.pinterest.com/pin/212795151136644341/,"Brownie in a Mug—A Single-Serve Dessert | Recipe | Brownie in a mug recipe, Brownie mug cake recipe, Scrumptious desserts",32,2026-05-26 19:42:45
https://www.pinterest.com/pin/212795151136642265/,"The BEST Jambalaya Recipe | Easy jambalaya recipes, Quick jambalaya dinner, Quick jambalaya meal",1,2026-05-26 19:42:45
https://www.pinterest.com/pin/47710077297450839/,"Ginger Chicken Stir Fry Recipe | Chicken stir fries recipes, Simple chicken stir fry recipes, Chicken stir-fry with tea",153,2026-05-26 19:42:47
https://www.pinterest.com/pin/212795151136637043/,"King Cake Recipe | Best king cake recipe, Moist king cake recipe, King cake birthday cake",4,2026-05-26 19:42:47
https://www.pinterest.com/pin/47710077297450617/,"The BEST Slow Cooker Zuppa Toscana | Recipe | Zuppa crockpot soup, Zuppa toscana soup slow cooker, Zoupa toscana recipe crock pot",14,2026-05-26 19:42:47
https://www.pinterest.com/pin/the-best-mississippi-sin-dip-pinwheels--212795151136634105/,"The BEST Mississippi Sin Dip Pinwheels | Best pinwheels recipe, Pinwheel dip, Pin wheel appetizers",82,2026-05-26 19:42:48
https://www.pinterest.com/pin/56787645300209594/,"Wonton Soup Recipe for a Delicious Asian Lunch or Dinner | Winton soup, Chinese pork soup, Wonton soup recipe pork",438,2026-05-26 19:42:48
https://www.pinterest.com/pin/212795151136625975/,"Instant Pot Lasagna Soup Recipe - Easy Family Dinner Idea | How to make lasagna soup in instant pot, Lasagna soup easy, Dinner recipes",15,2026-05-26 19:42:49
https://www.pinterest.com/pin/56787645300206322/,"The BEST Copycat Pizza Hut Cheese Sticks | Recipe | How to make pizza hut cheese sticks, Homemade pizza hut cheese sticks, Cheesy recipes",111,2026-05-26 19:42:51
https://www.pinterest.com/pin/56787645300205840/,"Easy Banana Muffins | Recipe | Banana muffins easy, Banana muffins, Homemade banana muffins",8,2026-05-26 19:42:52
https://www.pinterest.com/pin/56787645300195149/,"Instant Pot Chicken Gnocchi Soup Recipe | Instant pot recipes gnocchi, Soup for lunch, Instant pot soup recipes",37,2026-05-26 19:42:54
https://www.pinterest.com/pin/47710077297427540/,"French Onion Soup Recipe | Soups with onions, Beef and onion soup, French onion soup easy",85,2026-05-26 19:42:54
https://www.pinterest.com/pin/sausage-corn-chowder--56787645300195196/,"Sausage Corn Chowder Recipe for a Crowd | Corn chowder recipe with sausage, Homemade sausage chowder, One pot sausage corn chowder",67,2026-05-26 19:42:54
https://www.pinterest.com/pin/212795151136612343/,"Baked Caprese Chicken Recipe | Baked caprese chicken breast, Caprese chicken breast oven, Best recipes on pinterest",8,2026-05-26 19:42:55
https://www.pinterest.com/pin/brownie-in-a-mug--56787645300195128/,"Quick and Easy Brownie in a Mug Recipe | Quick individual desserts, Single serve mug desserts, Single serve chocolate desserts",44,2026-05-26 19:42:55
https://www.pinterest.com/pin/56787645300194898/,"Spinach Dip Pinwheels - Creamy and Delicious Appetizer | Recipe | Veggie finger foods parties, Finger food appetizers vegetarian, Veggie finger foods appetizers",74,2026-05-26 19:42:55
https://www.pinterest.com/pin/47710077297427299/,"Classic Homemade Chicken and Dumplings Recipe | Chicken n dumplings homemade, Best homemade dumplings, Homemade chicken dumpling dish",35,2026-05-26 19:42:55
https://www.pinterest.com/pin/47710077297427289/,"Hearty Slow Cooker Tortellini Soup Recipe | Slow cooker tortellini lasagna soup, Sausage tortellini soup crockpot with cream cheese, Slow cooker vegetable tortellini soup",115,2026-05-26 19:42:56
https://www.pinterest.com/pin/212795151136601237/,"Jalapeno Popper Breadsticks—A Great Game Day Appetizer! | Jalapeno dip for bread, Jalapeno cheese sticks recipe, Recipes appetizers",57,2026-05-26 19:42:58
https://www.pinterest.com/pin/56787645300184312/,"Easy Beer Cheese Soup Recipe | Beer cheese soup recipes, Soup recipes comfort, Easy soup recipes",44,2026-05-26 19:42:58
https://www.pinterest.com/pin/212795151136594152/,"Smothered Beef Burritos Recipe | Burritos with red sauce, Sunken burrito, Beef tortillas",18,2026-05-26 19:42:59
https://www.pinterest.com/pin/212795151136600761/,"Ranch Ham and Cheese Pinwheels | Recipe | Ham pinwheel recipes, The best pinwheel recipes, Ham ranch pinwheels",45,2026-05-26 19:42:59
https://www.pinterest.com/pin/fried-pickles--56787645300181587/,"Easy Fried Pickles Recipe | What to serve with fried pickles, Fried pickles on blue plate, Fried pickles as an appetizer",90,2026-05-26 19:42:59
https://www.pinterest.com/pin/56787645300181632/,"Easy Ham and Cheese Sliders | Recipe | What goes good with ham sliders, Ham and cheese sliders on hawaiian rolls brown sugar, Dinner recipes",88,2026-05-26 19:43:00
https://www.pinterest.com/pin/212795151136599371/,"Brownie in a Mug | Recipe | Brownie in a mug, Single serve desserts, Mug brownie recipes",24,2026-05-26 19:43:00
https://www.pinterest.com/pin/212795151136594311/,"Delicious Pickle Dip Pinwheels | Recipe | Pickle wrap pinwheels, Pinwheel appetizers pickle, Pickle tortilla roll ups",61,2026-05-26 19:43:02
https://www.pinterest.com/pin/212795151136587528/,"Eggnog Sheet Cake with Eggnog Buttercream Frosting | Recipe | Eggnog cake recipe easy, Christmas sheet cake recipes, Homemade eggnog cake",110,2026-05-26 19:43:04
https://www.pinterest.com/pin/212795151136587324/,"Sheet Pan Nachos Recipe - Quick and Easy Munchie Food | Nachos sheet pan recipe, Easy dinner recipes",47,2026-05-26 19:43:04
https://www.pinterest.com/pin/212795151136586811/,"Caramel Gingerbread Latte Recipe - A Spicy Sweet Holiday Drink | Gingerbread latte recipe easy, Gingerbread coffee, Winter coffee drinks",18,2026-05-26 19:43:04
https://www.pinterest.com/pin/212795151136586715/,"Eggnog Hot Chocolate—A Twist on a Classic! | Recipe | Hot eggnog drinks, Eggnog hot cocoa, Drinks hot chocolate",18,2026-05-26 19:43:05
https://www.pinterest.com/pin/212795151136587306/,"Christmas Peanut Clusters—A Delicious Snack to Gift! | Recipe | Easy peanut clusters, How to make peanut clusters, Christmas candy recipes",247,2026-05-26 19:43:05
https://www.pinterest.com/pin/212795151136587070/,"Bacon Wrapped Jalapeno Poppers Recipe | Jalapeno poppers ingredients on wooden table, Jalepeno poppers with bacon, Bacon wrapped jalapeño poppers",108,2026-05-26 19:43:05
https://www.pinterest.com/pin/56787645300169080/,"Giant Cheesy Tater Tots in a Basket | Recipe | Homemade cheesy tater tots, Cheese stuffed tater tots, Cheesy tots recipe",63,2026-05-26 19:43:05
https://www.pinterest.com/pin/212795151136586672/,"Deep Fried Snickers—Great for Game Days! | Recipe | Snickers recipe, Chocolate snickers, Snickers bar",14,2026-05-26 19:43:05
https://www.pinterest.com/pin/212795151136586528/,"Hot Ham and Cheese Stuffed Pretzels Recipe | Homemade stuffed pretzels, Cheese-stuffed pretzels, Ham and cheese pretzel rolls",20,2026-05-26 19:43:05
https://www.pinterest.com/pin/212795151136583195/,"Baked Italian Subs—Great for Game Days! | Recipe | How to make italian sub in a tub, Oven baked italian subs, Hot italian sub recipe",29,2026-05-26 19:43:07
https://www.pinterest.com/pin/56787645300158673/,"Whiskey Bacon Burgers—Perfect for Game Day or the Superbowl! | Recipe | Whiskey burger recipe easy, Best whiskey burger recipe, Bacon cheeseburger",14,2026-05-26 19:43:08
https://www.pinterest.com/pin/212795151136576598/,"Supreme Pizza Sliders Recipe | Sausage pizza sliders, Pizza burger sliders, Sandwiches sliders",169,2026-05-26 19:43:08
