url,title,saves,timestamp
https://www.pinterest.com/pin/212795151135245704/,"Cracker Barrel Hashbrown Casserole Recipe | Hashbrown casserole cracker barrel, Simple cheesy hash brown casserole, Breakfast casserole",540,2026-06-20 14:06:25
https://www.pinterest.com/pin/212795151135245535/,Delicious Fall Off The Bone Ribs,229,2026-06-20 14:06:26
https://www.pinterest.com/pin/56787645297496965/,"Sweets & Meats Inspired Sweet Potato Casserole Recipe | Perfect for Easter! | The best sweet potato casserole ever, Best sweet potato casserole with pecans, Sweet potato recipes casserole",21,2026-06-20 14:06:26
https://www.pinterest.com/pin/212795151135242546/,"Frozen Mudslides | Recipe | Mud slides drink recipe, Mudslides with baileys, Frozen drinks",9,2026-06-20 14:06:26
https://www.pinterest.com/pin/easy-stuffing-recipe-from-tornadough-alli--56787645297493726/,"Easy Stuffing Recipe from Tornadough Alli | Home made stuffing, Recipes side dishes, Homemade everything",32,2026-06-20 14:06:27
https://www.pinterest.com/pin/212795151135241489/,"Delicious White Chicken Chili Recipe | What goes with white chicken chili, Which chicken chili, Chicken chili with toppings",23,2026-06-20 14:06:27
https://www.pinterest.com/pin/212795151135238928/,"Homemade Bailey's Irish Cream | Recipe | Homemade baileys irish cream, Homemade drinks recipes",2,2026-06-20 14:06:27
https://www.pinterest.com/pin/212795151135238653/,"The Best Southern Sweet Potato Casserole | Recipe | Southern pecan sweet potato casserole, Sweet potato recipes casserole",3,2026-06-20 14:06:27
https://www.pinterest.com/pin/homemade-fudge--212795151135238947/,"Homemade Fudge | Recipe | Easy homemade fudge dessert, Homemade fudge christmas, Fudge recipes",48,2026-06-20 14:06:27
https://www.pinterest.com/pin/212795151135223595/,"Arancini | Recipe | Golden fried arancini, Arancini recipe easy, Fried arancini with tomato sauce",8,2026-06-20 14:06:28
https://www.pinterest.com/pin/hot-spinach-artichoke-dip--212795151135238592/,"Hot Spinach Artichoke Dip | Hot spinach dip recipe, Bhg recipes, Spinach artichoke dip recipe",1,2026-06-20 14:06:28
https://www.pinterest.com/pin/212795151135223723/,"Hot Toddy Recipe - Soothing Drink with Whiskey | Best cold remedies, Hot alcoholic drinks, A hot toddy",9,2026-06-20 14:06:30
https://www.pinterest.com/pin/212795151135223684/,"Mac and Cheese | Recipe | Easy home made mac and cheese baked, Easy max and cheese recipe baked, Best home made mac and cheese baked",50,2026-06-20 14:06:31
https://www.pinterest.com/pin/212795151135223329/,"Honey Walnut Baked Brie Recipe | Baked brie recipes, Baked brie in puff pastry, Cheese recipes",7,2026-06-20 14:06:31
https://www.pinterest.com/pin/turkey-moist-maker-sandwich-from-tornadough-alli--56787645297472396/,"Turkey Moist Maker Sandwich from Tornadough Alli | Sandwiches, Breakfast recipes, Wrap sandwiches",14,2026-06-20 14:06:31
https://www.pinterest.com/pin/rumchata-hot-chocolate--56787645297466384/,"RUMCHATA HOT CHOCOLATE | Food drinks, Hot drinks, Hot cocoa",83,2026-06-20 14:06:34
https://www.pinterest.com/pin/212795151135216382/,"Chicken Gnocchi Soup Copycat Olive Garden Soup | Easy olive garden chicken gnocchi soup, Copycat chicken gnocchi soup recipe, Olive garden chicken gnocchi soup recipe",13,2026-06-20 14:06:34
https://www.pinterest.com/pin/212795151135212837/,"Olive Garden Chicken Gnocchi Soup | Olive garden chicken gnocchi soup recipe, Crockpot mashed potatoes, Copycat olive garden chicken gnocchi",4,2026-06-20 14:06:35
https://www.pinterest.com/pin/56787645297465265/,"RumChata Hot Chocolate Recipe | Warm rumchata drinks, How to make rum chata hot cocoa, Hot rumchata drinks",20,2026-06-20 14:06:35
https://www.pinterest.com/pin/212795151135212725/,"Christmas Mimosas | Recipe | Quick drink recipes, Cranberry apple juice, Holiday party drinks",6,2026-06-20 14:06:35
https://www.pinterest.com/pin/eggnog-hot-chocolate--212795151135212773/,"Eggnog Hot Chocolate | Hot eggnog recipe, Hot eggnog drinks, Holiday drinks",17,2026-06-20 14:06:35
https://www.pinterest.com/pin/slowcooker-green-bean-casserole--212795151135195651/,Slow-Cooker Green Bean Casserole,3,2026-06-20 14:06:36
https://www.pinterest.com/pin/easy-shepherds-pie--56787645297447091/,"Easy Shepherds Pie | Recipe | Quick shepards pie ground beef, How to make shepherd's pie with ground beef, Shepherd's pie recipe with ground beef and gravy",84,2026-06-20 14:06:36
https://www.pinterest.com/pin/212795151135195637/,"Creamy Potato Soup | Recipe | Creamy potato soup recipe, Homemade potato soup, Easy potato soup recipe",3,2026-06-20 14:06:37
https://www.pinterest.com/pin/212795151135195514/,"Chewy Sugar Cookies | Recipe | Iced oatmeal cookies, Butter pecan cookies, Delicious cookie recipe",2,2026-06-20 14:06:39
https://www.pinterest.com/pin/212795151135195535/,"Turkey Moist Maker Sandwich- Ross' Favorite | Recipe | Turkey dressing sandwich recipes, Turkey sandwich recipes cold, Tasty recipes",6,2026-06-20 14:06:39
https://www.pinterest.com/pin/212795151135192969/,"Easy Shepherd's Pie | Recipe | Quick shepards pie ground beef, How to make shepherd's pie with ground beef, Shepherd's pie recipe with ground beef and gravy",63,2026-06-20 14:06:39
https://www.pinterest.com/pin/212795151135190915/,"Olive Garden Chicken Gnocchi Soup | Recipe | Skirt steak soup recipes, Soups and stews",5777,2026-06-20 14:06:39
https://www.pinterest.com/pin/212795151135172956/,"Easy Shepherd’s Pie for Dinner | Recipe | Quick shepards pie ground beef, How to make shepherd's pie with ground beef, Shepherd's pie recipe with ground beef and gravy",6,2026-06-20 14:06:41
https://www.pinterest.com/pin/roasted-turkey-from-tornadough-alli--56787645297416293/,"Roasted Turkey from Tornadough Alli | Turkey recipes, Chicken turkey, Turkey leg",32,2026-06-20 14:06:41
https://www.pinterest.com/pin/56787645297415833/,"Pickle Dip Pinwheels: Creamy and Flavorful Party Appetizer | Pickle dip pinwheel recipe, Pinwheel appetizers pickle, Party appetizers",8,2026-06-20 14:06:41
https://www.pinterest.com/pin/56787645297415293/,"Delicious Monster Cookies with Oats, Peanut Butter, and Chocolate Chips | Recipe | Best monster cookie recipe, The best monster cookies, Chewy monster cookies",20,2026-06-20 14:06:42
https://www.pinterest.com/pin/slow-cooker-wassail-recipe--212795151135167753/,"Slow Cooker Wassail Recipe | Winter wassail drink, Easy crockpot wassail, Wassail recipe slow cooker",1,2026-06-20 14:06:42
https://www.pinterest.com/pin/212795151135158138/,"Popovers | Recipe | Popovers recipes americas test kitchen, Mary makes it easy recipes popovers, Traditional passover popovers",10,2026-06-20 14:06:43
https://www.pinterest.com/pin/bourbon-sweet-potato-cake-from-tornadough-alli--56787645297406820/,"Bourbon Sweet Potato Cake Recipe | Sweet potato rum cake, Sweet potato recipes with bourbon, Sweet potato cake southern",85,2026-06-20 14:06:43
https://www.pinterest.com/pin/56787645297398566/,"Smothered Potatoes | Recipe | Stay at home chef, Food content, Delicious potatoes",2,2026-06-20 14:06:46
https://www.pinterest.com/pin/329536897746212726/,"Easy Ground Beef Stir Fry Recipe | Ground meat stir-fry dish, Spicy ground meat stir-fry, Teriyaki ground beef stir fry",2,2026-06-20 14:06:47
https://www.pinterest.com/pin/slow-cooker-cranberry-meatballs--212795151135151156/,"Slow Cooker Cranberry Meatballs | Recipe | Jellied cranberry sauce, Grape jelly meatballs, Side dishes appetizers",8,2026-06-20 14:06:47
https://www.pinterest.com/pin/212795151135148530/,"Creamy Crockpot Mashed Potatoes Recipe | Mashed potatoes recipe crock pot easy, Mashed potatoes in a crockpot, Crockpot mashed potatoes easy",4,2026-06-20 14:06:48
https://www.pinterest.com/pin/212795151135148348/,"Buffalo Chicken Mac and Cheese Recipe | Buffalo chicken bacon mac and cheese, High protein buffalo chicken mac and cheese, Mac and cheese with buffalo chicken",5,2026-06-20 14:06:48
https://www.pinterest.com/pin/212795151135138048/,"Sopa de pastel de pollo | Sopa de pollo | Chicken pot pie soup with potatoes, Best chicken pot pie soup, Chicken pot pie soup with biscuits",6,2026-06-20 14:06:50
https://www.pinterest.com/pin/french-onion-dip--212795151135137964/,"Classic French Onion Dip Recipe | Ranch french onion dip, French onion chip dip recipes, Easy dip recipes",6,2026-06-20 14:06:50
https://www.pinterest.com/pin/212795151135137802/,"Copycat IKEA Swedish Meatballs | Recipe | Ikea copycat recipes, Homemade swedish meatballs dinner, Copycat ikea meatballs",29,2026-06-20 14:06:50
https://www.pinterest.com/pin/212795151135137501/,"Porcupine Meatball Recipe | Ground beef porcupine meatballs, Porcupine meatballs 12 tomatoes, Porcupine meatballs recipe",6,2026-06-20 14:06:50
https://www.pinterest.com/pin/212795151135137373/,"Slow Cooker Pork Chops | Slow cooker pork chops recipes, Boneless pork loin chops, Tender pork chops",3,2026-06-20 14:06:51
https://www.pinterest.com/pin/212795151135137317/,"Cheeseburger Pie Recipe | Southern cheeseburger pie, Cheeseburger pie hot dish, Cheeseburger pie with crust",4,2026-06-20 14:06:51
https://www.pinterest.com/pin/56787645297379868/,"Slow Cooker Pizza | Recipe | Buffalo chicken sandwiches, Slow cooker meatballs, Homemade pizza dough",7,2026-06-20 14:06:52
https://www.pinterest.com/pin/212795151135135455/,"Maple Dijon Pork Tenderloin Recipe | Pork tenderloin recipes with maple syrup, Maple dijon pork loin recipe, Maple dijon pork tenderloin oven",5,2026-06-20 14:06:53
https://www.pinterest.com/pin/212795151135135103/,"Honey BBQ Crockpot Meatballs | Recipe | Super bowl food, Superbowl party food, Bowl party food",8,2026-06-20 14:06:53
https://www.pinterest.com/pin/212795151135134472/,"Fall Off The Bone Ribs Recipe | Back rib recipes, Bone in rib recipe, Ribs oven",16996,2026-06-20 14:06:55
https://www.pinterest.com/pin/212795151135132782/,"Braided Apple Puff Pastry Recipe | Quick and Easy Dessert | Easy apple pastry tutorial, Apple caramel puff pastry braid, Apple butter puff pastry braid",6,2026-06-20 14:06:55
https://www.pinterest.com/pin/212795151135134437/,"Delicious Smothered Potatoes Recipe | Smothered potatoes in oven, How to make smothered potatoes, Southern smothered potatoes",23,2026-06-20 14:06:55
https://www.pinterest.com/pin/212795151135134406/,"Apple Fritter Bread | Recipe | Scrumptious desserts, Apple fritter bread recipe, Apple pie",9,2026-06-20 14:06:55
https://www.pinterest.com/pin/56787645297377036/,"Pumpkin Cheesecake Pie | Recipe | Pumpkin pie recipes, Pumpkin pie cheesecake, Pumpkin cheesecake",5,2026-06-20 14:06:55
https://www.pinterest.com/pin/540361655306039881/,"Pumpkin Patch Cookies | Recipe | Chocolate covered cookies, Halloween food desserts, Halloween food treats",5,2026-06-20 14:06:57
https://www.pinterest.com/pin/212795151135128095/,"Slow Cooker Pizza Recipe | Buffalo chicken sandwiches, Slow cooker meatballs, Homemade pizza dough",3,2026-06-20 14:06:58
https://www.pinterest.com/pin/212795151135123259/,"Cream Horns: Crunchy, Sweet, and Creamy | Recipe | Chocolate cream horns, Cream horn dessert, Cream horn recipe",60,2026-06-20 14:07:00
https://www.pinterest.com/pin/45036065015285654/,"Delicious Struffoli with Honey and Sprinkles | Recipe | Best struffoli recipe, Baked struffoli recipe, Struffoli recipe traditional",26,2026-06-20 14:07:00
https://www.pinterest.com/pin/slow-cooker-pizza--212795151135123249/,"Slow Cooker Pizza Recipe | Homemade pizza, Pizza dough, Pizza pizzazz",51,2026-06-20 14:07:00
https://www.pinterest.com/pin/212795151135123027/,"30 Minute Ground Beef Stroganoff Recipe | Beef stroganoff with ground turkey, Ground beef stroganoff recipe healthy, Ground beef stroganoff recipe no mushrooms",7,2026-06-20 14:07:00
https://www.pinterest.com/pin/butterbeer-recipe--56787645297364042/,"Butterbeer Recipe | Butterscotch beer recipe, Easy butterbeer, Butterbeer recipe with beer",42,2026-06-20 14:07:00
https://www.pinterest.com/pin/wendys-chili-recipe--212795151135122558/,"Wendy's Chili Recipe | Wendys chilli recipes, Wendy's chilli, Wendys chili recipe",102,2026-06-20 14:07:00
https://www.pinterest.com/pin/212795151135110737/,"Creepy and Cute Halloween Dirt Cake | Recipe | Pumpkin patch dirt cake, Halloween dirt cake recipe easy, Halloween dessert cake",7,2026-06-20 14:07:03
https://www.pinterest.com/pin/56787645297351545/,"Apple Fritter Bread Recipe | Scrumptious desserts, Apple pie",4,2026-06-20 14:07:03
https://www.pinterest.com/pin/212795151135108389/,"Apple Cider Mimosas Recipe | Stay at home chef, Fall drink, Fall cocktails",17,2026-06-20 14:07:03
https://www.pinterest.com/pin/mini-halloween-cheesecakes--212795151135108099/,"Mini Halloween Cheesecakes Recipe | Halloween desserts, Halloween food treats, Like cheesecake",99,2026-06-20 14:07:03
https://www.pinterest.com/pin/56787645297346876/,"Twice Baked Sweet Potatoes Recipe | Vegan twice baked sweet potatoes, Twice baked sweet potatoes with caramelized onions, Baked sweet potatoes with rosemary",30,2026-06-20 14:07:03
https://www.pinterest.com/pin/212795151135108081/,"Cinnamon Crescent Rolls: Tornadough Alli | Recipe | Cinnamon cresent rolls, Super easy breakfast, Crescent roll recipes dessert",12,2026-06-20 14:07:03
https://www.pinterest.com/pin/212795151135107905/,"Finger steak batter recipe | Homemade steak fingers, Hand breaded steak fingers, Chicken fried steak fingers recipe",355,2026-06-20 14:07:04
https://www.pinterest.com/pin/212795151135108014/,"Mini Halloween Cheesecakes | Recipe | Cocoa powder cookies, Chocolate whipped cream, Cheesecake flavor",17,2026-06-20 14:07:04
https://www.pinterest.com/pin/56787645297342741/,"Fluffy Buttermilk Pancake Recipe | Buttermilk pancakes with butter, Ingredients for buttermilk pancakes, Pancake recipe image",9,2026-06-20 14:07:05
https://www.pinterest.com/pin/212795151135104875/,"Delicious Apple Pie Monkey Bread Recipe for Fall Brunch or Dessert | Apple monkey bread from scratch, Monkey bread with canned biscuits and apple pie filling, Apple desserts",10,2026-06-20 14:07:06
https://www.pinterest.com/pin/212795151135104671/,"Apple Cider Sangria | Recipe | Fall fun food, Fall drinks, Sangria fall",8,2026-06-20 14:07:06
https://www.pinterest.com/pin/212795151135101638/,"Make Your Own Taco Bell Nacho Fries at Home | Recipe | How to make taco bell fries, Taco bell fries ingredients, Taco bell fries recipe",77,2026-06-20 14:07:07
https://www.pinterest.com/pin/pumpkin-banana-bread--212795151135101550/,"Pumpkin Banana Bread | Recipe | Moist pumpkin banana cake bread, Pumpkin and banana bread, Pumpkin banana bread recipe",39,2026-06-20 14:07:07
https://www.pinterest.com/pin/easy-beef-stir-fry--212795151135101450/,"Easy Beef Stir Fry | Beef recipes, Ground beef, Beef dish",195,2026-06-20 14:07:07
https://www.pinterest.com/pin/45036065015254962/,"No Bake Mint Chocolate Cheesecake Recipe | Mint cheesecake topping, Homemade mint cheesecake recipe, Mint chocolate cheesecake no bake",4,2026-06-20 14:07:10
https://www.pinterest.com/pin/212795151135092129/,"Crescent Roll Apple Dumplings | Recipe | Apple recipe with crescent rolls, Grandmas apple dumplings, Apple and dumplings",6,2026-06-20 14:07:11
https://www.pinterest.com/pin/212795151135092109/,"Sweet Potato Pie Recipe | Easy sweet potato pie recipe simple, Recipe for sweet potato pie without crust, Easy homemade sweet potato pie",5,2026-06-20 14:07:11
https://www.pinterest.com/pin/212795151135091979/,"Chocolate Chip Pumpkin Blondies | Recipe | Pumpkin bread pudding, Chocolate chip blondies, Caramel bits",13,2026-06-20 14:07:11
https://www.pinterest.com/pin/45036065015254589/,"Chocolate Chip Pumpkin Pudding Pie Recipe | Pumpkin pie with pudding recipe, Thanksgiving pudding desserts, Chocolate chip pumpkin pie",5,2026-06-20 14:07:11
https://www.pinterest.com/pin/slow-cooker-sausage-stuffing--212795151135091718/,"Slow Cooker Sausage Stuffing Recipe | Crockpot sausage stuffing thanksgiving, Crock pot sausage stuffing thanksgiving",2230,2026-06-20 14:07:11
https://www.pinterest.com/pin/crockpot-easy-apple-crumble--56787645297327925/,"Crockpot Easy Apple Crumble | Recipe | Crock pot desserts, Slow cooker desserts, Apple crumble crockpot",7,2026-06-20 14:07:11
https://www.pinterest.com/pin/45036065015254440/,"Pumpkin Truffles - Tornadough Alli | Recipe | Expensive chocolate, Pumpkin spice treats, Truffles recipe",7,2026-06-20 14:07:11
https://www.pinterest.com/pin/pumpkin-patch-cookies--212795151135087367/,"Pumpkin Patch Cookies Recipe | Dog cookies recipe easy pumpkin, How to make pumpkin cookie dough, Pumpkin dog treats no peanut butter",130,2026-06-20 14:07:12
https://www.pinterest.com/pin/212795151135091245/,"German Chocolate Cake Recipe | German chocolate cake with coconut filling, German chocolate cake with cocoa powder, Kenneth temple german chocolate cake",64,2026-06-20 14:07:12
https://www.pinterest.com/pin/212795151135084510/,"Arancini | Recipe | Arancini recipe, Fried mac and cheese, Italian appetizers",2,2026-06-20 14:07:15
https://www.pinterest.com/pin/212795151135084489/,"Easy Beef Stir Fry Recipe | Leftover beef, Tender beef, Simple stir fry",4,2026-06-20 14:07:15
https://www.pinterest.com/pin/45036065015245872/,"Best Apple Crisp Recipe with Crispy Oatmeal Topping | How to make apple crisp in the oven, How to make apple crisp easy, How to make apple crisp with pecans",7,2026-06-20 14:07:16
https://www.pinterest.com/pin/212795151135077502/,"Pumpkin Patch Cookies: A Fun Fall Dessert Idea | Recipe | Chocolate covered cookies, Halloween food desserts, Halloween food treats",2,2026-06-20 14:07:18
https://www.pinterest.com/pin/212795151135077494/,"Arancini Recipe | Golden fried arancini, Arancini recipe easy, Fried arancini with tomato sauce",35,2026-06-20 14:07:18
https://www.pinterest.com/pin/212795151135075609/,"Monster Cookies Recipe: Scrumptious Desserts and Sweets | Easy monster cookie baking, How to decorate monster cookies, Pumpkin monster cookies recipe",95,2026-06-20 14:07:18
https://www.pinterest.com/pin/the-best-lasagna-tornadough-alli--56787645297310378/,"The Best Homemade Lasagna | Recipe | Italian lasagna slice on plate, Layered lasagna with meat sauce, Lasagna slice with fresh herbs",8,2026-06-20 14:07:19
https://www.pinterest.com/pin/56787645297306642/,"Cream Horns Recipe | Delicious Pastry Dessert | Tasty pastry, Puff pastry cream puffs, Easy puff pastry recipe",11,2026-06-20 14:07:19
https://www.pinterest.com/pin/212795151135070742/,"The Best Lasagna | Recipe | Italian sausage lasagna, Homemade meat sauce, Best lasagna recipe",7,2026-06-20 14:07:20
https://www.pinterest.com/pin/56787645297305928/,"Kringla Recipe: What Is Kringla? | Easy kringla recipe, How to make kringla, Kringla dessert",5,2026-06-20 14:07:20
https://www.pinterest.com/pin/breakfast-sausage-recipe-best-recipes--56787645297303462/,"Breakfast Sausage Recipe: Best Recipes | Breakfast sausage recipes, Food content, Savory breakfast",19,2026-06-20 14:07:21
https://www.pinterest.com/pin/homemade-star-crunch--56787645297302530/,"Homemade Star Crunch: Blogger Recipes We Love | Star crunch copycat recipe, Crunchie fudge recipe, No bake desserts",44,2026-06-20 14:07:23
https://www.pinterest.com/pin/breakfast-sausage--212795151135067160/,"Hearty Breakfast Sausage | Sausage recipes, Sausage homemade, Breakfast sandwiches",101,2026-06-20 14:07:23
https://www.pinterest.com/pin/cinnamon-sugar-mini-donuts-breakfast--212795151135065704/,"Cinnamon Sugar Mini Donuts: Breakfast! | Yeast donuts, Strawberry donuts, Chocolate glazed donuts",10,2026-06-20 14:07:24
https://www.pinterest.com/pin/peanut-butter-halloween-brownies--212795151135063305/,"Peanut Butter Halloween Brownies | Fudge brownie mix, Cookies brownies",135,2026-06-20 14:07:24
https://www.pinterest.com/pin/45036065015224675/,"Braided Apple Puff Pastry: Delicious Desserts | Recipe | Easy apple puff pastry recipes, Apple strudel recipe puff pastry, Apple recipes with puff pastry",11,2026-06-20 14:07:24
https://www.pinterest.com/pin/212795151135061103/,"Homemade Star Crunch Recipe | Star crunch copycat recipe, Crunchie fudge recipe, No bake desserts",17,2026-06-20 14:07:25
https://www.pinterest.com/pin/56787645297300286/,"Christmas Tree Cookies | Recipe | Christmas food, Christmas cookies, Christmas desserts",5,2026-06-20 14:07:25
https://www.pinterest.com/pin/cream-puffs-recipe-tornadough-alli--56787645297278761/,"Cream Puffs Recipe: Tornadough Alli | Lithuanian curd cheese doughnuts, Traditional lithuanian dessert - skruzdelynas, Serbian pastries",2,2026-06-20 14:07:31
https://www.pinterest.com/pin/212795151135046673/,"Cranberry Orange Bundt Cake Recipe | Cranberry orange cake easy, Cranberry cake with orange juice, Cranberry orange bundt cake with pineapple",7,2026-06-20 14:07:31
https://www.pinterest.com/pin/56787645297277994/,"Slow Cooker Sausage Stuffing: BHG's Best Recipes | Slow cooker sausage stuffing recipe, Pork crockpot recipes, Crockpot sausage stuffing",2,2026-06-20 14:07:32
https://www.pinterest.com/pin/56787645297278095/,"Gingerbread Edible Cookie Dough Recipe | Cookie dough to eat, Gluten free christmas cookies, Edible sugar cookie dough recipe",2,2026-06-20 14:07:32
https://www.pinterest.com/pin/212795151135045666/,"Burnt Almond Torte | Recipe | Almond torte cake recipe, Burnt almond torte recipe, Almond desserts",294,2026-06-20 14:07:32
https://www.pinterest.com/pin/slow-cooker-shredded-beef-tacos-bhgs-best-recipes--56787645297270910/,"Slow Cooker Shredded Beef Tacos: BHG's Best Recipes | Shredded beef taco recipes, Shredded beef taco tuesday, Shredded beef taco crockpot",4,2026-06-20 14:07:32
https://www.pinterest.com/pin/56787645297275049/,"Creamy Root Beer Rum Cocktails Recipe | Homemade root beer drink, Root beer and rum drink, Spiced rum",4,2026-06-20 14:07:33
https://www.pinterest.com/pin/56787645297274874/,"Melted Snowman Cookies | Recipe | How to make melted snowman cookies, Melted snowman cookies recipe, Melting snowman cookie recipe",5,2026-06-20 14:07:33
https://www.pinterest.com/pin/212795151135040339/,"Christmas Mimosas Recipe with Cranberry Spritz | Christmas brunch drinks, Christmas mimosas ideas, Christmas cocktails",16,2026-06-20 14:07:33
https://www.pinterest.com/pin/45036065015198774/,"Chocolate Chip Cake: Best Food Blogger Recipes | Homemade ganache, Chocolate chip cake recipe, Marble cake recipes",11,2026-06-20 14:07:36
https://www.pinterest.com/pin/45036065015200738/,"Cinnamon Sugar Mini Donuts Recipe | Yeast donuts, Strawberry donuts, Chocolate glazed donuts",3,2026-06-20 14:07:36
https://www.pinterest.com/pin/maple-dijon-pork-tenderloin--212795151135039560/,"Maple Dijon Pork Tenderloin Recipe | Pork tenderloin recipes, Pork dishes",81,2026-06-20 14:07:36
https://www.pinterest.com/pin/212795151135037400/,"Beer Can Chicken: Easy Dinners | Recipe | Beer can chicken sides dishes, Beer can chicken recipe with beer, Best beer can chicken",32,2026-06-20 14:07:36
https://www.pinterest.com/pin/212795151135039530/,Slow Cooker Sausage Stuffing,138,2026-06-20 14:07:36
https://www.pinterest.com/pin/212795151135032831/,"Baked Italian Subs | Flavorful Meats and Cheeses on a Toasted Hoagie Roll | Recipe | Hot hoagie sandwich recipes, Toasted subs sandwiches, Homemade italian subs",219,2026-06-20 14:07:37
https://www.pinterest.com/pin/apple-cider-mimosas--212795151135032395/,"Apple Cider Mimosas Recipe | Fall drinks, Refreshing drink, Easy drink",73,2026-06-20 14:07:37
https://www.pinterest.com/pin/212795151135032082/,"Slow Cooker Shredded Beef Tacos | Recipe | Shredded beef taco recipes, Shredded beef taco tuesday, Shredded beef taco crockpot",2,2026-06-20 14:07:37
https://www.pinterest.com/pin/56787645297261779/,"Sheet Pan Pizza Recipe: BHG's Best Recipes | Best easy dinner recipes, Pizza recipes homemade, Homemade sausage",3,2026-06-20 14:07:37
https://www.pinterest.com/pin/56787645297254905/,"Fireball Hard Cider | Recipe | Summer fireball cider drink, Fireball and apple cider, Fireball whiskey",4,2026-06-20 14:07:38
https://www.pinterest.com/pin/47710077295840856/,"TikTok Grinder Sandwich: BHG's Best Recipes | Tik tok grinder sandwich recipe, How to make the viral tiktok grinder sandwich, Best sandwich recipes",520,2026-06-20 14:07:38
https://www.pinterest.com/pin/56787645297254387/,"Apple Cider Mimosas: Tornadough Alli | Recipe | How to make a caramel apple mimosa, Fall apple cider mimosa, How to make caramel apple cider mimosas",5,2026-06-20 14:07:38
https://www.pinterest.com/pin/pumpkin-chocolate-chip-cupcakes--212795151135022021/,"Pumpkin Chocolate Chip Cupcakes Recipe | Pumpkin puree, Cupcake recipes",127,2026-06-20 14:07:41
https://www.pinterest.com/pin/apple-cider-mimosas--212795151135022006/,"Apple Cider Mimosas | Recipe | How to make a caramel apple mimosa, Fall apple cider mimosa, How to make caramel apple cider mimosas",1,2026-06-20 14:07:41
https://www.pinterest.com/pin/56787645297237934/,"Buffalo Chicken Pinwheels | Buffalo chicken roll ups recipe, Dinner recipes, Easy dinner",85,2026-06-20 14:07:43
https://www.pinterest.com/pin/212795151135008240/,"Slow Cooker Pork Chops: Tornadough Alli | Best slow cooker pork chop recipes, Easy slow cooker pork chops, How to cook pork chops in crock pot",110,2026-06-20 14:07:43
https://www.pinterest.com/pin/212795151135008234/,"Best Chocolate Chip Pumpkin Cupcakes for Fall | Recipe | Chocolate chip pumpkin cupcakes recipe, Chocolate chip pumpkin cupcakes with cream cheese frosting",29,2026-06-20 14:07:43
https://www.pinterest.com/pin/56787645297237927/,"Cozy up with a comforting Hot Toddy Recipe | Sore throat cocktail, Classic hot toddy drink, Hot toddy for sore throat",27,2026-06-20 14:07:44
https://www.pinterest.com/pin/56787645297235720/,"Halloween Cookie Bars | Recipe | Halloween bars and cookies, Halloween bars dessert, Halloween bars recipes",6,2026-06-20 14:07:45
