url,title,saves,timestamp
https://www.pinterest.com/pin/56787645302181539/,"Pineapple Margaritas Recipe | Pineapples and cream margarita, Big batch pineapple margaritas recipe, Summer drinks",398,2026-06-20 13:54:03
https://www.pinterest.com/pin/56787645302181672/,"Baked Pork Chops & Rice | Baked pork chops oven boneless with rice, Baked pork chops and rice oven, Baked pork chops and rice recipe",3070,2026-06-20 13:54:04
https://www.pinterest.com/pin/56787645302181279/,"Delicious Chicken Bacon Ranch Sliders Recipe | Chicken ranch sliders recipes kings hawaiian, Bacon bits, Chicken sandwich",487,2026-06-20 13:54:04
https://www.pinterest.com/pin/212795151136992352/,"Slow Cooker Beer Brats Recipe | Beer brat slow cooker, Beer brats in crock pot, Best dinner recipes",36,2026-06-20 13:54:09
https://www.pinterest.com/pin/56787645302171991/,"Grilled Italian Sausage Sandwiches | Recipe | Italian sausage sub sandwich, Italian sausage grinder sandwich, How to make italian sausage sandwiches",27,2026-06-20 13:54:09
https://www.pinterest.com/pin/56787645302171877/,"Chocolate Chip Banana Bread—Great for Mother's Day Breakfast or Brunch! | Recipe | Brunch ideas with chocolate chips, Banana bread recipe chocolate chip cinnamon, Chocolate chip banana bread variation",28,2026-06-20 13:54:09
https://www.pinterest.com/pin/212795151136989943/,"Chocolate Icebox Cake Recipe | Easy No Bake Dessert | Icebox cake recipe with chocolate pudding, Icebox cake with graham crackers, Chocolate dessert",39,2026-06-20 13:54:09
https://www.pinterest.com/pin/56787645302169622/,"Slow Cooker Beer Brats | Recipe | Easy meals, Slow cooker, Recipes",32,2026-06-20 13:54:10
https://www.pinterest.com/pin/212795151136989860/,"Homemade Lemon Brownies | Recipe | Fudgy lemon brownies recipe, Easy lemon brownies recipe, Lemon flavor",60,2026-06-20 13:54:10
https://www.pinterest.com/pin/212795151136989801/,"Homemade Baked Beans - Tornadough Alli | Recipe | Homemade bbq baked beans, From scratch baked beans, Baked beans recipe oven",115,2026-06-20 13:54:10
https://www.pinterest.com/pin/56787645302169387/,"Coconut Cream Bread Pudding | Recipe | Bread pudding with coconut milk, Coconut cheesecake bread pudding, Bread pudding recipes",35,2026-06-20 13:54:11
https://www.pinterest.com/pin/212795151136989723/,"Make Your Own Delicious Dirty Soda at Home | Recipe | How to make italian cream soda with alcohol, Dirty soda recipe non alcoholic, Italian soda flavors combinations",43,2026-06-20 13:54:11
https://www.pinterest.com/pin/212795151136985657/,"Fresh Strawberry Pie | Recipe | Strawberry pie recipe with honey, Strawberry almond pie recipe, Easy strawberry pie recipe",1012,2026-06-20 13:54:14
https://www.pinterest.com/pin/212795151136974936/,"Fall Off The Bone Ribs | Recipe | Fall ribs recipe, How to make fall off the bone ribs, Oven ribs fall off the bone pork",399,2026-06-20 13:54:14
https://www.pinterest.com/pin/47710077297779902/,"Tender Fall Off The Bone Ribs | Recipe | Fall off the bone ribs in oven, Fall off the bone ribs recipe, Tender ribs",1165,2026-06-20 13:54:14
https://www.pinterest.com/pin/56787645302154502/,"Easiest Fruit Pizza | Baked fruit desserts healthy, Healthy fruit pizza ideas, Best sugar cookie recipe for fruit pizza",105,2026-06-20 13:54:15
https://www.pinterest.com/pin/parmesan-crusted-chicken-recipe--212795151136969098/,"Parmesan Crusted Chicken Recipe | 3 ingredient parmesan crusted chicken, Parmesan crusted chicken meal, Parmesan crusted chicken no bread crumbs",34,2026-06-20 13:54:17
https://www.pinterest.com/pin/212795151136963286/,"How to Make Blueberry Jam | Recipe | Homemade blueberry jam recipe, Strawberry jam recipes, Delicious desserts",17,2026-06-20 13:54:17
https://www.pinterest.com/pin/212795151136968392/,"Lemon Pepper Chicken {The Easiest and Best Grilled Chicken Recipe} | Grilled lemon pepper chicken, Recipes with chicken and peppers, Easy chicken recipes",29,2026-06-20 13:54:17
https://www.pinterest.com/pin/no-bake-coconut-cheesecake--56787645302138108/,"Easy No Bake Coconut Cheesecake | Recipe | Coconut food recipes, Coconut cream cheesecake no bake, Easy coconut cheesecake",290,2026-06-20 13:54:17
https://www.pinterest.com/pin/56787645302137751/,"Copycat Wendy's Frosty Recipe | Wendys copycat frosty, Wendy's frosty copycat recipe, Dessert recipes",106,2026-06-20 13:54:17
https://www.pinterest.com/pin/212795151136957829/,"Garlic Butter Pasta | Recipe | Garlic butter pasta with vegetables, Quick butter pasta meal, Butter and garlic pasta",22,2026-06-20 13:54:18
https://www.pinterest.com/pin/56787645302130057/,"Vanilla Bean Pistachio Cake | Light and Flavorful Dessert | Recipe | Vanilla cake with pistachio frosting, Cake recipes, Cake ideas",12284,2026-06-20 13:54:18
https://www.pinterest.com/pin/56787645302130186/,"Limoncello for Summer | Recipe | Lemoncello drink recipe, Summer drink ideas with limoncello, Limoncello recipe",220,2026-06-20 13:54:18
https://www.pinterest.com/pin/56787645302130031/,"Easy cheesecake bar ideas | Recipe | Cheesecake bar treats, Cheesecake bar recipes easy, Dessert bars",343,2026-06-20 13:54:20
https://www.pinterest.com/pin/212795151136951748/,"Hollandaise Sauce | Recipe | Things to make with egg yolks, Recipes that use egg yolks, Homemade hollandaise",12,2026-06-20 13:54:20
https://www.pinterest.com/pin/56787645302058389/,"Overnight French Toast Bake {An Easy Breakfast Solution} | Baked french toast recipe overnight, French toast bake not overnight",413,2026-06-20 13:54:21
https://www.pinterest.com/pin/56787645302058404/,"Tender and Juicy Marry Me Chicken | How to cook chicken tikka masala, How to make marry me chicken keto, Marry me dinner recipes",485,2026-06-20 13:54:21
https://www.pinterest.com/pin/56787645302058341/,"Easy Homemade Fruit Pizza | Homemade fruit pizza dessert, Simple fruit pizza, Fruit pizza with homemade crust",75,2026-06-20 13:54:22
https://www.pinterest.com/pin/56787645302058218/,"Strawberry Cupcakes | Recipe | Strawberry frosting donut, Strawberry cupcakes with strawberry filling, Strawberries & cream cupcakes",49,2026-06-20 13:54:22
https://www.pinterest.com/pin/56787645301947197/,"Homemade Baked Beans—Great for Summer! | Recipe | Baked beans dish with herbs, Baked beans recipe using bushes baked beans, Easy jack daniels baked beans",96,2026-06-20 13:54:22
https://www.pinterest.com/pin/bacon-ranch-pasta-salad--56787645302058150/,"Bacon Ranch Pasta Salad | Bacon ranch pasta salad recipes cold, Pickle bacon ranch pasta salad, Easy pasta salad",76,2026-06-20 13:54:22
https://www.pinterest.com/pin/212795151136937665/,"Homemade Pancake Muffins | Recipe | Muffins from pancake mix recipes, Pancake mix banana muffins, Homemade banana muffins in pan",112,2026-06-20 13:54:23
https://www.pinterest.com/pin/56787645301947026/,"Creamy Root Beer Rum Cocktail - Tornadough Alli | Recipe | Easy whiskey drink ideas, Homemade root beer drink, Creamy alcoholic drinks recipes",3338,2026-06-20 13:54:23
https://www.pinterest.com/pin/56787645301946958/,"Slow Cooker Beer Brats You Have to Try! | Recipe | Beer brats recipe, Easy dinner recipes, Crockpot beer",49,2026-06-20 13:54:24
https://www.pinterest.com/pin/56787645301498041/,"Hearty Tater Tot Breakfast Casserole with Bacon, Sausage, and Cheese | Breakfast casserole with tater tots and bacon, Bacon tator tot breakfast casserole, Breakfast recipes casserole",310,2026-06-20 13:54:27
https://www.pinterest.com/pin/56787645301497985/,"Savory Veggie Pizza Pinwheels - A Crowd-Pleasing Appetizer! | Recipe | No meat pinwheels, Meatless pinwheels, Party foods",684,2026-06-20 13:54:28
https://www.pinterest.com/pin/212795151136930641/,"Easy and Delicious Chicken Fried Chicken | Recipe | Homemade chicken fried chicken, Fried chicken tenders with mashed potatoes, Fried chicken and gravy dinner",2325,2026-06-20 13:54:30
https://www.pinterest.com/pin/212795151136925970/,"Chicken Fried Chicken - Tornadough Alli | Recipe | Traditional fried chicken meal, Classic fried chicken meal, Southern fried chicken and gravy",7447,2026-06-20 13:54:31
https://www.pinterest.com/pin/mojo-pork-chops-with-cilantro-sour-cream-rice-recipe--212795151136929759/,"Mojo Pork Chops with Cilantro Sour Cream Rice Recipe | Mojo salmon, Pork chop dinner side dishes, Summer pork chop recipes",130,2026-06-20 13:54:32
https://www.pinterest.com/pin/tiktok-grinder-sandwich--212795151136926103/,"TikTok Grinder Sandwich | Recipe | Tik tok grinder sandwich recipe, Best sandwich recipes",334,2026-06-20 13:54:32
https://www.pinterest.com/pin/212795151136919595/,"How to Make Walking Tacos | Recipe | Walking tacos recipe, Taco recipes ground beef, Best easy dinner recipes",46,2026-06-20 13:54:33
https://www.pinterest.com/pin/56787645301479364/,"Almond Croissants Recipe with Almond Cream Filling | Almond croissant recipe easy, Almond croissant recipe from scratch, Homemade almond croissants",80,2026-06-20 13:54:33
https://www.pinterest.com/pin/212795151136914771/,"Baked Queso Dip | Recipe | Baked queso dip easy, Baked queso dip for party, Queso dip in oven",10,2026-06-20 13:54:33
https://www.pinterest.com/pin/dirty-soda--56787645301479715/,"Easy Dirty Soda | Recipe | Dirty soda recipe non alcoholic, Creamer in soda, Dirty soda drink ideas",170,2026-06-20 13:54:33
https://www.pinterest.com/pin/56787645301473495/,"Southern Banana Pudding | Classic Dessert Recipe | Southern banana pudding recipe homemade, How to make banana pudding with vanilla pudding, Vanilla wafer pudding",1560,2026-06-20 13:54:35
https://www.pinterest.com/pin/212795151136910848/,"Creamy Bacon Cheddar Ranch Pasta Salad | Bacon ranch pasta salad recipe, Bacon ranch pasta salad with mayo, Dinner recipes",7,2026-06-20 13:54:35
https://www.pinterest.com/pin/how-to-make-the-perfect-chicken-tenders--47710077297713496/,"How to Make the Perfect Chicken Tenders | Recipe | Homemade chicken tenders with ranch, Best homemade chicken tenders, Easy homemade chicken tenders",538,2026-06-20 13:54:36
https://www.pinterest.com/pin/56787645301456797/,"Easy Strawberry Mousse Recipe | Fluffy strawberry mousse recipe, Easy strawberry mousse dessert, Strawberry mousse dessert recipe",19,2026-06-20 13:54:37
https://www.pinterest.com/pin/56787645301456751/,"Slow Cooker Shredded Mexican Chicken | Recipe | Mexican style shredded chicken, Mexican shredded chicken stovetop, Mexican chicken recipe",16,2026-06-20 13:54:37
https://www.pinterest.com/pin/tuna-melt-recipe--56787645301456650/,"Tuna Melt Recipe | Tuna melt sandwich ideas, How to make a tuna melt with tomato, Best tuna melt sandwich",46,2026-06-20 13:54:38
https://www.pinterest.com/pin/56787645301453401/,"New York Cheesecake with Cherries | Recipe | Cheesecake bars with cherry filling, Cheesecake bars with cherry topping, Cherry cheesecake bars recipe",45,2026-06-20 13:54:39
https://www.pinterest.com/pin/212795151136892097/,"Irish Coffee Recipe | Easy and Delicious | Best whiskey for irish coffee, Jameson irish coffee recipe, Homemade irish coffee ingredients",36,2026-06-20 13:54:40
https://www.pinterest.com/pin/muffuletta-sandwich-recipe--212795151136889640/,"Muffuletta Sandwich Recipe | Recipe | Muffuletta sandwich, Muffuletta, Muffuletta recipe",3,2026-06-20 13:54:43
https://www.pinterest.com/pin/212795151136888952/,"Creamy and Fluffy Strawberry Mousse | Strawberry puree desserts, Strawberry mousse dessert with sauce, Fluffy strawberry mousse recipe",36,2026-06-20 13:54:44
https://www.pinterest.com/pin/212795151136889186/,"Vanilla Bean Pistachio Cake {A Delicious, Light, Flavorful Cake} | Recipe | Vanilla pistachio cake, Pistachio birthday cake recipe, Pistachio buttercream cake",464,2026-06-20 13:54:45
https://www.pinterest.com/pin/212795151136885409/,"The Ultimate Easter Menu | Easter dinner menu with ham, Easter meats besides ham, Typical easter meal",14,2026-06-20 13:54:46
https://www.pinterest.com/pin/212795151136870870/,"Traditional Carrot Cake Recipe with Cream Cheese Buttercream | Best frosting for carrot cake, Best icing for carrot cake, Best carrot cake for parties",258,2026-06-20 13:54:49
https://www.pinterest.com/pin/212795151136867693/,"Delicious Carrot Cake Cupcakes | Recipe | Easy carrot cupcake recipe, Homemade carrot cupcakes recipe, Classic carrot cupcakes",60,2026-06-20 13:54:51
https://www.pinterest.com/pin/56787645301404278/,"Refreshing Malibu Bay Breeze Cocktail | Easy cocktails with malibu, Easy mixed drinks with malibu rum, Summer cocktail recipes",503,2026-06-20 13:54:51
https://www.pinterest.com/pin/56787645301404485/,"Easy Crispy Buffalo Shrimp Recipe | Baked buffalo shrimp dip, How to make buffalo shrimp tacos, Spicy buffalo shrimp dip",231,2026-06-20 13:54:52
https://www.pinterest.com/pin/212795151136864431/,"Copycat Olive Garden Chicken Gnocchi Soup Recipe—A Comforting, Warm Meal! | Simple chicken gnocchi soup, Chicken gnocchi soup with artichokes, Chicken an gnocchi soup",704,2026-06-20 13:54:52
https://www.pinterest.com/pin/47710077297662706/,"Easter Menu Inspiration: Explore Delicious Options for Your Perfect Meal | Best easter dinner, Easter dinner ideas pinterest, Easter dinner menus",119,2026-06-20 13:54:52
https://www.pinterest.com/pin/56787645300917199/,"Easy and Tart Lemon Brownies | Recipe | Fudgy lemon brownies recipe, Moist fudgy lemon brownies, Easy lemon brownie recipe",87,2026-06-20 13:54:52
https://www.pinterest.com/pin/56787645300638975/,"Easy Strawberry Mousse | Strawberry puree desserts, Strawberry mousse dessert with sauce, Fluffy strawberry mousse recipe",23,2026-06-20 13:54:58
https://www.pinterest.com/pin/56787645300638958/,"Instant Pot BBQ Ribs | Recipe | Instant pot ribs recipe, Rib recipes, Instant pot dinner recipes",24,2026-06-20 13:54:59
https://www.pinterest.com/pin/212795151136848348/,"Homemade Strawberry Pop Tarts Recipe | Strawberry pop tart recipe, How to make strawberry pop tarts, Strawberry pop tarts breakfast",46,2026-06-20 13:54:59
https://www.pinterest.com/pin/212795151136848154/,"Bisquick Quiche | Easy Breakfast Recipe | Breakfast with bisquick, Bisquick quiche recipes simple, Bisquick impossible quiche recipe",436,2026-06-20 13:54:59
https://www.pinterest.com/pin/212795151136845720/,"Easy Summer Corn Salad | Recipe | Corn salad with tomatoes and onions, Grilled corn and tomato salad, Two-corn summer salad",33,2026-06-20 13:54:59
https://www.pinterest.com/pin/212795151136845749/,"Strawberry Shortcake Bars Recipe | Simple vanilla icing, Easy strawberry shortcake, Make strawberry shortcake",31,2026-06-20 13:54:59
https://www.pinterest.com/pin/212795151136845354/,"Tortellini Carbonara | Recipe | Tortellini recipes, Recipes, Cooking recipes",527,2026-06-20 13:55:02
https://www.pinterest.com/pin/212795151136836586/,"Easy Lemon Brownies | Recipe | Fudgy lemon brownies recipe, Moist fudgy lemon brownies, Easy lemon brownie recipe",15,2026-06-20 13:55:03
https://www.pinterest.com/pin/212795151136834813/,"Tuna Melt Recipe | What goes good with a tuna melt, Tuna melt recipe sandwiches, Easy tuna melt recipe",289,2026-06-20 13:55:03
https://www.pinterest.com/pin/56787645300410580/,"Club Sandwich Recipe - Tornadough Alli | Best club sandwich, Classic club sandwich, Deluxe sandwich",75,2026-06-20 13:55:04
https://www.pinterest.com/pin/56787645300410152/,"Pizza Grilled Cheese Explosion | Grilled pizza sandwich ideas, Pizza sandwiches recipe, Cheesy pizza",17087,2026-06-20 13:55:06
https://www.pinterest.com/pin/212795151136827724/,"Instant Pot BBQ Ribs | Recipe | Best instant pot bbq ribs, Easy instant pot bbq ribs, Instant pot ribs recipe",4,2026-06-20 13:55:07
https://www.pinterest.com/pin/212795151136820534/,"Hibachi Noodles Recipe - Easy Asian Dish | Simple asian noodles, Hibachi noodles at home, Homemade hibachi recipes",21,2026-06-20 13:55:09
https://www.pinterest.com/pin/slow-cooker-shredded-mexican-chicken-recipe--212795151136820260/,"Slow Cooker Shredded Mexican Chicken Recipe | Mexican shredded chicken recipes crockpot, Mexican chicken slow cooker recipes, Mexican shredded chicken crockpot easy",159,2026-06-20 13:55:09
https://www.pinterest.com/pin/47710077297612488/,"Marry Me Chicken—Tender and Savory! | How to cook chicken tikka masala, How to make marry me chicken keto, Marry me dinner recipes",1355,2026-06-20 13:55:13
https://www.pinterest.com/pin/56787645300390673/,"Crispy Air Fryer Frozen French Fries in Minutes | Recipe | Frozen fries in deep fryer, Frozen fries in air fryer, Frozen fry recipes",183,2026-06-20 13:55:13
https://www.pinterest.com/pin/classic-irish-coffee-recipe-with-whisky--212795151136804113/,"Classic Irish Coffee Recipe with Whisky | How to make irish coffee, Homemade irish coffee recipe, Coffee drinks",3,2026-06-20 13:55:14
https://www.pinterest.com/pin/56787645300383972/,"The Best Bread Pudding EVER! | Recipe | Best bread pudding recipe simple, Breadpudding dessert, Homemade bread pudding recipes",225,2026-06-20 13:55:16
https://www.pinterest.com/pin/56787645300383942/,"Summer Fancy Toast with Stella® Cheese | Recipe | Deviled egg potato salad for a crowd, Deviled egg potato salad recipe",48,2026-06-20 13:55:16
https://www.pinterest.com/pin/212795151136798310/,"Homemade Tartar Sauce | Delicious Condiment for Any Dish | Recipe | Simple homemade tartar sauce, Quick tartar sauce, How do you make homemade tartar sauce",846,2026-06-20 13:55:16
https://www.pinterest.com/pin/56787645300383797/,"Creamy Slow Cooker Mashed Potatoes | Instant mashed potatoes in crockpot, Crockpot mashed potatoes without chicken broth, Slow cooker mashed potatoes pioneer woman",123,2026-06-20 13:55:17
https://www.pinterest.com/pin/212795151136795301/,"Honey BBQ Crockpot Meatballs - The Perfect Party Appetizer! | Recipe | Halloween meatballs crockpot, Meatball recipes appetizer crock pot, Bbq meatball recipes crockpot",3575,2026-06-20 13:55:18
https://www.pinterest.com/pin/212795151136795325/,"Fried Shrimp Recipe | Tornadough Alli | Chinese fried shrimp recipes, Homemade fried seafood appetizer, Crispy fried shrimp",95,2026-06-20 13:55:19
https://www.pinterest.com/pin/212795151136796034/,Almond Croissant Recipe,22,2026-06-20 13:55:19
https://www.pinterest.com/pin/212795151136794409/,"Chicken Fried Chicken with Gravy and Ranch Sauce | Recipe | Homemade country fried chicken, Easy chicken frying tips, Homemade chicken frying tips",2040,2026-06-20 13:55:20
https://www.pinterest.com/pin/212795151136790609/,"Easy One-Pan Stuffed Pepper Casserole: A Twist on a Classic Recipe | Stuffed pepper casserole easy, Pepper casserole recipes",574,2026-06-20 13:55:22
https://www.pinterest.com/pin/212795151136786008/,"Indulgent Chicken Fried Chicken | Recipe | Fast and easy chicken dinners, Traditional fried chicken meal, Classic fried chicken meal",815,2026-06-20 13:55:23
https://www.pinterest.com/pin/212795151136783829/,Marry Me Chicken,19,2026-06-20 13:55:23
https://www.pinterest.com/pin/212795151136769887/,"Tuna Melt | Recipe | What goes good with a tuna melt, Tuna melt recipe sandwiches, Easy tuna melt recipe",5,2026-06-20 13:55:24
https://www.pinterest.com/pin/56787645300359144/,"Delicious Cream Cheese Wontons | Recipe | Wonton wrapper recipes, Delicious recipes, Dinner recipes",1295,2026-06-20 13:55:25
https://www.pinterest.com/pin/212795151136764580/,"Homemade Chicken and Dumplings | Recipe | Homemade chicken and dumplings, Recipes, Chicken recipes",436,2026-06-20 13:55:27
https://www.pinterest.com/pin/212795151136764479/,"Simple Bread Pudding Recipe with Cinnamon and Nutmeg | Best bread pudding recipe simple, Sauce for bread pudding easy, Bread pudding sauce recipe",46,2026-06-20 13:55:28
https://www.pinterest.com/pin/212795151136748023/,"Savory and Juicy Slow Cooker Pork Chops | Peach pork chops crock pot, Lemon pepper pork chops slow cooker, Keto slow cooker pork chops",1181,2026-06-20 13:55:29
https://www.pinterest.com/pin/56787645300348819/,"McDonald's Copycat Shamrock Shake | Recipe | Copycat shamrock shake recipe, Mcdonald's shamrock shake, Mcdonalds shamrock shake recipe",62,2026-06-20 13:55:30
https://www.pinterest.com/pin/212795151136747916/,"Homemade Shrimp Boil | Recipe | How to make a shrimp boil with vegetables, Simple shrimp boil recipe, Seafood boil recipe",64,2026-06-20 13:55:34
https://www.pinterest.com/pin/crispy-fish-sandwich--56787645300333829/,"Crispy Fish Sandwich with Tartar Sauce and Cheese | Recipe | Slaw for fish sandwiches, Homemade crispy fish sandwich, Best fish sandwich",245,2026-06-20 13:55:35
https://www.pinterest.com/pin/56787645300333229/,"Strawberries and Cream Oatmeal Recipe | Strawberry oatmeal with oats, Homemade strawberry oatmeal, Strawberry oatmeal with fresh fruit",31,2026-06-20 13:55:37
https://www.pinterest.com/pin/47710077297553386/,"The BEST Copycat Olive Garden Chicken Gnocchi Soup | Recipes, Chicken gnocchi soup olive garden, Soup recipes",916,2026-06-20 13:55:37
https://www.pinterest.com/pin/212795151136741740/,"Homemade Tartar Sauce Recipe for Fish & More | Simple homemade tartar sauce, Quick tartar sauce, How do you make homemade tartar sauce",409,2026-06-20 13:55:37
https://www.pinterest.com/pin/212795151136741646/,"Best Air Fryer French Fries Recipe | French fry air fryer recipes, Ninja air fryer french fries, French fries recipe air fryer",155,2026-06-20 13:55:37
https://www.pinterest.com/pin/tortellini-carbonara-recipe-with-spinach-and-bacon--212795151136734482/,"Tortellini Carbonara Recipe with Spinach and Bacon | Tortellini carbonara pasta dish, Chicken tortellini carbonara, Simple tortellini carbonara recipe",429,2026-06-20 13:55:41
https://www.pinterest.com/pin/212795151136728215/,"Baked Ribs Recipe | Best country style ribs in oven, Country style ribs recipe oven, Baked country style ribs",183,2026-06-20 13:55:42
https://www.pinterest.com/pin/mini-tacos--212795151136718776/,"Easy Mini Tacos—A Bite-Sized Side or Appetizer! | Recipe | Easy mini taco recipe, Mini tacos for kids, Simple taco",694,2026-06-20 13:55:47
https://www.pinterest.com/pin/chocolate-raspberry-cake--56787645300305393/,"Valentine's Day Chocolate Raspberry Cake—Great for Crowds! | Recipe | Chocolate raspberry cake recipe, Raspberry layer cake, Raspberry buttercream",779,2026-06-20 13:55:49
https://www.pinterest.com/pin/56787645300305244/,"Chicken Fried Chicken With Country Gravy | Recipe | Country gravy recipe, Creamy cajun shrimp pasta, Fried chicken recipes",151,2026-06-20 13:55:50
https://www.pinterest.com/pin/212795151136711034/,"Korean Spicy Pork Bowls | Delicious Asian Recipes | Korean pork rice bowl recipe, Pork bulgogi bowl, Spicy pork bulgogi",164,2026-06-20 13:55:52
https://www.pinterest.com/pin/212795151136710723/,"Homemade Chicken Tenders | Recipe | Homemade chicken tenders with ranch, Best homemade chicken tenders, How to make ranch chicken tenders in oven",589,2026-06-20 13:55:52
https://www.pinterest.com/pin/212795151136684950/,"Valentine's Day Chocolate Raspberry Cake | Recipe | Chocolate raspberry cake recipe, Raspberry layer cake, Raspberry buttercream",37,2026-06-20 13:55:59
https://www.pinterest.com/pin/212795151136684881/,"Baked Pork Chop Recipes: Delicious and Easy! | Pork chops and rice recipes in oven, Easy pork chop and rice recipes, Pork chop and rice casserole easy",312,2026-06-20 13:55:59
https://www.pinterest.com/pin/212795151136684843/,"French Onion Chicken: Comfort with a Twist | Recipe | Cheesy french onion chicken, French onion chicken delish, French onion chicken recipe allrecipes",396,2026-06-20 13:55:59
https://www.pinterest.com/pin/the-best-king-cake-recipegreat-for-mardi-gras--56787645300265897/,"The BEST King Cake Recipe—Great for Mardi Gras! | Moist king cake recipe, King cake birthday cake, Mardi gras king cake",55,2026-06-20 13:56:03
https://www.pinterest.com/pin/47710077297488751/,"Delicious Tuna Casserole with Creamy Homemade Sauce | Recipe | Tuna casserole from scratch, Homemade tuna casserole recipe, Tuna noodle casserole with bread crumbs",88,2026-06-20 13:56:03
https://www.pinterest.com/pin/212795151136674763/,"Egg Drop Soup—A Healthy Winter Meal | Recipe | Quick homemade egg drop soup, Homemade egg soup recipe, Recipe for egg drop soup",68,2026-06-20 13:56:03
https://www.pinterest.com/pin/212795151136674293/,"Easy Chocolate Cake Recipe (9x13-inch Pan) | Chocolate cake with fluffy frosting, Simple moist chocolate cake, Easy fluffy chocolate cake recipe",559,2026-06-20 13:56:05
https://www.pinterest.com/pin/delicious-shredded-brussel-sprout-harvest-salad-recipe--212795151136674596/,"Delicious Shredded Brussel Sprout Harvest Salad Recipe | Shredded brussel sprout recipes salad, Shaved brussel sprout salad thanksgiving, Salad dressings",42,2026-06-20 13:56:05
https://www.pinterest.com/pin/56787645300262360/,"Easy Fruit Pizza—A Delicious Dessert or Breakfast! | Homemade fruit pizza dessert, Fruit pizza with homemade crust, Dessert pizza with fruit",147,2026-06-20 13:56:07
https://www.pinterest.com/pin/47710077297485228/,"Chicken Caesar Pasta Salad—A Delicious Healthy Meal | Recipe | Chicken caesar salad pasta recipe, Pasta salad with chicken caesar dressing, Chicken caesar pasta salad without lettuce",340,2026-06-20 13:56:08
https://www.pinterest.com/pin/47710077297485111/,"Olive Garden Chicken Gnocchi Soup Recipe | Easy olive garden chicken gnocchi soup, Copycat chicken gnocchi soup recipe",381,2026-06-20 13:56:08
https://www.pinterest.com/pin/creamy-potato-soup-recipe-delicious-dish-using-the-most-versatile-ingredient--47710077297484976/,"Creamy Potato Soup Recipe: Delicious Dish Using the Most Versatile Ingredient | Vegetable beef soup, Chicken gnocchi soup, Soup and stew",107,2026-06-20 13:56:08
https://www.pinterest.com/pin/56787645300262025/,"Mini Pizza Bagels | Recipe | Mini bagel pizzas, How to make bagels with pizza dough, Mini bagel appetizers",21,2026-06-20 13:56:08
