url,title,saves,timestamp
https://www.pinterest.com/pin/56787645295946745/,"Easy Ground Beef Carbonara Recipe | Thrifty meals, Pasta carbonara recipe, New recipes for dinner",11,2026-06-06 16:26:07
https://www.pinterest.com/pin/47710077294641140/,"Spaghetti Aglio e Olio | Recipe | Easy aglio olio recipe, Spaghetti aglio e olio for two, Simple aglio olio recipe",2,2026-06-06 16:26:07
https://www.pinterest.com/pin/45036065014087068/,"Chocolate Chip Pumpkin Pudding Pie | Recipe | No bake thanksgiving pie, Pumpkin chip cream pie, Classic pumpkin pie",5,2026-06-06 16:26:09
https://www.pinterest.com/pin/56787645295937894/,"One Pan Stuffed Pepper Casserole | Stuffed pepper casserole easy, Stuffed pepper hot dish, Casserole recipes",9,2026-06-06 16:26:09
https://www.pinterest.com/pin/hot-toddy--212795151133852682/,"Hot Toddy Recipe with Lemon and Spices | Hot toddies recipe, Toddy coffee, Food drink",129,2026-06-06 16:26:10
https://www.pinterest.com/pin/56787645295926116/,"Sausage Rolls Appetizer | Recipe | Easy sausage rolls appetizer, How to make sausage rolls with crescent rolls, Sausage rolls recipes",2,2026-06-06 16:26:12
https://www.pinterest.com/pin/212795151133840225/,"Southern Pecan Pie Recipe for Thanksgiving and Christmas | Best easy pecan pie, Best southern pecan pie recipe, The best pecan pie recipe",9,2026-06-06 16:26:13
https://www.pinterest.com/pin/pumpkin-bread-with-maple-glaze--212795151133839364/,"Pumpkin Bread with Maple Glaze Recipe | Delicious pumpkin, Pumpkin sweet, Pumpkin recipes dessert",362,2026-06-06 16:26:14
https://www.pinterest.com/pin/212795151133823407/,"Chicken Fried Chicken | Country gravy recipe, Creamy cajun shrimp pasta, Large family meals",16,2026-06-06 16:26:21
https://www.pinterest.com/pin/212795151133823604/,"The Best Homemade Sloppy Joes - Tornadough Alli | Recipe | Spicy meat sandwich recipe, Savory sloppy joe recipe, How to make spicy sloppy joes",3,2026-06-06 16:26:21
https://www.pinterest.com/pin/212795151133823178/,"Copycat Cracker Barrel Meatloaf - Tornadough Alli | Recipe | Cracker barrel meatloaf sauce, Cracker barrel meatloaf recipe with ground beef, Cracker barrel meatloaf recipe copycat",2,2026-06-06 16:26:21
https://www.pinterest.com/pin/pumpkin-cupcakes--212795151133820875/,"Delicious Pumpkin Cupcakes with Cream Cheese Frosting | Pumpkin sweet, Pumpkin puree, Pumpkin desserts",128,2026-06-06 16:26:22
https://www.pinterest.com/pin/56787645295902159/,"Easy Easy Croissant Breakfast Sandwiches | Recipe | Make ahead breakfast sandwiches croissant, Crossaint breakfast sandwiches, Easy croissant sandwiches",18,2026-06-06 16:26:22
https://www.pinterest.com/pin/glazed-apple-cider-donuts--212795151133821678/,"Glazed Apple Cider Donuts Recipe | Apple cider cinnamon, Apple pie spice, Donut recipes",93,2026-06-06 16:26:23
https://www.pinterest.com/pin/tuna-noodle-casserole--212795151133815388/,"Tuna Noodle Casserole Recipe | One pot tuna noodle casserole, One pan tuna noodle casserole, Tuna noodle casserole elbow macaroni",167,2026-06-06 16:26:25
https://www.pinterest.com/pin/vegetable-lo-mein--212795151133814949/,"Vegetable Lo Mein | Recipe | Easy vegetable lo mein, Low mein recipe vegetable, Recipes for food",41,2026-06-06 16:26:25
https://www.pinterest.com/pin/pasta-e-fagioli-soup-recipe-with-fresh-herbs-and-carrots--212795151133812806/,"Pasta e Fagioli Soup Recipe with Fresh Herbs and Carrots | Ministroni soup recipe italian crockpot, Easy classic minestrone soup, Classic homemade minestrone soup recipe",92,2026-06-06 16:26:25
https://www.pinterest.com/pin/329536897742848839/,"Ground Beef Carbonara an Easy Flavorful Pasta Recipe | Ground beef carbonara recipe, White pasta with ground beef, Beef pasta recipes",1255,2026-06-06 16:26:25
https://www.pinterest.com/pin/212795151133805889/,The Best Chicken Fried Chicken,12,2026-06-06 16:26:27
https://www.pinterest.com/pin/212795151133812300/,"Easy Pecan Sticky Buns Recipe | Pecan buns recipe easy, Toffee pecan sticky buns, Sticky buns easy",20,2026-06-06 16:26:27
https://www.pinterest.com/pin/212795151133806670/,"Easy Croissant Breakfast Sandwiches | Recipe | Make ahead breakfast sandwiches croissant, Crossaint breakfast sandwiches, Easy croissant sandwiches",10,2026-06-06 16:26:28
https://www.pinterest.com/pin/56787645295880016/,"French Toast Waffle Sticks | Recipe | Homemade waffle sticks recipe, Belgian waffle sticks, Baked waffle sticks",75,2026-06-06 16:26:29
https://www.pinterest.com/pin/212795151133805256/,"Easy Apple Crisp Recipe | Thm apple crisp recipe, Apple crisp sugar free, Best apple crisp",23,2026-06-06 16:26:29
https://www.pinterest.com/pin/229754018483118097/,"Decadent Paleo Brownies with Coconut Salted Caramel Sauce | Caramel brownies recipe, Almond flour brownies, Chocolate brownies",8,2026-06-06 16:26:30
https://www.pinterest.com/pin/229754018483114866/,"The Best Bread Pudding | Recipe | Best bread pudding recipe, Best easy dessert recipes",21,2026-06-06 16:26:30
https://www.pinterest.com/pin/white-chicken-chili--212795151133803094/,"White Chicken Chili | White chicken chilli in dutch oven, Healthier white chicken chili, White chicken chili crockpot recipes greek yogurt",139,2026-06-06 16:26:30
https://www.pinterest.com/pin/sweet-potato-pie-recipe-a-delicious-alternative-to-pumpkin-pie--56787645295875825/,"Sweet Potato Pie Recipe - A Delicious Alternative to Pumpkin Pie | Sweet potato pie on cooling rack, Old fashioned sweet potato pie recipes, Sweet potato pie southern",4,2026-06-06 16:26:30
https://www.pinterest.com/pin/212795151133793301/,"Vegetable Frittata | Recipe | Vegetable frittata with salad, Vegetable frittata with tomatoes and spinach, Green vegetable frittata in skillet",140,2026-06-06 16:26:32
https://www.pinterest.com/pin/212795151133793296/,"Watergate Cake: A Delicious Vintage Recipe | Watergate bundt cake, Watergate cake recipe, Pistachio watergate cake",8,2026-06-06 16:26:32
https://www.pinterest.com/pin/56787645295867316/,"Baked Tortellini | Recipe | How to make baked tortellini, Easy oven tortellini dish, Tortellini oven dish recipe",1,2026-06-06 16:26:33
https://www.pinterest.com/pin/56787645295865402/,"Slow Cooker Pork Carnitas | Recipe | Pulled pork carnitas slow cooker, Pork loin carnitas slow cooker, Easy pork carnitas slow cooker",6,2026-06-06 16:26:33
https://www.pinterest.com/pin/212795151133789009/,"Maple Chocolate Pecan Pie Bars Recipe | Easy pecan pie bar recipe, Best fall desserts",76,2026-06-06 16:26:35
https://www.pinterest.com/pin/212795151133788975/,"Cinnamon Swirl Bread Recipe | Cinnamon roll bread, Sweet bread, Homemade bread",34,2026-06-06 16:26:35
https://www.pinterest.com/pin/45036065014014322/,"Homemade Oatmeal Cream Pies Recipe | Best dessert recipes, Cake oatmeal, Whoopie pie recipes",6,2026-06-06 16:26:35
https://www.pinterest.com/pin/212795151133782787/,"Easy and Delicious Chicken Tortilla Casserole Recipe | Casserole with corn tortillas, Casserole using corn tortillas, Casserole recipes",2,2026-06-06 16:26:36
https://www.pinterest.com/pin/cinnamon-apple-cheesecake-recipe--212795151133781635/,"Cinnamon Apple Cheesecake Recipe | Apple cinnamon cheesecake recipe, Apple cheesecake with slice missing, Caramel apple cheesecake",77,2026-06-06 16:26:38
https://www.pinterest.com/pin/easy-creamed-potatoes-a-delicious-side-dish-recipe--212795151133781419/,"Creamed Potatoes | Recipe | Creamed potatoes southern, Creamed potatoes recipe, Creamed potatoes old fashioned",51,2026-06-06 16:26:38
https://www.pinterest.com/pin/443675000800578668/,"Chocolate Chip Pumpkin Pudding Pie - A Twist on a Classic | Recipe | No bake thanksgiving pie, Pumpkin chip cream pie, Classic pumpkin pie",18,2026-06-06 16:26:39
https://www.pinterest.com/pin/212795151133779028/,"Sloppy Joe Casserole | Recipe | Sloppy joe pasta bake with cream cheese, Sloppy joe casserole with noodles, Casserole recipes",192,2026-06-06 16:26:39
https://www.pinterest.com/pin/56787645295845408/,"Delicious Old-Fashioned Oatmeal Cake | Oatmeal cinnamon cake, Desserts using oats, Oatmeal cookie cake",3,2026-06-06 16:26:42
https://www.pinterest.com/pin/212795151133771421/,"Ultimate Thanksgiving Roundup: Delicious Everyday Paleo Favorites | Recipe | All recipes apple pie, White chocolate apple pie, Apple pie in white dish",17,2026-06-06 16:26:42
https://www.pinterest.com/pin/56787645295842287/,"French Onion Chicken with Caramelized Onions and Cheese | Recipe | French onion stuffed chicken casserole, Cheesy french onion chicken, French onion soup chicken dish",92,2026-06-06 16:26:42
https://www.pinterest.com/pin/212795151133768289/,Sweet & Spicy Slow Cooker Chicken Wings,79,2026-06-06 16:26:42
https://www.pinterest.com/pin/212795151133768280/,French Onion Dip,130,2026-06-06 16:26:42
https://www.pinterest.com/pin/brussel-sprout-casserole--56787645295841491/,"Brussel Sprout Casserole | Recipe | Easy brussel sprout casserole, Brussel sprouts casserole recipes, Easy casserole recipes",111,2026-06-06 16:26:44
https://www.pinterest.com/pin/peanut-butter-and-jelly-poke-cake--212795151133761023/,"Peanut Butter and Jelly Poke Cake | Peanut butter and jelly cake, Poke cake recipes, Pokecake",369,2026-06-06 16:26:45
https://www.pinterest.com/pin/212795151133758643/,"Crockpot Honey BBQ Meatballs | Recipe | Bbq meatballs crockpot, Dip recipes appetizers, Best party appetizers",4,2026-06-06 16:26:47
https://www.pinterest.com/pin/apple-cider-sangria--212795151133758021/,"Apple Cider Sangria Recipe | Zinc rich foods, Fall sangria, Sangria rum",184,2026-06-06 16:26:49
https://www.pinterest.com/pin/56787645295828694/,"Crispy Chicken Sandwich - Tornadough Alli | Recipe | Crispy chicken sandwich lunch, Easy crispy chicken sandwich, Restaurant style chicken sandwich",42,2026-06-06 16:26:50
https://www.pinterest.com/pin/slow-cooker-bolognese-sauce--212795151133748592/,"Slow Cooker Bolognese Sauce Recipe | Bolognese pasta with rich sauce, Bolognese sauce crockpot, Slow cooker bolognese recipe",194,2026-06-06 16:26:51
https://www.pinterest.com/pin/212795151133756407/,"Delicious and Addictive Philly Cheesesteak Recipe | Philly cheesesteak recipe without bread, Easy philly cheesesteak recipe, Easy homemade philly cheesesteak",10,2026-06-06 16:26:51
https://www.pinterest.com/pin/pepperoni-pizza-rolls--212795151133744714/,"Pepperoni Pizza Rolls | Recipe | Pepperoni pizza rolls, Pizza rolls, Pepperoni",24,2026-06-06 16:26:53
https://www.pinterest.com/pin/crock-pot-easy-apple-crumble--212795151133745176/,"Crock Pot Easy Apple Crumble Recipe | Apple crumble crockpot recipe, Apple crumble in crockpot, Apple desserts",191,2026-06-06 16:26:53
https://www.pinterest.com/pin/pumpkin-chocolate-chip-cookies--212795151133744697/,"Pumpkin Chocolate Chip Cookies Recipe | Chocolate chip fall treats, Chocolate chip cookie mix with pumpkin, Recipes with pumpkin spice baking chips",99,2026-06-06 16:26:54
https://www.pinterest.com/pin/oatmeal-cream-pies--212795151133736056/,"Oatmeal Cream Pies Recipe | Homemade oatmeal cream pie cookies, How to make homemade oatmeal cream pies, Oatmeal crème pies",2989,2026-06-06 16:26:56
https://www.pinterest.com/pin/212795151133734187/,"Banana Cookies with White Frosting and Chopped Nuts | Recipe | Banana cookie recipe, Cinnamon cream cheese frosting, Banana nut cookies",31,2026-06-06 16:26:57
https://www.pinterest.com/pin/slow-cooker-meatloaf-tornadough-alli--56787645295799087/,"Slow Cooker Meatloaf | Salmon patties recipe, Ground beef dishes, Slow cooker meatloaf recipe",3,2026-06-06 16:26:58
https://www.pinterest.com/pin/56787645295792914/,"Pickle Dip Pinwheels Recipe | Pickle dip pinwheel recipe, Dill pickle pinwheels, Dried dill",17,2026-06-06 16:27:00
https://www.pinterest.com/pin/56787645295789468/,"Baked Pork Chops & Rice | Recipe | Baked pork chops and rice recipe, Baked pork chops oven",7,2026-06-06 16:27:00
https://www.pinterest.com/pin/pumpkin-bars--212795151133725872/,"Easy and Delicious Pumpkin Bars with Cinnamon Cream Cheese Frosting | Homemade pumpkin bar ideas, Easy pumpkin bar baking, Pumpkin bars recipe from scratch",97,2026-06-06 16:27:01
https://www.pinterest.com/pin/56787645295789073/,"Chicken Gnocchi Soup - An Olive Garden Copycat | Recipe | Easy olive garden chicken gnocchi soup, Copycat chicken gnocchi soup recipe, Olive garden chicken gnocchi soup recipe",10,2026-06-06 16:27:02
https://www.pinterest.com/pin/pickle-dip-pinwheels--212795151133725480/,"Pickle Dip Pinwheels Recipe | Pickle wrap pinwheels, Pinwheel appetizers pickle, Pickle tortilla roll ups",1430,2026-06-06 16:27:03
https://www.pinterest.com/pin/the-best-chicken-salad--212795151133724450/,"Best Chicken Salad Recipe | Chicken salad with dill and grapes, Cheese and chicken salad croissant, Croissant sandwich chicken salad",199,2026-06-06 16:27:04
https://www.pinterest.com/pin/nashville-hot-chicken-tenders--212795151133722302/,"Nashville Hot Chicken Tenders Recipe | Homemade chicken tenders, Crispy chicken sandwiches, Buffalo chicken sandwiches",178,2026-06-06 16:27:06
https://www.pinterest.com/pin/212795151133722299/,"Homemade Soft Pretzels | Recipe | Homemade soft pretzels, Soft pretzel recipe, Homemade pretzels",77,2026-06-06 16:27:06
https://www.pinterest.com/pin/212795151133719409/,"Easy Ground Beef Enchiladas | Recipe | Ground beef cheesy enchiladas, Ground beef enchiladas with cheese sauce, Ground beef enchiladas corn tortillas",6,2026-06-06 16:27:08
https://www.pinterest.com/pin/212795151133719201/,"Italian Pinwheels Appetizer | Recipe | How to make italian pinwheels, Italian pinwheel roll recipe, Italian pin wheel recipes",14,2026-06-06 16:27:08
https://www.pinterest.com/pin/pumpkin-bread-pudding--212795151133718842/,"Pumpkin Bread Pudding Recipe for Thanksgiving | Pumpkin bread pudding recipe easy, Autumn bread pudding dish, Pumpkin recipes dessert",3766,2026-06-06 16:27:09
https://www.pinterest.com/pin/apple-monkey-bread--212795151133712593/,"Apple Monkey Bread Recipe | Apple walnut monkey bread rolls, Apple monkey bread with cinnamon rolls, Easy apple monkey bread",402,2026-06-06 16:27:11
https://www.pinterest.com/pin/212795151133712564/,"Slow Cooker Grape Jelly Meatballs Recipe | Homemade grape jelly meatballs, Meatballs and jelly, Appetizer meatballs",58,2026-06-06 16:27:11
https://www.pinterest.com/pin/pumpkin-cheesecake-pie--212795151133712255/,"Pumpkin Cheesecake Pie with Whipped Cream and Cinnamon Sticks | Homemade pumpkin pie cheesecake, Pumpkin and cheesecake pie, Pumpkin pie with cheesecake layer",276,2026-06-06 16:27:11
https://www.pinterest.com/pin/212795151133712097/,"Slow Cooker Meatloaf with Delicious Glaze | Salmon patties recipe, Ground beef dishes, Slow cooker meatloaf recipe",3,2026-06-06 16:27:12
https://www.pinterest.com/pin/spaghetti-aglio-e-olio--212795151133702225/,"Spaghetti Aglio e Olio Recipe | Ethnic recipes, Food - pasta, Pasta dishes",78,2026-06-06 16:27:14
https://www.pinterest.com/pin/212795151133702183/,"Italian Pinwheels Recipe | How to make italian pinwheels, Italian pinwheel roll recipe, Italian pin wheel recipes",2,2026-06-06 16:27:14
https://www.pinterest.com/pin/212795151133701657/,"Flavorful Instant Pot Street Tacos: A Quick and Delicious Recipe | Instapot beef tacos, Instant pot beef tacos, Dinner recipes",2653,2026-06-06 16:27:15
https://www.pinterest.com/pin/212795151133702099/,"Easy Pumpkin Donuts | Recipe | Cinnamon sugar pumpkin donuts, Baked pumpkin donuts, Pumpkin donuts recipe",1,2026-06-06 16:27:15
https://www.pinterest.com/pin/braided-apple-puff-pastry--212795151133701614/,"Braided Apple Puff Pastry | Easy apple puff pastry recipes, Apple strudel recipe puff pastry, Apple recipes with puff pastry",4138,2026-06-06 16:27:15
https://www.pinterest.com/pin/cookie-monster-edible-cookie-dough--229754018482956712/,"Cookie Monster Edible Cookie Dough Recipe | Homemade monster cookie dough, Recipe for monster cookie dough, Easy edible monster cookie dough",529,2026-06-06 16:27:15
https://www.pinterest.com/pin/copycat-cracker-barrel-meatloaf--212795151133698523/,"Copycat Cracker Barrel Meatloaf Recipe | Glazed meatloaf slices, Glazed meatloaf on serving plate, Meatloaf with barbecue sauce",224,2026-06-06 16:27:17
https://www.pinterest.com/pin/mini-air-fryer-pizza-recipe--3588874693135314/,"Mini Air Fryer Pizza Recipe | Quick and Delicious | How long to cook mini pizza in air fryer, Air fryer dinner recipes",1,2026-06-06 16:27:17
https://www.pinterest.com/pin/82753711892695718/,"Homemade Soft Pretzels with Cheese Sauce | Recipe | Homemade pretzel cheese sauce, Cheese sauce recipe for soft pretzels, Appetizer recipes",7,2026-06-06 16:27:17
https://www.pinterest.com/pin/7-layer-dip--212795151133689617/,"Delicious 7 Layer Dip Recipe | Layered dip recipes, Layered taco dip, Layered bean dip",575,2026-06-06 16:27:18
https://www.pinterest.com/pin/peach-cobbler-dump-cake-recipe--212795151133689603/,"Peach Cobbler Dump Cake Recipe | Easy 4-Ingredient Dessert | Canned peach dump cake easy, Peach cobbler ice cream cake with cool whip, Peach cobbler with cake mix and sprite",2,2026-06-06 16:27:19
https://www.pinterest.com/pin/212795151133688864/,"Easy and Decadent Pumpkin Roll Recipe with Cream Cheese Filling | Easy pumpkin rolls with cream cheese, Pumpkin roll cream cheese filling, Cream cheese stuffed pumpkin rolls",4,2026-06-06 16:27:20
https://www.pinterest.com/pin/homemade-chicken-tenders--212795151133664749/,"The Best Homemade Chicken Tenders | Recipe | Homemade chicken tenders recipe, Boneless chicken wings, Chicken sliders",9,2026-06-06 16:27:27
https://www.pinterest.com/pin/212795151133664809/,"Easy Homemade Macaroni Salad Recipe | Macaroni salad with corn and ham, Macaroni salad recipe with peas, Easy macaroni salad",3,2026-06-06 16:27:27
https://www.pinterest.com/pin/56787645295714523/,"Arnold Palmer Drink | Recipe | Iced tea lemonade, Iced tea lemonade recipe, Lemonade recipes",4,2026-06-06 16:27:27
https://www.pinterest.com/pin/copycat-applebees-honey-pepper-chicken-mac-and-cheese--212795151133661088/,"Copycat Applebee's Honey Pepper Chicken Mac and Cheese | Applebee's honey pepper chicken mac and cheese ingredients, Applebee's honey pepper chicken mac and cheese recipe",933,2026-06-06 16:27:27
https://www.pinterest.com/pin/212795151133664703/,"Gluten-Free Peach Crumb Bars with a Summery Twist | Recipe | Peach crumble cheesecake bars, Peach pie cheesecake bars, Peach cobbler cheesecake bars",8,2026-06-06 16:27:27
https://www.pinterest.com/pin/slow-cooker-chicken-tinga--212795151133661080/,"Slow Cooker Chicken Tinga Recipe | Chicken tinga crockpot slow cooker, Make ahead meals, Healthy meal plans",49,2026-06-06 16:27:27
https://www.pinterest.com/pin/229754018482885614/,"Cannoli Dip Recipe | Vegan cannoli dip, Easy cannoli dip, Cannoli dip for cake",12,2026-06-06 16:27:28
https://www.pinterest.com/pin/56787645295709728/,"Spicy Korean Pork Bowls | Recipe | Chicken pesto sandwich, Boneless chicken wings, Spicy appetizers",4,2026-06-06 16:27:28
https://www.pinterest.com/pin/delicious-cinnamon-muffins-recipe--56787645295714004/,"Delicious Cinnamon Muffins Recipe | Homemade cinnamon muffins on cooling rack, Homemade glazed muffins recipe, Muffins easy",7,2026-06-06 16:27:29
https://www.pinterest.com/pin/oldfashioned-oatmeal-cake--212795151133656612/,"Old-Fashioned Oatmeal Cake Recipe | Oatmeal cinnamon cake, Desserts using oats, Oatmeal cookie cake",210,2026-06-06 16:27:29
https://www.pinterest.com/pin/blackberry-muffins--212795151133655424/,"Blackberry Muffins | Blackberry crumble muffins, Blackberry muffins with oatmeal streusel, Blueberry muffins",122,2026-06-06 16:27:30
https://www.pinterest.com/pin/56787645295704042/,"Refreshing Homemade Arnold Palmer Recipe | Arnold palmer drink recipe, How to make arnold palmer, Iced tea lemonade",2,2026-06-06 16:27:31
https://www.pinterest.com/pin/ham-salad--56787645295703519/,"Ham Salad Recipe | Pizza grilled cheese, Ham steaks, Recipe for ham salad",4,2026-06-06 16:27:32
https://www.pinterest.com/pin/212795151133651236/,"Banana Cookies with Cinnamon Cream Cheese Frosting | Recipe | Banana cookie recipe, Banana nut cookies, 2 banana",39,2026-06-06 16:27:32
https://www.pinterest.com/pin/donut-cake--212795151133649636/,"Donut Cake | Delicious Desserts | Diy donut cake inspiration, Sprinkle cake donut recipe, Pink donut cake",76,2026-06-06 16:27:32
https://www.pinterest.com/pin/slow-cooker-buffalo-chicken-sandwiches--212795151133649347/,"Slow Cooker Buffalo Chicken Sandwiches Recipe | Shredded buffalo chicken, Sweet potato buns, Chicken recipes at home",321,2026-06-06 16:27:33
https://www.pinterest.com/pin/sausage-rolls--212795151133645677/,"Savory Sausage Rolls for Easy and Delicious Entertaining | Snacks for bible study group, Sausage roll appetizer, Savory sausage pastry recipe",660,2026-06-06 16:27:35
https://www.pinterest.com/pin/56787645295697152/,"Mexican Street Corn | Recipe | Corn on the cob mexican street corn, Mexican street corn with mayo, Mexican street corn recipe",5,2026-06-06 16:27:35
https://www.pinterest.com/pin/212795151133642718/,Easy Macaroni Salad Recipe,22,2026-06-06 16:27:36
https://www.pinterest.com/pin/oreo-milkshake--212795151133640957/,"Oreo Milkshake Recipe | Easy oreo milkshake, Homemade oreo milkshake, How to make oreo strawberry milkshake",46,2026-06-06 16:27:37
https://www.pinterest.com/pin/copycat-kfc-bowls--212795151133642034/,"Copycat KFC Bowls | Quick and Easy Dinner Recipe | Easy kfc bowl recipe, Homemade kfc bowl, At home kfc bowls",99,2026-06-06 16:27:37
https://www.pinterest.com/pin/honey-walnut-shrimp--212795151133638083/,"Honey Walnut Shrimp | Honey walnut shrimp batter recipe, How to make honey walnut shrimp batter, Honey walnut shrimp batter ingredients",2568,2026-06-06 16:27:37
https://www.pinterest.com/pin/56787645295688574/,"The Best Lemon Poppy Seed Cake | Homemade lemon cake recipe, Lemon poppyseed cake recipe, Cranberry orange bundt cake",4,2026-06-06 16:27:37
https://www.pinterest.com/pin/229754018482816460/,"Delicious Peach Dump Cake Recipe | Canned peach dump cake easy, Peach cobbler ice cream cake with cool whip, Peach cobbler with cake mix and sprite",23,2026-06-06 16:27:38
https://www.pinterest.com/pin/56787645295684347/,"Ground Beef Carbonara | Recipe | Thrifty meals, Pasta carbonara recipe, New recipes for dinner",14,2026-06-06 16:27:41
https://www.pinterest.com/pin/56787645295673386/,"Fall Off The Bone Ribs Recipe | Fall ribs recipe, How to make fall off the bone ribs, Oven ribs fall off the bone pork",286,2026-06-06 16:27:43
https://www.pinterest.com/pin/56787645295673296/,"Cheesy Zucchini Bread | Recipe | Bacon and cheddar zucchini bread, Cheesy zucchini quick bread, Savory zucchini bread",5,2026-06-06 16:27:43
https://www.pinterest.com/pin/easy-sauted-zucchini--212795151133624391/,"Easy Sautéed Zucchini Recipe | Sautéed zucchini recipes, Quick zucchini onion dish, Zucchini sauteed",223,2026-06-06 16:27:43
https://www.pinterest.com/pin/pistachio-cake--212795151133624383/,"Pistachio Cake Recipe | Watergate bundt cake, Watergate cake recipe, Pistachio watergate cake",711,2026-06-06 16:27:44
https://www.pinterest.com/pin/fall-off-the-bone-ribs--212795151133622029/,"Fall Off the Bone Ribs | Fall off the bone ribs in oven, Fall off the bone ribs recipe, Back ribs",137,2026-06-06 16:27:46
https://www.pinterest.com/pin/baked-french-fries--212795151133621823/,"Baked French Fries | Baked french fries in oven, Best way to bake french fries, Fried",160,2026-06-06 16:27:46
https://www.pinterest.com/pin/slow-cooker-indian-butter-chicken--212795151133616006/,"Slow Cooker Indian Butter Chicken | Recipe | Indian butter chicken, Best easy dinner recipes, Butter chicken",84,2026-06-06 16:27:50
https://www.pinterest.com/pin/56787645295661416/,The BEST Bread Pudding Recipe | Best easy dessert recipes,15,2026-06-06 16:27:50
https://www.pinterest.com/pin/56787645295658921/,"Homemade Chicken Tenders | Recipe | Homemade chicken tenders recipe, Boneless chicken wings, Chicken sliders",7,2026-06-06 16:27:50
https://www.pinterest.com/pin/grape-salad-recipe--56787645295656936/,"Grape Salad Recipe | Easy grape salad, Fruit salad recipes, Sides salads",4,2026-06-06 16:27:50
https://www.pinterest.com/pin/56787645295658078/,"Southern Banana Pudding Recipe | Homemade banana pudding recipe, Southern recipes desserts, Classic southern recipes",2,2026-06-06 16:27:51
https://www.pinterest.com/pin/56787645295651504/,"Funfetti Sugar Cookie Cheesecake Bars | Recipe | Funfetti cheesecake cookies, Birthday cake cheesecake bars, Funfetti cheesecake bar recipe",25,2026-06-06 16:27:53
https://www.pinterest.com/pin/212795151133605855/,"Cinnamon Cream Cheese Frosting | Recipe | Homemade frosting recipes, Frosting recipes easy, Cupcake decorating tips",7,2026-06-06 16:27:53
https://www.pinterest.com/pin/229754018482771567/,"Kahlua Tres Leches Cake Recipe | How to make tres leches cake with baileys, Coffee tres leches cake recipe, Desserts",141,2026-06-06 16:27:53
https://www.pinterest.com/pin/212795151133602775/,"Applebee's Copycat Honey Pepper Chicken Mac & Cheese | Recipe | Applebee's honey pepper chicken mac and cheese recipe, Copycat applebee's honey pepper chicken mac and cheese, Easy dinner recipes",934,2026-06-06 16:27:56
https://www.pinterest.com/pin/homemade-chicken-tenders--212795151133602725/,"Easy Homemade Chicken Tenders | Recipe | Homemade chicken tenders recipe, Boneless chicken wings, Chicken sliders",6,2026-06-06 16:27:56
https://www.pinterest.com/pin/chicken-fried-chicken--212795151133601528/,"The Best Chicken Fried Chicken | Recipe | Best easy dinner recipes, Large family meals, Buttermilk chicken",2,2026-06-06 16:27:56
https://www.pinterest.com/pin/212795151133600556/,"Fall Off the Bone Ribs - The Only Recipe You'll Ever Need! | Bbq dinner, Summer grilling recipes, Best breakfast recipes",18,2026-06-06 16:27:58
